"No.","Time","Source","Destination","Protocol","Length","Info"
"1","0.000000","192.168.137.147","13.107.21.200","TCP","54","57292  >  443 [RST, ACK] Seq=1 Ack=1 Win=0 Len=0"
"2","0.000116","192.168.137.147","52.96.189.34","TCP","54","57295  >  443 [RST, ACK] Seq=1 Ack=1 Win=0 Len=0"
"3","0.000149","192.168.137.147","13.107.18.254","TCP","54","57294  >  443 [RST, ACK] Seq=1 Ack=1 Win=0 Len=0"
"4","0.000165","192.168.137.147","204.79.197.222","TCP","54","57296  >  443 [RST, ACK] Seq=1 Ack=1 Win=0 Len=0"
"5","0.000183","192.168.137.147","13.107.246.254","TCP","54","57293  >  443 [RST, ACK] Seq=1 Ack=1 Win=0 Len=0"
"6","6.090735","20.62.59.38","192.168.137.147","TLSv1.2","81","Application Data"
"7","6.135764","192.168.137.147","20.62.59.38","TCP","54","63575  >  443 [ACK] Seq=1 Ack=28 Win=509 Len=0"
"8","6.373438","192.168.137.147","20.62.59.38","TLSv1.2","85","Application Data"
"9","6.375453","20.62.59.38","192.168.137.147","TCP","54","443  >  63575 [ACK] Seq=28 Ack=32 Win=169 Len=0"
"10","16.264717","192.168.137.147","20.62.59.38","TLSv1.2","82","Application Data"
"11","16.481656","192.168.137.147","20.62.59.38","TCP","82","[TCP Retransmission] 63575  >  443 [PSH, ACK] Seq=32 Ack=28 Win=509 Len=28"
"12","16.687667","20.62.59.38","192.168.137.147","TCP","54","443  >  63575 [ACK] Seq=28 Ack=60 Win=169 Len=0"
"13","18.428142","192.168.137.147","20.42.73.25","TCP","66","57383  >  443 [SYN] Seq=0 Win=65535 Len=0 MSS=1460 WS=256 SACK_PERM"
"14","19.441875","192.168.137.147","20.42.73.25","TCP","66","[TCP Retransmission] [TCP Port numbers reused] 57383  >  443 [SYN] Seq=0 Win=65535 Len=0 MSS=1460 WS=256 SACK_PERM"
"15","19.670717","20.42.73.25","192.168.137.147","TCP","66","443  >  57383 [SYN, ACK] Seq=0 Ack=1 Win=14600 Len=0 MSS=1460 SACK_PERM WS=128"
"16","19.670913","192.168.137.147","20.42.73.25","TCP","54","57383  >  443 [ACK] Seq=1 Ack=1 Win=262144 Len=0"
"17","19.671878","192.168.137.147","20.42.73.25","TLSv1.2","281","Client Hello"
"18","19.674148","20.42.73.25","192.168.137.147","TCP","54","443  >  57383 [ACK] Seq=1 Ack=228 Win=15744 Len=0"
"19","19.828206","20.42.73.25","192.168.137.147","TCP","1514","443  >  57383 [ACK] Seq=1 Ack=228 Win=15744 Len=1460 [TCP segment of a reassembled PDU]"
"20","19.828487","192.168.137.147","20.42.73.25","TCP","54","57383  >  443 [ACK] Seq=228 Ack=1461 Win=262144 Len=0"
"21","19.828652","20.42.73.25","192.168.137.147","TCP","1514","443  >  57383 [ACK] Seq=1461 Ack=228 Win=15744 Len=1460 [TCP segment of a reassembled PDU]"
"22","19.828652","20.42.73.25","192.168.137.147","TCP","1514","443  >  57383 [ACK] Seq=2921 Ack=228 Win=15744 Len=1460 [TCP segment of a reassembled PDU]"
"23","19.828652","20.42.73.25","192.168.137.147","TCP","1514","443  >  57383 [ACK] Seq=4381 Ack=228 Win=15744 Len=1460 [TCP segment of a reassembled PDU]"
"24","19.828652","20.42.73.25","192.168.137.147","TLSv1.2","505","Server Hello, Certificate, Certificate Status, Server Key Exchange, Server Hello Done"
"25","19.828839","192.168.137.147","20.42.73.25","TCP","54","57383  >  443 [ACK] Seq=228 Ack=6292 Win=262144 Len=0"
"26","19.835004","192.168.137.147","20.42.73.25","TLSv1.2","212","Client Key Exchange, Change Cipher Spec, Encrypted Handshake Message"
"27","19.837253","20.42.73.25","192.168.137.147","TCP","54","443  >  57383 [ACK] Seq=6292 Ack=386 Win=16768 Len=0"
"28","19.959372","20.42.73.25","192.168.137.147","TLSv1.2","105","Change Cipher Spec, Encrypted Handshake Message"
"29","19.959561","192.168.137.147","20.42.73.25","TCP","54","57383  >  443 [ACK] Seq=386 Ack=6343 Win=261888 Len=0"
"30","19.961130","192.168.137.147","20.42.73.25","TLSv1.2","512","Application Data"
"31","19.961276","192.168.137.147","20.42.73.25","TCP","1514","57383  >  443 [ACK] Seq=844 Ack=6343 Win=261888 Len=1460 [TCP segment of a reassembled PDU]"
"32","19.961276","192.168.137.147","20.42.73.25","TCP","1514","57383  >  443 [ACK] Seq=2304 Ack=6343 Win=261888 Len=1460 [TCP segment of a reassembled PDU]"
"33","19.961276","192.168.137.147","20.42.73.25","TLSv1.2","1076","Application Data"
"34","19.963204","20.42.73.25","192.168.137.147","TCP","54","443  >  57383 [ACK] Seq=6343 Ack=844 Win=17920 Len=0"
"35","19.963356","20.42.73.25","192.168.137.147","TCP","54","443  >  57383 [ACK] Seq=6343 Ack=2304 Win=20736 Len=0"
"36","19.963356","20.42.73.25","192.168.137.147","TCP","54","443  >  57383 [ACK] Seq=6343 Ack=3764 Win=23680 Len=0"
"37","19.963356","20.42.73.25","192.168.137.147","TCP","54","443  >  57383 [ACK] Seq=6343 Ack=4786 Win=26624 Len=0"
"38","20.102109","20.42.73.25","192.168.137.147","TLSv1.2","507","Application Data"
"39","20.102333","192.168.137.147","20.42.73.25","TCP","54","57383  >  443 [ACK] Seq=4786 Ack=6796 Win=261632 Len=0"
"40","21.374628","192.168.137.147","20.62.59.38","TLSv1.2","85","Application Data"
"41","21.376704","20.62.59.38","192.168.137.147","TCP","54","443  >  63575 [ACK] Seq=28 Ack=91 Win=169 Len=0"
"42","22.081077","20.62.59.38","192.168.137.147","TLSv1.2","81","Application Data"
"43","22.121447","192.168.137.147","20.62.59.38","TCP","54","63575  >  443 [ACK] Seq=91 Ack=55 Win=509 Len=0"
"44","22.506028","192.168.137.10","224.0.0.251","MDNS","162","Standard query 0x0000 ANY {""nm"":""Redmi Note 8"",""as"":""[8193, 8194]"",""ip"":""10""}._mi-connect._udp.local, ""QU"" question SRV 0 0 56666 Android.local"
"45","22.506325","fe80::c417:f47:ee09:3a2d","ff02::fb","MDNS","182","Standard query 0x0000 ANY {""nm"":""Redmi Note 8"",""as"":""[8193, 8194]"",""ip"":""10""}._mi-connect._udp.local, ""QU"" question SRV 0 0 56666 Android.local"
"46","22.813198","192.168.137.10","224.0.0.251","MDNS","162","Standard query 0x0000 ANY {""nm"":""Redmi Note 8"",""as"":""[8193, 8194]"",""ip"":""10""}._mi-connect._udp.local, ""QM"" question SRV 0 0 56666 Android.local"
"47","22.813436","fe80::c417:f47:ee09:3a2d","ff02::fb","MDNS","182","Standard query 0x0000 ANY {""nm"":""Redmi Note 8"",""as"":""[8193, 8194]"",""ip"":""10""}._mi-connect._udp.local, ""QM"" question SRV 0 0 56666 Android.local"
"48","23.120216","192.168.137.10","224.0.0.251","MDNS","162","Standard query 0x0000 ANY {""nm"":""Redmi Note 8"",""as"":""[8193, 8194]"",""ip"":""10""}._mi-connect._udp.local, ""QM"" question SRV 0 0 56666 Android.local"
"49","23.120630","fe80::c417:f47:ee09:3a2d","ff02::fb","MDNS","182","Standard query 0x0000 ANY {""nm"":""Redmi Note 8"",""as"":""[8193, 8194]"",""ip"":""10""}._mi-connect._udp.local, ""QM"" question SRV 0 0 56666 Android.local"
"50","23.120630","192.168.137.10","224.0.0.251","MDNS","422","Standard query response 0x0000 TXT, cache flush PTR _mi-connect._udp.local PTR {""nm"":""Redmi Note 8"",""as"":""[8193, 8194]"",""ip"":""10""}._mi-connect._udp.local SRV, cache flush 0 0 56666 Android.local A, cache flush 192.168.137.10 AAAA, cache flush fe80::c417:f47:ee09:3a2d NSEC, cache flush Android.local NSEC, cache flush {""nm"":""Redmi Note 8"",""as"":""[8193, 8194]"",""ip"":""10""}._mi-connect._udp.local"
"51","23.120947","fe80::c417:f47:ee09:3a2d","ff02::fb","MDNS","442","Standard query response 0x0000 TXT, cache flush PTR _mi-connect._udp.local PTR {""nm"":""Redmi Note 8"",""as"":""[8193, 8194]"",""ip"":""10""}._mi-connect._udp.local SRV, cache flush 0 0 56666 Android.local A, cache flush 192.168.137.10 AAAA, cache flush fe80::c417:f47:ee09:3a2d NSEC, cache flush Android.local NSEC, cache flush {""nm"":""Redmi Note 8"",""as"":""[8193, 8194]"",""ip"":""10""}._mi-connect._udp.local"
"52","23.980649","192.168.137.147","52.159.127.243","TLSv1.2","97","Application Data"
"53","23.983039","52.159.127.243","192.168.137.147","TCP","54","443  >  62472 [ACK] Seq=1 Ack=44 Win=162 Len=0"
"54","24.080553","52.159.127.243","192.168.137.147","TLSv1.2","228","Application Data"
"55","24.135860","192.168.137.147","52.159.127.243","TCP","54","62472  >  443 [ACK] Seq=44 Ack=175 Win=510 Len=0"
"56","24.256170","192.168.137.10","224.0.0.251","MDNS","422","Standard query response 0x0000 TXT, cache flush PTR _mi-connect._udp.local PTR {""nm"":""Redmi Note 8"",""as"":""[8193, 8194]"",""ip"":""10""}._mi-connect._udp.local SRV, cache flush 0 0 56666 Android.local A, cache flush 192.168.137.10 AAAA, cache flush fe80::c417:f47:ee09:3a2d NSEC, cache flush Android.local NSEC, cache flush {""nm"":""Redmi Note 8"",""as"":""[8193, 8194]"",""ip"":""10""}._mi-connect._udp.local"
"57","24.256538","fe80::c417:f47:ee09:3a2d","ff02::fb","MDNS","442","Standard query response 0x0000 TXT, cache flush PTR _mi-connect._udp.local PTR {""nm"":""Redmi Note 8"",""as"":""[8193, 8194]"",""ip"":""10""}._mi-connect._udp.local SRV, cache flush 0 0 56666 Android.local A, cache flush 192.168.137.10 AAAA, cache flush fe80::c417:f47:ee09:3a2d NSEC, cache flush Android.local NSEC, cache flush {""nm"":""Redmi Note 8"",""as"":""[8193, 8194]"",""ip"":""10""}._mi-connect._udp.local"
"58","24.349006","192.168.137.169","239.255.255.250","SSDP","216","M-SEARCH * HTTP/1.1 "
"59","24.656368","192.168.137.169","239.255.255.250","SSDP","217","M-SEARCH * HTTP/1.1 "
"60","25.578008","192.168.137.169","239.255.255.250","SSDP","216","M-SEARCH * HTTP/1.1 "
"61","25.578258","192.168.137.169","239.255.255.250","SSDP","217","M-SEARCH * HTTP/1.1 "
"62","25.887379","192.168.137.147","77.234.42.98","TLSv1.2","141","Application Data"
"63","25.889670","77.234.42.98","192.168.137.147","TCP","54","443  >  57371 [ACK] Seq=1 Ack=88 Win=131 Len=0"
"64","25.953009","77.234.42.98","192.168.137.147","TLSv1.2","272","Application Data"
"65","25.963642","192.168.137.147","23.8.25.52","TCP","66","57384  >  80 [SYN] Seq=0 Win=64240 Len=0 MSS=1460 WS=256 SACK_PERM"
"66","25.966425","23.8.25.52","192.168.137.147","TCP","66","80  >  57384 [SYN, ACK] Seq=0 Ack=1 Win=14600 Len=0 MSS=1460 SACK_PERM WS=128"
"67","25.966644","192.168.137.147","23.8.25.52","TCP","54","57384  >  80 [ACK] Seq=1 Ack=1 Win=131328 Len=0"
"68","25.967967","192.168.137.147","23.8.25.52","HTTP","281","GET / HTTP/1.1 "
"69","25.970399","23.8.25.52","192.168.137.147","TCP","54","80  >  57384 [ACK] Seq=1 Ack=228 Win=15744 Len=0"
"70","26.003041","192.168.137.147","77.234.42.98","TCP","54","57371  >  443 [ACK] Seq=88 Ack=219 Win=510 Len=0"
"71","26.095221","23.8.25.52","192.168.137.147","HTTP","317","HTTP/1.1 304 Not Modified "
"72","26.110027","192.168.137.147","77.234.42.98","TLSv1.2","150","Application Data"
"73","26.112276","77.234.42.98","192.168.137.147","TCP","54","443  >  57371 [ACK] Seq=219 Ack=184 Win=131 Len=0"
"74","26.144513","192.168.137.147","23.8.25.52","TCP","54","57384  >  80 [ACK] Seq=228 Ack=264 Win=131072 Len=0"
"75","26.175781","77.234.42.98","192.168.137.147","TLSv1.2","275","Application Data"
"76","26.177678","192.168.137.147","208.111.136.0","TCP","66","57385  >  80 [SYN] Seq=0 Win=64240 Len=0 MSS=1460 WS=256 SACK_PERM"
"77","26.179409","208.111.136.0","192.168.137.147","TCP","66","80  >  57385 [SYN, ACK] Seq=0 Ack=1 Win=14600 Len=0 MSS=1460 SACK_PERM WS=128"
"78","26.179557","192.168.137.147","208.111.136.0","TCP","54","57385  >  80 [ACK] Seq=1 Ack=1 Win=131328 Len=0"
"79","26.180774","192.168.137.147","208.111.136.0","HTTP","306","GET /msdownload/update/v3/static/trustedr/en/disallowedcertstl.cab?b0374fbaab160798 HTTP/1.1 "
"80","26.186200","208.111.136.0","192.168.137.147","TCP","54","80  >  57385 [ACK] Seq=1 Ack=253 Win=15744 Len=0"
"81","26.192115","192.168.137.10","224.0.0.251","MDNS","422","Standard query response 0x0000 TXT, cache flush PTR _mi-connect._udp.local PTR {""nm"":""Redmi Note 8"",""as"":""[8193, 8194]"",""ip"":""10""}._mi-connect._udp.local SRV, cache flush 0 0 56666 Android.local A, cache flush 192.168.137.10 AAAA, cache flush fe80::c417:f47:ee09:3a2d NSEC, cache flush Android.local NSEC, cache flush {""nm"":""Redmi Note 8"",""as"":""[8193, 8194]"",""ip"":""10""}._mi-connect._udp.local"
"82","26.192323","fe80::c417:f47:ee09:3a2d","ff02::fb","MDNS","442","Standard query response 0x0000 TXT, cache flush PTR _mi-connect._udp.local PTR {""nm"":""Redmi Note 8"",""as"":""[8193, 8194]"",""ip"":""10""}._mi-connect._udp.local SRV, cache flush 0 0 56666 Android.local A, cache flush 192.168.137.10 AAAA, cache flush fe80::c417:f47:ee09:3a2d NSEC, cache flush Android.local NSEC, cache flush {""nm"":""Redmi Note 8"",""as"":""[8193, 8194]"",""ip"":""10""}._mi-connect._udp.local"
"83","26.221722","192.168.137.147","77.234.42.98","TCP","54","57371  >  443 [ACK] Seq=184 Ack=440 Win=509 Len=0"
"84","26.305930","208.111.136.0","192.168.137.147","HTTP","309","HTTP/1.1 304 Not Modified "
"85","26.319748","192.168.137.147","208.111.136.0","HTTP","336","GET /msdownload/update/v3/static/trustedr/en/pinrulesstl.cab?7be6d8558adf6bb4 HTTP/1.1 "
"86","26.322000","208.111.136.0","192.168.137.147","TCP","54","80  >  57385 [ACK] Seq=256 Ack=535 Win=16768 Len=0"
"87","26.384142","208.111.136.0","192.168.137.147","HTTP","308","HTTP/1.1 304 Not Modified "
"88","26.424910","192.168.137.147","208.111.136.0","TCP","54","57385  >  80 [ACK] Seq=535 Ack=510 Win=130816 Len=0"
"89","26.499281","192.168.137.169","239.255.255.250","SSDP","216","M-SEARCH * HTTP/1.1 "
"90","26.499528","192.168.137.169","239.255.255.250","SSDP","217","M-SEARCH * HTTP/1.1 "
"91","27.421166","192.168.137.169","239.255.255.250","SSDP","216","M-SEARCH * HTTP/1.1 "
"92","27.421386","192.168.137.169","239.255.255.250","SSDP","217","M-SEARCH * HTTP/1.1 "
"93","27.558411","192.168.137.147","77.234.42.98","TLSv1.2","161","Application Data"
"94","27.560590","77.234.42.98","192.168.137.147","TCP","54","443  >  57371 [ACK] Seq=440 Ack=291 Win=131 Len=0"
"95","27.631045","77.234.42.98","192.168.137.147","TLSv1.2","276","Application Data"
"96","27.637498","192.168.137.147","5.62.38.18","TCP","66","57386  >  443 [SYN] Seq=0 Win=64240 Len=0 MSS=1460 WS=256 SACK_PERM"
"97","27.640172","5.62.38.18","192.168.137.147","TCP","66","443  >  57386 [SYN, ACK] Seq=0 Ack=1 Win=14600 Len=0 MSS=1460 SACK_PERM WS=128"
"98","27.640419","192.168.137.147","5.62.38.18","TCP","54","57386  >  443 [ACK] Seq=1 Ack=1 Win=131328 Len=0"
"99","27.676163","192.168.137.147","77.234.42.98","TCP","54","57371  >  443 [ACK] Seq=291 Ack=662 Win=508 Len=0"
"100","27.850126","192.168.137.147","5.62.38.18","TLSv1.2","353","Client Hello"
"101","27.852558","5.62.38.18","192.168.137.147","TCP","54","443  >  57386 [ACK] Seq=1 Ack=300 Win=15744 Len=0"
"102","28.037506","5.62.38.18","192.168.137.147","TLSv1.2","1502","Server Hello"
"103","28.037506","5.62.38.18","192.168.137.147","TCP","1514","443  >  57386 [ACK] Seq=1449 Ack=300 Win=15744 Len=1460 [TCP segment of a reassembled PDU]"
"104","28.037506","5.62.38.18","192.168.137.147","TLSv1.2","613","Certificate, Server Key Exchange, Server Hello Done"
"105","28.037762","192.168.137.147","5.62.38.18","TCP","54","57386  >  443 [ACK] Seq=300 Ack=3468 Win=131328 Len=0"
"106","28.044939","192.168.137.147","5.62.38.18","TLSv1.2","180","Client Key Exchange, Change Cipher Spec, Encrypted Handshake Message"
"107","28.047208","5.62.38.18","192.168.137.147","TCP","54","443  >  57386 [ACK] Seq=3468 Ack=426 Win=15744 Len=0"
"108","28.231525","5.62.38.18","192.168.137.147","TLSv1.2","328","New Session Ticket, Change Cipher Spec, Encrypted Handshake Message"
"109","28.232502","192.168.137.147","5.62.38.18","TLSv1.2","311","Application Data"
"110","28.232640","192.168.137.147","5.62.38.18","TCP","1514","57386  >  443 [ACK] Seq=683 Ack=3742 Win=131072 Len=1460 [TCP segment of a reassembled PDU]"
"111","28.232640","192.168.137.147","5.62.38.18","TCP","1514","57386  >  443 [ACK] Seq=2143 Ack=3742 Win=131072 Len=1460 [TCP segment of a reassembled PDU]"
"112","28.232640","192.168.137.147","5.62.38.18","TLSv1.2","1285","Application Data"
"113","28.234279","5.62.38.18","192.168.137.147","TCP","54","443  >  57386 [ACK] Seq=3742 Ack=683 Win=16768 Len=0"
"114","28.234647","5.62.38.18","192.168.137.147","TCP","54","443  >  57386 [ACK] Seq=3742 Ack=2143 Win=19712 Len=0"
"115","28.234647","5.62.38.18","192.168.137.147","TCP","54","443  >  57386 [ACK] Seq=3742 Ack=3603 Win=22656 Len=0"
"116","28.234647","5.62.38.18","192.168.137.147","TCP","54","443  >  57386 [ACK] Seq=3742 Ack=4834 Win=25600 Len=0"
"117","28.459425","5.62.38.18","192.168.137.147","TLSv1.2","336","Application Data"
"118","28.460559","192.168.137.147","5.62.38.18","TLSv1.2","85","Encrypted Alert"
"119","28.460706","192.168.137.147","5.62.38.18","TCP","54","57386  >  443 [FIN, ACK] Seq=4865 Ack=4024 Win=130816 Len=0"
"120","28.462283","5.62.38.18","192.168.137.147","TCP","54","443  >  57386 [ACK] Seq=4024 Ack=4865 Win=25600 Len=0"
"121","28.462810","5.62.38.18","192.168.137.147","TCP","54","443  >  57386 [FIN, ACK] Seq=4024 Ack=4866 Win=25600 Len=0"
"122","28.462911","192.168.137.147","5.62.38.18","TCP","54","57386  >  443 [ACK] Seq=4866 Ack=4025 Win=130816 Len=0"
"123","28.519570","192.168.137.147","5.62.38.18","TCP","66","57387  >  443 [SYN] Seq=0 Win=64240 Len=0 MSS=1460 WS=256 SACK_PERM"
"124","28.521413","5.62.38.18","192.168.137.147","TCP","66","443  >  57387 [SYN, ACK] Seq=0 Ack=1 Win=14600 Len=0 MSS=1460 SACK_PERM WS=128"
"125","28.521611","192.168.137.147","5.62.38.18","TCP","54","57387  >  443 [ACK] Seq=1 Ack=1 Win=131328 Len=0"
"126","28.721796","192.168.137.147","5.62.38.18","TLSv1.2","353","Client Hello"
"127","28.724092","5.62.38.18","192.168.137.147","TCP","54","443  >  57387 [ACK] Seq=1 Ack=300 Win=15744 Len=0"
"128","28.898376","5.62.38.18","192.168.137.147","TLSv1.2","1514","Server Hello"
"129","28.898376","5.62.38.18","192.168.137.147","TCP","1490","443  >  57387 [PSH, ACK] Seq=1461 Ack=300 Win=15744 Len=1436 [TCP segment of a reassembled PDU]"
"130","28.898376","5.62.38.18","192.168.137.147","TLSv1.2","625","Certificate, Server Key Exchange, Server Hello Done"
"131","28.898672","192.168.137.147","5.62.38.18","TCP","54","57387  >  443 [ACK] Seq=300 Ack=3468 Win=131328 Len=0"
"132","28.901693","192.168.137.147","5.62.38.18","TLSv1.2","180","Client Key Exchange, Change Cipher Spec, Encrypted Handshake Message"
"133","28.903384","5.62.38.18","192.168.137.147","TCP","54","443  >  57387 [ACK] Seq=3468 Ack=426 Win=15744 Len=0"
"134","29.077877","5.62.38.18","192.168.137.147","TLSv1.2","328","New Session Ticket, Change Cipher Spec, Encrypted Handshake Message"
"135","29.078742","192.168.137.147","5.62.38.18","TLSv1.2","311","Application Data"
"136","29.078916","192.168.137.147","5.62.38.18","TCP","1514","57387  >  443 [ACK] Seq=683 Ack=3742 Win=131072 Len=1460 [TCP segment of a reassembled PDU]"
"137","29.078916","192.168.137.147","5.62.38.18","TCP","1514","57387  >  443 [ACK] Seq=2143 Ack=3742 Win=131072 Len=1460 [TCP segment of a reassembled PDU]"
"138","29.078916","192.168.137.147","5.62.38.18","TLSv1.2","1233","Application Data"
"139","29.080704","5.62.38.18","192.168.137.147","TCP","54","443  >  57387 [ACK] Seq=3742 Ack=683 Win=16768 Len=0"
"140","29.080932","5.62.38.18","192.168.137.147","TCP","54","443  >  57387 [ACK] Seq=3742 Ack=2143 Win=19712 Len=0"
"141","29.080932","5.62.38.18","192.168.137.147","TCP","54","443  >  57387 [ACK] Seq=3742 Ack=3603 Win=22656 Len=0"
"142","29.080932","5.62.38.18","192.168.137.147","TCP","54","443  >  57387 [ACK] Seq=3742 Ack=4782 Win=25600 Len=0"
"143","29.307163","5.62.38.18","192.168.137.147","TLSv1.2","383","Application Data"
"144","29.308565","192.168.137.147","5.62.38.18","TLSv1.2","85","Encrypted Alert"
"145","29.308867","192.168.137.147","5.62.38.18","TCP","54","57387  >  443 [FIN, ACK] Seq=4813 Ack=4071 Win=130560 Len=0"
"146","29.310802","5.62.38.18","192.168.137.147","TCP","54","443  >  57387 [ACK] Seq=4071 Ack=4813 Win=25600 Len=0"
"147","29.311145","5.62.38.18","192.168.137.147","TCP","54","443  >  57387 [FIN, ACK] Seq=4071 Ack=4814 Win=25600 Len=0"
"148","29.311268","192.168.137.147","5.62.38.18","TCP","54","57387  >  443 [ACK] Seq=4814 Ack=4072 Win=130560 Len=0"
"149","29.367017","192.168.137.147","5.62.38.18","TCP","66","57388  >  443 [SYN] Seq=0 Win=64240 Len=0 MSS=1460 WS=256 SACK_PERM"
"150","29.369371","5.62.38.18","192.168.137.147","TCP","66","443  >  57388 [SYN, ACK] Seq=0 Ack=1 Win=14600 Len=0 MSS=1460 SACK_PERM WS=128"
"151","29.369605","192.168.137.147","5.62.38.18","TCP","54","57388  >  443 [ACK] Seq=1 Ack=1 Win=131328 Len=0"
"152","29.579270","192.168.137.147","5.62.38.18","TLSv1.2","353","Client Hello"
"153","29.581887","5.62.38.18","192.168.137.147","TCP","54","443  >  57388 [ACK] Seq=1 Ack=300 Win=15744 Len=0"
"154","29.768146","5.62.38.18","192.168.137.147","TLSv1.2","1514","Server Hello"
"155","29.768444","5.62.38.18","192.168.137.147","TCP","1514","443  >  57388 [ACK] Seq=1461 Ack=300 Win=15744 Len=1460 [TCP segment of a reassembled PDU]"
"156","29.768444","5.62.38.18","192.168.137.147","TLSv1.2","602","Certificate, Server Key Exchange, Server Hello Done"
"157","29.768574","192.168.137.147","5.62.38.18","TCP","54","57388  >  443 [ACK] Seq=300 Ack=3469 Win=131328 Len=0"
"158","29.771710","192.168.137.147","5.62.38.18","TLSv1.2","180","Client Key Exchange, Change Cipher Spec, Encrypted Handshake Message"
"159","29.773659","5.62.38.18","192.168.137.147","TCP","54","443  >  57388 [ACK] Seq=3469 Ack=426 Win=15744 Len=0"
"160","29.959811","5.62.38.18","192.168.137.147","TLSv1.2","328","New Session Ticket, Change Cipher Spec, Encrypted Handshake Message"
"161","29.960873","192.168.137.147","5.62.38.18","TLSv1.2","311","Application Data"
"162","29.961001","192.168.137.147","5.62.38.18","TCP","1514","57388  >  443 [ACK] Seq=683 Ack=3743 Win=131072 Len=1460 [TCP segment of a reassembled PDU]"
"163","29.961001","192.168.137.147","5.62.38.18","TCP","1514","57388  >  443 [ACK] Seq=2143 Ack=3743 Win=131072 Len=1460 [TCP segment of a reassembled PDU]"
"164","29.961001","192.168.137.147","5.62.38.18","TLSv1.2","1235","Application Data"
"165","29.962738","5.62.38.18","192.168.137.147","TCP","54","443  >  57388 [ACK] Seq=3743 Ack=683 Win=16768 Len=0"
"166","29.963056","5.62.38.18","192.168.137.147","TCP","54","443  >  57388 [ACK] Seq=3743 Ack=2143 Win=19712 Len=0"
"167","29.963056","5.62.38.18","192.168.137.147","TCP","54","443  >  57388 [ACK] Seq=3743 Ack=3603 Win=22656 Len=0"
"168","29.963056","5.62.38.18","192.168.137.147","TCP","54","443  >  57388 [ACK] Seq=3743 Ack=4784 Win=25600 Len=0"
"169","30.179380","5.62.38.18","192.168.137.147","TLSv1.2","425","Application Data"
"170","30.180745","192.168.137.147","5.62.38.18","TLSv1.2","85","Encrypted Alert"
"171","30.180982","192.168.137.147","5.62.38.18","TCP","54","57388  >  443 [FIN, ACK] Seq=4815 Ack=4114 Win=130560 Len=0"
"172","30.183694","5.62.38.18","192.168.137.147","TCP","54","443  >  57388 [ACK] Seq=4114 Ack=4815 Win=25600 Len=0"
"173","30.183694","5.62.38.18","192.168.137.147","TCP","54","443  >  57388 [FIN, ACK] Seq=4114 Ack=4816 Win=25600 Len=0"
"174","30.183980","192.168.137.147","5.62.38.18","TCP","54","57388  >  443 [ACK] Seq=4816 Ack=4115 Win=130560 Len=0"
"175","30.186305","192.168.137.10","224.0.0.251","MDNS","422","Standard query response 0x0000 TXT, cache flush PTR _mi-connect._udp.local PTR {""nm"":""Redmi Note 8"",""as"":""[8193, 8194]"",""ip"":""10""}._mi-connect._udp.local SRV, cache flush 0 0 56666 Android.local A, cache flush 192.168.137.10 AAAA, cache flush fe80::c417:f47:ee09:3a2d NSEC, cache flush Android.local NSEC, cache flush {""nm"":""Redmi Note 8"",""as"":""[8193, 8194]"",""ip"":""10""}._mi-connect._udp.local"
"176","30.186305","fe80::c417:f47:ee09:3a2d","ff02::fb","MDNS","442","Standard query response 0x0000 TXT, cache flush PTR _mi-connect._udp.local PTR {""nm"":""Redmi Note 8"",""as"":""[8193, 8194]"",""ip"":""10""}._mi-connect._udp.local SRV, cache flush 0 0 56666 Android.local A, cache flush 192.168.137.10 AAAA, cache flush fe80::c417:f47:ee09:3a2d NSEC, cache flush Android.local NSEC, cache flush {""nm"":""Redmi Note 8"",""as"":""[8193, 8194]"",""ip"":""10""}._mi-connect._udp.local"
"177","32.950513","192.168.137.10","224.0.0.251","MDNS","142","Standard query response 0x0000 PTR {""nm"":""Redmi Note 8"",""as"":""[8193, 8194]"",""ip"":""10""}._mi-connect._udp.local"
"178","32.950513","fe80::c417:f47:ee09:3a2d","ff02::fb","MDNS","162","Standard query response 0x0000 PTR {""nm"":""Redmi Note 8"",""as"":""[8193, 8194]"",""ip"":""10""}._mi-connect._udp.local"
"179","34.793712","192.168.137.10","224.0.0.251","MDNS","142","Standard query response 0x0000 PTR {""nm"":""Redmi Note 8"",""as"":""[8193, 8194]"",""ip"":""10""}._mi-connect._udp.local"
"180","34.793712","fe80::c417:f47:ee09:3a2d","ff02::fb","MDNS","162","Standard query response 0x0000 PTR {""nm"":""Redmi Note 8"",""as"":""[8193, 8194]"",""ip"":""10""}._mi-connect._udp.local"
"181","35.094606","192.168.137.147","172.217.3.78","ICMP","74","Echo (ping) request  id=0x0001, seq=610/25090, ttl=128 (reply in 182)"
"182","35.138052","172.217.3.78","192.168.137.147","ICMP","74","Echo (ping) reply    id=0x0001, seq=610/25090, ttl=114 (request in 181)"
"183","36.099556","192.168.137.147","172.217.3.78","ICMP","74","Echo (ping) request  id=0x0001, seq=611/25346, ttl=128 (reply in 184)"
"184","36.142953","172.217.3.78","192.168.137.147","ICMP","74","Echo (ping) reply    id=0x0001, seq=611/25346, ttl=114 (request in 183)"
"185","36.380045","192.168.137.147","20.62.59.38","TLSv1.2","85","Application Data"
"186","36.381884","20.62.59.38","192.168.137.147","TCP","54","443  >  63575 [ACK] Seq=55 Ack=122 Win=169 Len=0"
"187","36.944322","192.168.137.10","224.0.0.251","MDNS","142","Standard query response 0x0000 PTR {""nm"":""Redmi Note 8"",""as"":""[8193, 8194]"",""ip"":""10""}._mi-connect._udp.local"
"188","36.944678","fe80::c417:f47:ee09:3a2d","ff02::fb","MDNS","162","Standard query response 0x0000 PTR {""nm"":""Redmi Note 8"",""as"":""[8193, 8194]"",""ip"":""10""}._mi-connect._udp.local"
"189","37.114720","192.168.137.147","172.217.3.78","ICMP","74","Echo (ping) request  id=0x0001, seq=612/25602, ttl=128 (reply in 190)"
"190","37.158024","172.217.3.78","192.168.137.147","ICMP","74","Echo (ping) reply    id=0x0001, seq=612/25602, ttl=114 (request in 189)"
"191","38.076499","20.62.59.38","192.168.137.147","TLSv1.2","81","Application Data"
"192","38.129684","192.168.137.147","20.62.59.38","TCP","54","63575  >  443 [ACK] Seq=122 Ack=82 Win=509 Len=0"
"193","38.129863","192.168.137.147","172.217.3.78","ICMP","74","Echo (ping) request  id=0x0001, seq=613/25858, ttl=128 (reply in 194)"
"194","38.171490","172.217.3.78","192.168.137.147","ICMP","74","Echo (ping) reply    id=0x0001, seq=613/25858, ttl=114 (request in 193)"
"195","39.142999","192.168.137.147","172.217.3.78","ICMP","74","Echo (ping) request  id=0x0001, seq=614/26114, ttl=128 (reply in 196)"
"196","39.186071","172.217.3.78","192.168.137.147","ICMP","74","Echo (ping) reply    id=0x0001, seq=614/26114, ttl=114 (request in 195)"
"197","40.154671","192.168.137.147","172.217.3.78","ICMP","74","Echo (ping) request  id=0x0001, seq=615/26370, ttl=128 (reply in 198)"
"198","40.198148","172.217.3.78","192.168.137.147","ICMP","74","Echo (ping) reply    id=0x0001, seq=615/26370, ttl=114 (request in 197)"
"199","41.166352","192.168.137.147","172.217.3.78","ICMP","74","Echo (ping) request  id=0x0001, seq=616/26626, ttl=128 (reply in 200)"
"200","41.208142","172.217.3.78","192.168.137.147","ICMP","74","Echo (ping) reply    id=0x0001, seq=616/26626, ttl=114 (request in 199)"
"201","41.435076","192.168.137.147","208.111.136.0","TCP","66","57389  >  80 [SYN] Seq=0 Win=64240 Len=0 MSS=1460 WS=256 SACK_PERM"
"202","41.436739","208.111.136.0","192.168.137.147","TCP","66","80  >  57389 [SYN, ACK] Seq=0 Ack=1 Win=14600 Len=0 MSS=1460 SACK_PERM WS=128"
"203","41.436958","192.168.137.147","208.111.136.0","TCP","54","57389  >  80 [ACK] Seq=1 Ack=1 Win=131328 Len=0"
"204","41.438688","192.168.137.147","208.111.136.0","HTTP","341","GET /msdownload/update/v3/static/trustedr/en/disallowedcertstl.cab?df9b61d2b3340c07 HTTP/1.1 "
"205","41.442528","208.111.136.0","192.168.137.147","TCP","54","80  >  57389 [ACK] Seq=1 Ack=288 Win=15744 Len=0"
"206","41.563803","208.111.136.0","192.168.137.147","HTTP","309","HTTP/1.1 304 Not Modified "
"207","41.577567","192.168.137.147","208.111.136.0","HTTP","336","GET /msdownload/update/v3/static/trustedr/en/pinrulesstl.cab?1f3861c855867d2f HTTP/1.1 "
"208","41.579458","208.111.136.0","192.168.137.147","TCP","54","80  >  57389 [ACK] Seq=256 Ack=570 Win=16768 Len=0"
"209","41.642366","208.111.136.0","192.168.137.147","HTTP","308","HTTP/1.1 304 Not Modified "
"210","41.696674","192.168.137.147","208.111.136.0","TCP","54","57389  >  80 [ACK] Seq=570 Ack=510 Win=130816 Len=0"
"211","42.178259","192.168.137.147","172.217.3.78","ICMP","74","Echo (ping) request  id=0x0001, seq=617/26882, ttl=128 (reply in 212)"
"212","42.221631","172.217.3.78","192.168.137.147","ICMP","74","Echo (ping) reply    id=0x0001, seq=617/26882, ttl=114 (request in 211)"
"213","42.672381","192.168.137.147","208.111.136.0","TCP","66","57390  >  80 [SYN] Seq=0 Win=64240 Len=0 MSS=1460 WS=256 SACK_PERM"
"214","42.676108","208.111.136.0","192.168.137.147","TCP","66","80  >  57390 [SYN, ACK] Seq=0 Ack=1 Win=14600 Len=0 MSS=1460 SACK_PERM WS=128"
"215","42.676286","192.168.137.147","208.111.136.0","TCP","54","57390  >  80 [ACK] Seq=1 Ack=1 Win=131328 Len=0"
"216","42.677026","192.168.137.147","208.111.136.0","HTTP","341","GET /msdownload/update/v3/static/trustedr/en/disallowedcertstl.cab?cdaabf13eeb9e061 HTTP/1.1 "
"217","42.680944","208.111.136.0","192.168.137.147","TCP","54","80  >  57390 [ACK] Seq=1 Ack=288 Win=15744 Len=0"
"218","42.801317","208.111.136.0","192.168.137.147","HTTP","309","HTTP/1.1 304 Not Modified "
"219","42.813759","192.168.137.147","208.111.136.0","HTTP","336","GET /msdownload/update/v3/static/trustedr/en/pinrulesstl.cab?f0e95099147452cc HTTP/1.1 "
"220","42.816125","208.111.136.0","192.168.137.147","TCP","54","80  >  57390 [ACK] Seq=256 Ack=570 Win=16768 Len=0"
"221","42.877706","208.111.136.0","192.168.137.147","HTTP","308","HTTP/1.1 304 Not Modified "
"222","42.925683","192.168.137.147","208.111.136.0","TCP","54","57390  >  80 [ACK] Seq=570 Ack=510 Win=130816 Len=0"
"223","43.190650","192.168.137.147","172.217.3.78","ICMP","74","Echo (ping) request  id=0x0001, seq=618/27138, ttl=128 (reply in 224)"
"224","43.233919","172.217.3.78","192.168.137.147","ICMP","74","Echo (ping) reply    id=0x0001, seq=618/27138, ttl=114 (request in 223)"
"225","44.200577","192.168.137.147","172.217.3.78","ICMP","74","Echo (ping) request  id=0x0001, seq=619/27394, ttl=128 (reply in 226)"
"226","44.242358","172.217.3.78","192.168.137.147","ICMP","74","Echo (ping) reply    id=0x0001, seq=619/27394, ttl=114 (request in 225)"
"227","45.207357","192.168.137.147","172.217.3.78","ICMP","74","Echo (ping) request  id=0x0001, seq=620/27650, ttl=128 (reply in 228)"
"228","45.250157","172.217.3.78","192.168.137.147","ICMP","74","Echo (ping) reply    id=0x0001, seq=620/27650, ttl=114 (request in 227)"
"229","46.220211","192.168.137.147","172.217.3.78","ICMP","74","Echo (ping) request  id=0x0001, seq=621/27906, ttl=128 (reply in 230)"
"230","46.262601","172.217.3.78","192.168.137.147","ICMP","74","Echo (ping) reply    id=0x0001, seq=621/27906, ttl=114 (request in 229)"
"231","46.268836","192.168.137.147","20.62.59.38","TLSv1.2","82","Application Data"
"232","46.270912","20.62.59.38","192.168.137.147","TCP","54","443  >  63575 [ACK] Seq=82 Ack=150 Win=169 Len=0"
"233","47.235254","192.168.137.147","172.217.3.78","ICMP","74","Echo (ping) request  id=0x0001, seq=622/28162, ttl=128 (reply in 234)"
"234","47.276722","172.217.3.78","192.168.137.147","ICMP","74","Echo (ping) reply    id=0x0001, seq=622/28162, ttl=114 (request in 233)"
"235","48.018629","192.168.137.147","52.159.127.243","TLSv1.2","155","Application Data"
"236","48.020225","52.159.127.243","192.168.137.147","TCP","54","443  >  49410 [ACK] Seq=1 Ack=102 Win=267 Len=0"
"237","48.069571","192.168.137.147","77.234.42.98","TLSv1.2","137","Application Data"
"238","48.071216","77.234.42.98","192.168.137.147","TCP","54","443  >  57371 [ACK] Seq=662 Ack=374 Win=131 Len=0"
"239","48.114940","52.159.127.243","192.168.137.147","TLSv1.2","225","Application Data"
"240","48.134019","77.234.42.98","192.168.137.147","TLSv1.2","248","Application Data"
"241","48.136195","192.168.137.147","204.79.197.203","TCP","66","57391  >  443 [SYN] Seq=0 Win=65535 Len=0 MSS=1460 WS=256 SACK_PERM"
"242","48.137692","204.79.197.203","192.168.137.147","TCP","66","443  >  57391 [SYN, ACK] Seq=0 Ack=1 Win=14600 Len=0 MSS=1460 SACK_PERM WS=128"
"243","48.137840","192.168.137.147","204.79.197.203","TCP","54","57391  >  443 [ACK] Seq=1 Ack=1 Win=262144 Len=0"
"244","48.139955","192.168.137.147","204.79.197.203","TLSv1.2","339","Client Hello"
"245","48.141652","204.79.197.203","192.168.137.147","TCP","54","443  >  57391 [ACK] Seq=1 Ack=286 Win=15744 Len=0"
"246","48.148958","204.79.197.203","192.168.137.147","TCP","1514","443  >  57391 [ACK] Seq=1 Ack=286 Win=15744 Len=1460 [TCP segment of a reassembled PDU]"
"247","48.148958","204.79.197.203","192.168.137.147","TCP","1514","443  >  57391 [PSH, ACK] Seq=1461 Ack=286 Win=15744 Len=1460 [TCP segment of a reassembled PDU]"
"248","48.148958","204.79.197.203","192.168.137.147","TCP","1514","443  >  57391 [ACK] Seq=2921 Ack=286 Win=15744 Len=1460 [TCP segment of a reassembled PDU]"
"249","48.148958","204.79.197.203","192.168.137.147","TLSv1.2","1384","Server Hello, Certificate, Certificate Status, Server Key Exchange, Server Hello Done"
"250","48.149297","192.168.137.147","204.79.197.203","TCP","54","57391  >  443 [ACK] Seq=286 Ack=5711 Win=262144 Len=0"
"251","48.156713","192.168.137.147","52.159.127.243","TCP","54","49410  >  443 [ACK] Seq=102 Ack=172 Win=512 Len=0"
"252","48.158847","192.168.137.147","204.79.197.203","TLSv1.2","212","Client Key Exchange, Change Cipher Spec, Encrypted Handshake Message"
"253","48.171447","204.79.197.203","192.168.137.147","TLSv1.2","396","New Session Ticket, Change Cipher Spec, Encrypted Handshake Message"
"254","48.171447","204.79.197.203","192.168.137.147","TLSv1.2","123","Application Data"
"255","48.171694","192.168.137.147","204.79.197.203","TCP","54","57391  >  443 [ACK] Seq=444 Ack=6122 Win=261632 Len=0"
"256","48.173460","192.168.137.147","204.79.197.203","TLSv1.2","141","Application Data"
"257","48.173515","192.168.137.147","204.79.197.203","TLSv1.2","92","Application Data"
"258","48.174301","192.168.137.147","204.79.197.203","TLSv1.2","351","Application Data"
"259","48.175177","204.79.197.203","192.168.137.147","TCP","54","443  >  57391 [ACK] Seq=6122 Ack=569 Win=16768 Len=0"
"260","48.178816","204.79.197.203","192.168.137.147","TLSv1.2","92","Application Data"
"261","48.179090","192.168.137.147","204.79.197.203","TCP","54","57391  >  443 [ACK] Seq=866 Ack=6160 Win=261632 Len=0"
"262","48.187449","192.168.137.147","77.234.42.98","TCP","54","57371  >  443 [ACK] Seq=374 Ack=856 Win=508 Len=0"
"263","48.248719","192.168.137.147","172.217.3.78","ICMP","74","Echo (ping) request  id=0x0001, seq=623/28418, ttl=128 (reply in 272)"
"264","48.257476","204.79.197.203","192.168.137.147","TCP","1514","443  >  57391 [ACK] Seq=6160 Ack=866 Win=17920 Len=1460 [TCP segment of a reassembled PDU]"
"265","48.257645","192.168.137.147","204.79.197.203","TCP","54","57391  >  443 [ACK] Seq=866 Ack=7620 Win=262144 Len=0"
"266","48.257730","204.79.197.203","192.168.137.147","TCP","1514","443  >  57391 [ACK] Seq=7620 Ack=866 Win=17920 Len=1460 [TCP segment of a reassembled PDU]"
"267","48.257730","204.79.197.203","192.168.137.147","TLSv1.2","570","Application Data"
"268","48.257730","204.79.197.203","192.168.137.147","TCP","1514","443  >  57391 [ACK] Seq=9596 Ack=866 Win=17920 Len=1460 [TCP segment of a reassembled PDU]"
"269","48.257776","192.168.137.147","204.79.197.203","TCP","54","57391  >  443 [ACK] Seq=866 Ack=11056 Win=262144 Len=0"
"270","48.257798","204.79.197.203","192.168.137.147","TLSv1.2","1112","Application Data, Application Data"
"271","48.257825","192.168.137.147","204.79.197.203","TCP","54","57391  >  443 [ACK] Seq=866 Ack=12114 Win=260864 Len=0"
"272","48.292713","172.217.3.78","192.168.137.147","ICMP","74","Echo (ping) reply    id=0x0001, seq=623/28418, ttl=114 (request in 263)"
"273","49.260747","192.168.137.147","172.217.3.78","ICMP","74","Echo (ping) request  id=0x0001, seq=624/28674, ttl=128 (reply in 274)"
"274","49.489885","172.217.3.78","192.168.137.147","ICMP","74","Echo (ping) reply    id=0x0001, seq=624/28674, ttl=114 (request in 273)"
"275","50.274144","192.168.137.147","172.217.3.78","ICMP","74","Echo (ping) request  id=0x0001, seq=625/28930, ttl=128 (reply in 276)"
"276","50.418472","172.217.3.78","192.168.137.147","ICMP","74","Echo (ping) reply    id=0x0001, seq=625/28930, ttl=114 (request in 275)"
"277","51.284540","192.168.137.147","172.217.3.78","ICMP","74","Echo (ping) request  id=0x0001, seq=626/29186, ttl=128 (reply in 278)"
"278","51.408318","172.217.3.78","192.168.137.147","ICMP","74","Echo (ping) reply    id=0x0001, seq=626/29186, ttl=114 (request in 277)"
"279","51.868613","192.168.137.147","77.234.42.98","TLSv1.2","140","Application Data"
"280","51.870549","77.234.42.98","192.168.137.147","TCP","54","443  >  57371 [ACK] Seq=856 Ack=460 Win=131 Len=0"
"281","51.933629","77.234.42.98","192.168.137.147","TLSv1.2","361","Application Data"
"282","51.936246","192.168.137.147","184.28.209.57","TCP","66","57392  >  443 [SYN] Seq=0 Win=65535 Len=0 MSS=1460 WS=256 SACK_PERM"
"283","51.938002","184.28.209.57","192.168.137.147","TCP","66","443  >  57392 [SYN, ACK] Seq=0 Ack=1 Win=14600 Len=0 MSS=1460 SACK_PERM WS=128"
"284","51.938221","192.168.137.147","184.28.209.57","TCP","54","57392  >  443 [ACK] Seq=1 Ack=1 Win=262144 Len=0"
"285","51.940591","192.168.137.147","184.28.209.57","TLSv1.3","342","Client Hello"
"286","51.942614","184.28.209.57","192.168.137.147","TCP","54","443  >  57392 [ACK] Seq=1 Ack=289 Win=15744 Len=0"
"287","51.986435","192.168.137.147","77.234.42.98","TCP","54","57371  >  443 [ACK] Seq=460 Ack=1163 Win=513 Len=0"
"288","52.256449","184.28.209.57","192.168.137.147","TLSv1.3","1514","Server Hello, Change Cipher Spec, Application Data"
"289","52.256655","192.168.137.147","184.28.209.57","TCP","54","57392  >  443 [ACK] Seq=289 Ack=1461 Win=262144 Len=0"
"290","52.256795","184.28.209.57","192.168.137.147","TCP","1514","443  >  57392 [ACK] Seq=1461 Ack=289 Win=15744 Len=1460 [TCP segment of a reassembled PDU]"
"291","52.256795","184.28.209.57","192.168.137.147","TCP","1230","443  >  57392 [PSH, ACK] Seq=2921 Ack=289 Win=15744 Len=1176 [TCP segment of a reassembled PDU]"
"292","52.256865","192.168.137.147","184.28.209.57","TCP","54","57392  >  443 [ACK] Seq=289 Ack=4097 Win=262144 Len=0"
"293","52.257256","184.28.209.57","192.168.137.147","TCP","1502","443  >  57392 [PSH, ACK] Seq=4097 Ack=289 Win=15744 Len=1448 [TCP segment of a reassembled PDU]"
"294","52.257492","192.168.137.147","184.28.209.57","TCP","54","57392  >  443 [ACK] Seq=289 Ack=5545 Win=260608 Len=0"
"295","52.298909","192.168.137.147","172.217.3.78","ICMP","74","Echo (ping) request  id=0x0001, seq=627/29442, ttl=128 (reply in 306)"
"296","52.317981","184.28.209.57","192.168.137.147","TLSv1.3","555","Application Data, Application Data, Application Data"
"297","52.318251","192.168.137.147","184.28.209.57","TCP","54","57392  >  443 [ACK] Seq=289 Ack=6046 Win=262144 Len=0"
"298","52.321737","192.168.137.147","184.28.209.57","TLSv1.3","134","Change Cipher Spec, Application Data"
"299","52.325822","184.28.209.57","192.168.137.147","TCP","54","443  >  57392 [ACK] Seq=6046 Ack=369 Win=15744 Len=0"
"300","52.328239","192.168.137.147","184.28.209.57","TLSv1.3","134","Application Data"
"301","52.328375","192.168.137.147","184.28.209.57","TCP","1514","57392  >  443 [ACK] Seq=449 Ack=6046 Win=262144 Len=1460 [TCP segment of a reassembled PDU]"
"302","52.328375","192.168.137.147","184.28.209.57","TLSv1.3","308","Application Data"
"303","52.329628","184.28.209.57","192.168.137.147","TCP","54","443  >  57392 [ACK] Seq=6046 Ack=449 Win=15744 Len=0"
"304","52.329628","184.28.209.57","192.168.137.147","TCP","54","443  >  57392 [ACK] Seq=6046 Ack=1909 Win=18688 Len=0"
"305","52.329628","184.28.209.57","192.168.137.147","TCP","54","443  >  57392 [ACK] Seq=6046 Ack=2163 Win=21632 Len=0"
