"No.","Time","Source","Destination","Protocol","Length","Info"
"1","0.000000","77.234.42.34","192.168.137.147","TLSv1.2","309","Application Data"
"2","0.001904","192.168.137.147","20.42.73.25","TCP","66","62447  >  443 [SYN] Seq=0 Win=65535 Len=0 MSS=1460 WS=256 SACK_PERM"
"3","0.040524","192.168.137.147","77.234.42.34","TCP","54","63562  >  443 [ACK] Seq=1 Ack=256 Win=512 Len=0"
"4","0.195374","20.42.73.25","192.168.137.147","TCP","66","443  >  62447 [SYN, ACK] Seq=0 Ack=1 Win=14600 Len=0 MSS=1460 SACK_PERM WS=128"
"5","0.195625","192.168.137.147","20.42.73.25","TCP","54","62447  >  443 [ACK] Seq=1 Ack=1 Win=262144 Len=0"
"6","0.196810","192.168.137.147","20.42.73.25","TLSv1.2","281","Client Hello"
"7","0.198120","20.42.73.25","192.168.137.147","TCP","54","443  >  62447 [ACK] Seq=1 Ack=228 Win=15744 Len=0"
"8","0.362805","20.42.73.25","192.168.137.147","TCP","1514","443  >  62447 [ACK] Seq=1 Ack=228 Win=15744 Len=1460 [TCP segment of a reassembled PDU]"
"9","0.363030","192.168.137.147","20.42.73.25","TCP","54","62447  >  443 [ACK] Seq=228 Ack=1461 Win=262144 Len=0"
"10","0.363149","20.42.73.25","192.168.137.147","TCP","1514","443  >  62447 [ACK] Seq=1461 Ack=228 Win=15744 Len=1460 [TCP segment of a reassembled PDU]"
"11","0.363149","20.42.73.25","192.168.137.147","TCP","1514","443  >  62447 [ACK] Seq=2921 Ack=228 Win=15744 Len=1460 [TCP segment of a reassembled PDU]"
"12","0.363149","20.42.73.25","192.168.137.147","TCP","1514","443  >  62447 [ACK] Seq=4381 Ack=228 Win=15744 Len=1460 [TCP segment of a reassembled PDU]"
"13","0.363149","20.42.73.25","192.168.137.147","TLSv1.2","505","Server Hello, Certificate, Certificate Status, Server Key Exchange, Server Hello Done"
"14","0.363297","192.168.137.147","20.42.73.25","TCP","54","62447  >  443 [ACK] Seq=228 Ack=6292 Win=262144 Len=0"
"15","0.367194","192.168.137.147","20.42.73.25","TLSv1.2","212","Client Key Exchange, Change Cipher Spec, Encrypted Handshake Message"
"16","0.369593","20.42.73.25","192.168.137.147","TCP","54","443  >  62447 [ACK] Seq=6292 Ack=386 Win=16768 Len=0"
"17","0.464422","20.42.73.25","192.168.137.147","TLSv1.2","105","Change Cipher Spec, Encrypted Handshake Message"
"18","0.464628","192.168.137.147","20.42.73.25","TCP","54","62447  >  443 [ACK] Seq=386 Ack=6343 Win=261888 Len=0"
"19","0.466253","192.168.137.147","20.42.73.25","TLSv1.2","1514","Application Data"
"20","0.466253","192.168.137.147","20.42.73.25","TCP","1514","62447  >  443 [ACK] Seq=1846 Ack=6343 Win=261888 Len=1460 [TCP segment of a reassembled PDU]"
"21","0.466253","192.168.137.147","20.42.73.25","TCP","1514","62447  >  443 [ACK] Seq=3306 Ack=6343 Win=261888 Len=1460 [TCP segment of a reassembled PDU]"
"22","0.466253","192.168.137.147","20.42.73.25","TLSv1.2","219","Application Data"
"23","0.468391","20.42.73.25","192.168.137.147","TCP","54","443  >  62447 [ACK] Seq=6343 Ack=1846 Win=19712 Len=0"
"24","0.468621","20.42.73.25","192.168.137.147","TCP","54","443  >  62447 [ACK] Seq=6343 Ack=3306 Win=22656 Len=0"
"25","0.468621","20.42.73.25","192.168.137.147","TCP","54","443  >  62447 [ACK] Seq=6343 Ack=4766 Win=25600 Len=0"
"26","0.468621","20.42.73.25","192.168.137.147","TCP","54","443  >  62447 [ACK] Seq=6343 Ack=4931 Win=28544 Len=0"
"27","0.635299","20.42.73.25","192.168.137.147","TLSv1.2","506","Application Data"
"28","0.635509","192.168.137.147","20.42.73.25","TCP","54","62447  >  443 [ACK] Seq=4931 Ack=6795 Win=261632 Len=0"
"29","0.955151","192.168.137.147","10.4.73.130","TCP","66","62448  >  49666 [SYN] Seq=0 Win=64240 Len=0 MSS=1460 WS=256 SACK_PERM"
"30","1.318001","192.168.137.147","77.234.42.34","TLSv1.2","144","Application Data"
"31","1.536116","192.168.137.147","77.234.42.34","TCP","144","[TCP Retransmission] 63562  >  443 [PSH, ACK] Seq=1 Ack=256 Win=512 Len=90"
"32","1.758469","77.234.42.34","192.168.137.147","TCP","54","443  >  63562 [ACK] Seq=256 Ack=91 Win=131 Len=0"
"33","1.782150","77.234.42.34","192.168.137.147","TLSv1.2","232","Application Data"
"34","1.788965","192.168.137.147","162.125.5.13","TCP","66","62449  >  443 [SYN] Seq=0 Win=64240 Len=0 MSS=1460 WS=256 SACK_PERM"
"35","1.790923","162.125.5.13","192.168.137.147","TCP","66","443  >  62449 [SYN, ACK] Seq=0 Ack=1 Win=14600 Len=0 MSS=1460 SACK_PERM WS=128"
"36","1.791068","192.168.137.147","162.125.5.13","TCP","54","62449  >  443 [ACK] Seq=1 Ack=1 Win=131328 Len=0"
"37","1.793750","192.168.137.147","162.125.5.13","TLSv1.2","255","Client Hello"
"38","1.795483","162.125.5.13","192.168.137.147","TCP","54","443  >  62449 [ACK] Seq=1 Ack=202 Win=15744 Len=0"
"39","1.835134","192.168.137.147","77.234.42.34","TCP","54","63562  >  443 [ACK] Seq=91 Ack=434 Win=511 Len=0"
"40","1.918762","162.125.5.13","192.168.137.147","TLSv1.2","1514","Server Hello"
"41","1.918762","162.125.5.13","192.168.137.147","TCP","1514","443  >  62449 [ACK] Seq=1461 Ack=202 Win=15744 Len=1460 [TCP segment of a reassembled PDU]"
"42","1.918762","162.125.5.13","192.168.137.147","TLSv1.2","489","Certificate, Server Key Exchange, Server Hello Done"
"43","1.919034","192.168.137.147","162.125.5.13","TCP","54","62449  >  443 [ACK] Seq=202 Ack=3356 Win=131328 Len=0"
"44","1.921975","192.168.137.147","162.125.5.13","TLSv1.2","147","Client Key Exchange, Change Cipher Spec, Encrypted Handshake Message"
"45","1.923297","162.125.5.13","192.168.137.147","TCP","54","443  >  62449 [ACK] Seq=3356 Ack=295 Win=15744 Len=0"
"46","1.961066","192.168.137.147","10.4.73.130","TCP","66","[TCP Retransmission] [TCP Port numbers reused] 62448  >  49666 [SYN] Seq=0 Win=64240 Len=0 MSS=1460 WS=256 SACK_PERM"
"47","1.986204","162.125.5.13","192.168.137.147","TLSv1.2","312","New Session Ticket, Change Cipher Spec, Encrypted Handshake Message"
"48","2.007508","192.168.137.147","162.125.5.13","TLSv1.2","141","Application Data"
"49","2.007621","192.168.137.147","162.125.5.13","TLSv1.2","331","Application Data"
"50","2.197164","192.168.137.147","162.125.5.13","TCP","418","[TCP Retransmission] 62449  >  443 [PSH, ACK] Seq=295 Ack=3614 Win=131072 Len=364"
"51","2.310936","162.125.5.13","192.168.137.147","TCP","312","[TCP Spurious Retransmission] 443  >  62449 [PSH, ACK] Seq=3356 Ack=295 Win=15744 Len=258"
"52","2.311084","192.168.137.147","162.125.5.13","TCP","66","[TCP Dup ACK 48#1] 62449  >  443 [ACK] Seq=659 Ack=3614 Win=131072 Len=0 SLE=3356 SRE=3614"
"53","2.412263","162.125.5.13","192.168.137.147","TCP","54","443  >  62449 [ACK] Seq=3614 Ack=659 Win=16768 Len=0"
"54","2.443604","162.125.5.13","192.168.137.147","TLSv1.2","138","Application Data"
"55","2.444687","192.168.137.147","162.125.5.13","TLSv1.2","92","Application Data"
"56","2.447239","162.125.5.13","192.168.137.147","TCP","54","443  >  62449 [ACK] Seq=3698 Ack=697 Win=16768 Len=0"
"57","2.477379","162.125.5.13","192.168.137.147","TLSv1.2","381","Application Data"
"58","2.485174","192.168.137.147","162.125.5.13","TCP","54","62449  >  443 [FIN, ACK] Seq=697 Ack=4025 Win=130560 Len=0"
"59","2.487336","162.125.5.13","192.168.137.147","TCP","54","443  >  62449 [FIN, ACK] Seq=4025 Ack=698 Win=16768 Len=0"
"60","2.487779","192.168.137.147","162.125.5.13","TCP","54","62449  >  443 [ACK] Seq=698 Ack=4026 Win=130560 Len=0"
"61","2.970951","192.168.137.147","10.4.73.130","TCP","66","62450  >  49667 [SYN] Seq=0 Win=64240 Len=0 MSS=1460 WS=256 SACK_PERM"
"62","3.976678","192.168.137.147","10.4.73.130","TCP","66","[TCP Retransmission] [TCP Port numbers reused] 62450  >  49667 [SYN] Seq=0 Win=64240 Len=0 MSS=1460 WS=256 SACK_PERM"
"63","4.985555","192.168.137.147","10.4.73.130","TCP","66","62451  >  49668 [SYN] Seq=0 Win=64240 Len=0 MSS=1460 WS=256 SACK_PERM"
"64","5.992505","192.168.137.147","10.4.73.130","TCP","66","[TCP Retransmission] [TCP Port numbers reused] 62451  >  49668 [SYN] Seq=0 Win=64240 Len=0 MSS=1460 WS=256 SACK_PERM"
"65","6.353935","fe80::a8f9:bf90:88d5:7c62","ff02::1:2","DHCPv6","156","Solicit XID: 0x9589a4 CID: 000100012b3d3ad9900f0c86e395 "
"66","7.000548","192.168.137.147","10.4.73.130","TCP","66","62452  >  49669 [SYN] Seq=0 Win=64240 Len=0 MSS=1460 WS=256 SACK_PERM"
"67","8.005728","192.168.137.147","10.4.73.130","TCP","66","[TCP Retransmission] [TCP Port numbers reused] 62452  >  49669 [SYN] Seq=0 Win=64240 Len=0 MSS=1460 WS=256 SACK_PERM"
"68","9.013642","192.168.137.147","10.4.73.130","TCP","66","62453  >  49716 [SYN] Seq=0 Win=64240 Len=0 MSS=1460 WS=256 SACK_PERM"
"69","9.108463","192.168.137.147","192.168.137.1","DNS","75","Standard query 0x6897 A su.ff.avast.com"
"70","9.108773","192.168.137.147","192.168.137.1","DNS","75","Standard query 0x28c9 AAAA su.ff.avast.com"
"71","9.120201","192.168.137.1","192.168.137.147","DNS","480","Standard query response 0x6897 A su.ff.avast.com CNAME su.ns1.ff.avast.com A 77.234.42.238 A 77.234.42.39 A 77.234.42.239 A 77.234.42.40 A 77.234.42.249 A 77.234.46.107 A 77.234.44.84 A 77.234.42.247 A 77.234.44.86 A 77.234.42.248 NS m.gtld-servers.net NS g.gtld-servers.net NS c.gtld-servers.net NS l.gtld-servers.net NS a.gtld-servers.net NS i.gtld-servers.net NS e.gtld-servers.net NS k.gtld-servers.net NS f.gtld-servers.net NS h.gtld-servers.net NS b.gtld-servers.net NS d.gtld-servers.net NS j.gtld-servers.net"
"72","9.120378","192.168.137.1","192.168.137.147","DNS","161","Standard query response 0x28c9 AAAA su.ff.avast.com CNAME su.ns1.ff.avast.com SOA dns1.p02.nsone.net"
"73","9.121642","192.168.137.147","192.168.137.1","DNS","87","Standard query 0x70c8 AAAA su.ff.avast.com.uptc.edu.co"
"74","9.125272","192.168.137.1","192.168.137.147","DNS","155","Standard query response 0x70c8 No such name AAAA su.ff.avast.com.uptc.edu.co SOA dns-pri.uptc.edu.co.uptc.edu.co"
"75","9.125576","192.168.137.147","192.168.137.1","DNS","86","Standard query 0x93a9 AAAA su.ff.avast.com.mshome.net"
"76","9.128282","192.168.137.1","192.168.137.147","DNS","86","Standard query response 0x93a9 No such name AAAA su.ff.avast.com.mshome.net"
"77","9.129045","192.168.137.147","77.234.42.238","TCP","66","62454  >  80 [SYN] Seq=0 Win=64240 Len=0 MSS=1460 WS=256 SACK_PERM"
"78","9.131168","77.234.42.238","192.168.137.147","TCP","66","80  >  62454 [SYN, ACK] Seq=0 Ack=1 Win=14600 Len=0 MSS=1460 SACK_PERM WS=128"
"79","9.131352","192.168.137.147","77.234.42.238","TCP","54","62454  >  80 [ACK] Seq=1 Ack=1 Win=131328 Len=0"
"80","9.131580","192.168.137.147","77.234.42.238","HTTP","344","GET /R/A24KIGNlNTk2OTI4ZTRlMzQ1YTY4NzhiMTQzZjRlM2ViMDgyEgQCFAMjGKwCIgEBKggIBBDv58OoASoICAMQrZXwpwE4oa-EuAFCIHY6SnbH5a1RMzutpW5nQfJNNCF6fSbKVrDET0SEfzFeSICDKA== HTTP/1.1 "
"81","9.133401","77.234.42.238","192.168.137.147","TCP","54","80  >  62454 [ACK] Seq=1 Ack=291 Win=15744 Len=0"
"82","10.017952","192.168.137.147","10.4.73.130","TCP","66","[TCP Retransmission] [TCP Port numbers reused] 62453  >  49716 [SYN] Seq=0 Win=64240 Len=0 MSS=1460 WS=256 SACK_PERM"
"83","10.036835","CloudNet_86:e3:ee","Broadcast","ARP","42","Who has 192.168.137.1? Tell 192.168.137.147"
"84","10.038577","7a:2b:46:79:67:01","CloudNet_86:e3:ee","ARP","42","192.168.137.1 is at 7a:2b:46:79:67:01"
"85","10.270056","77.234.42.238","192.168.137.147","TCP","1514","80  >  62454 [ACK] Seq=1 Ack=291 Win=15744 Len=1460 [TCP segment of a reassembled PDU]"
"86","10.270292","77.234.42.238","192.168.137.147","TCP","1514","80  >  62454 [ACK] Seq=1461 Ack=291 Win=15744 Len=1460 [TCP segment of a reassembled PDU]"
"87","10.270292","77.234.42.238","192.168.137.147","HTTP","858","HTTP/1.1 200 OK "
"88","10.270395","192.168.137.147","77.234.42.238","TCP","54","62454  >  80 [ACK] Seq=291 Ack=3725 Win=131328 Len=0"
"89","10.279661","192.168.137.147","77.234.42.238","HTTP","360","GET /R/A3sKIGNlNTk2OTI4ZTRlMzQ1YTY4NzhiMTQzZjRlM2ViMDgyEgQCFAMjGKwCIgH-KggIBBDZ6sOoASoICAMQrZXwpwEyCwgEENnqw6gBGIAKOKGvhLgBQiB2Okp2x-WtUTM7raVuZ0HyTTQhen0mylawxE9EhH8xXkiAgyg= HTTP/1.1 "
"90","10.285914","77.234.42.238","192.168.137.147","TCP","54","80  >  62454 [ACK] Seq=3725 Ack=597 Win=16768 Len=0"
"91","11.025779","192.168.137.147","10.4.73.130","TCP","66","62455  >  53126 [SYN] Seq=0 Win=64240 Len=0 MSS=1460 WS=256 SACK_PERM"
"92","11.704042","192.168.137.147","20.62.59.38","TLSv1.2","82","Application Data"
"93","11.705693","20.62.59.38","192.168.137.147","TCP","54","443  >  63575 [ACK] Seq=1 Ack=29 Win=169 Len=0"
"94","11.814268","192.168.137.147","20.62.59.38","TLSv1.2","85","Application Data"
"95","11.815829","20.62.59.38","192.168.137.147","TCP","54","443  >  63575 [ACK] Seq=1 Ack=60 Win=169 Len=0"
"96","12.033658","192.168.137.147","10.4.73.130","TCP","66","[TCP Retransmission] [TCP Port numbers reused] 62455  >  53126 [SYN] Seq=0 Win=64240 Len=0 MSS=1460 WS=256 SACK_PERM"
"97","12.128469","192.168.137.1","192.168.137.147","DNS","155","Standard query response 0x70c8 No such name AAAA su.ff.avast.com.uptc.edu.co SOA dns-pri.uptc.edu.co.uptc.edu.co"
"98","13.040885","192.168.137.147","10.4.73.130","TCP","66","62456  >  53127 [SYN] Seq=0 Win=64240 Len=0 MSS=1460 WS=256 SACK_PERM"
"99","13.473408","20.62.59.38","192.168.137.147","TLSv1.2","81","Application Data"
"100","13.528160","192.168.137.147","20.62.59.38","TCP","54","63575  >  443 [ACK] Seq=60 Ack=28 Win=511 Len=0"
"101","14.047051","192.168.137.147","10.4.73.130","TCP","66","[TCP Retransmission] [TCP Port numbers reused] 62456  >  53127 [SYN] Seq=0 Win=64240 Len=0 MSS=1460 WS=256 SACK_PERM"
"102","14.477947","192.168.137.147","77.234.42.34","TLSv1.2","148","Application Data"
"103","14.480779","77.234.42.34","192.168.137.147","TCP","54","443  >  63562 [ACK] Seq=434 Ack=185 Win=131 Len=0"
"104","14.543291","77.234.42.34","192.168.137.147","TLSv1.2","286","Application Data"
"105","14.544654","192.168.137.147","77.234.42.34","TLSv1.2","144","Application Data"
"106","14.546731","77.234.42.34","192.168.137.147","TCP","54","443  >  63562 [ACK] Seq=666 Ack=275 Win=131 Len=0"
"107","14.610091","77.234.42.34","192.168.137.147","TLSv1.2","252","Application Data"
"108","14.611425","192.168.137.147","35.231.83.144","TCP","66","62457  >  443 [SYN] Seq=0 Win=64240 Len=0 MSS=1460 WS=256 SACK_PERM"
"109","14.613543","35.231.83.144","192.168.137.147","TCP","66","443  >  62457 [SYN, ACK] Seq=0 Ack=1 Win=14600 Len=0 MSS=1460 SACK_PERM WS=128"
"110","14.613651","192.168.137.147","35.231.83.144","TCP","54","62457  >  443 [ACK] Seq=1 Ack=1 Win=131328 Len=0"
"111","14.614058","192.168.137.147","35.231.83.144","TCP","150","62457  >  443 [PSH, ACK] Seq=1 Ack=1 Win=131328 Len=96"
"112","14.615617","35.231.83.144","192.168.137.147","TCP","54","443  >  62457 [ACK] Seq=1 Ack=97 Win=14720 Len=0"
"113","14.660751","192.168.137.147","77.234.42.34","TCP","54","63562  >  443 [ACK] Seq=275 Ack=864 Win=509 Len=0"
"114","14.731649","35.231.83.144","192.168.137.147","TCP","70","443  >  62457 [PSH, ACK] Seq=1 Ack=97 Win=14720 Len=16"
"115","14.786714","192.168.137.147","35.231.83.144","TCP","54","62457  >  443 [ACK] Seq=97 Ack=17 Win=131328 Len=0"
"116","15.054042","192.168.137.147","10.4.73.130","TCP","66","62458  >  54193 [SYN] Seq=0 Win=64240 Len=0 MSS=1460 WS=256 SACK_PERM"
"117","15.138426","192.168.137.1","192.168.137.147","DNS","155","Standard query response 0x70c8 No such name AAAA su.ff.avast.com.uptc.edu.co SOA dns-pri.uptc.edu.co.uptc.edu.co"
"118","15.242717","CloudNet_86:e3:ee","Broadcast","ARP","42","Who has 192.168.137.1? Tell 192.168.137.147"
"119","15.243844","7a:2b:46:79:67:01","CloudNet_86:e3:ee","ARP","42","192.168.137.1 is at 7a:2b:46:79:67:01"
"120","15.750412","192.168.137.147","77.234.42.34","TLSv1.2","149","Application Data"
"121","15.752175","77.234.42.34","192.168.137.147","TCP","54","443  >  63562 [ACK] Seq=864 Ack=370 Win=131 Len=0"
"122","15.815486","77.234.42.34","192.168.137.147","TLSv1.2","312","Application Data"
"123","15.815989","192.168.137.147","77.234.42.34","TLSv1.2","152","Application Data"
"124","15.816152","192.168.137.147","77.234.42.34","TLSv1.2","152","Application Data"
"125","15.817543","192.168.137.147","13.107.4.52","TCP","66","62459  >  80 [SYN] Seq=0 Win=64240 Len=0 MSS=1460 WS=256 SACK_PERM"
"126","15.818075","77.234.42.34","192.168.137.147","TCP","54","443  >  63562 [ACK] Seq=1122 Ack=468 Win=131 Len=0"
"127","15.818550","77.234.42.34","192.168.137.147","TCP","54","443  >  63562 [ACK] Seq=1122 Ack=566 Win=131 Len=0"
"128","15.819282","13.107.4.52","192.168.137.147","TCP","66","80  >  62459 [SYN, ACK] Seq=0 Ack=1 Win=14600 Len=0 MSS=1460 SACK_PERM WS=128"
"129","15.819418","192.168.137.147","13.107.4.52","TCP","54","62459  >  80 [ACK] Seq=1 Ack=1 Win=131328 Len=0"
"130","15.820428","192.168.137.147","13.107.4.52","HTTP","208","GET /connecttest.txt HTTP/1.1 "
"131","15.822802","13.107.4.52","192.168.137.147","TCP","54","80  >  62459 [ACK] Seq=1 Ack=155 Win=15744 Len=0"
"132","15.832319","13.107.4.52","192.168.137.147","HTTP","593","HTTP/1.1 200 OK  (text/plain)"
"133","15.832442","13.107.4.52","192.168.137.147","TCP","54","80  >  62459 [FIN, ACK] Seq=540 Ack=155 Win=15744 Len=0"
"134","15.832499","192.168.137.147","13.107.4.52","TCP","54","62459  >  80 [ACK] Seq=155 Ack=540 Win=130816 Len=0"
"135","15.834302","192.168.137.147","13.107.4.52","TCP","54","62459  >  80 [ACK] Seq=155 Ack=541 Win=130816 Len=0"
"136","15.834415","192.168.137.147","13.107.4.52","TCP","54","62459  >  80 [FIN, ACK] Seq=155 Ack=541 Win=130816 Len=0"
"137","15.834515","192.168.137.147","13.107.4.52","TCP","54","62459  >  80 [RST, ACK] Seq=156 Ack=541 Win=0 Len=0"
"138","15.836367","13.107.4.52","192.168.137.147","TCP","54","80  >  62459 [ACK] Seq=541 Ack=156 Win=15744 Len=0"
"139","15.836425","192.168.137.147","13.107.4.52","TCP","54","62459  >  80 [RST] Seq=156 Win=0 Len=0"
"140","15.881689","77.234.42.34","192.168.137.147","TLSv1.2","302","Application Data"
"141","15.881930","77.234.42.34","192.168.137.147","TLSv1.2","293","Application Data"
"142","15.882066","192.168.137.147","77.234.42.34","TCP","54","63562  >  443 [ACK] Seq=566 Ack=1609 Win=513 Len=0"
"143","16.058173","192.168.137.147","10.4.73.130","TCP","66","[TCP Retransmission] [TCP Port numbers reused] 62458  >  54193 [SYN] Seq=0 Win=64240 Len=0 MSS=1460 WS=256 SACK_PERM"
"144","16.068204","192.168.137.147","34.149.149.62","TCP","66","62460  >  443 [SYN] Seq=0 Win=64240 Len=0 MSS=1460 WS=256 SACK_PERM"
"145","16.070105","34.149.149.62","192.168.137.147","TCP","66","443  >  62460 [SYN, ACK] Seq=0 Ack=1 Win=14600 Len=0 MSS=1460 SACK_PERM WS=128"
"146","16.070287","192.168.137.147","34.149.149.62","TCP","54","62460  >  443 [ACK] Seq=1 Ack=1 Win=131328 Len=0"
"147","16.185692","192.168.137.147","34.149.149.62","TLSv1.3","352","Client Hello"
"148","16.189305","34.149.149.62","192.168.137.147","TCP","54","443  >  62460 [ACK] Seq=1 Ack=299 Win=15744 Len=0"
"149","16.195915","34.149.149.62","192.168.137.147","TLSv1.3","1514","Server Hello, Change Cipher Spec"
"150","16.195915","34.149.149.62","192.168.137.147","TCP","1514","443  >  62460 [ACK] Seq=1461 Ack=299 Win=15744 Len=1460 [TCP segment of a reassembled PDU]"
"151","16.196151","192.168.137.147","34.149.149.62","TCP","54","62460  >  443 [ACK] Seq=299 Ack=2921 Win=131328 Len=0"
"152","16.196267","34.149.149.62","192.168.137.147","TCP","1514","443  >  62460 [ACK] Seq=2921 Ack=299 Win=15744 Len=1460 [TCP segment of a reassembled PDU]"
"153","16.196267","34.149.149.62","192.168.137.147","TLSv1.3","403","Application Data"
"154","16.196339","192.168.137.147","34.149.149.62","TCP","54","62460  >  443 [ACK] Seq=299 Ack=4730 Win=131328 Len=0"
"155","16.200272","192.168.137.147","34.149.149.62","TLSv1.3","134","Change Cipher Spec, Application Data"
"156","16.200459","192.168.137.147","34.149.149.62","TLSv1.3","142","Application Data"
"157","16.202221","34.149.149.62","192.168.137.147","TCP","54","443  >  62460 [ACK] Seq=4730 Ack=467 Win=15744 Len=0"
"158","16.259623","34.149.149.62","192.168.137.147","TLSv1.3","1161","Application Data, Application Data"
"159","16.262006","192.168.137.147","34.149.149.62","TLSv1.3","78","Application Data"
"160","16.262244","192.168.137.147","34.149.149.62","TCP","54","62460  >  443 [FIN, ACK] Seq=491 Ack=5837 Win=130048 Len=0"
"161","16.264356","34.149.149.62","192.168.137.147","TCP","54","443  >  62460 [FIN, ACK] Seq=5837 Ack=492 Win=15744 Len=0"
"162","16.264457","192.168.137.147","34.149.149.62","TCP","54","62460  >  443 [ACK] Seq=492 Ack=5838 Win=130048 Len=0"
"163","16.285600","CloudNet_86:e3:ee","Broadcast","ARP","42","Who has 192.168.137.1? Tell 192.168.137.147"
"164","16.287398","7a:2b:46:79:67:01","CloudNet_86:e3:ee","ARP","42","192.168.137.1 is at 7a:2b:46:79:67:01"
"165","17.064649","192.168.137.147","10.4.73.130","TCP","66","62462  >  54194 [SYN] Seq=0 Win=64240 Len=0 MSS=1460 WS=256 SACK_PERM"
"166","18.070612","192.168.137.147","10.4.73.130","TCP","66","[TCP Retransmission] [TCP Port numbers reused] 62462  >  54194 [SYN] Seq=0 Win=64240 Len=0 MSS=1460 WS=256 SACK_PERM"
"167","18.144796","192.168.137.1","192.168.137.147","DNS","155","Standard query response 0x70c8 No such name AAAA su.ff.avast.com.uptc.edu.co SOA dns-pri.uptc.edu.co.uptc.edu.co"
"168","18.906623","192.168.137.147","239.255.255.250","UDP","666","56935  >  3702 Len=624"
"169","19.080024","192.168.137.147","10.4.73.130","TCP","66","62463  >  54197 [SYN] Seq=0 Win=64240 Len=0 MSS=1460 WS=256 SACK_PERM"
"170","19.410850","fe80::a8f9:bf90:88d5:7c62","ff02::c","SSDP","157","M-SEARCH * HTTP/1.1 "
"171","19.411401","192.168.137.147","239.255.255.250","SSDP","143","M-SEARCH * HTTP/1.1 "
"172","19.649391","192.168.137.10","224.0.0.251","MDNS","422","Standard query response 0x0000 TXT, cache flush PTR _mi-connect._udp.local PTR {""nm"":""Redmi Note 8"",""as"":""[8193, 8194]"",""ip"":""10""}._mi-connect._udp.local SRV, cache flush 0 0 56666 Android.local A, cache flush 192.168.137.10 AAAA, cache flush fe80::c417:f47:ee09:3a2d NSEC, cache flush Android.local NSEC, cache flush {""nm"":""Redmi Note 8"",""as"":""[8193, 8194]"",""ip"":""10""}._mi-connect._udp.local"
"173","19.649778","fe80::c417:f47:ee09:3a2d","ff02::fb","MDNS","442","Standard query response 0x0000 TXT, cache flush PTR _mi-connect._udp.local PTR {""nm"":""Redmi Note 8"",""as"":""[8193, 8194]"",""ip"":""10""}._mi-connect._udp.local SRV, cache flush 0 0 56666 Android.local A, cache flush 192.168.137.10 AAAA, cache flush fe80::c417:f47:ee09:3a2d NSEC, cache flush Android.local NSEC, cache flush {""nm"":""Redmi Note 8"",""as"":""[8193, 8194]"",""ip"":""10""}._mi-connect._udp.local"
"174","19.790025","fe80::a8f9:bf90:88d5:7c62","ff02::c","UDP","686","56936  >  3702 Len=624"
"175","19.992735","192.168.137.169","239.255.255.250","SSDP","216","M-SEARCH * HTTP/1.1 "
"176","19.992935","192.168.137.169","239.255.255.250","SSDP","217","M-SEARCH * HTTP/1.1 "
"177","20.088222","192.168.137.147","10.4.73.130","TCP","66","[TCP Retransmission] [TCP Port numbers reused] 62463  >  54197 [SYN] Seq=0 Win=64240 Len=0 MSS=1460 WS=256 SACK_PERM"
"178","20.248705","CloudNet_86:e3:ee","Broadcast","ARP","42","Who has 192.168.137.1? Tell 192.168.137.147"
"179","20.250045","7a:2b:46:79:67:01","CloudNet_86:e3:ee","ARP","42","192.168.137.1 is at 7a:2b:46:79:67:01"
"180","20.915731","192.168.137.169","239.255.255.250","SSDP","217","M-SEARCH * HTTP/1.1 "
"181","20.915731","192.168.137.169","239.255.255.250","SSDP","216","M-SEARCH * HTTP/1.1 "
"182","21.081015","192.168.137.147","10.4.73.130","TCP","66","62464  >  54198 [SYN] Seq=0 Win=64240 Len=0 MSS=1460 WS=256 SACK_PERM"
"183","21.835914","192.168.137.169","239.255.255.250","SSDP","217","M-SEARCH * HTTP/1.1 "
"184","21.836081","192.168.137.169","239.255.255.250","SSDP","216","M-SEARCH * HTTP/1.1 "
"185","22.090604","192.168.137.147","10.4.73.130","TCP","66","[TCP Retransmission] [TCP Port numbers reused] 62464  >  54198 [SYN] Seq=0 Win=64240 Len=0 MSS=1460 WS=256 SACK_PERM"
"186","22.747692","192.168.137.169","239.255.255.250","SSDP","217","M-SEARCH * HTTP/1.1 "
"187","22.747891","192.168.137.169","239.255.255.250","SSDP","216","M-SEARCH * HTTP/1.1 "
"188","22.775230","192.168.137.147","77.234.42.34","TLSv1.2","145","Application Data"
"189","22.777807","77.234.42.34","192.168.137.147","TCP","54","443  >  63562 [ACK] Seq=1609 Ack=657 Win=131 Len=0"
"190","22.839961","77.234.42.34","192.168.137.147","TLSv1.2","283","Application Data"
"191","22.895948","192.168.137.147","77.234.42.34","TCP","54","63562  >  443 [ACK] Seq=657 Ack=1838 Win=512 Len=0"
"192","22.912169","192.168.137.147","239.255.255.250","UDP","666","56935  >  3702 Len=624"
"193","23.085743","192.168.137.147","10.4.73.130","TCP","66","62465  >  64620 [SYN] Seq=0 Win=64240 Len=0 MSS=1460 WS=256 SACK_PERM"
"194","23.632372","192.168.137.147","40.97.230.178","TLSv1.2","1070","Application Data"
"195","23.638575","40.97.230.178","192.168.137.147","TCP","54","443  >  62431 [ACK] Seq=1 Ack=1017 Win=174 Len=0"
"196","23.733275","40.97.230.178","192.168.137.147","TCP","1514","443  >  62431 [ACK] Seq=1 Ack=1017 Win=174 Len=1460 [TCP segment of a reassembled PDU]"
"197","23.733275","40.97.230.178","192.168.137.147","TLSv1.2","486","Application Data"
"198","23.733275","40.97.230.178","192.168.137.147","TLSv1.2","85","Application Data"
"199","23.733416","192.168.137.147","40.97.230.178","TCP","54","62431  >  443 [ACK] Seq=1017 Ack=1924 Win=1024 Len=0"
"200","23.797862","fe80::a8f9:bf90:88d5:7c62","ff02::c","UDP","686","56936  >  3702 Len=624"
"201","23.800959","fe80::a8f9:bf90:88d5:7c62","ff02::c","SSDP","157","M-SEARCH * HTTP/1.1 "
"202","23.801246","192.168.137.147","239.255.255.250","SSDP","143","M-SEARCH * HTTP/1.1 "
"203","23.813648","fe80::a8f9:bf90:88d5:7c62","ff02::c","UDP","686","51576  >  3702 Len=624"
"204","23.814306","192.168.137.147","239.255.255.250","UDP","666","51575  >  3702 Len=624"
"205","23.829048","192.168.137.147","40.97.230.178","TCP","54","62431  >  443 [FIN, ACK] Seq=1017 Ack=1924 Win=1024 Len=0"
"206","23.829305","192.168.137.147","13.107.21.200","TCP","54","62428  >  443 [FIN, ACK] Seq=1 Ack=1 Win=1023 Len=0"
"207","23.829439","192.168.137.147","13.107.21.200","TCP","54","62429  >  443 [FIN, ACK] Seq=1 Ack=1 Win=1022 Len=0"
"208","23.830991","13.107.21.200","192.168.137.147","TCP","54","443  >  62428 [FIN, ACK] Seq=1 Ack=2 Win=1264 Len=0"
"209","23.831083","192.168.137.147","13.107.21.200","TCP","54","62428  >  443 [ACK] Seq=2 Ack=2 Win=1023 Len=0"
"210","23.831182","40.97.230.178","192.168.137.147","TCP","54","443  >  62431 [FIN, ACK] Seq=1924 Ack=1018 Win=174 Len=0"
"211","23.831182","13.107.21.200","192.168.137.147","TCP","54","443  >  62429 [FIN, ACK] Seq=1 Ack=2 Win=123 Len=0"
"212","23.831239","192.168.137.147","40.97.230.178","TCP","54","62431  >  443 [ACK] Seq=1018 Ack=1925 Win=1024 Len=0"
"213","23.831293","192.168.137.147","13.107.21.200","TCP","54","62429  >  443 [ACK] Seq=2 Ack=2 Win=1022 Len=0"
"214","23.955067","fe80::a8f9:bf90:88d5:7c62","ff02::c","UDP","686","51576  >  3702 Len=624"
"215","23.970470","192.168.137.147","239.255.255.250","UDP","666","51575  >  3702 Len=624"
"216","24.015673","192.168.137.147","172.16.0.73","TCP","66","62466  >  8080 [SYN] Seq=0 Win=64240 Len=0 MSS=1460 WS=256 SACK_PERM"
"217","24.017737","172.16.0.73","192.168.137.147","TCP","66","8080  >  62466 [SYN, ACK] Seq=0 Ack=1 Win=29200 Len=0 MSS=1460 SACK_PERM WS=128"
"218","24.017890","192.168.137.147","172.16.0.73","TCP","54","62466  >  8080 [ACK] Seq=1 Ack=1 Win=131328 Len=0"
"219","24.018712","192.168.137.147","172.16.0.73","HTTP","300","CONNECT edge.microsoft.com:443 HTTP/1.1 "
"220","24.034988","172.16.0.73","192.168.137.147","TCP","54","8080  >  62466 [ACK] Seq=1 Ack=247 Win=30336 Len=0"
"221","24.036025","172.16.0.73","192.168.137.147","HTTP","93","HTTP/1.1 200 Connection established "
"222","24.036764","192.168.137.147","172.16.0.73","TLSv1.2","648","Client Hello"
"223","24.044023","172.16.0.73","192.168.137.147","TLSv1.2","208","Server Hello, Change Cipher Spec, Encrypted Handshake Message"
"224","24.044874","192.168.137.147","172.16.0.73","TLSv1.2","105","Change Cipher Spec, Encrypted Handshake Message"
"225","24.044962","192.168.137.147","172.16.0.73","TLSv1.2","159","Application Data"
"226","24.045070","192.168.137.147","172.16.0.73","TLSv1.2","571","Application Data"
"227","24.046839","172.16.0.73","192.168.137.147","TCP","54","8080  >  62466 [ACK] Seq=194 Ack=997 Win=31488 Len=0"
"228","24.050554","172.16.0.73","192.168.137.147","TLSv1.2","123","Application Data"
"229","24.051222","192.168.137.147","172.16.0.73","TLSv1.2","92","Application Data"
"230","24.052552","CloudNet_86:e3:ee","Broadcast","ARP","42","Who has 192.168.137.1? Tell 192.168.137.147"
"231","24.053915","7a:2b:46:79:67:01","CloudNet_86:e3:ee","ARP","42","192.168.137.1 is at 7a:2b:46:79:67:01"
"232","24.065407","172.16.0.73","192.168.137.147","TLSv1.2","92","Application Data"
"233","24.097452","192.168.137.147","10.4.73.130","TCP","66","[TCP Retransmission] [TCP Port numbers reused] 62465  >  64620 [SYN] Seq=0 Win=64240 Len=0 MSS=1460 WS=256 SACK_PERM"
"234","24.113418","192.168.137.147","172.16.0.73","TCP","54","62466  >  8080 [ACK] Seq=1552 Ack=301 Win=131072 Len=0"
"235","24.125242","172.16.0.73","192.168.137.147","TLSv1.2","773","Application Data, Application Data"
"236","24.176408","192.168.137.147","172.16.0.73","TCP","54","62466  >  8080 [ACK] Seq=1552 Ack=1020 Win=130304 Len=0"
"237","25.031075","192.168.137.147","77.234.42.34","TLSv1.2","138","Application Data"
"238","25.034114","77.234.42.34","192.168.137.147","TCP","54","443  >  63562 [ACK] Seq=1838 Ack=741 Win=131 Len=0"
"239","25.091064","192.168.137.147","10.4.73.130","TCP","66","62468  >  64621 [SYN] Seq=0 Win=64240 Len=0 MSS=1460 WS=256 SACK_PERM"
"240","25.098032","77.234.42.34","192.168.137.147","TLSv1.2","317","Application Data"
"241","25.098599","192.168.137.147","77.234.42.34","TLSv1.2","151","Application Data"
"242","25.099661","192.168.137.147","13.107.21.200","TCP","66","62469  >  443 [SYN] Seq=0 Win=65535 Len=0 MSS=1460 WS=256 SACK_PERM"
"243","25.099715","192.168.137.147","13.107.21.200","TCP","66","62471  >  443 [SYN] Seq=0 Win=65535 Len=0 MSS=1460 WS=256 SACK_PERM"
"244","25.099717","192.168.137.147","13.107.21.200","TCP","66","62470  >  443 [SYN] Seq=0 Win=65535 Len=0 MSS=1460 WS=256 SACK_PERM"
"245","25.100459","77.234.42.34","192.168.137.147","TCP","54","443  >  63562 [ACK] Seq=2101 Ack=838 Win=131 Len=0"
"246","25.101230","13.107.21.200","192.168.137.147","TCP","66","443  >  62469 [SYN, ACK] Seq=0 Ack=1 Win=14600 Len=0 MSS=1460 SACK_PERM WS=128"
"247","25.101371","192.168.137.147","13.107.21.200","TCP","54","62469  >  443 [ACK] Seq=1 Ack=1 Win=262144 Len=0"
"248","25.101594","192.168.137.147","13.107.21.200","TLSv1.2","557","Client Hello"
"249","25.101699","13.107.21.200","192.168.137.147","TCP","66","443  >  62471 [SYN, ACK] Seq=0 Ack=1 Win=14600 Len=0 MSS=1460 SACK_PERM WS=128"
"250","25.101699","13.107.21.200","192.168.137.147","TCP","66","443  >  62470 [SYN, ACK] Seq=0 Ack=1 Win=14600 Len=0 MSS=1460 SACK_PERM WS=128"
"251","25.101808","192.168.137.147","13.107.21.200","TCP","54","62471  >  443 [ACK] Seq=1 Ack=1 Win=262144 Len=0"
"252","25.101837","192.168.137.147","13.107.21.200","TCP","54","62470  >  443 [ACK] Seq=1 Ack=1 Win=262144 Len=0"
"253","25.102008","192.168.137.147","13.107.21.200","TLSv1.2","557","Client Hello"
"254","25.102036","192.168.137.147","13.107.21.200","TLSv1.2","557","Client Hello"
"255","25.103853","13.107.21.200","192.168.137.147","TCP","54","443  >  62469 [ACK] Seq=1 Ack=504 Win=15744 Len=0"
"256","25.103853","13.107.21.200","192.168.137.147","TCP","54","443  >  62470 [ACK] Seq=1 Ack=504 Win=15744 Len=0"
"257","25.103853","13.107.21.200","192.168.137.147","TCP","54","443  >  62471 [ACK] Seq=1 Ack=504 Win=15744 Len=0"
"258","25.110815","13.107.21.200","192.168.137.147","TLSv1.2","204","Server Hello, Change Cipher Spec, Encrypted Handshake Message"
"259","25.110931","192.168.137.147","13.107.21.200","TCP","54","62471  >  443 [ACK] Seq=504 Ack=151 Win=261888 Len=0"
"260","25.111425","192.168.137.147","13.107.21.200","TLSv1.2","105","Change Cipher Spec, Encrypted Handshake Message"
"261","25.111739","192.168.137.147","13.107.21.200","TLSv1.2","141","Application Data"
"262","25.111830","192.168.137.147","13.107.21.200","TCP","1514","62471  >  443 [ACK] Seq=642 Ack=151 Win=261888 Len=1460 [TCP segment of a reassembled PDU]"
"263","25.111830","192.168.137.147","13.107.21.200","TLSv1.2","1343","Application Data"
"264","25.111866","13.107.21.200","192.168.137.147","TLSv1.2","204","Server Hello, Change Cipher Spec, Encrypted Handshake Message"
"265","25.111950","192.168.137.147","13.107.21.200","TCP","54","62469  >  443 [ACK] Seq=504 Ack=151 Win=261888 Len=0"
"266","25.112466","192.168.137.147","13.107.21.200","TLSv1.2","105","Change Cipher Spec, Encrypted Handshake Message"
"267","25.112825","192.168.137.147","13.107.21.200","TLSv1.2","141","Application Data"
"268","25.113011","192.168.137.147","13.107.21.200","TLSv1.2","1112","Application Data"
"269","25.113132","192.168.137.147","13.107.21.200","TCP","1514","62471  >  443 [ACK] Seq=4449 Ack=151 Win=261888 Len=1460 [TCP segment of a reassembled PDU]"
"270","25.113132","192.168.137.147","13.107.21.200","TCP","1514","62471  >  443 [ACK] Seq=5909 Ack=151 Win=261888 Len=1460 [TCP segment of a reassembled PDU]"
"271","25.113132","192.168.137.147","13.107.21.200","TCP","1514","62471  >  443 [ACK] Seq=7369 Ack=151 Win=261888 Len=1460 [TCP segment of a reassembled PDU]"
"272","25.113132","192.168.137.147","13.107.21.200","TCP","1514","62471  >  443 [ACK] Seq=8829 Ack=151 Win=261888 Len=1460 [TCP segment of a reassembled PDU]"
"273","25.113132","192.168.137.147","13.107.21.200","TLSv1.2","472","Application Data"
"274","25.113268","192.168.137.147","13.107.21.200","TLSv1.2","92","Application Data"
"275","25.113473","13.107.21.200","192.168.137.147","TCP","66","443  >  62471 [ACK] Seq=151 Ack=555 Win=15744 Len=0 SLE=2102 SRE=3391"
"276","25.113473","13.107.21.200","192.168.137.147","TCP","66","443  >  62471 [ACK] Seq=151 Ack=642 Win=15744 Len=0 SLE=2102 SRE=3391"
"277","25.113473","13.107.21.200","192.168.137.147","TCP","54","443  >  62471 [ACK] Seq=151 Ack=3391 Win=18688 Len=0"
"278","25.114199","13.107.21.200","192.168.137.147","TLSv1.2","204","Server Hello, Change Cipher Spec, Encrypted Handshake Message"
"279","25.114330","192.168.137.147","13.107.21.200","TCP","54","62470  >  443 [ACK] Seq=504 Ack=151 Win=261888 Len=0"
"280","25.114762","13.107.21.200","192.168.137.147","TCP","54","443  >  62469 [ACK] Seq=151 Ack=642 Win=15744 Len=0"
"281","25.114894","192.168.137.147","13.107.21.200","TLSv1.2","105","Change Cipher Spec, Encrypted Handshake Message"
"282","25.115180","192.168.137.147","13.107.21.200","TLSv1.2","141","Application Data"
"283","25.115328","192.168.137.147","13.107.21.200","TCP","1514","62471  >  443 [ACK] Seq=10745 Ack=151 Win=261888 Len=1460 [TCP segment of a reassembled PDU]"
"284","25.115328","192.168.137.147","13.107.21.200","TLSv1.2","300","Application Data"
"285","25.115393","192.168.137.147","13.107.21.200","TLSv1.2","127","Application Data"
"286","25.115410","13.107.21.200","192.168.137.147","TCP","54","443  >  62471 [ACK] Seq=151 Ack=4449 Win=21632 Len=0"
"287","25.115410","13.107.21.200","192.168.137.147","TCP","54","443  >  62471 [ACK] Seq=151 Ack=5909 Win=24448 Len=0"
"288","25.115410","13.107.21.200","192.168.137.147","TCP","54","443  >  62471 [ACK] Seq=151 Ack=7369 Win=27392 Len=0"
"289","25.115410","13.107.21.200","192.168.137.147","TCP","54","443  >  62471 [ACK] Seq=151 Ack=8829 Win=30336 Len=0"
"290","25.115410","13.107.21.200","192.168.137.147","TCP","54","443  >  62471 [ACK] Seq=151 Ack=10289 Win=33280 Len=0"
"291","25.115410","13.107.21.200","192.168.137.147","TCP","54","443  >  62471 [ACK] Seq=151 Ack=10707 Win=36224 Len=0"
"292","25.115424","192.168.137.147","13.107.21.200","TLSv1.2","92","Application Data"
"293","25.115498","13.107.21.200","192.168.137.147","TCP","54","443  >  62471 [ACK] Seq=151 Ack=10745 Win=36224 Len=0"
"294","25.116716","13.107.21.200","192.168.137.147","TCP","54","443  >  62470 [ACK] Seq=151 Ack=642 Win=15744 Len=0"
"295","25.117071","13.107.21.200","192.168.137.147","TCP","54","443  >  62471 [ACK] Seq=151 Ack=12205 Win=39040 Len=0"
"296","25.117071","13.107.21.200","192.168.137.147","TCP","54","443  >  62471 [ACK] Seq=151 Ack=12451 Win=41984 Len=0"
"297","25.117071","13.107.21.200","192.168.137.147","TCP","66","[TCP Dup ACK 296#1] 443  >  62471 [ACK] Seq=151 Ack=12451 Win=41984 Len=0 SLE=12524 SRE=12562"
"298","25.117071","13.107.21.200","192.168.137.147","TCP","54","443  >  62471 [ACK] Seq=151 Ack=12562 Win=41984 Len=0"
"299","25.117071","13.107.21.200","192.168.137.147","TLSv1.2","123","Application Data"
"300","25.117071","13.107.21.200","192.168.137.147","TLSv1.2","92","Application Data"
"301","25.117198","192.168.137.147","13.107.21.200","TCP","54","62471  >  443 [ACK] Seq=12562 Ack=258 Win=261632 Len=0"
"302","25.117293","192.168.137.147","13.107.21.200","TLSv1.2","92","Application Data"
"303","25.118391","13.107.21.200","192.168.137.147","TLSv1.2","123","Application Data"
"304","25.118497","192.168.137.147","13.107.21.200","TCP","54","62469  >  443 [ACK] Seq=642 Ack=220 Win=261888 Len=0"
"305","25.118592","192.168.137.147","13.107.21.200","TLSv1.2","92","Application Data"
"306","25.120225","13.107.21.200","192.168.137.147","TLSv1.2","123","Application Data"
"307","25.120347","192.168.137.147","13.107.21.200","TCP","54","62470  >  443 [ACK] Seq=642 Ack=220 Win=261888 Len=0"
"308","25.120454","192.168.137.147","13.107.21.200","TLSv1.2","92","Application Data"
"309","25.124720","13.107.21.200","192.168.137.147","TLSv1.2","92","Application Data"
"310","25.124816","192.168.137.147","13.107.21.200","TCP","54","62469  >  443 [ACK] Seq=680 Ack=258 Win=261632 Len=0"
"311","25.126338","13.107.21.200","192.168.137.147","TLSv1.2","92","Application Data"
"312","25.126421","192.168.137.147","13.107.21.200","TCP","54","62470  >  443 [ACK] Seq=680 Ack=258 Win=261632 Len=0"
"313","25.145212","192.168.137.147","13.107.21.200","TCP","1514","62471  >  443 [ACK] Seq=12600 Ack=258 Win=261632 Len=1460 [TCP segment of a reassembled PDU]"
"314","25.145212","192.168.137.147","13.107.21.200","TLSv1.2","1135","Application Data"
"315","25.147877","13.107.21.200","192.168.137.147","TCP","54","443  >  62471 [ACK] Seq=258 Ack=14060 Win=44928 Len=0"
"316","25.164119","77.234.42.34","192.168.137.147","TLSv1.2","243","Application Data"
"317","25.165317","192.168.137.147","52.159.127.243","TCP","66","62472  >  443 [SYN] Seq=0 Win=64240 Len=0 MSS=1460 WS=256 SACK_PERM"
"318","25.168406","52.159.127.243","192.168.137.147","TCP","66","443  >  62472 [SYN, ACK] Seq=0 Ack=1 Win=14600 Len=0 MSS=1460 SACK_PERM WS=128"
"319","25.168593","192.168.137.147","52.159.127.243","TCP","54","62472  >  443 [ACK] Seq=1 Ack=1 Win=131328 Len=0"
"320","25.169695","192.168.137.147","52.159.127.243","TLSv1.2","234","Client Hello"
"321","25.171603","52.159.127.243","192.168.137.147","TCP","54","443  >  62472 [ACK] Seq=1 Ack=181 Win=15744 Len=0"
"322","25.187986","13.107.21.200","192.168.137.147","TCP","54","443  >  62471 [ACK] Seq=258 Ack=15141 Win=47872 Len=0"
"323","25.189796","13.107.21.200","192.168.137.147","TLSv1.2","346","Application Data"
"324","25.189965","192.168.137.147","13.107.21.200","TCP","54","62471  >  443 [ACK] Seq=15141 Ack=550 Win=261376 Len=0"
"325","25.195609","192.168.137.147","77.234.42.34","TLSv1.2","147","Application Data"
"326","25.200177","77.234.42.34","192.168.137.147","TCP","54","443  >  63562 [ACK] Seq=2290 Ack=931 Win=131 Len=0"
"327","25.225294","13.107.21.200","192.168.137.147","TLSv1.2","949","Application Data"
"328","25.225294","13.107.21.200","192.168.137.147","TLSv1.2","92","Application Data"
"329","25.225427","192.168.137.147","13.107.21.200","TCP","54","62471  >  443 [ACK] Seq=15141 Ack=1483 Win=262144 Len=0"
"330","25.227259","13.107.21.200","192.168.137.147","TCP","1514","443  >  62471 [ACK] Seq=1483 Ack=15141 Win=47872 Len=1460 [TCP segment of a reassembled PDU]"
"331","25.227259","13.107.21.200","192.168.137.147","TLSv1.2","196","Application Data"
"332","25.227259","13.107.21.200","192.168.137.147","TLSv1.2","92","Application Data"
