"No.","Time","Source","Destination","Protocol","Length","Info"
"1","0.000000000","82.122.176.117","81.131.67.131","UDP","61","11326  >  41730 Len=19"
"2","0.000000000","81.131.67.131","82.122.176.117","UDP","50","41730  >  11326 Len=8"
"3","0.015625000","142.68.189.57","81.131.67.131","Gnutella","170",""
"4","0.031250000","217.136.191.58","81.131.67.131","ICMP","70","Destination unreachable (Port unreachable)"
"5","0.062500000","81.131.67.131","82.10.189.102","UDP","61","41730  >  6346 Len=19"
"6","0.078125000","81.131.67.131","149.156.74.157","UDP","61","41730  >  6347 Len=19"
"7","0.078125000","81.131.67.131","82.53.134.82","UDP","61","41730  >  6347 Len=19"
"8","0.093750000","81.131.67.131","62.203.155.212","UDP","61","41730  >  6346 Len=19"
"9","0.109375000","81.131.67.131","83.132.177.64","UDP","61","41730  >  6346 Len=19"
"10","0.125000000","81.131.67.131","172.177.184.179","UDP","61","41730  >  6346 Len=19"
"11","0.140625000","81.131.67.131","172.186.173.245","UDP","61","41730  >  6346 Len=19"
"12","0.156250000","81.131.67.131","207.216.13.37","UDP","61","41730  >  6346 Len=19"
"13","0.171875000","81.131.67.131","85.96.110.115","UDP","61","41730  >  6346 Len=19"
"14","0.171875000","81.131.67.131","83.112.25.172","UDP","61","41730  >  6346 Len=19"
"15","0.187500000","81.131.67.131","195.14.223.213","UDP","61","41730  >  6346 Len=19"
"16","0.203125000","81.131.67.131","142.68.189.57","TCP","54","1595  >  6346 [ACK] Seq=1 Ack=117 Win=8866 Len=0"
"17","0.218750000","81.131.67.131","82.44.146.72","UDP","61","41730  >  34087 Len=19"
"18","0.328125000","210.146.64.4","81.131.67.131","TCP","1514","80  >  2727 [ACK] Seq=1 Ack=1 Win=6432 Len=1460"
"19","0.328125000","65.30.55.121","81.131.67.131","UDP","54","6346  >  41730 Len=12"
"20","0.328125000","212.195.108.125","81.131.67.131","UDP","50","6346  >  41730 Len=8"
"21","0.328125000","81.131.67.131","210.146.64.4","TCP","54","2727  >  80 [ACK] Seq=1 Ack=1461 Win=8760 Len=0"
"22","0.343750000","212.195.108.125","81.131.67.131","UDP","54","6346  >  41730 Len=12"
"23","0.343750000","81.56.116.170","81.131.67.131","UDP","61","6346  >  41730 Len=19"
"24","0.359375000","81.131.67.131","65.30.55.121","UDP","50","41730  >  6346 Len=8"
"25","0.359375000","81.131.67.131","212.195.108.125","UDP","50","41730  >  6346 Len=8"
"26","0.375000000","81.131.67.131","81.56.116.170","UDP","50","41730  >  6346 Len=8"
"27","0.515625000","38.115.4.204","81.131.67.131","TCP","836","21284  >  2667 [PSH, ACK] Seq=1 Ack=1 Win=64611 Len=782"
"28","0.515625000","84.159.23.80","81.131.67.131","UDP","61","62082  >  41730 Len=19"
"29","0.515625000","81.131.67.131","38.115.4.204","TCP","54","2667  >  21284 [ACK] Seq=9 Ack=783 Win=8760 Len=0"
"30","0.546875000","70.27.127.185","81.131.67.131","Gnutella","135",""
"31","0.578125000","38.115.4.204","81.131.67.131","TCP","54","21284  >  2667 [ACK] Seq=783 Ack=9 Win=64603 Len=0"
"32","0.578125000","81.131.67.131","38.115.4.204","THRIFT","62","EXCEPTION "
"33","0.578125000","64.83.226.59","81.131.67.131","UDP","61","56000  >  41730 Len=19"
"34","0.578125000","81.131.67.131","84.159.23.80","UDP","50","41730  >  62082 Len=8"
"35","0.593750000","81.131.67.131","64.83.226.59","UDP","50","41730  >  56000 Len=8"
"36","0.750000000","81.131.67.131","70.27.127.185","TCP","54","2094  >  6346 [ACK] Seq=1 Ack=82 Win=8109 Len=0"
"37","0.859375000","210.146.64.4","81.131.67.131","TCP","1514","80  >  2727 [ACK] Seq=1461 Ack=1 Win=6432 Len=1460"
"38","0.859375000","24.11.146.28","81.131.67.131","TCP","54","17342  >  2675 [ACK] Seq=1 Ack=1 Win=65311 Len=0"
"39","0.859375000","81.131.67.131","24.11.146.28","TCP","62","2675  >  17342 [PSH, ACK] Seq=1 Ack=4294965611 Win=10164 Len=8"
"40","0.875000000","62.203.15.181","81.131.67.131","ICMP","70","Destination unreachable (Port unreachable)"
"41","0.875000000","81.131.67.131","210.146.64.4","TCP","54","2727  >  80 [ACK] Seq=1 Ack=2921 Win=8760 Len=0"
"42","1.156250000","210.146.64.4","81.131.67.131","TCP","1514","80  >  2727 [ACK] Seq=2921 Ack=1 Win=6432 Len=1460"
"43","1.156250000","81.131.67.131","210.146.64.4","TCP","54","2727  >  80 [ACK] Seq=1 Ack=4381 Win=8760 Len=0"
"44","1.218750000","81.131.67.131","80.171.9.79","UDP","61","41730  >  6346 Len=19"
"45","1.218750000","81.131.67.131","62.131.99.79","UDP","61","41730  >  6346 Len=19"
"46","1.234375000","81.131.67.131","81.96.187.231","UDP","423","41730  >  6346 Len=381"
"47","1.453125000","210.146.64.4","81.131.67.131","TCP","1514","80  >  2727 [PSH, ACK] Seq=4381 Ack=1 Win=6432 Len=1460"
"48","1.453125000","81.131.67.131","210.146.64.4","TCP","54","2727  >  80 [ACK] Seq=1 Ack=5841 Win=8760 Len=0"
"49","1.734375000","210.146.64.4","81.131.67.131","TCP","1514","80  >  2727 [ACK] Seq=5841 Ack=1 Win=6432 Len=1460"
"50","1.734375000","68.34.169.230","81.131.67.131","TCP","79","6346  >  2433 [PSH, ACK] Seq=1 Ack=1 Win=64285 Len=25 [TCP segment of a reassembled PDU]"
"51","1.734375000","81.131.67.131","210.146.64.4","TCP","54","2727  >  80 [ACK] Seq=1 Ack=7301 Win=8760 Len=0"
"52","1.765625000","213.164.97.197","81.131.67.131","UDP","61","6346  >  41730 Len=19"
"53","1.796875000","211.28.6.30","81.131.67.131","TCP","138","6348  >  2769 [ACK] Seq=1 Ack=1 Win=7465 Len=84"
"54","1.796875000","81.131.67.131","211.28.6.30","TCP","54","2769  >  6348 [ACK] Seq=1 Ack=85 Win=8760 Len=0"
"55","1.812500000","81.131.67.131","213.164.97.197","UDP","50","41730  >  6346 Len=8"
"56","1.953125000","81.131.67.131","68.34.169.230","TCP","54","2433  >  6346 [ACK] Seq=1 Ack=26 Win=8604 Len=0"
"57","2.078125000","210.146.64.4","81.131.67.131","TCP","1514","80  >  2727 [PSH, ACK] Seq=7301 Ack=1 Win=6432 Len=1460"
"58","2.078125000","142.68.189.57","81.131.67.131","Gnutella","119",""
"59","2.078125000","81.131.67.131","210.146.64.4","TCP","54","2727  >  80 [ACK] Seq=1 Ack=8761 Win=8760 Len=0"
"60","2.109375000","62.203.155.212","81.131.67.131","ICMP","70","Destination unreachable (Port unreachable)"
"61","2.109375000","38.115.4.204","81.131.67.131","UDP","54","21284  >  41730 Len=12"
"62","2.171875000","81.131.67.131","38.115.4.204","UDP","50","41730  >  21284 Len=8"
"63","2.281250000","81.131.67.131","142.68.189.57","TCP","54","1595  >  6346 [ACK] Seq=1 Ack=182 Win=8801 Len=0"
"64","2.343750000","81.131.67.131","38.115.4.204","UDP","54","41730  >  21284 Len=12"
"65","2.343750000","81.131.67.131","24.11.146.28","UDP","54","41730  >  17342 Len=12"
"66","2.359375000","81.131.67.131","65.30.55.121","UDP","54","41730  >  6346 Len=12"
"67","2.375000000","81.131.67.131","81.11.204.41","UDP","526","41730  >  6346 Len=484"
"68","2.390625000","210.146.64.4","81.131.67.131","TCP","1514","80  >  2727 [ACK] Seq=8761 Ack=1 Win=6432 Len=1460"
"69","2.390625000","81.131.67.131","210.146.64.4","TCP","54","2727  >  80 [ACK] Seq=1 Ack=10221 Win=8760 Len=0"
"70","2.406250000","68.62.236.42","81.131.67.131","UDP","61","28101  >  41730 Len=19"
"71","2.406250000","81.131.67.131","68.62.236.42","UDP","50","41730  >  28101 Len=8"
"72","2.484375000","38.115.4.204","81.131.67.131","TCP","459","21284  >  2667 [PSH, ACK] Seq=783 Ack=9 Win=64603 Len=405"
"73","2.515625000","38.115.4.204","81.131.67.131","TCP","120","21284  >  2667 [PSH, ACK] Seq=1188 Ack=17 Win=64595 Len=66"
"74","2.515625000","81.131.67.131","38.115.4.204","TCP","62","2667  >  21284 [PSH, ACK] Seq=17 Ack=1254 Win=8289 Len=8"
"75","2.515625000","70.27.127.185","81.131.67.131","Gnutella","78",""
"76","2.546875000","213.19.160.190","81.131.67.131","TCP","54","80  >  2836 [FIN, ACK] Seq=1 Ack=1 Win=6432 Len=0"
"77","2.546875000","81.131.67.131","213.19.160.190","TCP","54","2836  >  80 [ACK] Seq=1 Ack=2 Win=8760 Len=0"
"78","2.718750000","81.131.67.131","70.27.127.185","TCP","54","2094  >  6346 [ACK] Seq=1 Ack=106 Win=8085 Len=0"
"79","2.828125000","210.146.64.4","81.131.67.131","TCP","1514","80  >  2727 [ACK] Seq=10221 Ack=1 Win=6432 Len=1460"
"80","2.828125000","81.131.67.131","210.146.64.4","TCP","54","2727  >  80 [ACK] Seq=1 Ack=11681 Win=8760 Len=0"
"81","2.890625000","81.131.67.131","213.19.160.190","TCP","54","2836  >  80 [RST] Seq=1 Win=0 Len=0"
"82","2.890625000","24.11.146.28","81.131.67.131","TCP","372","17342  >  2675 [PSH, ACK] Seq=1 Ack=9 Win=65303 Len=318"
"83","2.890625000","81.131.67.131","24.11.146.28","TCP","66","[TCP Dup ACK 39#1] 2675  >  17342 [ACK] Seq=9 Ack=4294965611 Win=10164 Len=0 SLE=1 SRE=319"
"84","3.156250000","210.146.64.4","81.131.67.131","TCP","1514","80  >  2727 [ACK] Seq=11681 Ack=1 Win=6432 Len=1460"
"85","3.156250000","81.131.67.131","210.146.64.4","TCP","54","2727  >  80 [ACK] Seq=1 Ack=13141 Win=8760 Len=0"
"86","3.187500000","81.96.187.231","81.131.67.131","UDP","50","6346  >  41730 Len=8"
"87","3.359375000","81.131.67.131","80.144.139.239","UDP","61","41730  >  6346 Len=19"
"88","3.359375000","81.131.67.131","84.190.183.182","UDP","61","41730  >  6347 Len=19"
"89","3.359375000","81.131.67.131","81.244.90.24","UDP","61","41730  >  6346 Len=19"
"90","3.375000000","81.131.67.131","219.137.42.1","UDP","61","41730  >  6346 Len=19"
"91","3.390625000","81.131.67.131","139.168.32.121","UDP","61","41730  >  6346 Len=19"
"92","3.406250000","81.131.67.131","83.203.140.221","UDP","61","41730  >  6346 Len=19"
"93","3.421875000","81.131.67.131","193.251.185.169","UDP","61","41730  >  6346 Len=19"
"94","3.437500000","81.131.67.131","81.133.140.169","UDP","61","41730  >  6346 Len=19"
"95","3.437500000","81.131.67.131","84.56.231.176","UDP","61","41730  >  6346 Len=19"
"96","3.453125000","81.131.67.131","62.205.109.173","UDP","61","41730  >  6346 Len=19"
"97","3.468750000","210.146.64.4","81.131.67.131","TCP","1514","80  >  2727 [PSH, ACK] Seq=13141 Ack=1 Win=6432 Len=1460"
"98","3.468750000","84.133.93.36","81.131.67.131","UDP","60","20835  >  41730 Len=18"
"99","3.468750000","81.131.67.131","82.216.238.111","UDP","61","41730  >  28046 Len=19"
"100","3.484375000","81.131.67.131","213.96.20.254","UDP","61","41730  >  6347 Len=19"
"101","3.500000000","81.131.67.131","84.133.93.36","UDP","50","41730  >  20835 Len=8"
"102","3.515625000","81.131.67.131","210.146.64.4","TCP","54","2727  >  80 [ACK] Seq=1 Ack=14601 Win=8760 Len=0"
"103","3.593750000","81.131.67.131","212.195.108.125","Gnutella","488",""
"104","3.765625000","210.146.64.4","81.131.67.131","TCP","1514","80  >  2727 [ACK] Seq=14601 Ack=1 Win=6432 Len=1460"
"105","3.765625000","81.131.67.131","210.146.64.4","TCP","54","2727  >  80 [ACK] Seq=1 Ack=16061 Win=8760 Len=0"
"106","4.046875000","210.146.64.4","81.131.67.131","TCP","1514","80  >  2727 [PSH, ACK] Seq=16061 Ack=1 Win=6432 Len=1460"
"107","4.046875000","68.62.236.42","81.131.67.131","ICMP","70","Destination unreachable (Port unreachable)"
"108","4.046875000","81.131.67.131","210.146.64.4","TCP","54","2727  >  80 [ACK] Seq=1 Ack=17521 Win=8760 Len=0"
"109","4.078125000","70.27.127.185","81.131.67.131","Gnutella","89",""
"110","4.250000000","81.131.67.131","70.27.127.185","TCP","54","2094  >  6346 [ACK] Seq=1 Ack=141 Win=8050 Len=0"
"111","4.359375000","210.146.64.4","81.131.67.131","TCP","1514","80  >  2727 [ACK] Seq=17521 Ack=1 Win=6432 Len=1460"
"112","4.359375000","65.30.55.121","81.131.67.131","UDP","50","6346  >  41730 Len=8"
"113","4.359375000","81.131.67.131","210.146.64.4","TCP","54","2727  >  80 [ACK] Seq=1 Ack=18981 Win=8760 Len=0"
"114","4.531250000","81.131.67.131","200.158.81.150","UDP","61","41730  >  6346 Len=19"
"115","4.531250000","81.131.67.131","68.220.65.107","UDP","550","41730  >  41229 Len=508"
"116","4.656250000","210.146.64.4","81.131.67.131","TCP","1514","80  >  2727 [ACK] Seq=18981 Ack=1 Win=6432 Len=1460"
"117","4.656250000","81.131.67.131","210.146.64.4","TCP","54","2727  >  80 [ACK] Seq=1 Ack=20441 Win=8760 Len=0"
"118","4.937500000","211.28.6.30","81.131.67.131","TCP","1514","6348  >  2769 [PSH, ACK] Seq=85 Ack=1 Win=7465 Len=1460"
"119","4.937500000","81.131.67.131","211.28.6.30","TCP","54","2769  >  6348 [ACK] Seq=1 Ack=1545 Win=8760 Len=0"
"120","5.252930000","210.146.64.4","81.131.67.131","TCP","1514","80  >  2727 [ACK] Seq=20441 Ack=1 Win=6432 Len=1460"
"121","5.252930000","81.131.67.131","210.146.64.4","TCP","54","2727  >  80 [ACK] Seq=1 Ack=21901 Win=8760 Len=0"
"122","5.541993000","24.11.146.28","81.131.67.131","TCP","1506","[TCP Retransmission] 17342  >  2675 [PSH, ACK] Seq=4294965611 Ack=9 Win=65303 Len=1452"
"123","5.541993000","193.251.185.169","81.131.67.131","UDP","50","6346  >  41730 Len=8"
"124","5.541993000","213.22.134.120","81.131.67.131","UDP","60","19408  >  41730 Len=18"
"125","5.541993000","81.131.67.131","24.11.146.28","TCP","66","2675  >  17342 [ACK] Seq=9 Ack=4294967063 Win=10164 Len=0 SLE=1 SRE=319"
"126","5.554688000","81.131.67.131","84.149.148.25","UDP","61","41730  >  6346 Len=19"
"127","5.568360000","81.131.67.131","81.161.144.10","UDP","61","41730  >  6346 Len=19"
"128","5.581055000","81.131.67.131","24.43.167.12","UDP","61","41730  >  6346 Len=19"
"129","5.593750000","81.131.67.131","81.247.65.177","UDP","61","41730  >  6346 Len=19"
"130","5.607422000","81.131.67.131","83.117.6.35","UDP","61","41730  >  6346 Len=19"
"131","5.609375000","81.131.67.131","195.130.143.128","UDP","61","41730  >  6346 Len=19"
"132","5.625000000","81.131.67.131","212.194.202.220","UDP","61","41730  >  6346 Len=19"
"133","5.640625000","81.131.67.131","207.148.176.7","UDP","61","41730  >  6346 Len=19"
"134","5.656250000","81.131.67.131","212.129.214.254","UDP","61","41730  >  6346 Len=19"
"135","5.671875000","81.131.67.131","213.22.134.120","UDP","50","41730  >  19408 Len=8"
"136","5.671875000","81.131.67.131","84.61.15.193","UDP","61","41730  >  6347 Len=19"
"137","5.687500000","81.131.67.131","24.11.146.28","TCP","65","2675  >  17342 [PSH, ACK] Seq=9 Ack=4294967063 Win=10164 Len=11"
"138","5.703125000","81.131.67.131","68.220.65.107","UDP","153","41730  >  41229 Len=111"
"139","5.828125000","211.28.6.30","81.131.67.131","TCP","1514","6348  >  2769 [PSH, ACK] Seq=1545 Ack=1 Win=7465 Len=1460"
"140","5.828125000","81.131.67.131","211.28.6.30","TCP","54","2769  >  6348 [ACK] Seq=1 Ack=3005 Win=8760 Len=0"
"141","5.843750000","81.131.67.131","38.115.4.204","TCP","465","[TCP Retransmission] 2667  >  21284 [PSH, ACK] Seq=17 Ack=1254 Win=8289 Len=411"
"142","6.000000000","2002:5183:4383::5183:4383","2001:638:902:1:201:2ff:fee2:7596","FTP","100","Request: noop"
"143","6.109375000","210.146.64.4","81.131.67.131","TCP","1514","80  >  2727 [ACK] Seq=21901 Ack=1 Win=6432 Len=1460"
"144","6.109375000","219.137.42.1","81.131.67.131","ICMP","70","Destination unreachable (Port unreachable)"
"145","6.109375000","81.131.67.131","210.146.64.4","TCP","54","2727  >  80 [ACK] Seq=1 Ack=23361 Win=8760 Len=0"
"146","6.406250000","210.146.64.4","81.131.67.131","TCP","1514","80  >  2727 [ACK] Seq=23361 Ack=1 Win=6432 Len=1460"
"147","6.406250000","81.131.67.131","210.146.64.4","TCP","54","2727  >  80 [ACK] Seq=1 Ack=24821 Win=8760 Len=0"
"148","6.421875000","212.195.108.125","81.131.67.131","Gnutella","141",""
"149","6.421875000","81.131.67.131","212.195.108.125","TCP","66","[TCP Dup ACK 103#1] 2824  >  6346 [ACK] Seq=435 Ack=1 Win=9465 Len=0 SLE=858 SRE=945"
"150","6.625000000","81.131.67.131","38.115.4.204","UDP","54","41730  >  21284 Len=12"
"151","6.625000000","81.131.67.131","24.207.37.197","UDP","61","41730  >  6346 Len=19"
"152","6.640625000","81.131.67.131","216.252.228.53","UDP","61","41730  >  6346 Len=19"
"153","6.656250000","81.131.67.131","83.76.196.106","UDP","61","41730  >  6346 Len=19"
"154","6.656250000","81.131.67.131","59.190.36.108","UDP","61","41730  >  6346 Len=19"
"155","6.671875000","81.131.67.131","211.28.166.121","UDP","61","41730  >  6346 Len=19"
"156","6.687500000","81.131.67.131","67.187.170.171","UDP","61","41730  >  6346 Len=19"
"157","6.703125000","210.146.64.4","81.131.67.131","TCP","1514","80  >  2727 [PSH, ACK] Seq=24821 Ack=1 Win=6432 Len=1460"
"158","6.703125000","81.131.67.131","80.57.230.242","UDP","61","41730  >  6346 Len=19"
"159","6.718750000","81.131.67.131","62.238.23.14","UDP","61","41730  >  6346 Len=19"
"160","6.734375000","81.131.67.131","62.39.164.74","UDP","61","41730  >  6346 Len=19"
"161","6.734375000","81.131.67.131","84.98.230.135","UDP","61","41730  >  6346 Len=19"
"162","6.750000000","81.131.67.131","210.146.64.4","TCP","54","2727  >  80 [ACK] Seq=1 Ack=26281 Win=8760 Len=0"
"163","6.765625000","81.131.67.131","68.214.31.233","UDP","61","41730  >  37459 Len=19"
"164","6.781250000","81.131.67.131","64.235.163.143","UDP","61","41730  >  25985 Len=19"
"165","6.984375000","38.115.4.204","81.131.67.131","TCP","1514","[TCP Retransmission] 21284  >  2667 [PSH, ACK] Seq=783 Ack=17 Win=64595 Len=1460"
"166","6.984375000","81.131.67.131","38.115.4.204","TCP","63","[TCP ACKed unseen segment] 2667  >  21284 [PSH, ACK] Seq=428 Ack=2243 Win=7300 Len=9"
"167","7.000000000","81.131.67.131","38.115.4.204","TCP","54","[TCP Window Update] 2667  >  21284 [ACK] Seq=437 Ack=2243 Win=8760 Len=0"
"168","7.281250000","210.146.64.4","81.131.67.131","TCP","1514","80  >  2727 [ACK] Seq=26281 Ack=1 Win=6432 Len=1460"
"169","7.281250000","81.131.67.131","210.146.64.4","TCP","54","2727  >  80 [ACK] Seq=1 Ack=27741 Win=8760 Len=0"
"170","7.312500000","218.13.89.168","81.131.67.131","UDP","61","65198  >  41730 Len=19"
"171","7.312500000","142.68.189.57","81.131.67.131","Gnutella","89",""
"172","7.312500000","81.131.67.131","218.13.89.168","UDP","50","41730  >  65198 Len=8"
"173","7.328125000","200.158.81.150","81.131.67.131","ICMP","70","Destination unreachable (Port unreachable)"
"174","7.484375000","81.131.67.131","142.68.189.57","TCP","54","1595  >  6346 [ACK] Seq=1 Ack=217 Win=8766 Len=0"
"175","7.625000000","210.146.64.4","81.131.67.131","TCP","1514","80  >  2727 [ACK] Seq=27741 Ack=1 Win=6432 Len=1460"
"176","7.625000000","81.131.67.131","210.146.64.4","TCP","54","2727  >  80 [ACK] Seq=1 Ack=29201 Win=8760 Len=0"
"177","7.718750000","81.131.67.131","80.201.83.15","UDP","461","41730  >  6346 Len=419"
"178","7.890625000","210.146.64.4","81.131.67.131","TCP","1514","80  >  2727 [ACK] Seq=29201 Ack=1 Win=6432 Len=1460"
"179","7.890625000","81.131.67.131","210.146.64.4","TCP","54","2727  >  80 [ACK] Seq=1 Ack=30661 Win=8760 Len=0"
"180","8.000000000","24.11.146.28","81.131.67.131","TCP","606","[TCP Retransmission] 17342  >  2675 [PSH, ACK] Seq=4294967063 Ack=9 Win=65303 Len=552"
"181","8.031250000","2001:638:902:1:201:2ff:fee2:7596","2002:5183:4383::5183:4383","FTP","124","Response: 200 NOOP command successful."
"182","8.078125000","2002:5183:4383::5183:4383","2001:638:902:1:201:2ff:fee2:7596","FTP","133","Request: CWD /pub/ftp.zebra.org/pub/zebra/old/"
"183","8.140625000","81.131.67.131","24.11.146.28","TCP","54","2675  >  17342 [ACK] Seq=20 Ack=319 Win=9612 Len=0"
"184","8.140625000","38.115.4.204","81.131.67.131","TCP","574","[TCP ACKed unseen segment] 21284  >  2667 [PSH, ACK] Seq=2243 Ack=428 Win=64184 Len=520"
"185","8.140625000","66.50.6.35","81.131.67.131","UDP","61","6346  >  41730 Len=19"
"186","8.140625000","81.131.67.131","38.115.4.204","TCP","63","2667  >  21284 [PSH, ACK] Seq=437 Ack=2763 Win=8240 Len=9"
"187","8.218750000","81.131.67.131","66.50.6.35","UDP","50","41730  >  6346 Len=8"
"188","8.437500000","210.146.64.4","81.131.67.131","TCP","1514","80  >  2727 [ACK] Seq=30661 Ack=1 Win=6432 Len=1460"
"189","8.437500000","68.34.169.230","81.131.67.131","TCP","92","6346  >  2433 [PSH, ACK] Seq=26 Ack=1 Win=64285 Len=38 [TCP segment of a reassembled PDU]"
"190","8.437500000","81.131.67.131","210.146.64.4","TCP","54","2727  >  80 [ACK] Seq=1 Ack=32121 Win=8760 Len=0"
"191","8.578125000","81.131.67.131","68.34.169.230","TCP","54","2433  >  6346 [ACK] Seq=1 Ack=64 Win=8566 Len=0"
"192","8.718750000","210.146.64.4","81.131.67.131","TCP","1514","80  >  2727 [ACK] Seq=32121 Ack=1 Win=6432 Len=1460"
"193","8.718750000","81.131.67.131","210.146.64.4","TCP","54","2727  >  80 [ACK] Seq=1 Ack=33581 Win=8760 Len=0"
"194","8.734375000","81.131.67.131","62.167.89.152","UDP","61","41730  >  6346 Len=19"
"195","8.750000000","68.62.236.42","81.131.67.131","UDP","61","28101  >  41730 Len=19"
"196","8.750000000","83.76.196.106","81.131.67.131","ICMP","70","Destination unreachable (Port unreachable)"
"197","8.750000000","81.131.67.131","212.195.247.161","UDP","61","41730  >  6346 Len=19"
"198","8.765625000","81.131.67.131","84.228.12.31","UDP","61","41730  >  6346 Len=19"
"199","8.781250000","64.235.163.143","81.131.67.131","UDP","50","25985  >  41730 Len=8"
"200","8.781250000","81.131.67.131","210.23.168.206","UDP","550","41730  >  4014 Len=508"
"201","8.812500000","81.131.67.131","213.19.160.190","TCP","62","2840  >  80 [SYN] Seq=0 Win=8760 Len=0 MSS=1460 SACK_PERM"
"202","8.875000000","81.131.67.131","68.62.236.42","UDP","50","41730  >  28101 Len=8"
"203","9.031250000","81.131.67.131","216.12.80.10","UDP","71","6348  >  6348 Len=29"
"204","9.046875000","210.146.64.4","81.131.67.131","TCP","1514","80  >  2727 [PSH, ACK] Seq=33581 Ack=1 Win=6432 Len=1460"
"205","9.046875000","81.131.67.131","210.146.64.4","TCP","54","2727  >  80 [ACK] Seq=1 Ack=35041 Win=8760 Len=0"
"206","9.062500000","213.73.236.149","81.131.67.131","UDP","61","60832  >  41730 Len=19"
"207","9.062500000","68.214.31.233","81.131.67.131","UDP","50","37459  >  41730 Len=8"
"208","9.062500000","81.131.67.131","213.73.236.149","UDP","50","41730  >  60832 Len=8"
"209","9.359375000","210.146.64.4","81.131.67.131","TCP","1514","80  >  2727 [ACK] Seq=35041 Ack=1 Win=6432 Len=1460"
"210","9.359375000","81.131.67.131","210.146.64.4","TCP","54","2727  >  80 [ACK] Seq=1 Ack=36501 Win=8760 Len=0"
"211","9.640625000","211.28.6.30","81.131.67.131","TCP","1514","6348  >  2769 [PSH, ACK] Seq=3005 Ack=1 Win=7465 Len=1460"
"212","9.640625000","81.131.67.131","211.28.6.30","TCP","54","2769  >  6348 [ACK] Seq=1 Ack=4465 Win=8760 Len=0"
"213","9.671875000","142.68.189.57","81.131.67.131","Gnutella","80",""
"214","9.671875000","69.11.56.178","81.131.67.131","UDP","61","6346  >  41730 Len=19"
"215","9.703125000","81.131.67.131","69.11.56.178","UDP","50","41730  >  6346 Len=8"
"216","9.875000000","81.131.67.131","210.23.168.206","UDP","550","41730  >  4014 Len=508"
"217","9.890625000","81.131.67.131","142.68.189.57","TCP","54","1595  >  6346 [ACK] Seq=1 Ack=243 Win=8740 Len=0"
"218","9.953125000","210.146.64.4","81.131.67.131","TCP","1514","80  >  2727 [ACK] Seq=36501 Ack=1 Win=6432 Len=1460"
"219","9.953125000","60.240.56.21","81.131.67.131","UDP","61","6346  >  41730 Len=19"
"220","9.953125000","81.131.67.131","210.146.64.4","TCP","54","2727  >  80 [ACK] Seq=1 Ack=37961 Win=8760 Len=0"
"221","9.968750000","2001:638:902:1:201:2ff:fee2:7596","2002:5183:4383::5183:4383","FTP","123","Response: 250 CWD command successful."
"222","9.968750000","81.131.67.131","60.240.56.21","UDP","50","41730  >  6346 Len=8"
"223","9.984375000","2002:5183:4383::5183:4383","2001:638:902:1:201:2ff:fee2:7596","FTP","102","Request: TYPE A"
"224","10.265625000","210.146.64.4","81.131.67.131","TCP","1514","80  >  2727 [ACK] Seq=37961 Ack=1 Win=6432 Len=1460"
"225","10.265625000","81.131.67.131","210.146.64.4","TCP","54","2727  >  80 [ACK] Seq=1 Ack=39421 Win=8760 Len=0"
"226","10.281250000","62.179.21.139","81.131.67.131","UDP","74","6346  >  6348 Len=32"
"227","10.281250000","68.34.169.230","81.131.67.131","TCP","75","6346  >  2433 [PSH, ACK] Seq=64 Ack=1 Win=64285 Len=21 [TCP segment of a reassembled PDU]"
"228","10.281250000","81.131.67.131","68.34.169.230","TCP","78","2433  >  6346 [PSH, ACK] Seq=1 Ack=85 Win=8545 Len=24 [TCP segment of a reassembled PDU]"
"229","10.578125000","210.146.64.4","81.131.67.131","TCP","1514","80  >  2727 [PSH, ACK] Seq=39421 Ack=1 Win=6432 Len=1460"
"230","10.578125000","84.228.12.31","81.131.67.131","UDP","50","6346  >  41730 Len=8"
"231","10.578125000","81.131.67.131","210.146.64.4","TCP","54","2727  >  80 [ACK] Seq=1 Ack=40881 Win=8760 Len=0"
"232","10.859375000","210.146.64.4","81.131.67.131","TCP","1514","80  >  2727 [ACK] Seq=40881 Ack=1 Win=6432 Len=1460"
"233","10.859375000","81.131.67.131","210.146.64.4","TCP","54","2727  >  80 [ACK] Seq=1 Ack=42341 Win=8760 Len=0"
"234","10.890625000","213.19.160.190","81.131.67.131","TCP","62","80  >  2840 [SYN, ACK] Seq=0 Ack=1 Win=5840 Len=0 MSS=1460 SACK_PERM"
"235","10.890625000","81.131.67.131","213.19.160.190","TCP","54","2840  >  80 [ACK] Seq=1 Ack=1 Win=8760 Len=0"
"236","10.890625000","68.62.236.42","81.131.67.131","ICMP","70","Destination unreachable (Port unreachable)"
"237","10.906250000","81.131.67.131","210.23.168.206","UDP","550","41730  >  4014 Len=508"
"238","10.921875000","216.12.80.10","81.131.67.131","UDP","126","6348  >  6348 Len=84"
"239","10.921875000","81.131.67.131","213.19.160.190","HTTP","336","GET /msdownload/update/v5/psf/windowsxp-sp2-x86fre-usa-2180_056b2b38baf5620be85ddd58141b073bc0b06a1d.psf HTTP/1.1 "
"240","11.203125000","210.146.64.4","81.131.67.131","TCP","1514","80  >  2727 [PSH, ACK] Seq=42341 Ack=1 Win=6432 Len=1460"
"241","11.203125000","81.131.67.131","210.146.64.4","TCP","54","2727  >  80 [ACK] Seq=1 Ack=43801 Win=8760 Len=0"
"242","11.421875000","81.131.67.131","38.115.4.204","TCP","80","[TCP Retransmission] 2667  >  21284 [PSH, ACK] Seq=428 Ack=2763 Win=8240 Len=26"
"243","11.500000000","210.146.64.4","81.131.67.131","TCP","1514","80  >  2727 [ACK] Seq=43801 Ack=1 Win=6432 Len=1460"
"244","11.500000000","81.131.67.131","210.146.64.4","TCP","54","2727  >  80 [ACK] Seq=1 Ack=45261 Win=8760 Len=0"
"245","11.500000000","2001:638:902:1:201:2ff:fee2:7596","2002:5183:4383::5183:4383","FTP","114","Response: 200 Type set to A."
"246","11.500000000","2002:5183:4383::5183:4383","2001:638:902:1:201:2ff:fee2:7596","FTP","134","Request: EPRT |2|2002:5183:4383::5183:4383|1031"
"247","11.812500000","38.115.4.204","81.131.67.131","TCP","1514","[TCP Spurious Retransmission] 21284  >  2667 [PSH, ACK] Seq=1254 Ack=428 Win=64184 Len=1460"
"248","11.812500000","81.131.67.131","38.115.4.204","TCP","54","[TCP Dup ACK 186#1] 2667  >  21284 [ACK] Seq=454 Ack=2763 Win=8240 Len=0"
"249","11.921875000","81.131.67.131","210.23.168.206","UDP","550","41730  >  4014 Len=508"
"250","11.937500000","81.131.67.131","212.195.108.125","TCP","63","2824  >  6346 [PSH, ACK] Seq=435 Ack=1 Win=9465 Len=9 [TCP segment of a reassembled PDU]"
"251","12.078125000","210.146.64.4","81.131.67.131","TCP","1514","80  >  2727 [ACK] Seq=45261 Ack=1 Win=6432 Len=1460"
"252","12.078125000","81.131.67.131","210.146.64.4","TCP","54","2727  >  80 [ACK] Seq=1 Ack=46721 Win=8760 Len=0"
"253","12.359375000","210.146.64.4","81.131.67.131","TCP","1514","80  >  2727 [ACK] Seq=46721 Ack=1 Win=6432 Len=1460"
"254","12.359375000","81.131.67.131","210.146.64.4","TCP","54","2727  >  80 [ACK] Seq=1 Ack=48181 Win=8760 Len=0"
"255","12.375000000","68.34.169.230","81.131.67.131","TCP","54","6346  >  2433 [ACK] Seq=85 Ack=25 Win=64261 Len=0"
"256","12.375000000","70.27.127.185","81.131.67.131","Gnutella","89",""
"257","12.406250000","71.112.28.202","81.131.67.131","UDP","61","6346  >  41730 Len=19"
"258","12.406250000","81.131.67.131","71.112.28.202","UDP","50","41730  >  6346 Len=8"
"259","12.515625000","81.131.67.131","70.27.127.185","TCP","54","2094  >  6346 [ACK] Seq=1 Ack=176 Win=8015 Len=0"
"260","12.687500000","210.146.64.4","81.131.67.131","TCP","1514","80  >  2727 [PSH, ACK] Seq=48181 Ack=1 Win=6432 Len=1460"
"261","12.687500000","81.59.142.167","81.131.67.131","UDP","61","6346  >  41730 Len=19"
"262","12.687500000","81.131.67.131","210.146.64.4","TCP","54","2727  >  80 [ACK] Seq=1 Ack=49641 Win=8760 Len=0"
"263","12.703125000","81.131.67.131","81.59.142.167","UDP","50","41730  >  6346 Len=8"
"264","13.016602000","211.28.6.30","81.131.67.131","TCP","1514","6348  >  2769 [PSH, ACK] Seq=4465 Ack=1 Win=7465 Len=1460"
"265","13.032227000","81.131.67.131","211.28.6.30","TCP","54","2769  >  6348 [ACK] Seq=1 Ack=5925 Win=8760 Len=0"
"266","13.044922000","81.131.67.131","212.195.108.125","UDP","54","41730  >  6346 Len=12"
"267","13.057618000","81.131.67.131","210.23.168.206","UDP","550","41730  >  4014 Len=508"
"268","13.320313000","210.146.64.4","81.131.67.131","TCP","1514","80  >  2727 [ACK] Seq=49641 Ack=1 Win=6432 Len=1460"
"269","13.320313000","81.229.210.114","81.131.67.131","UDP","61","6346  >  41730 Len=19"
"270","13.320313000","81.131.67.131","210.146.64.4","TCP","54","2727  >  80 [ACK] Seq=1 Ack=51101 Win=8760 Len=0"
"271","13.333008000","81.131.67.131","81.229.210.114","UDP","50","41730  >  6346 Len=8"
"272","13.346680000","213.19.160.190","81.131.67.131","TCP","54","80  >  2840 [ACK] Seq=1 Ack=283 Win=6432 Len=0"
"273","13.412110000","213.19.160.190","81.131.67.131","TCP","407","80  >  2840 [PSH, ACK] Seq=1 Ack=283 Win=6432 Len=353 [TCP segment of a reassembled PDU]"
"274","13.412110000","68.34.169.230","81.131.67.131","TCP","93","6346  >  2433 [PSH, ACK] Seq=85 Ack=25 Win=64261 Len=39 [TCP segment of a reassembled PDU]"
"275","13.552735000","81.131.67.131","68.34.169.230","TCP","54","2433  >  6346 [ACK] Seq=25 Ack=124 Win=8506 Len=0"
"276","13.556641000","81.131.67.131","213.19.160.190","TCP","54","2840  >  80 [ACK] Seq=283 Ack=354 Win=8407 Len=0"
"277","13.683594000","210.146.64.4","81.131.67.131","TCP","1514","80  >  2727 [PSH, ACK] Seq=51101 Ack=1 Win=6432 Len=1460"
"278","13.683594000","81.131.67.131","210.146.64.4","TCP","54","2727  >  80 [ACK] Seq=1 Ack=52561 Win=8760 Len=0"
"279","13.714844000","2001:638:902:1:201:2ff:fee2:7596","2002:5183:4383::5183:4383","FTP","127","Response: 500 Invalid argument, rejected."
"280","13.714844000","2002:5183:4383::5183:4383","2001:638:902:1:201:2ff:fee2:7596","FTP","156","Request: LPRT 6,16,32,2,81,131,67,131,0,0,0,0,0,0,81,131,67,131,2,4,7"
"281","13.839844000","38.115.4.204","81.131.67.131","TCP","594","[TCP ACKed unseen segment] 21284  >  2667 [PSH, ACK] Seq=2763 Ack=454 Win=64158 Len=540"
"282","13.855469000","142.68.189.57","81.131.67.131","Gnutella","89",""
"283","13.871094000","81.131.67.131","38.115.4.204","THRIFT","62","EXCEPTION "
"284","13.996094000","81.131.67.131","142.68.189.57","TCP","54","1595  >  6346 [ACK] Seq=1 Ack=278 Win=8705 Len=0"
"285","14.121094000","210.146.64.4","81.131.67.131","TCP","1514","80  >  2727 [ACK] Seq=52561 Ack=1 Win=6432 Len=1460"
"286","14.121094000","81.131.67.131","210.146.64.4","TCP","54","2727  >  80 [ACK] Seq=1 Ack=54021 Win=8760 Len=0"
"287","14.214844000","81.131.67.131","213.44.156.52","UDP","61","41730  >  6346 Len=19"
"288","14.214844000","81.131.67.131","67.174.93.14","UDP","61","41730  >  6346 Len=19"
"289","14.230469000","81.131.67.131","210.23.168.206","UDP","550","41730  >  4014 Len=508"
"290","14.402344000","38.115.4.204","81.131.67.131","TCP","1335","21284  >  2667 [PSH, ACK] Seq=3303 Ack=454 Win=64158 Len=1281"
"291","14.402344000","81.131.67.131","38.115.4.204","TCP","54","2667  >  21284 [ACK] Seq=462 Ack=4584 Win=8760 Len=0"
"292","14.667969000","213.19.160.190","81.131.67.131","TCP","1514","80  >  2840 [ACK] Seq=354 Ack=283 Win=6432 Len=1460 [TCP segment of a reassembled PDU]"
"293","14.667969000","81.131.67.131","213.19.160.190","TCP","54","2840  >  80 [ACK] Seq=283 Ack=1814 Win=8760 Len=0"
"294","14.964844000","211.28.6.30","81.131.67.131","TCP","1514","6348  >  2769 [PSH, ACK] Seq=5925 Ack=1 Win=7465 Len=1460"
"295","14.964844000","81.131.67.131","211.28.6.30","TCP","54","2769  >  6348 [ACK] Seq=1 Ack=7385 Win=8760 Len=0"
"296","15.268555000","81.131.67.131","144.138.79.46","UDP","428","41730  >  18500 Len=386"
"297","15.273438000","210.146.64.4","81.131.67.131","TCP","1514","80  >  2727 [ACK] Seq=54021 Ack=1 Win=6432 Len=1460"
"298","15.273438000","81.131.67.131","210.146.64.4","TCP","54","2727  >  80 [ACK] Seq=1 Ack=55481 Win=8760 Len=0"
"299","15.299805000","212.195.108.125","81.131.67.131","Gnutella","169","[TCP Previous segment not captured] "
"300","15.299805000","81.131.67.131","212.195.108.125","TCP","74","[TCP Dup ACK 103#2] 2824  >  6346 [ACK] Seq=444 Ack=1 Win=9465 Len=0 SLE=1091 SRE=1206 SLE=858 SRE=945"
"301","15.299805000","81.168.245.157","81.131.67.131","UDP","61","6346  >  41730 Len=19"
"302","15.319336000","81.131.67.131","81.168.245.157","UDP","50","41730  >  6346 Len=8"
"303","15.588868000","210.146.64.4","81.131.67.131","TCP","1514","80  >  2727 [ACK] Seq=55481 Ack=1 Win=6432 Len=1460"
"304","15.588868000","81.131.67.131","210.146.64.4","TCP","54","2727  >  80 [ACK] Seq=1 Ack=56941 Win=8760 Len=0"
"305","15.860352000","210.146.64.4","81.131.67.131","TCP","1514","80  >  2727 [PSH, ACK] Seq=56941 Ack=1 Win=6432 Len=1460"
"306","15.860352000","81.131.67.131","210.146.64.4","TCP","54","2727  >  80 [ACK] Seq=1 Ack=58401 Win=8760 Len=0"
"307","16.094727000","212.195.108.125","81.131.67.131","TCP","1280","[TCP Retransmission] 6346  >  2824 [PSH, ACK] Seq=1 Ack=444 Win=15874 Len=1226"
"308","16.094727000","81.131.67.131","212.195.108.125","TCP","54","[TCP ACKed unseen segment] 2824  >  6346 [ACK] Seq=444 Ack=1227 Win=9940 Len=0"
"309","16.110352000","81.131.67.131","212.195.108.125","TCP","63","2824  >  6346 [PSH, ACK] Seq=444 Ack=1227 Win=9940 Len=9 [TCP segment of a reassembled PDU]"
"310","16.125977000","70.27.127.185","81.131.67.131","Gnutella","87",""
"311","16.125977000","84.98.242.226","81.131.67.131","UDP","61","62573  >  41730 Len=19"
"312","16.125977000","65.30.55.121","81.131.67.131","UDP","54","6346  >  41730 Len=12"
"313","16.157227000","81.131.67.131","84.98.242.226","UDP","50","41730  >  62573 Len=8"
"314","16.157227000","81.131.67.131","65.30.55.121","UDP","50","41730  >  6346 Len=8"
"315","16.219727000","213.19.160.190","81.131.67.131","TCP","483","[TCP Previous segment not captured] 80  >  2840 [PSH, ACK] Seq=3274 Ack=283 Win=6432 Len=429 [TCP segment of a reassembled PDU]"
"316","16.219727000","81.131.67.131","213.19.160.190","TCP","66","[TCP Dup ACK 293#1] 2840  >  80 [ACK] Seq=283 Ack=1814 Win=8760 Len=0 SLE=3274 SRE=3703"
"317","16.250977000","81.131.67.131","210.146.64.4","TCP","54","2727  >  80 [FIN, ACK] Seq=1 Ack=58401 Win=8760 Len=0"
"318","16.344727000","81.131.67.131","70.27.127.185","TCP","54","2094  >  6346 [ACK] Seq=1 Ack=209 Win=7982 Len=0"
"319","16.391602000","81.131.67.131","65.30.55.121","UDP","54","41730  >  6346 Len=12"
"320","16.391602000","81.131.67.131","24.45.35.228","UDP","61","41730  >  6346 Len=19"
"321","16.407227000","81.131.67.131","83.237.44.108","UDP","61","41730  >  6346 Len=19"
"322","16.422852000","81.131.67.131","62.203.15.181","UDP","61","41730  >  6346 Len=19"
"323","16.438477000","81.131.67.131","24.109.212.31","UDP","61","41730  >  6346 Len=19"
"324","16.454102000","81.131.67.131","81.51.63.95","UDP","61","41730  >  6346 Len=19"
"325","16.469727000","81.131.67.131","84.99.71.2","UDP","61","41730  >  6346 Len=19"
"326","16.469727000","81.131.67.131","62.194.192.129","UDP","61","41730  >  6346 Len=19"
"327","16.485352000","81.131.67.131","83.237.103.61","UDP","61","41730  >  6346 Len=19"
"328","16.500977000","81.131.67.131","82.41.137.36","UDP","61","41730  >  6346 Len=19"
"329","16.516602000","213.19.160.190","81.131.67.131","TCP","1514","[TCP Out-Of-Order] 80  >  2840 [ACK] Seq=1814 Ack=283 Win=6432 Len=1460"
"330","16.516602000","81.131.67.131","217.136.191.58","UDP","61","41730  >  6346 Len=19"
"331","16.532227000","81.131.67.131","213.19.160.190","TCP","54","2840  >  80 [ACK] Seq=283 Ack=3703 Win=6871 Len=0"
"332","16.547852000","81.131.67.131","213.19.160.190","TCP","54","[TCP Window Update] 2840  >  80 [ACK] Seq=283 Ack=3703 Win=8760 Len=0"
"333","16.547852000","81.131.67.131","81.63.55.150","UDP","61","41730  >  21939 Len=19"
"334","16.563477000","81.131.67.131","85.216.130.151","UDP","61","41730  >  5180 Len=19"
"335","16.797852000","210.146.64.4","81.131.67.131","TCP","1514","80  >  2727 [ACK] Seq=58401 Ack=1 Win=6432 Len=1460"
"336","16.797852000","81.131.67.131","210.146.64.4","TCP","54","2727  >  80 [RST] Seq=2 Win=0 Len=0"
"337","16.813477000","68.34.169.230","81.131.67.131","TCP","91","6346  >  2433 [PSH, ACK] Seq=124 Ack=25 Win=64261 Len=37 [TCP segment of a reassembled PDU]"
"338","16.844727000","2001:638:902:1:201:2ff:fee2:7596","2002:5183:4383::5183:4383","FTP","124","Response: 200 LPRT command successful."
"339","16.844727000","216.90.136.40","81.131.67.131","UDP","61","33447  >  41730 Len=19"
"340","16.844727000","81.131.67.131","216.90.136.40","UDP","50","41730  >  33447 Len=8"
"341","16.860352000","2002:5183:4383::5183:4383","2001:638:902:1:201:2ff:fee2:7596","FTP","100","Request: LIST"
"342","16.891602000","81.131.67.131","68.34.169.230","TCP","54","2433  >  6346 [ACK] Seq=25 Ack=161 Win=8469 Len=0"
"343","17.110352000","81.131.67.131","38.115.4.204","TCP","70","[TCP Retransmission] 2667  >  21284 [PSH, ACK] Seq=454 Ack=4584 Win=8760 Len=16"
"344","17.125977000","210.146.64.4","81.131.67.131","TCP","1514","[TCP Spurious Retransmission] 80  >  2727 [PSH, ACK] Seq=59861 Ack=1 Win=6432 Len=1460"
"345","17.125977000","81.131.67.131","210.146.64.4","TCP","54","2727  >  80 [RST] Seq=1 Win=0 Len=0"
"346","17.188477000","38.115.4.204","81.131.67.131","TCP","300","21284  >  2667 [PSH, ACK] Seq=4584 Ack=462 Win=64150 Len=246"
"347","17.204102000","142.68.189.57","81.131.67.131","Gnutella","106",""
"348","17.204102000","82.252.14.139","81.131.67.131","UDP","61","6346  >  41730 Len=19"
"349","17.219727000","81.131.67.131","142.68.189.57","Gnutella","78",""
"350","17.250977000","81.131.67.131","82.252.14.139","UDP","50","41730  >  6346 Len=8"
"351","17.329102000","81.131.67.131","38.115.4.204","TCP","54","2667  >  21284 [ACK] Seq=470 Ack=4830 Win=8514 Len=0"
"352","17.422852000","81.131.67.131","81.106.187.198","UDP","61","41730  >  6346 Len=19"
"353","17.422852000","81.131.67.131","212.129.182.184","UDP","61","41730  >  6346 Len=19"
"354","17.438477000","81.131.67.131","81.51.184.69","UDP","61","41730  >  6346 Len=19"
"355","17.454102000","81.131.67.131","212.87.122.210","UDP","61","41730  >  6346 Len=19"
"356","17.454102000","81.131.67.131","84.98.242.226","UDP","61","41730  >  6346 Len=19"
"357","17.469727000","81.131.67.131","213.118.155.13","UDP","61","41730  >  6346 Len=19"
"358","17.485352000","81.131.67.131","210.80.167.146","UDP","61","41730  >  6346 Len=19"
"359","17.500977000","210.146.64.4","81.131.67.131","TCP","1514","[TCP Spurious Retransmission] 80  >  2727 [ACK] Seq=61321 Ack=1 Win=6432 Len=1460"
"360","17.500977000","81.131.67.131","172.207.12.17","UDP","61","41730  >  6346 Len=19"
"361","17.516602000","211.26.30.182","81.131.67.131","UDP","61","1807  >  41730 Len=19"
"362","17.516602000","81.131.67.131","85.68.186.238","UDP","61","41730  >  6346 Len=19"
"363","17.532227000","81.131.67.131","84.148.18.126","UDP","61","41730  >  6346 Len=19"
"364","17.532227000","81.131.67.131","81.190.139.194","UDP","61","41730  >  6346 Len=19"
"365","17.547852000","81.131.67.131","210.146.64.4","TCP","54","2727  >  80 [RST] Seq=1 Win=0 Len=0"
"366","17.563477000","81.131.67.131","85.216.130.151","UDP","61","41730  >  5180 Len=19"
"367","17.579102000","81.131.67.131","211.26.30.182","UDP","50","41730  >  1807 Len=8"
"368","17.625977000","38.115.4.204","81.131.67.131","TCP","582","21284  >  2667 [PSH, ACK] Seq=4830 Ack=462 Win=64150 Len=528"
"369","17.766602000","81.131.67.131","38.115.4.204","TCP","54","2667  >  21284 [ACK] Seq=470 Ack=5358 Win=7986 Len=0"
"370","17.875977000","81.131.67.131","24.11.146.28","TCP","474","[TCP Retransmission] 2675  >  17342 [PSH, ACK] Seq=9 Ack=319 Win=9612 Len=420"
"371","17.907227000","210.146.64.4","81.131.67.131","TCP","1514","[TCP Spurious Retransmission] 80  >  2727 [ACK] Seq=62781 Ack=1 Win=6432 Len=1460"
"372","17.907227000","81.131.67.131","210.146.64.4","TCP","54","2727  >  80 [RST] Seq=1 Win=0 Len=0"
"373","18.110352000","81.131.67.131","210.146.64.4","TCP","62","2843  >  80 [SYN] Seq=0 Win=8760 Len=0 MSS=1460 SACK_PERM"
"374","18.188477000","210.146.64.4","81.131.67.131","TCP","1514","[TCP Spurious Retransmission] 80  >  2727 [ACK] Seq=64241 Ack=1 Win=6432 Len=1460"
"375","18.188477000","81.131.67.131","210.146.64.4","TCP","54","2727  >  80 [RST] Seq=1 Win=0 Len=0"
"376","18.485352000","81.131.67.131","211.31.4.111","UDP","343","41730  >  39489 Len=301"
