"No.","Time","Source","Destination","Protocol","Length","Info"
"1","0.000000","10.251.23.139","62.39.3.142","Syslog","118","LOCAL2.ERR: Jan  2 10:09:52 nb6 chillispot[4222]: C:192.168.2.83/00:19:7D:3B:6F:D4\\n"
"2","0.218216","HuaweiTe_f0:45:d7","Sfr_30:42:41","ARP","60","Who has 10.194.144.196? Tell 10.194.144.1"
"3","0.219665","HuaweiTe_f0:45:d7","Sfr_05:b2:21","ARP","60","Who has 10.194.144.67? Tell 10.194.144.1"
"4","0.221143","HuaweiTe_f0:45:d7","UbeeInte_00:e0:9d","ARP","60","Who has 10.194.144.22? Tell 10.194.144.1"
"5","0.222117","HuaweiTe_f0:45:d7","Sfr_8e:45:29","ARP","60","Who has 10.251.196.189? Tell 10.251.196.1"
"6","0.224356","HuaweiTe_f0:45:d7","Sagemcom_29:64:29","ARP","60","Who has 10.251.196.176? Tell 10.251.196.1"
"7","1.794591","95.136.242.99","109.6.1.72","PPP LCP","68","Echo Request"
"8","1.819663","109.6.1.72","95.136.242.99","PPP LCP","70","Echo Reply"
"9","3.047733","95.136.242.99","109.6.1.72","L2TP","70","Control Message - Hello (tunnel id=1527, session id=0)"
"10","3.073242","109.6.1.72","95.136.242.99","L2TP","62","Control Message - ZLB      (tunnel id=18994, session id=0)"
"11","4.990813","109.6.1.72","95.136.242.99","PPP LCP","74","Echo Request"
"12","4.991134","95.136.242.99","109.6.1.72","PPP LCP","72","Echo Reply"
"13","4.999445","Sfr_18:c2:72","HuaweiTe_f0:45:d7","ARP","42","Who has 10.251.23.1? Tell 10.251.23.139"
"14","5.032962","HuaweiTe_f0:45:d7","Sfr_18:c2:72","ARP","60","10.251.23.1 is at 80:fb:06:f0:45:d7"
"15","5.216245","HuaweiTe_f0:45:d7","Sfr_ae:ba:81","ARP","60","Who has 10.194.144.57? Tell 10.194.144.1"
"16","5.217729","HuaweiTe_f0:45:d7","Sfr_81:98:61","ARP","60","Who has 10.194.144.145? Tell 10.194.144.1"
"17","5.219666","HuaweiTe_f0:45:d7","Sfr_66:65:b1","ARP","60","Who has 10.194.144.49? Tell 10.194.144.1"
"18","14.342833","95.136.242.99","109.0.66.20","DNS","77","Standard query 0x6508 A perdu.com"
"19","14.343717","95.136.242.99","109.0.66.20","DNS","77","Standard query 0x0947 AAAA perdu.com"
"20","14.369951","109.0.66.20","95.136.242.99","DNS","138","Standard query response 0x0947 AAAA perdu.com SOA ns1.dreamhost.com"
"21","14.375865","109.0.66.20","95.136.242.99","DNS","93","Standard query response 0x6508 A perdu.com A 208.97.177.124"
"22","14.393000","95.136.242.99","109.0.66.20","DNS","87","Standard query 0xe69b A hotspot.wifi.sfr.fr"
"23","14.393283","95.136.242.99","109.0.66.20","DNS","87","Standard query 0x740c AAAA hotspot.wifi.sfr.fr"
"24","14.420966","109.0.66.20","95.136.242.99","DNS","103","Standard query response 0xe69b A hotspot.wifi.sfr.fr A 109.0.74.75"
"25","14.421944","109.0.66.20","95.136.242.99","DNS","159","Standard query response 0x740c AAAA hotspot.wifi.sfr.fr SOA ns1.9services.com"
"26","14.423855","95.136.242.99","109.0.74.75","TCP","82","65386  >  443 [SYN] Seq=0 Win=29200 Len=0 MSS=1452 SACK_PERM TSval=982856 TSecr=0 WS=128"
"27","14.456445","109.0.74.75","95.136.242.99","TCP","82","443  >  65386 [SYN, ACK] Seq=0 Ack=1 Win=5792 Len=0 MSS=1380 SACK_PERM TSval=189810180 TSecr=982856 WS=128"
"28","14.458148","95.136.242.99","109.0.74.75","TCP","74","65386  >  443 [ACK] Seq=1 Ack=1 Win=29312 Len=0 TSval=982866 TSecr=189810180"
"29","14.458485","95.136.242.99","109.0.74.75","TLSv1","259","Client Hello"
"30","14.492163","109.0.74.75","95.136.242.99","TCP","74","443  >  65386 [ACK] Seq=1 Ack=186 Win=6912 Len=0 TSval=189810184 TSecr=982866"
"31","14.493635","109.0.74.75","95.136.242.99","TLSv1","1442","Server Hello"
"32","14.494159","109.0.74.75","95.136.242.99","TCP","1442","443  >  65386 [ACK] Seq=1369 Ack=186 Win=6912 Len=1368 TSval=189810184 TSecr=982866 [TCP segment of a reassembled PDU]"
"33","14.495079","95.136.242.99","109.0.74.75","TCP","74","65386  >  443 [ACK] Seq=186 Ack=1369 Win=32000 Len=0 TSval=982877 TSecr=189810184"
"34","14.495706","95.136.242.99","109.0.74.75","TCP","74","65386  >  443 [ACK] Seq=186 Ack=2737 Win=34688 Len=0 TSval=982877 TSecr=189810184"
"35","14.529643","109.0.74.75","95.136.242.99","TLSv1","706","Certificate, Server Hello Done"
"36","14.531721","95.136.242.99","109.0.74.75","TCP","74","65386  >  443 [ACK] Seq=186 Ack=3369 Win=37504 Len=0 TSval=982888 TSecr=189810188"
"37","14.539740","95.136.242.99","109.0.74.75","TLSv1","388","Client Key Exchange, Change Cipher Spec, Encrypted Handshake Message"
"38","14.542437","95.136.242.99","109.0.66.20","DNS","83","Standard query 0x24ce A ocsp.thawte.com"
"39","14.542975","95.136.242.99","109.0.66.20","DNS","83","Standard query 0xada7 AAAA ocsp.thawte.com"
"40","14.576169","109.0.66.20","95.136.242.99","DNS","130","Standard query response 0x24ce A ocsp.thawte.com CNAME ocsp.verisign.net A 199.7.71.72"
"41","14.576199","109.0.66.20","95.136.242.99","DNS","114","Standard query response 0xada7 AAAA ocsp.thawte.com CNAME ocsp.verisign.net"
"42","14.577164","109.0.74.75","95.136.242.99","TLSv1","121","Change Cipher Spec, Encrypted Handshake Message"
"43","14.579815","95.136.242.99","199.7.71.72","TCP","82","65386  >  80 [SYN] Seq=0 Win=29200 Len=0 MSS=1452 SACK_PERM TSval=982902 TSecr=0 WS=128"
"44","14.615340","199.7.71.72","95.136.242.99","TCP","66","80  >  65386 [SYN, ACK] Seq=0 Ack=1 Win=8190 Len=0 MSS=1440"
"45","14.616305","95.136.242.99","109.0.74.75","TCP","74","65386  >  443 [ACK] Seq=500 Ack=3416 Win=37504 Len=0 TSval=982914 TSecr=189810192"
"46","14.616917","95.136.242.99","199.7.71.72","TCP","62","65386  >  80 [ACK] Seq=1 Ack=1 Win=29200 Len=0"
"47","14.617480","95.136.242.99","199.7.71.72","OCSP","553","Request"
"48","14.658962","199.7.71.72","95.136.242.99","TCP","62","80  >  65386 [ACK] Seq=1 Ack=492 Win=7699 Len=0"
"49","14.662418","199.7.71.72","95.136.242.99","TCP","62","[TCP Previous segment not captured] 80  >  65386 [FIN, ACK] Seq=1755 Ack=492 Win=7699 Len=0"
"50","14.663441","199.7.71.72","95.136.242.99","TCP","1502","[TCP Out-Of-Order] 80  >  65386 [ACK] Seq=1 Ack=492 Win=7699 Len=1440"
"51","14.663478","199.7.71.72","95.136.242.99","TCP","376","[TCP Out-Of-Order] 80  >  65386 [PSH, ACK] Seq=1441 Ack=492 Win=7699 Len=314"
"52","14.664308","95.136.242.99","199.7.71.72","TCP","62","[TCP Dup ACK 46#1] 65386  >  80 [ACK] Seq=492 Ack=1 Win=29200 Len=0"
"53","14.665157","95.136.242.99","199.7.71.72","TCP","62","65386  >  80 [ACK] Seq=492 Ack=1441 Win=31680 Len=0"
"54","14.666369","95.136.242.99","199.7.71.72","TCP","62","65386  >  80 [ACK] Seq=492 Ack=1756 Win=34560 Len=0"
"55","14.666708","95.136.242.99","199.7.71.72","TCP","62","65386  >  80 [FIN, ACK] Seq=492 Ack=1756 Win=34560 Len=0"
"56","14.673753","95.136.242.99","109.0.74.75","TLSv1","624","Application Data"
"57","14.700345","199.7.71.72","95.136.242.99","TCP","62","[TCP Retransmission] 80  >  65386 [FIN, ACK] Seq=1755 Ack=492 Win=8190 Len=0"
"58","14.701732","95.136.242.99","199.7.71.72","TCP","62","[TCP Dup ACK 54#1] 65386  >  80 [ACK] Seq=493 Ack=1756 Win=34560 Len=0"
"59","14.702312","199.7.71.72","95.136.242.99","TCP","62","80  >  65386 [ACK] Seq=1756 Ack=493 Win=7699 Len=0"
"60","14.720818","109.0.74.75","95.136.242.99","TLSv1","1442","Application Data"
"61","14.721829","109.0.74.75","95.136.242.99","TCP","1442","443  >  65386 [ACK] Seq=4784 Ack=1050 Win=9088 Len=1368 TSval=189810207 TSecr=982931 [TCP segment of a reassembled PDU]"
"62","14.722803","109.0.74.75","95.136.242.99","TCP","1442","443  >  65386 [ACK] Seq=6152 Ack=1050 Win=9088 Len=1368 TSval=189810207 TSecr=982931 [TCP segment of a reassembled PDU]"
"63","14.728168","95.136.242.99","109.0.74.75","TCP","74","65386  >  443 [ACK] Seq=1050 Ack=4784 Win=40192 Len=0 TSval=982947 TSecr=189810207"
"64","14.728698","95.136.242.99","109.0.74.75","TCP","74","65386  >  443 [ACK] Seq=1050 Ack=6152 Win=42880 Len=0 TSval=982947 TSecr=189810207"
"65","14.728949","95.136.242.99","109.0.74.75","TCP","74","65386  >  443 [ACK] Seq=1050 Ack=7520 Win=45056 Len=0 TSval=982947 TSecr=189810207"
"66","14.760723","109.0.74.75","95.136.242.99","TLSv1","1113","Application Data, Application Data"
"67","14.762933","95.136.242.99","109.0.74.75","TCP","74","65386  >  443 [ACK] Seq=1050 Ack=8559 Win=45056 Len=0 TSval=982957 TSecr=189810211"
"68","14.861910","95.136.242.99","109.0.74.75","TLSv1","614","Application Data"
"69","14.862251","95.136.242.99","109.0.74.75","TCP","82","65387  >  443 [SYN] Seq=0 Win=29200 Len=0 MSS=1452 SACK_PERM TSval=982987 TSecr=0 WS=128"
"70","14.901432","109.0.74.75","95.136.242.99","TLSv1","1442","Application Data"
"71","14.902443","109.0.74.75","95.136.242.99","TCP","1442","443  >  65386 [ACK] Seq=9927 Ack=1590 Win=10240 Len=1368 TSval=189810225 TSecr=982987 [TCP segment of a reassembled PDU]"
"72","14.903458","109.0.74.75","95.136.242.99","TCP","1442","443  >  65386 [ACK] Seq=11295 Ack=1590 Win=10240 Len=1368 TSval=189810225 TSecr=982987 [TCP segment of a reassembled PDU]"
"73","14.903831","109.0.74.75","95.136.242.99","TLSv1","347","[TCP Previous segment not captured] , Application Data"
"74","14.903859","109.0.74.75","95.136.242.99","TCP","121","[TCP Out-Of-Order] 443  >  65386 [PSH, ACK] Seq=12663 Ack=1590 Win=10240 Len=47 TSval=189810225 TSecr=982987"
"75","14.903879","109.0.74.75","95.136.242.99","TCP","82","443  >  65387 [SYN, ACK] Seq=0 Ack=1 Win=5792 Len=0 MSS=1380 SACK_PERM TSval=219668167 TSecr=982987 WS=128"
"76","14.905433","95.136.242.99","109.0.74.75","TCP","74","65386  >  443 [ACK] Seq=1590 Ack=9927 Win=45056 Len=0 TSval=983000 TSecr=189810225"
"77","14.905982","95.136.242.99","109.0.74.75","TCP","74","65386  >  443 [ACK] Seq=1590 Ack=11295 Win=43776 Len=0 TSval=983000 TSecr=189810225"
"78","14.907048","95.136.242.99","109.0.74.75","TCP","74","65386  >  443 [ACK] Seq=1590 Ack=12663 Win=45056 Len=0 TSval=983000 TSecr=189810225"
"79","14.907314","95.136.242.99","109.0.74.75","TCP","86","[TCP Dup ACK 78#1] 65386  >  443 [ACK] Seq=1590 Ack=12663 Win=45056 Len=0 TSval=983000 TSecr=189810225 SLE=12710 SRE=12983"
"80","14.907921","95.136.242.99","109.0.74.75","TCP","74","65386  >  443 [ACK] Seq=1590 Ack=12983 Win=44800 Len=0 TSval=983000 TSecr=189810225"
"81","14.908459","95.136.242.99","109.0.74.75","TCP","74","65387  >  443 [ACK] Seq=1 Ack=1 Win=29312 Len=0 TSval=983001 TSecr=219668167"
"82","14.909702","95.136.242.99","109.0.74.75","TLSv1","291","Client Hello"
"83","14.939413","109.0.74.75","95.136.242.99","TCP","1442","443  >  65386 [ACK] Seq=12983 Ack=1590 Win=10240 Len=1368 TSval=189810228 TSecr=983000 [TCP segment of a reassembled PDU]"
"84","14.940353","109.0.74.75","95.136.242.99","TCP","1442","443  >  65386 [ACK] Seq=14351 Ack=1590 Win=10240 Len=1368 TSval=189810228 TSecr=983000 [TCP segment of a reassembled PDU]"
"85","14.941339","95.136.242.99","109.0.74.75","TCP","74","65386  >  443 [ACK] Seq=1590 Ack=14351 Win=45056 Len=0 TSval=983011 TSecr=189810228"
"86","14.941451","109.0.74.75","95.136.242.99","TLSv1","1442","Application Data"
"87","14.942308","95.136.242.99","109.0.74.75","TCP","74","65386  >  443 [ACK] Seq=1590 Ack=15719 Win=45056 Len=0 TSval=983011 TSecr=189810228"
"88","14.942369","109.0.74.75","95.136.242.99","TCP","1442","443  >  65386 [ACK] Seq=17087 Ack=1590 Win=10240 Len=1368 TSval=189810228 TSecr=983000 [TCP segment of a reassembled PDU]"
"89","14.942835","109.0.74.75","95.136.242.99","TLSv1","330","Application Data"
"90","14.943891","95.136.242.99","109.0.74.75","TCP","74","65386  >  443 [ACK] Seq=1590 Ack=17087 Win=45056 Len=0 TSval=983012 TSecr=189810228"
"91","14.944949","95.136.242.99","109.0.74.75","TCP","74","65386  >  443 [ACK] Seq=1590 Ack=18455 Win=45056 Len=0 TSval=983012 TSecr=189810228"
"92","14.945237","95.136.242.99","109.0.74.75","TCP","74","65386  >  443 [ACK] Seq=1590 Ack=18711 Win=45056 Len=0 TSval=983012 TSecr=189810229"
"93","14.946466","109.0.74.75","95.136.242.99","TCP","74","443  >  65387 [ACK] Seq=1 Ack=218 Win=6912 Len=0 TSval=219668172 TSecr=983001"
"94","14.947643","109.0.74.75","95.136.242.99","TLSv1","1442","Server Hello"
"95","14.947989","109.0.74.75","95.136.242.99","TCP","1442","443  >  65387 [ACK] Seq=1369 Ack=218 Win=6912 Len=1368 TSval=219668172 TSecr=983001 [TCP segment of a reassembled PDU]"
"96","14.950861","95.136.242.99","109.0.74.75","TCP","74","65387  >  443 [ACK] Seq=218 Ack=1369 Win=32000 Len=0 TSval=983013 TSecr=219668172"
"97","14.951130","95.136.242.99","109.0.74.75","TCP","74","65387  >  443 [ACK] Seq=218 Ack=2737 Win=34688 Len=0 TSval=983014 TSecr=219668172"
"98","14.984445","109.0.74.75","95.136.242.99","TLSv1","706","Certificate, Server Hello Done"
"99","14.986729","95.136.242.99","109.0.74.75","TCP","74","65387  >  443 [ACK] Seq=218 Ack=3369 Win=37504 Len=0 TSval=983024 TSecr=219668177"
"100","14.987962","95.136.242.99","109.0.74.75","TLSv1","388","Client Key Exchange, Change Cipher Spec, Encrypted Handshake Message"
"101","15.007233","109.6.1.72","95.136.242.99","PPP LCP","74","Echo Request"
"102","15.007780","95.136.242.99","109.6.1.72","PPP LCP","72","Echo Reply"
"103","15.008186","95.136.242.99","109.0.74.75","TLSv1","428","Application Data"
"104","15.026080","109.0.74.75","95.136.242.99","TLSv1","121","Change Cipher Spec, Encrypted Handshake Message"
"105","15.034759","95.136.242.99","109.0.74.75","TLSv1","642","Application Data"
"106","15.046033","109.0.74.75","95.136.242.99","TLSv1","1442","Application Data"
"107","15.047014","109.0.74.75","95.136.242.99","TCP","1442","443  >  65386 [ACK] Seq=20079 Ack=1944 Win=11264 Len=1368 TSval=189810239 TSecr=983031 [TCP segment of a reassembled PDU]"
"108","15.047679","109.0.74.75","95.136.242.99","TLSv1","456","Application Data"
"109","15.048917","95.136.242.99","109.0.74.75","TCP","74","65386  >  443 [ACK] Seq=1944 Ack=20079 Win=45056 Len=0 TSval=983043 TSecr=189810239"
"110","15.051079","95.136.242.99","109.0.74.75","TCP","74","65386  >  443 [ACK] Seq=1944 Ack=21447 Win=45056 Len=0 TSval=983044 TSecr=189810239"
"111","15.051343","95.136.242.99","109.0.74.75","TCP","74","65386  >  443 [ACK] Seq=1944 Ack=21829 Win=45056 Len=0 TSval=983044 TSecr=189810239"
"112","15.084718","109.0.74.75","95.136.242.99","TLSv1","1442","Application Data"
"113","15.085699","109.0.74.75","95.136.242.99","TCP","1442","443  >  65387 [ACK] Seq=4784 Ack=1100 Win=9088 Len=1368 TSval=219668188 TSecr=983037 [TCP segment of a reassembled PDU]"
"114","15.086696","109.0.74.75","95.136.242.99","TCP","1442","443  >  65387 [ACK] Seq=6152 Ack=1100 Win=9088 Len=1368 TSval=219668188 TSecr=983037 [TCP segment of a reassembled PDU]"
"115","15.087973","95.136.242.99","109.0.74.75","TCP","74","65387  >  443 [ACK] Seq=1100 Ack=6152 Win=42880 Len=0 TSval=983055 TSecr=219668188"
"116","15.120716","109.0.74.75","95.136.242.99","TLSv1","1442","Application Data, Application Data"
"117","15.121676","109.0.74.75","95.136.242.99","TCP","1442","443  >  65387 [ACK] Seq=8888 Ack=1100 Win=9088 Len=1368 TSval=219668193 TSecr=983055 [TCP segment of a reassembled PDU]"
"118","15.122697","109.0.74.75","95.136.242.99","TCP","1442","443  >  65387 [ACK] Seq=10256 Ack=1100 Win=9088 Len=1368 TSval=219668193 TSecr=983055 [TCP segment of a reassembled PDU]"
"119","15.126552","95.136.242.99","109.0.74.75","TCP","74","65387  >  443 [ACK] Seq=1100 Ack=8888 Win=45056 Len=0 TSval=983065 TSecr=219668188"
"120","15.126824","95.136.242.99","109.0.74.75","TCP","74","65387  >  443 [ACK] Seq=1100 Ack=11624 Win=45056 Len=0 TSval=983066 TSecr=219668193"
"121","15.162327","109.0.74.75","95.136.242.99","TLSv1","1442","Application Data"
"122","15.163336","109.0.74.75","95.136.242.99","TCP","1442","443  >  65387 [ACK] Seq=12992 Ack=1100 Win=9088 Len=1368 TSval=219668197 TSecr=983065 [TCP segment of a reassembled PDU]"
"123","15.163794","109.0.74.75","95.136.242.99","TLSv1","516","Application Data"
"124","15.168167","95.136.242.99","109.0.74.75","TCP","74","65387  >  443 [ACK] Seq=1100 Ack=14360 Win=45056 Len=0 TSval=983079 TSecr=219668197"
"125","15.168521","95.136.242.99","109.0.74.75","TLSv1","614","Application Data"
"126","15.212486","109.0.74.75","95.136.242.99","TLSv1","1442","Application Data"
"127","15.213347","95.136.242.99","109.0.74.75","TCP","74","65387  >  443 [ACK] Seq=1100 Ack=14802 Win=45184 Len=0 TSval=983092 TSecr=219668197"
"128","15.213462","109.0.74.75","95.136.242.99","TCP","1442","443  >  65386 [ACK] Seq=23197 Ack=2484 Win=12416 Len=1368 TSval=189810256 TSecr=983079 [TCP segment of a reassembled PDU]"
"129","15.214297","109.0.74.75","95.136.242.99","TCP","1442","443  >  65386 [ACK] Seq=24565 Ack=2484 Win=12416 Len=1368 TSval=189810256 TSecr=983079 [TCP segment of a reassembled PDU]"
"130","15.214333","109.0.74.75","95.136.242.99","TLSv1","121","Application Data"
"131","15.214354","109.0.74.75","95.136.242.99","TLSv1","188","[TCP Previous segment not captured] , Ignored Unknown Record"
"132","15.215192","95.136.242.99","109.0.74.75","TCP","74","65386  >  443 [ACK] Seq=2484 Ack=23197 Win=45056 Len=0 TSval=983093 TSecr=189810256"
"133","15.215304","109.0.74.75","95.136.242.99","TCP","1442","[TCP Out-Of-Order] 443  >  65386 [ACK] Seq=25980 Ack=2484 Win=12416 Len=1368 TSval=189810256 TSecr=983079"
"134","15.215918","95.136.242.99","109.0.74.75","TCP","74","65386  >  443 [ACK] Seq=2484 Ack=24565 Win=45056 Len=0 TSval=983093 TSecr=189810256"
"135","15.217374","95.136.242.99","109.0.74.75","TCP","74","65386  >  443 [ACK] Seq=2484 Ack=25933 Win=45056 Len=0 TSval=983094 TSecr=189810256"
"136","15.218631","95.136.242.99","109.0.74.75","TCP","74","65386  >  443 [ACK] Seq=2484 Ack=25980 Win=45056 Len=0 TSval=983094 TSecr=189810256"
"137","15.218896","95.136.242.99","109.0.74.75","TCP","86","[TCP Dup ACK 136#1] 65386  >  443 [ACK] Seq=2484 Ack=25980 Win=45056 Len=0 TSval=983094 TSecr=189810256 SLE=27348 SRE=27462"
"138","15.219133","95.136.242.99","109.0.74.75","TCP","74","65386  >  443 [ACK] Seq=2484 Ack=27462 Win=43648 Len=0 TSval=983094 TSecr=189810256"
"139","15.507938","95.136.242.99","109.0.74.75","TLSv1","463","Application Data"
"140","15.512942","95.136.242.99","109.0.74.75","TLSv1","1062","Application Data"
"141","15.545695","109.0.74.75","95.136.242.99","TLSv1","1442","Application Data"
"142","15.546698","109.0.74.75","95.136.242.99","TCP","1442","443  >  65387 [ACK] Seq=16170 Ack=1489 Win=10240 Len=1368 TSval=219668242 TSecr=983181 [TCP segment of a reassembled PDU]"
"143","15.547682","109.0.74.75","95.136.242.99","TCP","1442","443  >  65387 [ACK] Seq=17538 Ack=1489 Win=10240 Len=1368 TSval=219668242 TSecr=983181 [TCP segment of a reassembled PDU]"
"144","15.548708","95.136.242.99","109.0.74.75","TCP","74","65387  >  443 [ACK] Seq=1489 Ack=16170 Win=45056 Len=0 TSval=983193 TSecr=219668242"
"145","15.548983","95.136.242.99","109.0.74.75","TCP","74","65387  >  443 [ACK] Seq=1489 Ack=17538 Win=45056 Len=0 TSval=983193 TSecr=219668242"
"146","15.549609","95.136.242.99","109.0.74.75","TCP","74","65387  >  443 [ACK] Seq=1489 Ack=18906 Win=45056 Len=0 TSval=983194 TSecr=219668242"
"147","15.564157","109.0.74.75","95.136.242.99","TLSv1","354","Application Data, Application Data"
"148","15.566710","95.136.242.99","109.0.74.75","TCP","74","65386  >  443 [ACK] Seq=3472 Ack=27742 Win=45056 Len=0 TSval=983198 TSecr=189810291"
"149","15.582154","109.0.74.75","95.136.242.99","TLSv1","1442","Application Data, Application Data"
"150","15.583161","109.0.74.75","95.136.242.99","TCP","1442","443  >  65387 [ACK] Seq=20274 Ack=1489 Win=10240 Len=1368 TSval=219668246 TSecr=983193 [TCP segment of a reassembled PDU]"
"151","15.584177","95.136.242.99","109.0.74.75","TCP","74","65387  >  443 [ACK] Seq=1489 Ack=20274 Win=45056 Len=0 TSval=983204 TSecr=219668246"
"152","15.584242","109.0.74.75","95.136.242.99","TCP","1442","443  >  65387 [ACK] Seq=21642 Ack=1489 Win=10240 Len=1368 TSval=219668246 TSecr=983193 [TCP segment of a reassembled PDU]"
"153","15.585140","95.136.242.99","109.0.74.75","TCP","74","65387  >  443 [ACK] Seq=1489 Ack=21642 Win=45056 Len=0 TSval=983204 TSecr=219668246"
"154","15.585203","109.0.74.75","95.136.242.99","TLSv1","1442","Application Data"
"155","15.586155","109.0.74.75","95.136.242.99","TCP","1442","443  >  65387 [ACK] Seq=24378 Ack=1489 Win=10240 Len=1368 TSval=219668246 TSecr=983194 [TCP segment of a reassembled PDU]"
"156","15.586696","95.136.242.99","109.0.74.75","TCP","74","65387  >  443 [ACK] Seq=1489 Ack=23010 Win=43776 Len=0 TSval=983204 TSecr=219668246"
"157","15.587115","109.0.74.75","95.136.242.99","TCP","1442","443  >  65387 [ACK] Seq=25746 Ack=1489 Win=10240 Len=1368 TSval=219668246 TSecr=983194 [TCP segment of a reassembled PDU]"
"158","15.587894","95.136.242.99","109.0.74.75","TCP","74","65387  >  443 [ACK] Seq=1489 Ack=24378 Win=45056 Len=0 TSval=983205 TSecr=219668246"
"159","15.588786","95.136.242.99","109.0.74.75","TCP","74","65387  >  443 [ACK] Seq=1489 Ack=25746 Win=45056 Len=0 TSval=983205 TSecr=219668246"
"160","15.589704","95.136.242.99","109.0.74.75","TCP","74","65387  >  443 [ACK] Seq=1489 Ack=27114 Win=45056 Len=0 TSval=983206 TSecr=219668246"
"161","15.617165","109.0.74.75","95.136.242.99","TLSv1","1442","Application Data, Application Data"
"162","15.618143","109.0.74.75","95.136.242.99","TCP","1442","443  >  65387 [ACK] Seq=28482 Ack=1489 Win=10240 Len=1368 TSval=219668250 TSecr=983204 [TCP segment of a reassembled PDU]"
"163","15.619124","95.136.242.99","109.0.74.75","TCP","74","65387  >  443 [ACK] Seq=1489 Ack=28482 Win=45056 Len=0 TSval=983214 TSecr=219668250"
"164","15.619185","109.0.74.75","95.136.242.99","TCP","1442","443  >  65387 [ACK] Seq=29850 Ack=1489 Win=10240 Len=1368 TSval=219668250 TSecr=983204 [TCP segment of a reassembled PDU]"
"165","15.620127","95.136.242.99","109.0.74.75","TCP","74","65387  >  443 [ACK] Seq=1489 Ack=29850 Win=45056 Len=0 TSval=983215 TSecr=219668250"
"166","15.620192","109.0.74.75","95.136.242.99","TLSv1","1442","Application Data"
"167","15.621089","109.0.74.75","95.136.242.99","TCP","1442","443  >  65387 [ACK] Seq=32586 Ack=1489 Win=10240 Len=1368 TSval=219668250 TSecr=983204 [TCP segment of a reassembled PDU]"
"168","15.621590","95.136.242.99","109.0.74.75","TCP","74","65387  >  443 [ACK] Seq=1489 Ack=31218 Win=45056 Len=0 TSval=983215 TSecr=219668250"
"169","15.622208","109.0.74.75","95.136.242.99","TCP","1442","443  >  65387 [ACK] Seq=33954 Ack=1489 Win=10240 Len=1368 TSval=219668250 TSecr=983204 [TCP segment of a reassembled PDU]"
"170","15.623106","95.136.242.99","109.0.74.75","TCP","74","65387  >  443 [ACK] Seq=1489 Ack=32586 Win=45056 Len=0 TSval=983215 TSecr=219668250"
"171","15.623171","109.0.74.75","95.136.242.99","TLSv1","1442","Application Data"
"172","15.624014","109.0.74.75","95.136.242.99","TCP","1442","443  >  65387 [ACK] Seq=36690 Ack=1489 Win=10240 Len=1368 TSval=219668250 TSecr=983205 [TCP segment of a reassembled PDU]"
"173","15.624545","109.0.74.75","95.136.242.99","TCP","1442","443  >  65387 [ACK] Seq=38058 Ack=1489 Win=10240 Len=1368 TSval=219668251 TSecr=983205 [TCP segment of a reassembled PDU]"
"174","15.625698","95.136.242.99","109.0.74.75","TCP","74","65387  >  443 [ACK] Seq=1489 Ack=33954 Win=45056 Len=0 TSval=983216 TSecr=219668250"
"175","15.625762","109.0.74.75","95.136.242.99","TLSv1","1442","Application Data"
"176","15.626838","95.136.242.99","109.0.74.75","TCP","74","65387  >  443 [ACK] Seq=1489 Ack=35322 Win=45056 Len=0 TSval=983216 TSecr=219668250"
"177","15.626923","109.0.74.75","95.136.242.99","TCP","1442","443  >  65387 [ACK] Seq=40794 Ack=1489 Win=10240 Len=1368 TSval=219668251 TSecr=983206 [TCP segment of a reassembled PDU]"
"178","15.627848","109.0.74.75","95.136.242.99","TLSv1","1442","Application Data"
"179","15.628544","95.136.242.99","109.0.74.75","TCP","74","65387  >  443 [ACK] Seq=1489 Ack=36690 Win=45056 Len=0 TSval=983217 TSecr=219668250"
"180","15.629201","95.136.242.99","109.0.74.75","TCP","74","65387  >  443 [ACK] Seq=1489 Ack=39426 Win=45056 Len=0 TSval=983217 TSecr=219668250"
"181","15.629571","95.136.242.99","109.0.74.75","TCP","74","65387  >  443 [ACK] Seq=1489 Ack=42162 Win=45056 Len=0 TSval=983217 TSecr=219668251"
"182","15.651632","109.0.74.75","95.136.242.99","TLSv1","1442","Application Data"
"183","15.652708","109.0.74.75","95.136.242.99","TCP","1442","443  >  65387 [ACK] Seq=44898 Ack=1489 Win=10240 Len=1368 TSval=219668254 TSecr=983214 [TCP segment of a reassembled PDU]"
"184","15.653610","109.0.74.75","95.136.242.99","TCP","1442","443  >  65387 [ACK] Seq=46266 Ack=1489 Win=10240 Len=1368 TSval=219668254 TSecr=983215 [TCP segment of a reassembled PDU]"
"185","15.653915","95.136.242.99","109.0.74.75","TCP","74","65387  >  443 [ACK] Seq=1489 Ack=44898 Win=45056 Len=0 TSval=983225 TSecr=219668251"
"186","15.654352","109.0.74.75","95.136.242.99","TLSv1","1442","Application Data"
"187","15.655334","109.0.74.75","95.136.242.99","TCP","1442","443  >  65387 [ACK] Seq=49002 Ack=1489 Win=10240 Len=1368 TSval=219668254 TSecr=983215 [TCP segment of a reassembled PDU]"
"188","15.655956","95.136.242.99","109.0.74.75","TCP","74","65387  >  443 [ACK] Seq=1489 Ack=47634 Win=45056 Len=0 TSval=983225 TSecr=219668254"
"189","15.656307","109.0.74.75","95.136.242.99","TCP","1442","443  >  65387 [ACK] Seq=50370 Ack=1489 Win=10240 Len=1368 TSval=219668254 TSecr=983215 [TCP segment of a reassembled PDU]"
"190","15.657274","109.0.74.75","95.136.242.99","TLSv1","1442","Application Data"
"191","15.658470","109.0.74.75","95.136.242.99","TCP","1442","443  >  65387 [ACK] Seq=53106 Ack=1489 Win=10240 Len=1368 TSval=219668254 TSecr=983215 [TCP segment of a reassembled PDU]"
"192","15.658803","109.0.74.75","95.136.242.99","TCP","1442","443  >  65387 [ACK] Seq=54474 Ack=1489 Win=10240 Len=1368 TSval=219668255 TSecr=983216 [TCP segment of a reassembled PDU]"
"193","15.659519","95.136.242.99","109.0.74.75","TCP","74","65387  >  443 [ACK] Seq=1489 Ack=50370 Win=45056 Len=0 TSval=983226 TSecr=219668254"
"194","15.659902","109.0.74.75","95.136.242.99","TLSv1","1442","Application Data"
"195","15.660765","95.136.242.99","109.0.74.75","TCP","74","65387  >  443 [ACK] Seq=1489 Ack=53106 Win=45056 Len=0 TSval=983227 TSecr=219668254"
"196","15.661036","109.0.74.75","95.136.242.99","TLSv1","1442","Application Data"
"197","15.662034","95.136.242.99","109.0.74.75","TCP","74","65387  >  443 [ACK] Seq=1489 Ack=55842 Win=45056 Len=0 TSval=983227 TSecr=219668254"
"198","15.662118","109.0.74.75","95.136.242.99","TCP","1442","443  >  65387 [ACK] Seq=58578 Ack=1489 Win=10240 Len=1368 TSval=219668255 TSecr=983216 [TCP segment of a reassembled PDU]"
"199","15.663039","109.0.74.75","95.136.242.99","TCP","1442","443  >  65387 [ACK] Seq=59946 Ack=1489 Win=10240 Len=1368 TSval=219668255 TSecr=983217 [TCP segment of a reassembled PDU]"
"200","15.663972","95.136.242.99","109.0.74.75","TCP","74","65387  >  443 [ACK] Seq=1489 Ack=58578 Win=45056 Len=0 TSval=983228 TSecr=219668255"
"201","15.664038","109.0.74.75","95.136.242.99","TCP","1442","443  >  65387 [ACK] Seq=61314 Ack=1489 Win=10240 Len=1368 TSval=219668255 TSecr=983217 [TCP segment of a reassembled PDU]"
"202","15.664912","109.0.74.75","95.136.242.99","TCP","1442","443  >  65387 [ACK] Seq=62682 Ack=1489 Win=10240 Len=1368 TSval=219668255 TSecr=983217 [TCP segment of a reassembled PDU]"
"203","15.665595","95.136.242.99","109.0.74.75","TCP","74","65387  >  443 [ACK] Seq=1489 Ack=61314 Win=45056 Len=0 TSval=983228 TSecr=219668255"
"204","15.665978","109.0.74.75","95.136.242.99","TCP","1442","443  >  65387 [ACK] Seq=64050 Ack=1489 Win=10240 Len=1368 TSval=219668255 TSecr=983217 [TCP segment of a reassembled PDU]"
"205","15.666960","95.136.242.99","109.0.74.75","TCP","74","65387  >  443 [ACK] Seq=1489 Ack=64050 Win=45056 Len=0 TSval=983229 TSecr=219668255"
"206","15.667025","109.0.74.75","95.136.242.99","TCP","1442","443  >  65387 [ACK] Seq=65418 Ack=1489 Win=10240 Len=1368 TSval=219668255 TSecr=983217 [TCP segment of a reassembled PDU]"
"207","15.667446","109.0.74.75","95.136.242.99","TCP","1442","443  >  65387 [ACK] Seq=66786 Ack=1489 Win=10240 Len=1368 TSval=219668255 TSecr=983217 [TCP segment of a reassembled PDU]"
"208","15.668451","109.0.74.75","95.136.242.99","TCP","1442","443  >  65387 [ACK] Seq=68154 Ack=1489 Win=10240 Len=1368 TSval=219668255 TSecr=983217 [TCP segment of a reassembled PDU]"
"209","15.669447","109.0.74.75","95.136.242.99","TCP","1442","443  >  65387 [ACK] Seq=69522 Ack=1489 Win=10240 Len=1368 TSval=219668255 TSecr=983217 [TCP segment of a reassembled PDU]"
"210","15.669888","95.136.242.99","109.0.74.75","TCP","74","65387  >  443 [ACK] Seq=1489 Ack=66786 Win=45056 Len=0 TSval=983229 TSecr=219668255"
"211","15.670740","95.136.242.99","109.0.74.75","TCP","74","65387  >  443 [ACK] Seq=1489 Ack=69522 Win=45056 Len=0 TSval=983230 TSecr=219668255"
"212","15.686430","109.0.74.75","95.136.242.99","TCP","1442","443  >  65387 [ACK] Seq=70890 Ack=1489 Win=10240 Len=1368 TSval=219668258 TSecr=983225 [TCP segment of a reassembled PDU]"
"213","15.687429","109.0.74.75","95.136.242.99","TLSv1","1438","Application Data"
"214","15.688368","109.0.74.75","95.136.242.99","TCP","1442","443  >  65387 [ACK] Seq=73622 Ack=1489 Win=10240 Len=1368 TSval=219668258 TSecr=983225 [TCP segment of a reassembled PDU]"
"215","15.689024","95.136.242.99","109.0.74.75","TCP","74","65387  >  443 [ACK] Seq=1489 Ack=72258 Win=45056 Len=0 TSval=983235 TSecr=219668255"
"216","15.689333","109.0.74.75","95.136.242.99","TCP","1442","443  >  65387 [ACK] Seq=74990 Ack=1489 Win=10240 Len=1368 TSval=219668258 TSecr=983225 [TCP segment of a reassembled PDU]"
"217","15.690295","109.0.74.75","95.136.242.99","TCP","1442","443  >  65387 [ACK] Seq=76358 Ack=1489 Win=10240 Len=1368 TSval=219668258 TSecr=983225 [TCP segment of a reassembled PDU]"
"218","15.691338","109.0.74.75","95.136.242.99","TCP","1442","443  >  65387 [ACK] Seq=77726 Ack=1489 Win=10240 Len=1368 TSval=219668258 TSecr=983225 [TCP segment of a reassembled PDU]"
"219","15.692332","95.136.242.99","109.0.74.75","TCP","74","65387  >  443 [ACK] Seq=1489 Ack=73622 Win=45184 Len=0 TSval=983236 TSecr=219668258"
"220","15.693221","95.136.242.99","109.0.74.75","TCP","74","65387  >  443 [ACK] Seq=1489 Ack=76358 Win=45184 Len=0 TSval=983236 TSecr=219668258"
"221","15.693557","95.136.242.99","109.0.74.75","TCP","74","65387  >  443 [ACK] Seq=1489 Ack=79094 Win=45184 Len=0 TSval=983237 TSecr=219668258"
"222","15.693767","109.0.74.75","95.136.242.99","TCP","1442","443  >  65387 [ACK] Seq=79094 Ack=1489 Win=10240 Len=1368 TSval=219668259 TSecr=983226 [TCP segment of a reassembled PDU]"
"223","15.694987","109.0.74.75","95.136.242.99","TCP","1442","443  >  65387 [ACK] Seq=80462 Ack=1489 Win=10240 Len=1368 TSval=219668259 TSecr=983226 [TCP segment of a reassembled PDU]"
"224","15.696019","109.0.74.75","95.136.242.99","TCP","1442","443  >  65387 [ACK] Seq=81830 Ack=1489 Win=10240 Len=1368 TSval=219668259 TSecr=983226 [TCP segment of a reassembled PDU]"
"225","15.696933","95.136.242.99","109.0.74.75","TCP","74","65387  >  443 [ACK] Seq=1489 Ack=81830 Win=45184 Len=0 TSval=983238 TSecr=219668259"
"226","15.696995","109.0.74.75","95.136.242.99","TCP","1442","443  >  65387 [ACK] Seq=83198 Ack=1489 Win=10240 Len=1368 TSval=219668259 TSecr=983227 [TCP segment of a reassembled PDU]"
"227","15.697963","109.0.74.75","95.136.242.99","TCP","1442","443  >  65387 [ACK] Seq=84566 Ack=1489 Win=10240 Len=1368 TSval=219668259 TSecr=983227 [TCP segment of a reassembled PDU]"
"228","15.699002","109.0.74.75","95.136.242.99","TCP","1442","443  >  65387 [ACK] Seq=85934 Ack=1489 Win=10240 Len=1368 TSval=219668259 TSecr=983227 [TCP segment of a reassembled PDU]"
"229","15.699517","109.0.74.75","95.136.242.99","TLSv1","1125","Application Data"
"230","15.699925","95.136.242.99","109.0.74.75","TCP","74","65387  >  443 [ACK] Seq=1489 Ack=84566 Win=45184 Len=0 TSval=983238 TSecr=219668259"
"231","15.701678","95.136.242.99","109.0.74.75","TCP","74","65387  >  443 [ACK] Seq=1489 Ack=87302 Win=45184 Len=0 TSval=983239 TSecr=219668259"
"232","15.701949","95.136.242.99","109.0.74.75","TCP","74","65387  >  443 [ACK] Seq=1489 Ack=88353 Win=45184 Len=0 TSval=983239 TSecr=219668259"
"233","17.676498","Sfr_18:c2:73","Sfr_61:00:00","PPP LCP","30","Echo Request"
"234","17.698525","Sfr_61:00:00","Sfr_18:c2:73","PPP LCP","60","Echo Reply"
"235","20.215783","HuaweiTe_f0:45:d7","Sfr_e2:29:09","ARP","60","Who has 10.251.196.213? Tell 10.251.196.1"
"236","20.217543","HuaweiTe_f0:45:d7","Sfr_64:7f:e9","ARP","60","Who has 10.251.196.91? Tell 10.251.196.1"
"237","20.218471","HuaweiTe_f0:45:d7","Sfr_db:17:71","ARP","60","Who has 10.194.144.6? Tell 10.194.144.1"
"238","21.373766","fe80::ca4c:75ff:fe78:ed00","ff02::1","ICMPv6","126","Router Advertisement"
"239","21.801589","95.136.242.99","109.6.1.72","PPP LCP","68","Echo Request"
"240","21.827844","109.6.1.72","95.136.242.99","PPP LCP","70","Echo Reply"
"241","25.025125","109.6.1.72","95.136.242.99","PPP LCP","74","Echo Request"
"242","25.025579","95.136.242.99","109.6.1.72","PPP LCP","72","Echo Reply"
"243","25.145336","109.0.74.75","95.136.242.99","TCP","74","443  >  65387 [FIN, ACK] Seq=88353 Ack=1489 Win=10240 Len=0 TSval=219669353 TSecr=983239"
"244","25.147521","95.136.242.99","109.0.74.75","TLSv1","101","Encrypted Alert"
"245","25.148756","95.136.242.99","109.0.74.75","TCP","74","65387  >  443 [FIN, ACK] Seq=1516 Ack=88354 Win=45184 Len=0 TSval=986073 TSecr=219669353"
"246","25.180560","109.0.74.75","95.136.242.99","TCP","62","443  >  65387 [RST] Seq=88354 Win=0 Len=0"
"247","25.214574","HuaweiTe_f0:45:d7","Sfr_60:07:79","ARP","60","Who has 10.194.144.142? Tell 10.194.144.1"
"248","27.124761","109.0.74.75","95.136.242.99","TCP","74","443  >  65386 [FIN, ACK] Seq=27742 Ack=3472 Win=14336 Len=0 TSval=189811447 TSecr=983198"
"249","27.126697","95.136.242.99","109.0.74.75","TLSv1","101","Encrypted Alert"
"250","27.127942","95.136.242.99","109.0.74.75","TCP","74","65386  >  443 [FIN, ACK] Seq=3499 Ack=27743 Win=45184 Len=0 TSval=986667 TSecr=189811447"
"251","27.159728","109.0.74.75","95.136.242.99","TCP","62","443  >  65386 [RST] Seq=27743 Win=0 Len=0"
"252","27.324819","95.136.242.99","109.0.74.75","TCP","82","65388  >  443 [SYN] Seq=0 Win=29200 Len=0 MSS=1452 SACK_PERM TSval=986724 TSecr=0 WS=128"
"253","27.358307","109.0.74.75","95.136.242.99","TCP","82","443  >  65388 [SYN, ACK] Seq=0 Ack=1 Win=5792 Len=0 MSS=1380 SACK_PERM TSval=219669609 TSecr=986724 WS=128"
"254","27.359731","95.136.242.99","109.0.74.75","TCP","74","65388  >  443 [ACK] Seq=1 Ack=1 Win=29312 Len=0 TSval=986737 TSecr=219669609"
"255","27.360710","95.136.242.99","109.0.74.75","TLSv1","291","Client Hello"
"256","27.374757","95.136.242.99","109.0.74.75","TCP","82","65389  >  443 [SYN] Seq=0 Win=29200 Len=0 MSS=1452 SACK_PERM TSval=986741 TSecr=0 WS=128"
"257","27.395257","109.0.74.75","95.136.242.99","TCP","74","443  >  65388 [ACK] Seq=1 Ack=218 Win=6912 Len=0 TSval=219669613 TSecr=986737"
"258","27.395287","109.0.74.75","95.136.242.99","TLSv1","206","Server Hello, Change Cipher Spec, Encrypted Handshake Message"
"259","27.396732","95.136.242.99","109.0.74.75","TCP","74","65388  >  443 [ACK] Seq=218 Ack=133 Win=30336 Len=0 TSval=986748 TSecr=219669613"
"260","27.409296","109.0.74.75","95.136.242.99","TCP","82","443  >  65389 [SYN, ACK] Seq=0 Ack=1 Win=5792 Len=0 MSS=1380 SACK_PERM TSval=129374971 TSecr=986741 WS=128"
"261","27.410727","95.136.242.99","109.0.74.75","TCP","74","65389  >  443 [ACK] Seq=1 Ack=1 Win=29312 Len=0 TSval=986752 TSecr=129374971"
"262","27.460742","95.136.242.99","109.0.74.75","TLSv1","121","Change Cipher Spec, Encrypted Handshake Message"
"263","27.462292","95.136.242.99","109.0.74.75","TLSv1","1130","Application Data"
"264","27.463747","95.136.242.99","109.0.74.75","TLSv1","291","Client Hello"
"265","27.504427","109.0.74.75","95.136.242.99","TCP","74","443  >  65388 [ACK] Seq=133 Ack=1321 Win=9088 Len=0 TSval=219669626 TSecr=986767"
"266","27.505425","109.0.74.75","95.136.242.99","TCP","74","443  >  65389 [ACK] Seq=1 Ack=218 Win=6912 Len=0 TSval=129374980 TSecr=986767"
"267","27.506368","109.0.74.75","95.136.242.99","TLSv1","1442","Server Hello"
"268","27.506899","109.0.74.75","95.136.242.99","TCP","1442","443  >  65389 [ACK] Seq=1369 Ack=218 Win=6912 Len=1368 TSval=129374980 TSecr=986767 [TCP segment of a reassembled PDU]"
"269","27.509463","95.136.242.99","109.0.74.75","TCP","74","65389  >  443 [ACK] Seq=218 Ack=1369 Win=32000 Len=0 TSval=986781 TSecr=129374980"
"270","27.510705","95.136.242.99","109.0.74.75","TCP","74","65389  >  443 [ACK] Seq=218 Ack=2737 Win=34688 Len=0 TSval=986781 TSecr=129374980"
"271","27.529047","109.0.74.75","95.136.242.99","TLSv1","776","Application Data, Application Data"
"272","27.530728","95.136.242.99","109.0.74.75","TCP","74","65388  >  443 [ACK] Seq=1321 Ack=835 Win=31744 Len=0 TSval=986788 TSecr=219669628"
"273","27.542860","109.0.74.75","95.136.242.99","TLSv1","706","Certificate, Server Hello Done"
"274","27.545731","95.136.242.99","109.0.74.75","TCP","74","65389  >  443 [ACK] Seq=218 Ack=3369 Win=37504 Len=0 TSval=986792 TSecr=129374984"
"275","27.548767","95.136.242.99","109.0.74.75","TLSv1","388","Client Key Exchange, Change Cipher Spec, Encrypted Handshake Message"
"276","27.586942","109.0.74.75","95.136.242.99","TLSv1","121","Change Cipher Spec, Encrypted Handshake Message"
"277","27.629740","95.136.242.99","109.0.74.75","TCP","74","65389  >  443 [ACK] Seq=532 Ack=3416 Win=37504 Len=0 TSval=986817 TSecr=129374988"
"278","27.733713","10.251.23.139","80.118.192.115","RADIUS","424","Access-Request id=0"
"279","27.739755","95.136.242.99","109.0.74.75","TLSv1","428","Application Data"
"280","27.779417","109.0.74.75","95.136.242.99","TLSv1","1442","Application Data"
"281","27.779956","109.0.74.75","95.136.242.99","TLSv1","423","Application Data"
"282","27.782453","95.136.242.99","109.0.74.75","TCP","74","65388  >  443 [ACK] Seq=1675 Ack=2203 Win=34432 Len=0 TSval=986863 TSecr=219669657"
"283","27.783732","95.136.242.99","109.0.74.75","TCP","74","65388  >  443 [ACK] Seq=1675 Ack=2552 Win=37248 Len=0 TSval=986863 TSecr=219669657"
"284","27.813852","80.118.192.115","10.251.23.139","RADIUS","74","Access-Accept id=0"
"285","27.832353","10.251.23.139","80.118.192.115","RADIUS","350","Accounting-Request id=0"
"286","27.836840","95.136.242.99","109.0.74.75","TLSv1","727","Application Data"
"287","27.864367","80.118.192.115","10.251.23.139","RADIUS","62","Accounting-Response id=0"
"288","27.883359","109.0.74.75","95.136.242.99","TLSv1","1442","Application Data"
"289","27.884353","109.0.74.75","95.136.242.99","TCP","1442","443  >  65388 [ACK] Seq=3920 Ack=2328 Win=13312 Len=1368 TSval=219669669 TSecr=986879 [TCP segment of a reassembled PDU]"
"290","27.885238","95.136.242.99","109.0.74.75","TCP","74","65388  >  443 [ACK] Seq=2328 Ack=3920 Win=39936 Len=0 TSval=986894 TSecr=219669669"
"291","27.885329","109.0.74.75","95.136.242.99","TCP","1442","443  >  65388 [ACK] Seq=5288 Ack=2328 Win=13312 Len=1368 TSval=219669669 TSecr=986879 [TCP segment of a reassembled PDU]"
"292","27.887132","95.136.242.99","109.0.74.75","TCP","74","65388  >  443 [ACK] Seq=2328 Ack=5288 Win=42624 Len=0 TSval=986895 TSecr=219669669"
"293","27.887336","95.136.242.99","109.0.74.75","TCP","74","65388  >  443 [ACK] Seq=2328 Ack=6656 Win=45056 Len=0 TSval=986895 TSecr=219669669"
"294","27.917410","109.0.74.75","95.136.242.99","TLSv1","1098","Application Data, Application Data"
"295","27.919741","95.136.242.99","109.0.74.75","TCP","74","65388  >  443 [ACK] Seq=2328 Ack=7680 Win=45056 Len=0 TSval=986904 TSecr=219669673"
"296","28.162964","95.136.242.99","109.0.74.75","TLSv1","1160","Application Data"
"297","28.205108","109.0.74.75","95.136.242.99","TLSv1","354","Application Data, Application Data"
"298","28.207956","95.136.242.99","109.0.74.75","TCP","74","65388  >  443 [ACK] Seq=3414 Ack=7960 Win=45056 Len=0 TSval=986991 TSecr=219669707"
"299","28.259761","95.136.242.99","109.0.74.75","TLSv1","513","Application Data"
"300","28.302532","109.0.74.75","95.136.242.99","TLSv1","1442","Application Data"
"301","28.302597","109.0.74.75","95.136.242.99","TCP","1442","443  >  65388 [ACK] Seq=9328 Ack=3853 Win=17664 Len=1368 TSval=219669718 TSecr=987006 [TCP segment of a reassembled PDU]"
"302","28.303580","109.0.74.75","95.136.242.99","TCP","1442","443  >  65388 [ACK] Seq=10696 Ack=3853 Win=17664 Len=1368 TSval=219669718 TSecr=987006 [TCP segment of a reassembled PDU]"
"303","28.307967","95.136.242.99","109.0.74.75","TCP","74","65388  >  443 [ACK] Seq=3853 Ack=9328 Win=45056 Len=0 TSval=987021 TSecr=219669718"
"304","28.309841","95.136.242.99","109.0.74.75","TCP","74","65388  >  443 [ACK] Seq=3853 Ack=10696 Win=45056 Len=0 TSval=987021 TSecr=219669718"
"305","28.310707","95.136.242.99","109.0.74.75","TCP","74","65388  >  443 [ACK] Seq=3853 Ack=12064 Win=45056 Len=0 TSval=987021 TSecr=219669718"
"306","28.341426","109.0.74.75","95.136.242.99","TLSv1","1442","Application Data"
"307","28.342649","109.0.74.75","95.136.242.99","TCP","1442","443  >  65388 [ACK] Seq=13432 Ack=3853 Win=17664 Len=1368 TSval=219669722 TSecr=987021 [TCP segment of a reassembled PDU]"
"308","28.343133","109.0.74.75","95.136.242.99","TLSv1","634","Application Data"
"309","28.346361","95.136.242.99","109.0.74.75","TCP","74","65388  >  443 [ACK] Seq=3853 Ack=13432 Win=45056 Len=0 TSval=987033 TSecr=219669722"
"310","28.347045","95.136.242.99","109.0.74.75","TCP","74","65388  >  443 [ACK] Seq=3853 Ack=14800 Win=45056 Len=0 TSval=987033 TSecr=219669722"
"311","28.347306","95.136.242.99","109.0.74.75","TCP","74","65388  >  443 [ACK] Seq=3853 Ack=15360 Win=45056 Len=0 TSval=987033 TSecr=219669723"
"312","30.214086","HuaweiTe_f0:45:d7","Sfr_79:8a:c9","ARP","60","Who has 10.194.144.111? Tell 10.194.144.1"
"313","32.462864","95.136.242.99","109.0.74.75","TLSv1","101","Encrypted Alert"
"314","32.463735","95.136.242.99","109.0.74.75","TCP","74","65389  >  443 [FIN, ACK] Seq=559 Ack=3416 Win=37504 Len=0 TSval=988267 TSecr=129374988"
"315","32.497516","109.0.74.75","95.136.242.99","TCP","74","443  >  65389 [FIN, ACK] Seq=3416 Ack=560 Win=7936 Len=0 TSval=129375479 TSecr=988267"
"316","32.500729","95.136.242.99","109.0.74.75","TCP","74","65389  >  443 [ACK] Seq=560 Ack=3417 Win=37504 Len=0 TSval=988279 TSecr=129375479"
"317","35.039161","109.6.1.72","95.136.242.99","PPP LCP","74","Echo Request"
"318","35.039751","95.136.242.99","109.6.1.72","PPP LCP","72","Echo Reply"
"319","35.226900","HuaweiTe_f0:45:d7","Sfr_65:86:11","ARP","60","Who has 10.194.144.61? Tell 10.194.144.1"
"320","35.228607","HuaweiTe_f0:45:d7","Sagemcom_5f:01:29","ARP","60","Who has 10.251.196.80? Tell 10.251.196.1[Malformed Packet]"
"321","35.259963","95.136.242.99","208.97.177.124","TCP","82","65389  >  80 [SYN] Seq=0 Win=29200 Len=0 MSS=1452 SACK_PERM TSval=989107 TSecr=0 WS=128"
"322","35.367840","208.97.177.124","95.136.242.99","TCP","74","80  >  65389 [SYN, ACK] Seq=0 Ack=1 Win=5840 Len=0 MSS=1460 SACK_PERM WS=512"
"323","35.369851","95.136.242.99","208.97.177.124","TCP","62","65389  >  80 [ACK] Seq=1 Ack=1 Win=29312 Len=0"
"324","35.370722","95.136.242.99","208.97.177.124","HTTP","370","GET / HTTP/1.1 "
"325","35.481451","208.97.177.124","95.136.242.99","TCP","62","80  >  65389 [ACK] Seq=1 Ack=309 Win=7168 Len=0"
"326","35.484127","208.97.177.124","95.136.242.99","HTTP","536","HTTP/1.1 200 OK  (text/html)"
"327","35.485736","95.136.242.99","208.97.177.124","TCP","62","65389  >  80 [ACK] Seq=309 Ack=475 Win=30336 Len=0"
"328","35.653754","95.136.242.99","208.97.177.124","HTTP","351","GET /favicon.ico HTTP/1.1 "
"329","35.764751","208.97.177.124","95.136.242.99","HTTP","329","HTTP/1.1 200 OK "
"330","35.766715","95.136.242.99","208.97.177.124","TCP","62","65389  >  80 [ACK] Seq=598 Ack=742 Win=31360 Len=0"
"331","37.696503","Sfr_18:c2:73","Sfr_61:00:00","PPP LCP","30","Echo Request"
"332","37.719306","Sfr_61:00:00","Sfr_18:c2:73","PPP LCP","60","Echo Reply"
"333","37.775434","208.97.177.124","95.136.242.99","TCP","62","80  >  65389 [FIN, ACK] Seq=742 Ack=598 Win=8192 Len=0"
"334","37.777809","95.136.242.99","208.97.177.124","TCP","62","65389  >  80 [FIN, ACK] Seq=598 Ack=743 Win=31360 Len=0"
"335","37.884834","208.97.177.124","95.136.242.99","TCP","62","80  >  65389 [ACK] Seq=743 Ack=599 Win=8192 Len=0"
"336","40.226178","109.0.74.75","95.136.242.99","TCP","74","443  >  65388 [FIN, ACK] Seq=15360 Ack=3853 Win=17664 Len=0 TSval=219671098 TSecr=987033"
"337","40.227545","10.251.23.139","239.255.255.250","IGMPv2","46","Membership Report group 239.255.255.250"
"338","40.228287","95.136.242.99","109.0.74.75","TLSv1","101","Encrypted Alert"
"339","40.229840","95.136.242.99","109.0.74.75","TCP","74","65388  >  443 [FIN, ACK] Seq=3880 Ack=15361 Win=45184 Len=0 TSval=990597 TSecr=219671098"
"340","40.261429","109.0.74.75","95.136.242.99","TCP","62","443  >  65388 [RST] Seq=15361 Win=0 Len=0"
"341","41.808600","95.136.242.99","109.6.1.72","PPP LCP","68","Echo Request"
"342","41.833803","109.6.1.72","95.136.242.99","PPP LCP","70","Echo Reply"
"343","45.054949","109.6.1.72","95.136.242.99","PPP LCP","74","Echo Request"
"344","45.055339","95.136.242.99","109.6.1.72","PPP LCP","72","Echo Reply"
"345","48.297184","10.251.23.139","80.118.192.115","RADIUS","398","Accounting-Request id=1"
"346","48.301503","10.251.23.139","62.39.3.142","Syslog","118","LOCAL2.ERR: Jan  2 10:10:41 nb6 chillispot[4222]: D:192.168.2.83/00:19:7D:3B:6F:D4\\n"
"347","48.330082","80.118.192.115","10.251.23.139","RADIUS","62","Accounting-Response id=1"
