"No.","Time","Source","Destination","Protocol","Length","Info"
"1","0.000000000","210.146.64.4","81.131.67.131","TCP","1514","80  >  2727 [ACK] Seq=1 Ack=1 Win=6432 Len=1460"
"2","0.000000000","81.131.67.131","210.146.64.4","TCP","54","2727  >  80 [ACK] Seq=1 Ack=1461 Win=8760 Len=0"
"3","0.031250000","70.27.127.185","81.131.67.131","Gnutella","93",""
"4","0.046875000","81.131.67.131","38.115.4.204","TCP","110","2667  >  21284 [PSH, ACK] Seq=1 Ack=1 Win=7482 Len=56"
"5","0.156250000","81.131.67.131","70.27.127.185","TCP","54","2094  >  6346 [ACK] Seq=1 Ack=40 Win=7886 Len=0"
"6","0.312500000","210.146.64.4","81.131.67.131","TCP","1514","80  >  2727 [ACK] Seq=1461 Ack=1 Win=6432 Len=1460"
"7","0.312500000","213.19.160.190","81.131.67.131","TCP","62","80  >  2810 [SYN, ACK] Seq=0 Ack=1 Win=5840 Len=0 MSS=1460 SACK_PERM"
"8","0.312500000","81.131.67.131","213.19.160.190","TCP","54","2810  >  80 [ACK] Seq=1 Ack=1 Win=8760 Len=0"
"9","0.328125000","81.131.67.131","210.146.64.4","TCP","54","2727  >  80 [ACK] Seq=1 Ack=2921 Win=8760 Len=0"
"10","0.343750000","81.131.67.131","213.19.160.190","HTTP","354","GET /msdownload/update/v5/psf/windowsxp-sp2-x86fre-usa-2180_056b2b38baf5620be85ddd58141b073bc0b06a1d.psf HTTP/1.1 "
"11","0.390625000","38.115.4.204","81.131.67.131","TCP","392","21284  >  2667 [PSH, ACK] Seq=1 Ack=1 Win=65535 Len=338"
"12","0.390625000","81.131.67.131","38.115.4.204","TCP","54","2667  >  21284 [ACK] Seq=57 Ack=339 Win=8760 Len=0"
"13","0.671875000","210.146.64.4","81.131.67.131","TCP","1514","80  >  2727 [PSH, ACK] Seq=2921 Ack=1 Win=6432 Len=1460"
"14","0.671875000","81.131.67.131","210.146.64.4","TCP","54","2727  >  80 [ACK] Seq=1 Ack=4381 Win=8760 Len=0"
"15","0.703125000","200.158.81.150","81.131.67.131","ICMP","70","Destination unreachable (Port unreachable)"
"16","0.703125000","142.68.189.57","81.131.67.131","Gnutella","90",""
"17","0.703125000","81.131.67.131","24.43.167.12","UDP","61","41730  >  6346 Len=19"
"18","0.718750000","81.131.67.131","81.247.65.177","UDP","61","41730  >  6346 Len=19"
"19","0.718750000","24.102.197.177","81.131.67.131","UDP","50","4917  >  41730 Len=8"
"20","0.718750000","81.131.67.131","83.117.6.35","UDP","61","41730  >  6346 Len=19"
"21","0.734375000","81.131.67.131","195.130.143.128","UDP","61","41730  >  6346 Len=19"
"22","0.750000000","81.131.67.131","212.194.202.220","UDP","61","41730  >  6346 Len=19"
"23","0.765625000","81.131.67.131","207.148.176.7","UDP","61","41730  >  6346 Len=19"
"24","0.781250000","81.131.67.131","62.193.101.150","UDP","61","41730  >  6346 Len=19"
"25","0.796875000","81.131.67.131","212.129.214.254","UDP","61","41730  >  6346 Len=19"
"26","0.796875000","81.131.67.131","172.177.184.179","UDP","61","41730  >  6346 Len=19"
"27","0.812500000","81.131.67.131","172.186.173.245","UDP","61","41730  >  6346 Len=19"
"28","0.828125000","81.131.67.131","207.216.13.37","UDP","61","41730  >  6346 Len=19"
"29","0.843750000","81.131.67.131","82.44.146.72","UDP","61","41730  >  34087 Len=19"
"30","0.921875000","81.131.67.131","142.68.189.57","TCP","54","1595  >  6346 [ACK] Seq=1 Ack=37 Win=8830 Len=0"
"31","1.015625000","210.146.64.4","81.131.67.131","TCP","1514","80  >  2727 [ACK] Seq=4381 Ack=1 Win=6432 Len=1460"
"32","1.015625000","68.186.167.166","81.131.67.131","UDP","50","13778  >  41730 Len=8"
"33","1.015625000","81.131.67.131","210.146.64.4","TCP","54","2727  >  80 [ACK] Seq=1 Ack=5841 Win=8760 Len=0"
"34","1.296875000","210.146.64.4","81.131.67.131","TCP","1514","80  >  2727 [ACK] Seq=5841 Ack=1 Win=6432 Len=1460"
"35","1.296875000","68.34.169.230","81.131.67.131","TCP","82","6346  >  2433 [PSH, ACK] Seq=1 Ack=1 Win=64332 Len=28 [TCP segment of a reassembled PDU]"
"36","1.296875000","81.131.67.131","210.146.64.4","TCP","54","2727  >  80 [ACK] Seq=1 Ack=7301 Win=8760 Len=0"
"37","1.468750000","81.131.67.131","68.34.169.230","TCP","54","2433  >  6346 [ACK] Seq=1 Ack=29 Win=8016 Len=0"
"38","1.593750000","210.146.64.4","81.131.67.131","TCP","1514","80  >  2727 [ACK] Seq=7301 Ack=1 Win=6432 Len=1460"
"39","1.593750000","81.131.67.131","210.146.64.4","TCP","54","2727  >  80 [ACK] Seq=1 Ack=8761 Win=8760 Len=0"
"40","1.875000000","81.131.67.131","85.96.110.115","UDP","61","41730  >  6346 Len=19"
"41","1.875000000","210.146.64.4","81.131.67.131","TCP","1514","80  >  2727 [ACK] Seq=8761 Ack=1 Win=6432 Len=1460"
"42","1.875000000","81.131.67.131","83.112.25.172","UDP","61","41730  >  6346 Len=19"
"43","1.890625000","81.131.67.131","24.11.146.28","UDP","54","41730  >  17342 Len=12"
"44","1.906250000","70.27.127.185","81.131.67.131","Gnutella","89",""
"45","1.906250000","38.115.4.204","81.131.67.131","TCP","54","21284  >  2667 [ACK] Seq=339 Ack=57 Win=65479 Len=0"
"46","1.906250000","81.131.67.131","68.186.167.166","UDP","550","41730  >  13778 Len=508"
"47","1.937500000","213.19.160.190","81.131.67.131","TCP","54","80  >  2810 [ACK] Seq=1 Ack=301 Win=6432 Len=0"
"48","1.937500000","81.131.67.131","210.146.64.4","TCP","54","2727  >  80 [ACK] Seq=1 Ack=10221 Win=8760 Len=0"
"49","1.953125000","81.131.67.131","38.115.4.204","TCP","62","2667  >  21284 [PSH, ACK] Seq=57 Ack=339 Win=8760 Len=8"
"50","1.953125000","81.131.67.131","68.45.204.224","UDP","75","6348  >  6346 Len=33"
"51","1.968750000","213.19.160.190","81.131.67.131","TCP","353","80  >  2810 [PSH, ACK] Seq=1 Ack=301 Win=6432 Len=299 [TCP segment of a reassembled PDU]"
"52","2.125000000","81.131.67.131","213.19.160.190","TCP","54","2810  >  80 [ACK] Seq=301 Ack=300 Win=8461 Len=0"
"53","2.125000000","81.131.67.131","70.27.127.185","TCP","54","2094  >  6346 [ACK] Seq=1 Ack=75 Win=7851 Len=0"
"54","2.265625000","210.146.64.4","81.131.67.131","TCP","1514","80  >  2727 [ACK] Seq=10221 Ack=1 Win=6432 Len=1460"
"55","2.265625000","81.131.67.131","210.146.64.4","TCP","54","2727  >  80 [ACK] Seq=1 Ack=11681 Win=8760 Len=0"
"56","2.343750000","213.19.160.190","81.131.67.131","TCP","370","80  >  2810 [PSH, ACK] Seq=300 Ack=301 Win=6432 Len=316 [TCP segment of a reassembled PDU]"
"57","2.562500000","81.131.67.131","213.19.160.190","TCP","54","2810  >  80 [ACK] Seq=301 Ack=616 Win=8145 Len=0"
"58","2.609375000","210.146.64.4","81.131.67.131","TCP","1514","80  >  2727 [PSH, ACK] Seq=11681 Ack=1 Win=6432 Len=1460"
"59","2.609375000","142.68.189.57","81.131.67.131","Gnutella","87",""
"60","2.609375000","81.131.67.131","210.146.64.4","TCP","54","2727  >  80 [ACK] Seq=1 Ack=13141 Win=8760 Len=0"
"61","2.781250000","81.131.67.131","142.68.189.57","TCP","54","1595  >  6346 [ACK] Seq=1 Ack=70 Win=8797 Len=0"
"62","2.796875000","81.131.67.131","213.120.62.99","DNS","83","Standard query 0x006a AAAA ftp.ipv6.uni-leipzig.de"
"63","2.906250000","81.131.67.131","82.10.189.102","UDP","61","41730  >  6346 Len=19"
"64","2.906250000","210.146.64.4","81.131.67.131","TCP","1514","80  >  2727 [ACK] Seq=13141 Ack=1 Win=6432 Len=1460"
"65","2.906250000","81.131.67.131","62.203.155.212","UDP","61","41730  >  6346 Len=19"
"66","2.921875000","81.131.67.131","83.132.177.64","UDP","61","41730  >  6346 Len=19"
"67","2.937500000","68.34.169.230","81.131.67.131","TCP","78","6346  >  2433 [PSH, ACK] Seq=29 Ack=1 Win=64332 Len=24 [TCP segment of a reassembled PDU]"
"68","2.937500000","81.131.67.131","68.186.167.166","UDP","550","41730  >  13778 Len=508"
"69","2.953125000","81.131.67.131","210.146.64.4","TCP","54","2727  >  80 [ACK] Seq=1 Ack=14601 Win=8760 Len=0"
"70","3.109375000","81.131.67.131","68.34.169.230","TCP","54","2433  >  6346 [ACK] Seq=1 Ack=53 Win=7992 Len=0"
"71","3.218750000","210.146.64.4","81.131.67.131","TCP","1514","80  >  2727 [ACK] Seq=14601 Ack=1 Win=6432 Len=1460"
"72","3.218750000","81.131.67.131","210.146.64.4","TCP","54","2727  >  80 [ACK] Seq=1 Ack=16061 Win=8760 Len=0"
"73","3.515625000","210.146.64.4","81.131.67.131","TCP","1514","80  >  2727 [ACK] Seq=16061 Ack=1 Win=6432 Len=1460"
"74","3.515625000","81.131.67.131","210.146.64.4","TCP","54","2727  >  80 [ACK] Seq=1 Ack=17521 Win=8760 Len=0"
"75","3.796875000","81.131.67.131","213.120.62.99","DNS","83","Standard query 0x006a AAAA ftp.ipv6.uni-leipzig.de"
"76","3.796875000","213.19.160.190","81.131.67.131","TCP","1514","80  >  2810 [ACK] Seq=616 Ack=301 Win=6432 Len=1460 [TCP segment of a reassembled PDU]"
"77","3.796875000","81.131.67.131","213.19.160.190","TCP","54","2810  >  80 [ACK] Seq=301 Ack=2076 Win=8760 Len=0"
"78","3.937500000","81.131.67.131","68.186.167.166","UDP","550","41730  >  13778 Len=508"
"79","4.078125000","213.19.160.190","81.131.67.131","TCP","1514","80  >  2810 [ACK] Seq=2076 Ack=301 Win=6432 Len=1460 [TCP segment of a reassembled PDU]"
"80","4.078125000","68.45.204.224","81.131.67.131","UDP","74","6346  >  6348 Len=32"
"81","4.078125000","81.131.67.131","213.19.160.190","TCP","54","2810  >  80 [ACK] Seq=301 Ack=3536 Win=8760 Len=0"
"82","4.093750000","81.131.67.131","68.45.204.224","UDP","415","6348  >  6346 Len=373"
"83","4.281250000","38.115.4.204","81.131.67.131","TCP","1061","[TCP Retransmission] 21284  >  2667 [PSH, ACK] Seq=1 Ack=57 Win=65479 Len=1007"
"84","4.421875000","81.131.67.131","38.115.4.204","TCP","54","[TCP ACKed unseen segment] 2667  >  21284 [ACK] Seq=65 Ack=1008 Win=8091 Len=0"
"85","4.578125000","210.146.64.4","81.131.67.131","TCP","1514","80  >  2727 [PSH, ACK] Seq=17521 Ack=1 Win=6432 Len=1460"
"86","4.578125000","81.131.67.131","210.146.64.4","TCP","54","2727  >  80 [ACK] Seq=1 Ack=18981 Win=8760 Len=0"
"87","4.593750000","38.115.4.204","81.131.67.131","TCP","54","21284  >  2667 [ACK] Seq=1008 Ack=65 Win=65471 Len=0"
"88","4.593750000","81.131.67.131","38.115.4.204","TCP","62","2667  >  21284 [PSH, ACK] Seq=65 Ack=1008 Win=8091 Len=8"
"89","4.796875000","81.131.67.131","213.120.62.99","DNS","83","Standard query 0x006a AAAA ftp.ipv6.uni-leipzig.de"
"90","4.859375000","210.146.64.4","81.131.67.131","TCP","1514","80  >  2727 [ACK] Seq=18981 Ack=1 Win=6432 Len=1460"
"91","4.859375000","81.131.67.131","210.146.64.4","TCP","54","2727  >  80 [ACK] Seq=1 Ack=20441 Win=8760 Len=0"
"92","4.906250000","213.19.160.190","81.131.67.131","TCP","268","80  >  2810 [PSH, ACK] Seq=3536 Ack=301 Win=6432 Len=214 [TCP segment of a reassembled PDU]"
"93","4.953125000","213.120.62.99","81.131.67.131","DNS","261","Standard query response 0x006a AAAA ftp.ipv6.uni-leipzig.de CNAME 6bone.informatik.uni-leipzig.de AAAA 2001:638:902:1:201:2ff:fee2:7596 NS server2.rz.uni-leipzig.de NS ws-kar1.win-ip.dfn.de NS ns.uni-jena.de NS news.uni-leipzig.de A 139.18.1.2"
"94","4.953125000","2002:5183:4383::5183:4383","2001:638:902:1:201:2ff:fee2:7596","TCP","98","1026  >  21 [SYN] Seq=0 Win=16384 Len=0 MSS=1220"
"95","5.031250000","81.131.67.131","84.56.231.176","UDP","61","41730  >  6346 Len=19"
"96","5.031250000","81.131.67.131","62.205.109.173","UDP","61","41730  >  6346 Len=19"
"97","5.046875000","81.131.67.131","80.171.9.79","UDP","61","41730  >  6346 Len=19"
"98","5.062500000","81.131.67.131","62.131.99.79","UDP","61","41730  >  6346 Len=19"
"99","5.062500000","81.131.67.131","147.10.31.210","UDP","433","41730  >  6346 Len=391"
"100","5.078125000","81.131.67.131","213.19.160.190","TCP","54","2810  >  80 [ACK] Seq=301 Ack=3750 Win=8546 Len=0"
"101","5.234375000","210.146.64.4","81.131.67.131","TCP","1514","80  >  2727 [PSH, ACK] Seq=20441 Ack=1 Win=6432 Len=1460"
"102","5.234375000","81.131.67.131","210.146.64.4","TCP","54","2727  >  80 [ACK] Seq=1 Ack=21901 Win=8760 Len=0"
"103","5.468750000","211.28.6.30","81.131.67.131","TCP","1078","6348  >  2769 [PSH, ACK] Seq=1 Ack=1 Win=7809 Len=1024"
"104","5.468750000","81.131.67.131","211.28.6.30","TCP","54","2769  >  6348 [ACK] Seq=1 Ack=1025 Win=8760 Len=0"
"105","5.761719000","210.146.64.4","81.131.67.131","TCP","1514","80  >  2727 [ACK] Seq=21901 Ack=1 Win=6432 Len=1460"
"106","5.761719000","81.131.67.131","210.146.64.4","TCP","54","2727  >  80 [ACK] Seq=1 Ack=23361 Win=8760 Len=0"
"107","5.808594000","81.131.67.131","24.11.146.28","TCP","357","2675  >  17342 [PSH, ACK] Seq=1 Ack=1 Win=10164 Len=303"
"108","6.050782000","210.146.64.4","81.131.67.131","TCP","1514","80  >  2727 [ACK] Seq=23361 Ack=1 Win=6432 Len=1460"
"109","6.050782000","81.131.67.131","210.146.64.4","TCP","54","2727  >  80 [ACK] Seq=1 Ack=24821 Win=8760 Len=0"
"110","6.179688000","81.131.67.131","83.53.165.235","UDP","54","41730  >  6346 Len=12"
"111","6.181641000","81.131.67.131","84.149.148.25","UDP","61","41730  >  6346 Len=19"
"112","6.195313000","81.131.67.131","81.161.144.10","UDP","61","41730  >  6346 Len=19"
"113","6.204102000","81.131.67.131","200.158.81.150","UDP","61","41730  >  6346 Len=19"
"114","6.219727000","81.131.67.131","195.14.223.213","UDP","61","41730  >  6346 Len=19"
"115","6.235352000","81.131.67.131","202.133.203.254","UDP","61","41730  >  6346 Len=19"
"116","6.235352000","81.131.67.131","62.34.123.244","UDP","61","41730  >  6346 Len=19"
"117","6.250977000","81.131.67.131","218.72.89.80","UDP","61","41730  >  6346 Len=19"
"118","6.266602000","81.131.67.131","213.189.168.206","UDP","61","41730  >  6346 Len=19"
"119","6.282227000","81.131.67.131","38.115.4.204","UDP","54","41730  >  21284 Len=12"
"120","6.297852000","81.131.67.131","68.186.167.166","UDP","550","41730  >  13778 Len=508"
"121","6.313477000","211.28.6.30","81.131.67.131","TCP","1514","6348  >  2769 [PSH, ACK] Seq=1025 Ack=1 Win=7809 Len=1460"
"122","6.313477000","81.131.67.131","211.28.6.30","TCP","54","2769  >  6348 [ACK] Seq=1 Ack=2485 Win=8760 Len=0"
"123","6.610352000","210.146.64.4","81.131.67.131","TCP","1514","80  >  2727 [ACK] Seq=24821 Ack=1 Win=6432 Len=1460"
"124","6.610352000","81.131.67.131","210.146.64.4","TCP","54","2727  >  80 [ACK] Seq=1 Ack=26281 Win=8760 Len=0"
"125","6.641602000","213.120.62.99","81.131.67.131","DNS","261","Standard query response 0x006a AAAA ftp.ipv6.uni-leipzig.de CNAME 6bone.informatik.uni-leipzig.de AAAA 2001:638:902:1:201:2ff:fee2:7596 NS server2.rz.uni-leipzig.de NS ws-kar1.win-ip.dfn.de NS ns.uni-jena.de NS news.uni-leipzig.de A 139.18.1.2"
"126","6.766602000","211.28.6.30","81.131.67.131","TCP","642","6348  >  2769 [PSH, ACK] Seq=2485 Ack=1 Win=7809 Len=588"
"127","6.797852000","62.203.155.212","81.131.67.131","ICMP","70","Destination unreachable (Port unreachable)"
"128","6.797852000","38.115.4.204","81.131.67.131","UDP","54","21284  >  41730 Len=12"
"129","6.860352000","81.131.67.131","38.115.4.204","UDP","50","41730  >  21284 Len=8"
"130","6.985352000","81.131.67.131","211.28.6.30","TCP","54","2769  >  6348 [ACK] Seq=1 Ack=3073 Win=8172 Len=0"
"131","7.016602000","211.28.6.30","81.131.67.131","TCP","1078","6348  >  2769 [PSH, ACK] Seq=3073 Ack=1 Win=7809 Len=1024"
"132","7.016602000","81.131.67.131","211.28.6.30","TCP","54","2769  >  6348 [ACK] Seq=1 Ack=4097 Win=8760 Len=0"
"133","7.110352000","38.115.4.204","81.131.67.131","TCP","565","21284  >  2667 [PSH, ACK] Seq=1008 Ack=65 Win=65471 Len=511"
"134","7.282227000","81.131.67.131","80.144.139.239","UDP","61","41730  >  6346 Len=19"
"135","7.282227000","81.131.67.131","81.244.90.24","UDP","61","41730  >  6346 Len=19"
"136","7.297852000","81.131.67.131","219.137.42.1","UDP","61","41730  >  6346 Len=19"
"137","7.297852000","81.131.67.131","139.168.32.121","UDP","61","41730  >  6346 Len=19"
"138","7.313477000","81.131.67.131","213.54.85.41","UDP","61","41730  >  6346 Len=19"
"139","7.329102000","81.131.67.131","82.192.36.209","UDP","61","41730  >  6346 Len=19"
"140","7.344727000","81.131.67.131","24.43.167.12","UDP","61","41730  >  6346 Len=19"
"141","7.360352000","81.131.67.131","81.247.65.177","UDP","61","41730  >  6346 Len=19"
"142","7.375977000","81.131.67.131","83.117.6.35","UDP","61","41730  >  6346 Len=19"
"143","7.375977000","81.131.67.131","195.130.143.128","UDP","61","41730  >  6346 Len=19"
"144","7.391602000","211.28.6.30","81.131.67.131","TCP","1514","6348  >  2769 [PSH, ACK] Seq=4097 Ack=1 Win=7809 Len=1460"
"145","7.391602000","81.131.67.131","212.194.202.220","UDP","61","41730  >  6346 Len=19"
"146","7.432618000","81.131.67.131","82.216.238.111","UDP","61","41730  >  28046 Len=19"
"147","7.445313000","81.131.67.131","38.115.4.204","UDP","54","41730  >  21284 Len=12"
"148","7.458008000","81.131.67.131","38.115.4.204","TCP","54","2667  >  21284 [ACK] Seq=73 Ack=1519 Win=7580 Len=0"
"149","7.471680000","213.120.62.99","81.131.67.131","DNS","261","Standard query response 0x006a AAAA ftp.ipv6.uni-leipzig.de CNAME 6bone.informatik.uni-leipzig.de AAAA 2001:638:902:1:201:2ff:fee2:7596 NS news.uni-leipzig.de NS server2.rz.uni-leipzig.de NS ws-kar1.win-ip.dfn.de NS ns.uni-jena.de A 139.18.1.2"
"150","7.471680000","81.131.67.131","211.28.6.30","TCP","54","2769  >  6348 [ACK] Seq=1 Ack=5557 Win=8760 Len=0"
"151","7.760743000","210.146.64.4","81.131.67.131","TCP","1514","80  >  2727 [PSH, ACK] Seq=26281 Ack=1 Win=6432 Len=1460"
"152","7.760743000","38.115.4.204","81.131.67.131","TCP","54","21284  >  2667 [ACK] Seq=1519 Ack=73 Win=65463 Len=0"
"153","7.760743000","81.131.67.131","38.115.4.204","TCP","62","2667  >  21284 [PSH, ACK] Seq=73 Ack=1519 Win=7580 Len=8"
"154","7.773438000","2001:638:902:1:201:2ff:fee2:7596","2002:5183:4383::5183:4383","TCP","98","21  >  1026 [SYN, ACK] Seq=0 Ack=1 Win=32768 Len=0 MSS=1440"
"155","7.773438000","81.131.67.131","210.146.64.4","TCP","54","2727  >  80 [ACK] Seq=1 Ack=27741 Win=8760 Len=0"
"156","7.786133000","2002:5183:4383::5183:4383","2001:638:902:1:201:2ff:fee2:7596","TCP","94","1026  >  21 [ACK] Seq=1 Ack=1 Win=17080 Len=0"
"157","8.062500000","210.146.64.4","81.131.67.131","TCP","1514","80  >  2727 [ACK] Seq=27741 Ack=1 Win=6432 Len=1460"
"158","8.062500000","81.131.67.131","210.146.64.4","TCP","54","2727  >  80 [ACK] Seq=1 Ack=29201 Win=8760 Len=0"
"159","8.236328000","81.131.67.131","83.53.165.235","Gnutella","722",""
"160","8.314453000","81.131.67.131","207.148.176.7","UDP","61","41730  >  6346 Len=19"
"161","8.314453000","81.131.67.131","62.193.101.150","UDP","61","41730  >  6346 Len=19"
"162","8.330078000","81.131.67.131","212.129.214.254","UDP","61","41730  >  6346 Len=19"
"163","8.345703000","211.28.6.30","81.131.67.131","TCP","1514","6348  >  2769 [PSH, ACK] Seq=5557 Ack=1 Win=7809 Len=1460"
"164","8.345703000","81.131.67.131","172.177.184.179","UDP","61","41730  >  6346 Len=19"
"165","8.361328000","81.131.67.131","172.186.173.245","UDP","61","41730  >  6346 Len=19"
"166","8.376953000","211.28.6.30","81.131.67.131","TCP","206","6348  >  2769 [PSH, ACK] Seq=7017 Ack=1 Win=7809 Len=152"
"167","8.376953000","81.131.67.131","207.216.13.37","UDP","61","41730  >  6346 Len=19"
"168","8.376953000","81.131.67.131","85.96.110.115","UDP","61","41730  >  6346 Len=19"
"169","8.392578000","81.131.67.131","83.112.25.172","UDP","61","41730  >  6346 Len=19"
"170","8.408203000","81.131.67.131","68.186.167.166","UDP","550","41730  >  13778 Len=508"
"171","8.439453000","81.131.67.131","82.44.146.72","UDP","61","41730  >  34087 Len=19"
"172","8.455078000","81.131.67.131","211.28.6.30","TCP","54","2769  >  6348 [ACK] Seq=1 Ack=7017 Win=8760 Len=0"
"173","8.470703000","81.131.67.131","24.11.146.28","UDP","54","41730  >  17342 Len=12"
"174","8.564453000","81.131.67.131","211.28.6.30","TCP","54","2769  >  6348 [ACK] Seq=1 Ack=7169 Win=8608 Len=0"
"175","8.658203000","210.146.64.4","81.131.67.131","TCP","1514","80  >  2727 [PSH, ACK] Seq=29201 Ack=1 Win=6432 Len=1460"
"176","8.658203000","147.10.31.210","81.131.67.131","UDP","50","6346  >  41730 Len=8"
"177","8.658203000","81.131.67.131","210.146.64.4","TCP","54","2727  >  80 [ACK] Seq=1 Ack=30661 Win=8760 Len=0"
"178","8.689453000","70.27.127.185","81.131.67.131","Gnutella","96",""
"179","8.689453000","81.131.67.131","69.227.71.60","UDP","75","6348  >  6346 Len=33"
"180","8.783203000","81.131.67.131","70.27.127.185","TCP","54","2094  >  6346 [ACK] Seq=1 Ack=117 Win=7809 Len=0"
"181","8.970703000","210.146.64.4","81.131.67.131","TCP","1514","80  >  2727 [ACK] Seq=30661 Ack=1 Win=6432 Len=1460"
"182","8.970703000","24.11.146.28","81.131.67.131","TCP","54","17342  >  2675 [ACK] Seq=2031 Ack=304 Win=64376 Len=0"
"183","8.970703000","81.131.67.131","24.11.146.28","TCP","62","2675  >  17342 [PSH, ACK] Seq=304 Ack=1 Win=10164 Len=8"
"184","8.986328000","81.131.67.131","210.146.64.4","TCP","54","2727  >  80 [ACK] Seq=1 Ack=32121 Win=8760 Len=0"
"185","9.267578000","210.146.64.4","81.131.67.131","TCP","1514","80  >  2727 [ACK] Seq=32121 Ack=1 Win=6432 Len=1460"
"186","9.267578000","81.131.67.131","210.146.64.4","TCP","54","2727  >  80 [ACK] Seq=1 Ack=33581 Win=8760 Len=0"
"187","9.283203000","200.158.81.150","81.131.67.131","ICMP","70","Destination unreachable (Port unreachable)"
"188","9.455078000","81.131.67.131","24.11.146.28","UDP","54","41730  >  17342 Len=12"
"189","9.455078000","81.131.67.131","82.10.189.102","UDP","61","41730  >  6346 Len=19"
"190","9.470703000","81.131.67.131","62.203.155.212","UDP","61","41730  >  6346 Len=19"
"191","9.486328000","81.131.67.131","83.132.177.64","UDP","61","41730  >  6346 Len=19"
"192","9.501953000","81.131.67.131","68.186.167.166","UDP","550","41730  >  13778 Len=508"
"193","9.580078000","210.146.64.4","81.131.67.131","TCP","1514","80  >  2727 [ACK] Seq=33581 Ack=1 Win=6432 Len=1460"
"194","9.580078000","142.68.189.57","81.131.67.131","Gnutella","91",""
"195","9.580078000","81.131.67.131","210.146.64.4","TCP","54","2727  >  80 [ACK] Seq=1 Ack=35041 Win=8760 Len=0"
"196","9.595703000","82.192.36.209","81.131.67.131","UDP","50","6346  >  41730 Len=8"
"197","9.736328000","38.115.4.204","81.131.67.131","TCP","765","21284  >  2667 [PSH, ACK] Seq=1519 Ack=81 Win=65455 Len=711"
"198","9.736328000","2001:638:902:1:201:2ff:fee2:7596","2002:5183:4383::5183:4383","FTP","100","Response: 220-"
"199","9.736328000","81.131.67.131","38.115.4.204","TCP","54","2667  >  21284 [ACK] Seq=81 Ack=2230 Win=8760 Len=0"
"200","9.751953000","81.131.67.131","38.115.4.204","TCP","62","2667  >  21284 [PSH, ACK] Seq=81 Ack=2230 Win=8760 Len=8"
"201","9.767578000","81.131.67.131","142.68.189.57","TCP","54","1595  >  6346 [ACK] Seq=1 Ack=107 Win=8760 Len=0"
"202","9.876953000","2002:5183:4383::5183:4383","2001:638:902:1:201:2ff:fee2:7596","TCP","94","1026  >  21 [ACK] Seq=1 Ack=7 Win=17074 Len=0"
"203","10.017578000","210.146.64.4","81.131.67.131","TCP","1514","80  >  2727 [PSH, ACK] Seq=35041 Ack=1 Win=6432 Len=1460"
"204","10.017578000","81.131.67.131","210.146.64.4","TCP","54","2727  >  80 [ACK] Seq=1 Ack=36501 Win=8760 Len=0"
"205","10.048828000","83.53.165.235","81.131.67.131","UDP","50","6346  >  41730 Len=8"
"206","10.048828000","83.53.165.235","81.131.67.131","UDP","54","6346  >  41730 Len=12"
"207","10.048828000","81.131.67.131","83.53.165.235","UDP","50","41730  >  6346 Len=8"
"208","10.345703000","210.146.64.4","81.131.67.131","TCP","1514","80  >  2727 [ACK] Seq=36501 Ack=1 Win=6432 Len=1460"
"209","10.345703000","81.131.67.131","210.146.64.4","TCP","54","2727  >  80 [ACK] Seq=1 Ack=37961 Win=8760 Len=0"
"210","10.361328000","70.27.127.185","81.131.67.131","TCP","96","[TCP Spurious Retransmission] 6346  >  2094 [PSH, ACK] Seq=75 Ack=1 Win=64249 Len=42"
"211","10.361328000","81.131.67.131","70.27.127.185","TCP","54","[TCP Dup ACK 180#1] 2094  >  6346 [ACK] Seq=1 Ack=117 Win=7809 Len=0"
"212","10.564453000","211.28.6.30","81.131.67.131","TCP","1058","6348  >  2769 [ACK] Seq=7169 Ack=1 Win=7809 Len=1004"
"213","10.626953000","81.131.67.131","139.55.21.35","UDP","428","41730  >  63346 Len=386"
"214","10.751953000","81.131.67.131","211.28.6.30","TCP","54","2769  >  6348 [ACK] Seq=1 Ack=8173 Win=7604 Len=0"
"215","10.845703000","210.146.64.4","81.131.67.131","TCP","1514","80  >  2727 [PSH, ACK] Seq=37961 Ack=1 Win=6432 Len=1460"
"216","10.845703000","81.131.67.131","210.146.64.4","TCP","54","2727  >  80 [ACK] Seq=1 Ack=39421 Win=8760 Len=0"
"217","11.126953000","210.146.64.4","81.131.67.131","TCP","1514","80  >  2727 [ACK] Seq=39421 Ack=1 Win=6432 Len=1460"
"218","11.126953000","24.11.146.28","81.131.67.131","TCP","54","17342  >  2675 [ACK] Seq=2031 Ack=312 Win=64368 Len=0"
"219","11.126953000","81.131.67.131","210.146.64.4","TCP","54","2727  >  80 [ACK] Seq=1 Ack=40881 Win=8760 Len=0"
"220","11.158203000","68.34.169.230","81.131.67.131","TCP","88","6346  >  2433 [PSH, ACK] Seq=53 Ack=1 Win=64332 Len=34 [TCP segment of a reassembled PDU]"
"221","11.158203000","213.19.160.190","81.131.67.131","HTTP","54","HTTP/1.1 206 Partial Content "
"222","11.158203000","81.131.67.131","213.19.160.190","TCP","54","2810  >  80 [ACK] Seq=301 Ack=3751 Win=8546 Len=0"
"223","11.189453000","81.131.67.131","68.34.169.230","TCP","54","2433  >  6346 [ACK] Seq=1 Ack=87 Win=7958 Len=0"
"224","11.439453000","210.146.64.4","81.131.67.131","TCP","1514","80  >  2727 [ACK] Seq=40881 Ack=1 Win=6432 Len=1460"
"225","11.439453000","81.131.67.131","210.146.64.4","TCP","54","2727  >  80 [ACK] Seq=1 Ack=42341 Win=8760 Len=0"
"226","11.470703000","142.68.189.57","81.131.67.131","Gnutella","113",""
"227","11.501953000","2001:638:902:1:201:2ff:fee2:7596","2002:5183:4383::5183:4383","FTP","172","Response: 220 6bone.informatik.uni-leipzig.de FTP server (NetBSD-ftpd 20041119) ready."
"228","11.501953000","2002:5183:4383::5183:4383","2001:638:902:1:201:2ff:fee2:7596","FTP","110","Request: USER anonymous"
"229","11.517578000","38.115.4.204","81.131.67.131","TCP","117","21284  >  2667 [PSH, ACK] Seq=2230 Ack=89 Win=65447 Len=63"
"230","11.548828000","81.131.67.131","38.115.4.204","TCP","62","2667  >  21284 [PSH, ACK] Seq=89 Ack=2293 Win=8697 Len=8"
"231","11.626953000","81.131.67.131","142.68.189.57","TCP","54","1595  >  6346 [ACK] Seq=1 Ack=166 Win=8701 Len=0"
"232","11.720703000","81.131.67.131","213.224.41.203","UDP","61","41730  >  6346 Len=19"
"233","11.720703000","81.131.67.131","69.4.150.232","UDP","61","41730  >  6346 Len=19"
"234","11.736328000","81.131.67.131","65.43.223.20","UDP","61","41730  >  6346 Len=19"
"235","11.751953000","81.131.67.131","151.37.67.40","UDP","61","41730  >  6346 Len=19"
"236","11.751953000","81.131.67.131","80.125.99.71","UDP","61","41730  >  6346 Len=19"
"237","11.767578000","81.131.67.131","82.92.21.6","UDP","61","41730  >  6346 Len=19"
"238","11.783203000","81.131.67.131","84.156.173.210","UDP","61","41730  >  6346 Len=19"
"239","11.798828000","81.131.67.131","82.92.79.199","UDP","61","41730  >  6346 Len=19"
"240","11.814453000","210.146.64.4","81.131.67.131","TCP","1514","80  >  2727 [ACK] Seq=42341 Ack=1 Win=6432 Len=1460"
"241","11.814453000","81.131.67.131","68.21.34.173","UDP","61","41730  >  6346 Len=19"
"242","11.830078000","70.27.127.185","81.131.67.131","Gnutella","88",""
"243","11.830078000","81.131.67.131","81.241.94.212","UDP","61","41730  >  6346 Len=19"
"244","11.830078000","81.131.67.131","82.171.96.179","UDP","61","41730  >  6346 Len=19"
"245","11.845703000","81.131.67.131","84.97.114.126","UDP","61","41730  >  6347 Len=19"
"246","11.861328000","81.131.67.131","210.146.64.4","TCP","54","2727  >  80 [ACK] Seq=1 Ack=43801 Win=8760 Len=0"
"247","11.955078000","81.131.67.131","70.27.127.185","TCP","54","2094  >  6346 [ACK] Seq=1 Ack=151 Win=7775 Len=0"
"248","12.095703000","210.146.64.4","81.131.67.131","TCP","1514","80  >  2727 [PSH, ACK] Seq=43801 Ack=1 Win=6432 Len=1460"
"249","12.095703000","81.131.67.131","210.146.64.4","TCP","54","2727  >  80 [ACK] Seq=1 Ack=45261 Win=8760 Len=0"
"250","12.314453000","211.28.6.30","81.131.67.131","TCP","1098","6348  >  2769 [PSH, ACK] Seq=8173 Ack=1 Win=7809 Len=1044"
"251","12.314453000","81.131.67.131","211.28.6.30","TCP","54","2769  >  6348 [ACK] Seq=1 Ack=9217 Win=8760 Len=0"
"252","12.330078000","62.203.155.212","81.131.67.131","ICMP","70","Destination unreachable (Port unreachable)"
"253","12.595703000","210.146.64.4","81.131.67.131","TCP","1514","80  >  2727 [ACK] Seq=45261 Ack=1 Win=6432 Len=1460"
"254","12.595703000","81.131.67.131","210.146.64.4","TCP","54","2727  >  80 [ACK] Seq=1 Ack=46721 Win=8760 Len=0"
"255","12.814453000","211.28.6.30","81.131.67.131","TCP","1078","6348  >  2769 [PSH, ACK] Seq=9217 Ack=1 Win=7809 Len=1024"
"256","12.861328000","81.131.67.131","80.185.105.19","UDP","61","41730  >  6346 Len=19"
"257","12.861328000","81.131.67.131","83.117.2.56","UDP","550","41730  >  2424 Len=508"
"258","12.939453000","81.131.67.131","211.28.6.30","TCP","54","2769  >  6348 [ACK] Seq=1 Ack=10241 Win=7736 Len=0"
"259","13.095703000","210.146.64.4","81.131.67.131","TCP","1514","80  >  2727 [PSH, ACK] Seq=46721 Ack=1 Win=6432 Len=1460"
"260","13.095703000","68.34.169.230","81.131.67.131","TCP","92","6346  >  2433 [PSH, ACK] Seq=87 Ack=1 Win=64332 Len=38 [TCP segment of a reassembled PDU]"
"261","13.095703000","81.131.67.131","210.146.64.4","TCP","54","2727  >  80 [ACK] Seq=1 Ack=48181 Win=8760 Len=0"
"262","13.267578000","81.131.67.131","68.34.169.230","TCP","54","2433  >  6346 [ACK] Seq=1 Ack=125 Win=7920 Len=0"
"263","13.392578000","210.146.64.4","81.131.67.131","TCP","1514","80  >  2727 [ACK] Seq=48181 Ack=1 Win=6432 Len=1460"
"264","13.392578000","81.131.67.131","210.146.64.4","TCP","54","2727  >  80 [ACK] Seq=1 Ack=49641 Win=8760 Len=0"
"265","13.408203000","83.53.165.235","81.131.67.131","TCP","54","6346  >  1677 [RST] Seq=1 Win=0 Len=0"
"266","13.439453000","81.131.67.131","83.53.165.235","TCP","62","2813  >  6346 [SYN] Seq=0 Win=8760 Len=0 MSS=1460 SACK_PERM"
"267","13.439453000","2001:638:902:1:201:2ff:fee2:7596","2002:5183:4383::5183:4383","FTP","143","Response: 331 Guest login ok, type your name as password."
"268","13.439453000","2002:5183:4383::5183:4383","2001:638:902:1:201:2ff:fee2:7596","FTP","108","Request: PASS IEUser@"
"269","13.720703000","81.131.67.131","82.232.4.28","TCP","62","2814  >  6346 [SYN] Seq=0 Win=8760 Len=0 MSS=1460 SACK_PERM"
"270","13.720703000","210.146.64.4","81.131.67.131","TCP","1514","80  >  2727 [ACK] Seq=49641 Ack=1 Win=6432 Len=1460"
"271","13.720703000","81.131.67.131","210.146.64.4","TCP","54","2727  >  80 [ACK] Seq=1 Ack=51101 Win=8760 Len=0"
"272","13.798828000","38.115.4.204","81.131.67.131","TCP","404","21284  >  2667 [PSH, ACK] Seq=2293 Ack=97 Win=65439 Len=350"
"273","13.798828000","81.131.67.131","38.115.4.204","TCP","62","2667  >  21284 [PSH, ACK] Seq=97 Ack=2643 Win=8347 Len=8"
"274","13.814453000","142.68.189.57","81.131.67.131","Gnutella","124",""
"275","13.814453000","213.224.41.203","81.131.67.131","UDP","50","6346  >  41730 Len=8"
"276","13.814453000","81.131.67.131","142.68.189.57","TCP","54","1595  >  6346 [ACK] Seq=1 Ack=236 Win=10080 Len=0"
"277","14.048828000","81.131.67.131","62.167.89.152","UDP","61","41730  >  6346 Len=19"
"278","14.048828000","81.131.67.131","83.117.2.56","UDP","77","41730  >  2424 Len=35"
"279","14.064453000","81.131.67.131","85.135.146.10","UDP","61","41730  >  6346 Len=19"
"280","14.080078000","81.131.67.131","80.144.139.239","UDP","61","41730  >  6346 Len=19"
"281","14.095703000","81.131.67.131","81.244.90.24","UDP","61","41730  >  6346 Len=19"
"282","14.111328000","210.146.64.4","81.131.67.131","TCP","1514","80  >  2727 [ACK] Seq=51101 Ack=1 Win=6432 Len=1460"
"283","14.111328000","84.97.114.126","81.131.67.131","ICMP","70","Destination unreachable (Port unreachable)"
"284","14.111328000","81.131.67.131","219.137.42.1","UDP","61","41730  >  6346 Len=19"
"285","14.126953000","81.131.67.131","83.116.155.57","UDP","61","41730  >  6346 Len=19"
"286","14.126953000","81.131.67.131","84.101.247.219","UDP","61","41730  >  6346 Len=19"
"287","14.142578000","81.131.67.131","218.86.72.220","UDP","61","41730  >  36389 Len=19"
"288","14.158203000","81.131.67.131","80.186.123.15","TCP","62","2815  >  6346 [SYN] Seq=0 Win=8760 Len=0 MSS=1460 SACK_PERM"
"289","14.173828000","81.131.67.131","60.224.255.117","UDP","61","41730  >  40682 Len=19"
"290","14.189453000","81.131.67.131","68.6.198.57","UDP","61","41730  >  6347 Len=19"
"291","14.205078000","81.131.67.131","210.146.64.4","TCP","54","2727  >  80 [ACK] Seq=1 Ack=52561 Win=8760 Len=0"
"292","14.298828000","81.131.67.131","172.187.62.41","TCP","62","2816  >  6346 [SYN] Seq=0 Win=8760 Len=0 MSS=1460 SACK_PERM"
"293","14.392578000","211.28.6.30","81.131.67.131","TCP","1514","6348  >  2769 [PSH, ACK] Seq=10241 Ack=1 Win=7809 Len=1460"
"294","14.392578000","81.131.67.131","211.28.6.30","TCP","54","2769  >  6348 [ACK] Seq=1 Ack=11701 Win=8760 Len=0"
"295","14.658203000","81.131.67.131","65.184.193.172","TCP","62","2817  >  33580 [SYN] Seq=0 Win=8760 Len=0 MSS=1460 SACK_PERM"
"296","14.689453000","210.146.64.4","81.131.67.131","TCP","1514","80  >  2727 [ACK] Seq=52561 Ack=1 Win=6432 Len=1460"
"297","14.689453000","24.11.146.28","81.131.67.131","UDP","54","17342  >  41730 Len=12"
"298","14.689453000","81.131.67.131","210.146.64.4","TCP","54","2727  >  80 [ACK] Seq=1 Ack=54021 Win=8760 Len=0"
"299","14.720703000","81.131.67.131","24.11.146.28","UDP","50","41730  >  17342 Len=8"
"300","14.798828000","211.28.6.30","81.131.67.131","TCP","642","6348  >  2769 [PSH, ACK] Seq=11701 Ack=1 Win=7809 Len=588"
"301","14.939453000","67.111.163.61","81.131.67.131","Messenger","835","NetrSendMessage request"
"302","14.939453000","81.131.67.131","67.111.163.61","ICMP","70","Destination unreachable (Port unreachable)"
"303","14.939453000","62.74.99.96","81.131.67.131","TCP","62","2588  >  1216 [SYN] Seq=0 Win=16384 Len=0 MSS=1460 SACK_PERM"
"304","14.955078000","81.131.67.131","62.74.99.96","TCP","54","1216  >  2588 [RST, ACK] Seq=1 Ack=1 Win=0 Len=0"
"305","15.017578000","81.131.67.131","211.28.6.30","TCP","54","2769  >  6348 [ACK] Seq=1 Ack=12289 Win=8172 Len=0"
"306","15.064453000","81.131.67.131","24.11.146.28","UDP","54","41730  >  17342 Len=12"
"307","15.064453000","81.131.67.131","38.115.4.204","UDP","54","41730  >  21284 Len=12"
"308","15.080078000","81.131.67.131","38.115.4.204","UDP","54","41730  >  21284 Len=12"
"309","15.095703000","81.131.67.131","139.168.32.121","UDP","61","41730  >  6346 Len=19"
"310","15.111328000","81.131.67.131","213.54.85.41","UDP","61","41730  >  6346 Len=19"
"311","15.111328000","81.131.67.131","84.56.231.176","UDP","61","41730  >  6346 Len=19"
"312","15.126953000","81.131.67.131","62.205.109.173","UDP","61","41730  >  6346 Len=19"
"313","15.142578000","81.131.67.131","80.171.9.79","UDP","61","41730  >  6346 Len=19"
"314","15.158203000","81.131.67.131","62.131.99.79","UDP","61","41730  >  6346 Len=19"
"315","15.173828000","81.131.67.131","84.149.148.25","UDP","61","41730  >  6346 Len=19"
"316","15.189453000","81.131.67.131","81.161.144.10","UDP","61","41730  >  6346 Len=19"
"317","15.189453000","81.131.67.131","24.43.167.12","UDP","61","41730  >  6346 Len=19"
"318","15.205078000","81.131.67.131","82.216.238.111","UDP","61","41730  >  28046 Len=19"
"319","15.267578000","210.146.64.4","81.131.67.131","TCP","1514","80  >  2727 [ACK] Seq=54021 Ack=1 Win=6432 Len=1460"
"320","15.267578000","81.131.67.131","210.146.64.4","TCP","54","2727  >  80 [ACK] Seq=1 Ack=55481 Win=8760 Len=0"
"321","15.439453000","211.28.6.30","81.131.67.131","TCP","1078","6348  >  2769 [PSH, ACK] Seq=12289 Ack=1 Win=7809 Len=1024"
"322","15.439453000","81.131.67.131","211.28.6.30","TCP","54","2769  >  6348 [ACK] Seq=1 Ack=13313 Win=8760 Len=0"
"323","15.494141000","83.117.2.56","81.131.67.131","UDP","50","2424  >  41730 Len=8"
"324","15.494141000","68.34.169.230","81.131.67.131","TCP","81","6346  >  2433 [PSH, ACK] Seq=125 Ack=1 Win=64332 Len=27 [TCP segment of a reassembled PDU]"
"325","15.656250000","81.131.67.131","68.34.169.230","TCP","54","2433  >  6346 [ACK] Seq=1 Ack=152 Win=7893 Len=0"
"326","15.783203000","210.146.64.4","81.131.67.131","TCP","1514","80  >  2727 [PSH, ACK] Seq=55481 Ack=1 Win=6432 Len=1460"
"327","15.783203000","81.131.67.131","210.146.64.4","TCP","54","2727  >  80 [ACK] Seq=1 Ack=56941 Win=8760 Len=0"
"328","15.809571000","2001:638:902:1:201:2ff:fee2:7596","2002:5183:4383::5183:4383","FTP","142","Response: 230 Guest login ok, access restrictions apply."
"329","15.821289000","2002:5183:4383::5183:4383","2001:638:902:1:201:2ff:fee2:7596","FTP","108","Request: opts utf8 on"
"330","16.097657000","210.146.64.4","81.131.67.131","TCP","1514","80  >  2727 [ACK] Seq=56941 Ack=1 Win=6432 Len=1460"
"331","16.098633000","81.131.67.131","210.146.64.4","TCP","54","2727  >  80 [ACK] Seq=1 Ack=58401 Win=8760 Len=0"
"332","16.111328000","81.131.67.131","24.11.146.28","UDP","54","41730  >  17342 Len=12"
"333","16.124024000","70.27.127.185","81.131.67.131","Gnutella","97",""
"334","16.125000000","142.68.189.57","81.131.67.131","Gnutella","89",""
"335","16.125000000","81.131.67.131","81.247.65.177","UDP","61","41730  >  6346 Len=19"
"336","16.137696000","81.131.67.131","83.117.6.35","UDP","61","41730  >  6346 Len=19"
"337","16.150391000","81.131.67.131","195.130.143.128","UDP","61","41730  >  6346 Len=19"
"338","16.164063000","81.131.67.131","212.194.202.220","UDP","61","41730  >  6346 Len=19"
"339","16.176758000","81.131.67.131","207.148.176.7","UDP","61","41730  >  6346 Len=19"
"340","16.190430000","81.131.67.131","62.193.101.150","UDP","61","41730  >  6346 Len=19"
"341","16.202149000","81.131.67.131","212.129.214.254","UDP","61","41730  >  6346 Len=19"
"342","16.203125000","81.131.67.131","200.158.81.150","UDP","61","41730  >  6346 Len=19"
"343","16.218750000","81.131.67.131","82.10.189.102","UDP","61","41730  >  6346 Len=19"
"344","16.234375000","81.131.67.131","62.203.155.212","UDP","61","41730  >  6346 Len=19"
"345","16.250000000","81.131.67.131","83.132.177.64","UDP","61","41730  >  6346 Len=19"
"346","16.265625000","81.131.67.131","213.19.160.190","TCP","62","2818  >  80 [SYN] Seq=0 Win=8760 Len=0 MSS=1460 SACK_PERM"
"347","16.265625000","81.131.67.131","38.115.4.204","UDP","54","41730  >  21284 Len=12"
"348","16.281250000","81.131.67.131","142.68.189.57","TCP","54","1595  >  6346 [ACK] Seq=1 Ack=271 Win=10045 Len=0"
"349","16.296875000","81.131.67.131","213.19.160.190","TCP","54","2810  >  80 [RST] Seq=301 Win=0 Len=0"
"350","16.312500000","81.131.67.131","70.27.127.185","TCP","54","2094  >  6346 [ACK] Seq=1 Ack=194 Win=7732 Len=0"
"351","16.359375000","38.115.4.204","81.131.67.131","TCP","1280","21284  >  2667 [PSH, ACK] Seq=2643 Ack=105 Win=65431 Len=1226"
"352","16.359375000","81.131.67.131","38.115.4.204","TCP","62","2667  >  21284 [PSH, ACK] Seq=105 Ack=3869 Win=7121 Len=8"
"353","16.359375000","81.131.67.131","38.115.4.204","TCP","54","[TCP Window Update] 2667  >  21284 [ACK] Seq=113 Ack=3869 Win=8760 Len=0"
"354","16.375000000","82.232.4.28","81.131.67.131","TCP","62","6346  >  2814 [SYN, ACK] Seq=0 Ack=1 Win=17520 Len=0 MSS=1460 SACK_PERM"
"355","16.375000000","81.131.67.131","83.53.165.235","TCP","62","[TCP Retransmission] [TCP Port numbers reused] 2813  >  6346 [SYN] Seq=0 Win=8760 Len=0 MSS=1460 SACK_PERM"
"356","16.390625000","81.131.67.131","82.232.4.28","TCP","54","2814  >  6346 [ACK] Seq=1 Ack=1 Win=8760 Len=0"
"357","16.421875000","81.131.67.131","82.232.4.28","Gnutella","274",""
"358","16.671875000","210.146.64.4","81.131.67.131","TCP","1514","80  >  2727 [ACK] Seq=58401 Ack=1 Win=6432 Len=1460"
"359","16.671875000","83.117.2.56","81.131.67.131","UDP","50","2424  >  41730 Len=8"
"360","16.671875000","84.101.247.219","81.131.67.131","UDP","50","6346  >  41730 Len=8"
"361","16.671875000","81.131.67.131","210.146.64.4","TCP","54","2727  >  80 [ACK] Seq=1 Ack=59861 Win=8760 Len=0"
"362","16.953125000","210.146.64.4","81.131.67.131","TCP","1514","80  >  2727 [ACK] Seq=59861 Ack=1 Win=6432 Len=1460"
"363","16.953125000","81.131.67.131","210.146.64.4","TCP","54","2727  >  80 [ACK] Seq=1 Ack=61321 Win=8760 Len=0"
"364","17.031250000","81.131.67.131","80.186.123.15","TCP","62","[TCP Retransmission] [TCP Port numbers reused] 2815  >  6346 [SYN] Seq=0 Win=8760 Len=0 MSS=1460 SACK_PERM"
"365","17.171875000","211.28.6.30","81.131.67.131","TCP","1078","6348  >  2769 [PSH, ACK] Seq=13313 Ack=1 Win=7809 Len=1024"
"366","17.171875000","219.137.42.1","81.131.67.131","ICMP","70","Destination unreachable (Port unreachable)"
"367","17.171875000","60.224.255.117","81.131.67.131","UDP","50","40682  >  41730 Len=8"
"368","17.187500000","65.184.193.172","81.131.67.131","TCP","62","33580  >  2817 [SYN, ACK] Seq=0 Ack=1 Win=64240 Len=0 MSS=1460 SACK_PERM"
"369","17.187500000","81.131.67.131","65.184.193.172","TCP","54","2817  >  33580 [ACK] Seq=1 Ack=1 Win=8760 Len=0"
"370","17.203125000","81.131.67.131","84.84.15.199","UDP","518","41730  >  15492 Len=476"
"371","17.234375000","81.131.67.131","65.184.193.172","TCP","277","2817  >  33580 [PSH, ACK] Seq=1 Ack=1 Win=8760 Len=223"
"372","17.250000000","81.131.67.131","172.187.62.41","TCP","62","[TCP Retransmission] [TCP Port numbers reused] 2816  >  6346 [SYN] Seq=0 Win=8760 Len=0 MSS=1460 SACK_PERM"
"373","17.359375000","81.131.67.131","211.28.6.30","TCP","54","2769  >  6348 [ACK] Seq=1 Ack=14337 Win=7736 Len=0"
"374","17.390625000","211.28.6.30","81.131.67.131","TCP","1078","6348  >  2769 [PSH, ACK] Seq=14337 Ack=1 Win=7809 Len=1024"
"375","17.390625000","81.131.67.131","211.28.6.30","TCP","54","2769  >  6348 [ACK] Seq=1 Ack=15361 Win=8760 Len=0"
"376","17.700196000","210.146.64.4","81.131.67.131","TCP","1514","80  >  2727 [ACK] Seq=61321 Ack=1 Win=6432 Len=1460"
"377","17.700196000","24.11.146.28","81.131.67.131","UDP","50","17342  >  41730 Len=8"
"378","17.700196000","81.131.67.131","210.146.64.4","TCP","54","2727  >  80 [ACK] Seq=1 Ack=62781 Win=8760 Len=0"
"379","17.989258000","210.146.64.4","81.131.67.131","TCP","1514","80  >  2727 [ACK] Seq=62781 Ack=1 Win=6432 Len=1460"
"380","17.989258000","81.131.67.131","210.146.64.4","TCP","54","2727  >  80 [ACK] Seq=1 Ack=64241 Win=8760 Len=0"
"381","18.001953000","62.74.99.96","81.131.67.131","TCP","62","[TCP Retransmission] [TCP Port numbers reused] 2588  >  1216 [SYN] Seq=0 Win=16384 Len=0 MSS=1460 SACK_PERM"
"382","18.001953000","68.34.169.230","81.131.67.131","TCP","99","6346  >  2433 [PSH, ACK] Seq=152 Ack=1 Win=64332 Len=45 [TCP segment of a reassembled PDU]"
"383","18.001953000","81.131.67.131","62.74.99.96","TCP","54","1216  >  2588 [RST, ACK] Seq=1 Ack=1 Win=0 Len=0"
"384","18.028321000","2001:638:902:1:201:2ff:fee2:7596","2002:5183:4383::5183:4383","FTP","123","Response: 502 Unknown command 'utf8'."
"385","18.028321000","2002:5183:4383::5183:4383","2001:638:902:1:201:2ff:fee2:7596","FTP","100","Request: syst"
"386","18.054688000","83.53.165.235","81.131.67.131","TCP","62","6346  >  2813 [SYN, ACK] Seq=0 Ack=1 Win=17424 Len=0 MSS=1452 SACK_PERM"
"387","18.054688000","81.131.67.131","83.53.165.235","TCP","54","2813  >  6346 [ACK] Seq=1 Ack=1 Win=10164 Len=0"
"388","18.067383000","81.131.67.131","83.53.165.235","Gnutella","276",""
"389","18.164063000","81.131.67.131","68.34.169.230","TCP","54","2433  >  6346 [ACK] Seq=1 Ack=197 Win=7848 Len=0"
"390","18.219727000","81.131.67.131","69.4.150.232","UDP","61","41730  >  6346 Len=19"
"391","18.219727000","81.131.67.131","65.43.223.20","UDP","61","41730  >  6346 Len=19"
"392","18.235352000","81.131.67.131","151.37.67.40","UDP","61","41730  >  6346 Len=19"
"393","18.250977000","81.131.67.131","80.125.99.71","UDP","61","41730  >  6346 Len=19"
"394","18.250977000","81.131.67.131","82.92.21.6","UDP","61","41730  >  6346 Len=19"
"395","18.266602000","81.131.67.131","139.55.21.35","UDP","428","41730  >  63346 Len=386"
"396","18.344727000","210.146.64.4","81.131.67.131","TCP","1514","80  >  2727 [PSH, ACK] Seq=64241 Ack=1 Win=6432 Len=1460"
"397","18.344727000","213.19.160.190","81.131.67.131","TCP","62","80  >  2818 [SYN, ACK] Seq=0 Ack=1 Win=5840 Len=0 MSS=1460 SACK_PERM"
"398","18.344727000","81.131.67.131","213.19.160.190","TCP","54","2818  >  80 [ACK] Seq=1 Ack=1 Win=8760 Len=0"
"399","18.344727000","81.131.67.131","210.146.64.4","TCP","54","2727  >  80 [ACK] Seq=1 Ack=65701 Win=8760 Len=0"
"400","18.360352000","81.131.67.131","213.19.160.190","HTTP","336","GET /msdownload/update/v5/psf/windowsxp-sp2-x86fre-usa-2180_056b2b38baf5620be85ddd58141b073bc0b06a1d.psf HTTP/1.1 "
"401","18.625977000","210.146.64.4","81.131.67.131","TCP","1514","80  >  2727 [ACK] Seq=65701 Ack=1 Win=6432 Len=1460"
"402","18.625977000","24.11.146.28","81.131.67.131","UDP","50","17342  >  41730 Len=8"
"403","18.625977000","81.131.67.131","210.146.64.4","TCP","54","2727  >  80 [ACK] Seq=1 Ack=67161 Win=8760 Len=0"
"404","18.657227000","24.11.146.28","81.131.67.131","UDP","54","17342  >  41730 Len=12"
"405","18.657227000","142.68.189.57","81.131.67.131","Gnutella","116",""
"406","18.672852000","70.27.127.185","81.131.67.131","Gnutella","85",""
"407","18.688477000","81.131.67.131","24.11.146.28","UDP","50","41730  >  17342 Len=8"
"408","18.688477000","200.158.81.150","81.131.67.131","ICMP","70","Destination unreachable (Port unreachable)"
"409","18.688477000","149.156.74.157","81.131.67.131","UDP","50","6347  >  41730 Len=8"
"410","18.688477000","82.232.4.28","81.131.67.131","TCP","54","6346  >  2814 [ACK] Seq=1 Ack=221 Win=17300 Len=0"
"411","18.813477000","81.131.67.131","70.27.127.185","TCP","54","2094  >  6346 [ACK] Seq=1 Ack=225 Win=7701 Len=0"
"412","18.813477000","81.131.67.131","142.68.189.57","TCP","54","1595  >  6346 [ACK] Seq=1 Ack=333 Win=9983 Len=0"
"413","18.985352000","210.146.64.4","81.131.67.131","TCP","1514","80  >  2727 [ACK] Seq=67161 Ack=1 Win=6432 Len=1460"
"414","18.985352000","81.131.67.131","210.146.64.4","TCP","54","2727  >  80 [ACK] Seq=1 Ack=68621 Win=8760 Len=0"
"415","19.079102000","82.232.4.28","81.131.67.131","Gnutella","595",""
"416","19.094727000","81.131.67.131","82.232.4.28","TCP","54","2814  >  6346 [FIN, ACK] Seq=221 Ack=542 Win=8219 Len=0"
"417","19.094727000","62.203.155.212","81.131.67.131","ICMP","70","Destination unreachable (Port unreachable)"
"418","19.094727000","82.232.4.28","81.131.67.131","TCP","54","6346  >  2814 [FIN, ACK] Seq=542 Ack=221 Win=17300 Len=0"
"419","19.094727000","81.131.67.131","209.89.41.78","TCP","62","2819  >  41061 [SYN] Seq=0 Win=8760 Len=0 MSS=1460 SACK_PERM"
"420","19.110352000","81.131.67.131","82.232.4.28","TCP","54","2814  >  6346 [ACK] Seq=222 Ack=543 Win=8219 Len=0"
"421","19.329102000","81.131.67.131","84.97.114.126","UDP","61","41730  >  6347 Len=19"
"422","19.329102000","81.131.67.131","84.156.173.210","UDP","61","41730  >  6346 Len=19"
"423","19.344727000","81.131.67.131","82.92.79.199","UDP","61","41730  >  6346 Len=19"
"424","19.360352000","81.131.67.131","68.21.34.173","UDP","61","41730  >  6346 Len=19"
"425","19.375977000","81.131.67.131","81.241.94.212","UDP","61","41730  >  6346 Len=19"
"426","19.391602000","210.146.64.4","81.131.67.131","TCP","1514","80  >  2727 [ACK] Seq=68621 Ack=1 Win=6432 Len=1460"
"427","19.391602000","81.131.67.131","82.171.96.179","UDP","61","41730  >  6346 Len=19"
"428","19.407227000","81.131.67.131","80.185.105.19","UDP","61","41730  >  6346 Len=19"
"429","19.407227000","65.184.193.172","81.131.67.131","TCP","54","33580  >  2817 [ACK] Seq=1 Ack=224 Win=64017 Len=0"
"430","19.407227000","62.74.99.96","81.131.67.131","TCP","62","[TCP Retransmission] [TCP Port numbers reused] 2588  >  1216 [SYN] Seq=0 Win=16384 Len=0 MSS=1460 SACK_PERM"
"431","19.407227000","81.131.67.131","172.177.184.179","UDP","61","41730  >  6346 Len=19"
"432","19.422852000","81.131.67.131","172.186.173.245","UDP","61","41730  >  6346 Len=19"
"433","19.438477000","81.131.67.131","207.216.13.37","UDP","61","41730  >  6346 Len=19"
"434","19.454102000","81.131.67.131","85.96.110.115","UDP","61","41730  >  6346 Len=19"
"435","19.469727000","81.131.67.131","62.74.99.96","TCP","54","1216  >  2588 [RST, ACK] Seq=1 Ack=1 Win=0 Len=0"
"436","19.485352000","81.131.67.131","82.44.146.72","UDP","61","41730  >  34087 Len=19"
"437","19.485352000","81.131.67.131","210.146.64.4","TCP","54","2727  >  80 [ACK] Seq=1 Ack=70081 Win=8760 Len=0"
"438","19.704102000","210.146.64.4","81.131.67.131","TCP","1514","80  >  2727 [ACK] Seq=70081 Ack=1 Win=6432 Len=1460"
"439","19.704102000","81.131.67.131","210.146.64.4","TCP","54","2727  >  80 [ACK] Seq=1 Ack=71541 Win=8760 Len=0"
"440","19.891602000","211.28.6.30","81.131.67.131","TCP","1078","6348  >  2769 [PSH, ACK] Seq=15361 Ack=1 Win=7809 Len=1024"
"441","19.948243000","2001:638:902:1:201:2ff:fee2:7596","2002:5183:4383::5183:4383","FTP","143","Response: 215 UNIX Type: L8 Version: NetBSD-ftpd 20041119"
"442","19.950196000","2002:5183:4383::5183:4383","2001:638:902:1:201:2ff:fee2:7596","FTP","105","Request: site help"
"443","19.960938000","68.34.169.230","81.131.67.131","TCP","115","6346  >  2433 [PSH, ACK] Seq=197 Ack=1 Win=64332 Len=61 [TCP segment of a reassembled PDU]"
"444","19.962891000","81.131.67.131","68.34.169.230","TCP","77","2433  >  6346 [PSH, ACK] Seq=1 Ack=258 Win=7787 Len=23 [TCP segment of a reassembled PDU]"
"445","20.007813000","81.131.67.131","211.28.6.30","TCP","54","2769  >  6348 [ACK] Seq=1 Ack=16385 Win=7736 Len=0"
"446","20.013672000","81.131.67.131","38.115.4.204","TCP","62","[TCP Retransmission] 2667  >  21284 [PSH, ACK] Seq=105 Ack=3869 Win=8760 Len=8"
"447","20.235352000","210.146.64.4","81.131.67.131","TCP","1514","80  >  2727 [ACK] Seq=71541 Ack=1 Win=6432 Len=1460"
"448","20.235352000","80.125.99.71","81.131.67.131","UDP","50","6346  >  41730 Len=8"
"449","20.235352000","81.131.67.131","210.146.64.4","TCP","54","2727  >  80 [ACK] Seq=1 Ack=73001 Win=8760 Len=0"
"450","20.422852000","81.131.67.131","62.167.89.152","UDP","61","41730  >  6346 Len=19"
"451","20.422852000","81.131.67.131","83.116.155.57","UDP","61","41730  >  6346 Len=19"
"452","20.438477000","81.131.67.131","85.135.146.10","UDP","61","41730  >  6346 Len=19"
"453","20.454102000","81.131.67.131","80.144.139.239","UDP","61","41730  >  6346 Len=19"
"454","20.469727000","81.131.67.131","81.244.90.24","UDP","61","41730  >  6346 Len=19"
"455","20.485352000","81.131.67.131","219.137.42.1","UDP","61","41730  >  6346 Len=19"
"456","20.485352000","81.131.67.131","218.86.72.220","UDP","61","41730  >  36389 Len=19"
"457","20.500977000","81.131.67.131","68.6.198.57","UDP","61","41730  >  6347 Len=19"
"458","20.547852000","38.115.4.204","81.131.67.131","TCP","1514","[TCP Retransmission] 21284  >  2667 [PSH, ACK] Seq=2643 Ack=105 Win=65431 Len=1460"
"459","20.766602000","81.131.67.131","38.115.4.204","TCP","54","[TCP ACKed unseen segment] 2667  >  21284 [ACK] Seq=113 Ack=4103 Win=8526 Len=0"
"460","20.813477000","211.28.6.30","81.131.67.131","TCP","1514","6348  >  2769 [PSH, ACK] Seq=16385 Ack=1 Win=7809 Len=1460"
"461","20.813477000","81.131.67.131","211.28.6.30","TCP","54","2769  >  6348 [ACK] Seq=1 Ack=17845 Win=8760 Len=0"
"462","20.844727000","213.19.160.190","81.131.67.131","TCP","54","80  >  2818 [ACK] Seq=1 Ack=283 Win=6432 Len=0"
"463","20.922852000","213.19.160.190","81.131.67.131","TCP","407","80  >  2818 [PSH, ACK] Seq=1 Ack=283 Win=6432 Len=353 [TCP segment of a reassembled PDU]"
"464","20.985352000","81.131.67.131","213.19.160.190","TCP","54","2818  >  80 [ACK] Seq=283 Ack=354 Win=8407 Len=0"
"465","21.063477000","81.131.67.131","38.115.4.204","UDP","54","41730  >  21284 Len=12"
"466","21.063477000","81.131.67.131","139.168.32.121","UDP","61","41730  >  6346 Len=19"
"467","21.079102000","81.131.67.131","213.54.85.41","UDP","61","41730  >  6346 Len=19"
"468","21.094727000","81.131.67.131","82.216.238.111","UDP","61","41730  >  28046 Len=19"
"469","21.110352000","81.131.67.131","38.115.4.204","UDP","54","41730  >  21284 Len=12"
"470","21.219727000","210.146.64.4","81.131.67.131","TCP","1514","80  >  2727 [PSH, ACK] Seq=73001 Ack=1 Win=6432 Len=1460"
"471","21.219727000","81.131.67.131","210.146.64.4","TCP","54","2727  >  80 [ACK] Seq=1 Ack=74461 Win=8760 Len=0"
"472","21.469727000","210.146.64.4","81.131.67.131","TCP","1514","80  >  2727 [ACK] Seq=74461 Ack=1 Win=6432 Len=1460"
"473","21.469727000","81.131.67.131","210.146.64.4","TCP","54","2727  >  80 [ACK] Seq=1 Ack=75921 Win=8760 Len=0"
"474","21.500977000","70.27.127.185","81.131.67.131","Gnutella","87",""
"475","21.579102000","81.131.67.131","84.56.231.176","UDP","61","41730  >  6346 Len=19"
"476","21.579102000","81.131.67.131","62.205.109.173","UDP","61","41730  >  6346 Len=19"
"477","21.594727000","81.131.67.131","80.171.9.79","UDP","61","41730  >  6346 Len=19"
"478","21.610352000","81.131.67.131","62.131.99.79","UDP","61","41730  >  6346 Len=19"
"479","21.625977000","81.131.67.131","84.149.148.25","UDP","61","41730  >  6346 Len=19"
"480","21.641602000","81.131.67.131","81.161.144.10","UDP","61","41730  >  6346 Len=19"
"481","21.641602000","81.131.67.131","24.43.167.12","UDP","61","41730  >  6346 Len=19"
"482","21.657227000","81.131.67.131","70.27.127.185","TCP","54","2094  >  6346 [ACK] Seq=1 Ack=258 Win=7668 Len=0"
"483","21.797852000","213.19.160.190","81.131.67.131","TCP","1514","80  >  2818 [ACK] Seq=354 Ack=283 Win=6432 Len=1460 [TCP segment of a reassembled PDU]"
"484","21.797852000","81.131.67.131","213.19.160.190","TCP","54","2818  >  80 [ACK] Seq=283 Ack=1814 Win=8760 Len=0"
"485","22.079102000","81.131.67.131","209.89.41.78","TCP","62","[TCP Retransmission] [TCP Port numbers reused] 2819  >  41061 [SYN] Seq=0 Win=8760 Len=0 MSS=1460 SACK_PERM"
"486","22.079102000","210.146.64.4","81.131.67.131","TCP","1514","80  >  2727 [ACK] Seq=75921 Ack=1 Win=6432 Len=1460"
"487","22.079102000","83.53.165.235","81.131.67.131","TCP","54","[TCP Dup ACK 386#1] 6346  >  2813 [ACK] Seq=1 Ack=1 Win=17424 Len=0"
"488","22.079102000","81.131.67.131","210.146.64.4","TCP","54","2727  >  80 [ACK] Seq=1 Ack=77381 Win=8760 Len=0"
"489","22.094727000","83.53.165.235","81.131.67.131","TCP","62","[TCP Retransmission] 6346  >  2813 [SYN, ACK] Seq=0 Ack=1 Win=17424 Len=0 MSS=1452 SACK_PERM"
"490","22.094727000","209.89.41.78","81.131.67.131","TCP","62","41061  >  2819 [SYN, ACK] Seq=0 Ack=1 Win=65535 Len=0 MSS=1460 SACK_PERM"
"491","22.094727000","172.201.93.149","81.131.67.131","MANOLITO","62","Ping"
"492","22.094727000","81.131.67.131","81.247.65.177","UDP","61","41730  >  6346 Len=19"
"493","22.110352000","81.131.67.131","83.117.6.35","UDP","61","41730  >  6346 Len=19"
"494","22.125977000","84.97.114.126","81.131.67.131","ICMP","70","Destination unreachable (Port unreachable)"
"495","22.125977000","81.131.67.131","195.130.143.128","UDP","61","41730  >  6346 Len=19"
"496","22.125977000","81.131.67.131","212.194.202.220","UDP","61","41730  >  6346 Len=19"
"497","22.141602000","81.131.67.131","207.148.176.7","UDP","61","41730  >  6346 Len=19"
"498","22.157227000","81.131.67.131","83.53.165.235","TCP","54","[TCP Dup ACK 387#1] 2813  >  6346 [ACK] Seq=223 Ack=1 Win=10164 Len=0"
"499","22.172852000","81.131.67.131","209.89.41.78","TCP","54","2819  >  41061 [ACK] Seq=1 Ack=1 Win=8760 Len=0"
"500","22.188477000","81.131.67.131","209.89.41.78","TCP","275","2819  >  41061 [PSH, ACK] Seq=1 Ack=1 Win=8760 Len=221"
"501","22.204102000","81.131.67.131","172.201.93.149","ICMP","70","Destination unreachable (Port unreachable)"
"502","22.407227000","210.146.64.4","81.131.67.131","TCP","1514","80  >  2727 [ACK] Seq=77381 Ack=1 Win=6432 Len=1460"
"503","22.407227000","81.131.67.131","210.146.64.4","TCP","54","2727  >  80 [ACK] Seq=1 Ack=78841 Win=8760 Len=0"
"504","22.610352000","81.131.67.131","86.130.246.222","UDP","71","6348  >  6348 Len=29"
"505","22.688477000","81.131.67.131","62.193.101.150","UDP","61","41730  >  6346 Len=19"
"506","22.688477000","81.131.67.131","212.129.214.254","UDP","61","41730  >  6346 Len=19"
"507","22.704102000","211.28.6.30","81.131.67.131","TCP","1514","6348  >  2769 [PSH, ACK] Seq=17845 Ack=1 Win=7809 Len=1460"
"508","22.704102000","81.131.67.131","200.158.81.150","UDP","61","41730  >  6346 Len=19"
"509","22.704102000","81.131.67.131","38.115.4.204","UDP","54","41730  >  21284 Len=12"
"510","22.719727000","81.131.67.131","211.28.6.30","TCP","54","2769  >  6348 [ACK] Seq=1 Ack=19305 Win=8760 Len=0"
"511","22.954102000","210.146.64.4","81.131.67.131","TCP","1514","80  >  2727 [PSH, ACK] Seq=78841 Ack=1 Win=6432 Len=1460"
"512","22.954102000","81.131.67.131","210.146.64.4","TCP","54","2727  >  80 [ACK] Seq=1 Ack=80301 Win=8760 Len=0"
"513","22.985352000","2001:638:902:1:201:2ff:fee2:7596","2002:5183:4383::5183:4383","FTP","100","Response: 214-"
"514","23.032227000","211.28.6.30","81.131.67.131","TCP","206","6348  >  2769 [PSH, ACK] Seq=19305 Ack=1 Win=7809 Len=152"
"515","23.032227000","172.187.62.41","81.131.67.131","TCP","62","6346  >  2816 [SYN, ACK] Seq=0 Ack=1 Win=17680 Len=0 MSS=1360 SACK_PERM"
"516","23.032227000","81.131.67.131","172.187.62.41","TCP","54","2816  >  6346 [ACK] Seq=1 Ack=1 Win=9520 Len=0"
"517","23.063477000","81.131.67.131","80.186.123.15","TCP","62","[TCP Retransmission] [TCP Port numbers reused] 2815  >  6346 [SYN] Seq=0 Win=8760 Len=0 MSS=1460 SACK_PERM"
"518","23.094727000","81.131.67.131","172.187.62.41","Gnutella","276",""
"519","23.157227000","38.115.4.204","81.131.67.131","TCP","646","21284  >  2667 [PSH, ACK] Seq=4103 Ack=113 Win=65423 Len=592"
"520","23.172852000","81.131.67.131","211.28.6.30","TCP","54","2769  >  6348 [ACK] Seq=1 Ack=19457 Win=8608 Len=0"
"521","23.172852000","2002:5183:4383::5183:4383","2001:638:902:1:201:2ff:fee2:7596","TCP","94","1026  >  21 [ACK] Seq=62 Ack=266 Win=16815 Len=0"
"522","23.188477000","68.34.169.230","81.131.67.131","TCP","54","6346  >  2433 [ACK] Seq=258 Ack=24 Win=64309 Len=0"
"523","23.188477000","172.187.62.41","81.131.67.131","TCP","54","[TCP Dup ACK 515#1] 6346  >  2816 [ACK] Seq=1 Ack=1 Win=17680 Len=0"
"524","23.282227000","81.131.67.131","38.115.4.204","TCP","54","2667  >  21284 [ACK] Seq=113 Ack=4695 Win=7934 Len=0"
"525","23.329102000","81.131.67.131","84.84.15.199","UDP","518","41730  >  15492 Len=476"
"526","23.469727000","210.146.64.4","81.131.67.131","TCP","1514","80  >  2727 [ACK] Seq=80301 Ack=1 Win=6432 Len=1460"
"527","23.469727000","81.131.67.131","210.146.64.4","TCP","54","2727  >  80 [ACK] Seq=1 Ack=81761 Win=8760 Len=0"
"528","23.563477000","213.19.160.190","81.131.67.131","TCP","519","[TCP Previous segment not captured] 80  >  2818 [PSH, ACK] Seq=3274 Ack=283 Win=6432 Len=465 [TCP segment of a reassembled PDU]"
"529","23.563477000","81.131.67.131","213.19.160.190","TCP","66","[TCP Dup ACK 484#1] 2818  >  80 [ACK] Seq=283 Ack=1814 Win=8760 Len=0 SLE=3274 SRE=3739"
"530","23.672852000","81.131.67.131","24.11.146.28","TCP","62","2675  >  17342 [PSH, ACK] Seq=312 Ack=1 Win=10164 Len=8"
"531","23.844727000","213.19.160.190","81.131.67.131","TCP","1514","[TCP Out-Of-Order] 80  >  2818 [ACK] Seq=1814 Ack=283 Win=6432 Len=1460"
"532","23.844727000","81.131.67.131","213.19.160.190","TCP","54","2818  >  80 [ACK] Seq=283 Ack=3739 Win=6835 Len=0"
"533","23.844727000","218.86.72.220","81.131.67.131","UDP","50","36389  >  41730 Len=8"
"534","23.860352000","81.131.67.131","213.19.160.190","TCP","54","[TCP Window Update] 2818  >  80 [ACK] Seq=283 Ack=3739 Win=8760 Len=0"
"535","23.938477000","81.131.67.131","82.232.4.28","TCP","54","[TCP Retransmission] 2814  >  6346 [FIN, ACK] Seq=221 Ack=543 Win=8219 Len=0"
"536","23.938477000","81.131.67.131","83.53.165.235","TCP","276","[TCP Retransmission] 2813  >  6346 [PSH, ACK] Seq=1 Ack=1 Win=10164 Len=222"
"537","24.141602000","211.28.6.30","81.131.67.131","TCP","1514","6348  >  2769 [PSH, ACK] Seq=19457 Ack=1 Win=7809 Len=1460"
"538","24.141602000","81.131.67.131","211.28.6.30","TCP","54","2769  >  6348 [ACK] Seq=1 Ack=20917 Win=8760 Len=0"
"539","24.440430000","210.146.64.4","81.131.67.131","TCP","1514","80  >  2727 [PSH, ACK] Seq=81761 Ack=1 Win=6432 Len=1460"
"540","24.440430000","81.131.67.131","210.146.64.4","TCP","54","2727  >  80 [ACK] Seq=1 Ack=83221 Win=8760 Len=0"
"541","24.471680000","81.131.67.131","24.11.146.28","UDP","54","41730  >  17342 Len=12"
"542","24.471680000","81.131.67.131","69.4.150.232","UDP","61","41730  >  6346 Len=19"
"543","24.487305000","81.131.67.131","65.43.223.20","UDP","61","41730  >  6346 Len=19"
"544","24.502930000","81.131.67.131","151.37.67.40","UDP","61","41730  >  6346 Len=19"
"545","24.518555000","81.131.67.131","82.92.21.6","UDP","61","41730  >  6346 Len=19"
"546","24.518555000","81.131.67.131","139.55.21.35","UDP","428","41730  >  63346 Len=386"
"547","24.565430000","211.28.6.30","81.131.67.131","TCP","642","6348  >  2769 [PSH, ACK] Seq=20917 Ack=1 Win=7809 Len=588"
"548","24.706055000","81.131.67.131","211.28.6.30","TCP","54","2769  >  6348 [ACK] Seq=1 Ack=21505 Win=8172 Len=0"
"549","24.846680000","210.146.64.4","81.131.67.131","TCP","1514","80  >  2727 [ACK] Seq=83221 Ack=1 Win=6432 Len=1460"
"550","24.846680000","70.27.127.185","81.131.67.131","Gnutella","89",""
"551","24.846680000","81.131.67.131","210.146.64.4","TCP","54","2727  >  80 [ACK] Seq=1 Ack=84681 Win=8760 Len=0"
"552","24.877930000","142.68.189.57","81.131.67.131","TCP","76","6346  >  1595 [PSH, ACK] Seq=333 Ack=1 Win=17164 Len=22 [TCP segment of a reassembled PDU]"
"553","24.877930000","81.131.67.131","142.68.189.57","Gnutella","78",""
"554","24.971680000","83.53.165.235","81.131.67.131","Gnutella","589",""
"555","24.971680000","83.53.165.235","81.131.67.131","TCP","54","6346  >  2813 [FIN, ACK] Seq=536 Ack=223 Win=17202 Len=0"
"556","24.971680000","81.131.67.131","83.53.165.235","TCP","54","2813  >  6346 [ACK] Seq=223 Ack=537 Win=9629 Len=0"
"557","24.987305000","81.131.67.131","83.53.165.235","TCP","54","2813  >  6346 [FIN, ACK] Seq=223 Ack=537 Win=9629 Len=0"
"558","25.002930000","81.131.67.131","69.224.47.236","TCP","62","2821  >  14280 [SYN] Seq=0 Win=8760 Len=0 MSS=1460 SACK_PERM"
"559","25.034180000","81.131.67.131","70.27.127.185","TCP","54","2094  >  6346 [ACK] Seq=1 Ack=293 Win=7633 Len=0"
"560","25.268555000","210.146.64.4","81.131.67.131","TCP","1514","80  >  2727 [ACK] Seq=84681 Ack=1 Win=6432 Len=1460"
"561","25.268555000","81.131.67.131","210.146.64.4","TCP","54","2727  >  80 [ACK] Seq=1 Ack=86141 Win=8760 Len=0"
"562","25.284180000","209.89.41.78","81.131.67.131","TCP","62","[TCP Retransmission] 41061  >  2819 [SYN, ACK] Seq=0 Ack=1 Win=65535 Len=0 MSS=1460 SACK_PERM"
"563","25.284180000","81.131.67.131","209.89.41.78","TCP","54","[TCP Dup ACK 499#1] 2819  >  41061 [ACK] Seq=222 Ack=1 Win=8760 Len=0"
"564","25.284180000","209.89.41.78","81.131.67.131","TCP","54","[TCP Dup ACK 490#1] 41061  >  2819 [ACK] Seq=1 Ack=1 Win=65535 Len=0"
"565","25.315430000","86.130.246.222","81.131.67.131","UDP","126","6348  >  6348 Len=84"
"566","25.549805000","81.131.67.131","84.97.114.126","UDP","61","41730  >  6347 Len=19"
