"No.","Time","Source","Destination","Protocol","Length","Info"
"1","0.000000","172.26.0.20","193.144.238.104","NNTP","74","Request: "
"2","0.000078","172.26.0.20","193.144.238.104","TCP","66","36387  >  119 [FIN, ACK] Seq=9 Ack=1 Win=4703 Len=0 TSval=2063563 TSecr=15125513"
"3","0.025900","193.144.238.104","172.26.0.20","NNTP","101","Response: 205 closing connection -"
"4","0.026038","172.26.0.20","193.144.238.104","TCP","54","36387  >  119 [RST] Seq=9 Win=0 Len=0"
"5","0.026264","193.144.238.104","172.26.0.20","TCP","66","119  >  36387 [FIN, ACK] Seq=36 Ack=9 Win=5792 Len=0 TSval=15133307 TSecr=2063562"
"6","0.026276","172.26.0.20","193.144.238.104","TCP","54","36387  >  119 [RST] Seq=9 Win=0 Len=0"
"7","0.026330","193.144.238.104","172.26.0.20","TCP","66","119  >  36387 [ACK] Seq=37 Ack=10 Win=5792 Len=0 TSval=15133307 TSecr=2063563"
"8","0.026340","172.26.0.20","193.144.238.104","TCP","54","36387  >  119 [RST] Seq=10 Win=0 Len=0"
"9","7.608636","172.26.0.20","172.26.0.1","DNS","77","Standard query 0x22eb A news.pntic.mec.es"
"10","7.636481","172.26.0.1","172.26.0.20","DNS","116","Standard query response 0x22eb A news.pntic.mec.es CNAME[Packet size limited during capture]"
"11","7.637410","172.26.0.20","193.144.238.104","TCP","74","36388  >  119 [SYN] Seq=0 Win=5840 Len=0 MSS=1460 SACK_PERM TSval=2065472 TSecr=0 WS=32"
"12","7.664269","193.144.238.104","172.26.0.20","TCP","74","119  >  36388 [SYN, ACK] Seq=0 Ack=1 Win=5792 Len=0 MSS=1380 SACK_PERM TSval=15134070 TSecr=2065472 WS=1"
"13","7.664374","172.26.0.20","193.144.238.104","TCP","66","36388  >  119 [ACK] Seq=1 Ack=1 Win=5856 Len=0 TSval=2065479 TSecr=15134070"
"14","7.694089","193.144.238.104","172.26.0.20","NNTP","128","Response: 200 news.pntic.mec.es DN"
"15","7.694237","172.26.0.20","193.144.238.104","TCP","66","36388  >  119 [ACK] Seq=1 Ack=63 Win=5856 Len=0 TSval=2065486 TSecr=15134073"
"16","7.695031","172.26.0.20","193.144.238.104","NNTP","79","Request: MODE READER"
"17","7.724689","193.144.238.104","172.26.0.20","TCP","66","119  >  36388 [ACK] Seq=63 Ack=14 Win=5792 Len=0 TSval=15134076 TSecr=2065486"
"18","7.724768","193.144.238.104","172.26.0.20","NNTP","109","Response: 200 DNews is in reader m"
"19","7.724995","172.26.0.20","193.144.238.104","NNTP","73","Request: XOVER"
"20","7.749197","193.144.238.104","172.26.0.20","NNTP","102","Response: 412 no newsgroup has bee"
"21","7.753994","172.26.0.20","193.144.238.104","NNTP","72","Request: LIST"
"22","7.778453","193.144.238.104","172.26.0.20","NNTP","98","Response: 215 list of newsgroups f"
"23","7.817404","172.26.0.20","193.144.238.104","TCP","66","36388  >  119 [ACK] Seq=27 Ack=174 Win=5856 Len=0 TSval=2065517 TSecr=15134082"
"24","7.842129","193.144.238.104","172.26.0.20","NNTP","163","Response: pntic.curso.malted2 3260"
"25","7.843688","172.26.0.20","193.144.238.104","TCP","66","36388  >  119 [ACK] Seq=27 Ack=271 Win=5856 Len=0 TSval=2065523 TSecr=15134088"
"26","7.844316","172.26.0.20","193.144.238.104","NNTP","83","Request: LIST NEWSGROUPS"
"27","7.869234","193.144.238.104","172.26.0.20","NNTP","102","Response: 215 list of newsgroup na"
"28","7.910264","172.26.0.20","193.144.238.104","TCP","66","36388  >  119 [ACK] Seq=44 Ack=307 Win=5856 Len=0 TSval=2065540 TSecr=15134091"
"29","7.936234","193.144.238.104","172.26.0.20","NNTP","111","Response: control.PRUEBAS_CRIS\\tGru"
"30","7.938416","172.26.0.20","193.144.238.104","TCP","66","36388  >  119 [ACK] Seq=44 Ack=352 Win=5856 Len=0 TSval=2065547 TSecr=15134098"
"31","7.939686","172.26.0.20","193.144.238.104","NNTP","95","Request: NEWGROUPS 091017 163839 "
"32","7.969306","193.144.238.104","172.26.0.20","NNTP","105","Response: 231 list of new newsgrou"
"33","8.019362","172.26.0.20","193.144.238.104","TCP","66","36388  >  119 [ACK] Seq=73 Ack=391 Win=5856 Len=0 TSval=2065567 TSecr=15134100"
"34","10.868347","172.26.0.20","193.144.238.104","NNTP","93","Request: GROUP pntic.curso.malted"
"35","10.893164","193.144.238.104","172.26.0.20","NNTP","114","Response: 211 320 2241 3260 pntic."
"36","10.893200","172.26.0.20","193.144.238.104","TCP","66","36388  >  119 [ACK] Seq=100 Ack=439 Win=5856 Len=0 TSval=2066286 TSecr=15134393"
"37","10.893430","172.26.0.20","193.144.238.104","NNTP","83","Request: XOVER 2241-3260"
"38","10.917609","193.144.238.104","172.26.0.20","NNTP","84","Response: 224 data follows"
"39","10.919992","193.144.238.104","172.26.0.20","NNTP","1434","Response: 2241\\tRe: Malted blue bar"
"40","10.920019","172.26.0.20","193.144.238.104","TCP","66","36388  >  119 [ACK] Seq=117 Ack=1825 Win=8576 Len=0 TSval=2066293 TSecr=15134396"
"41","10.945102","193.144.238.104","172.26.0.20","NNTP","1434","Response: ws.cnice.mecd.es>\\t<44687"
"42","10.946176","193.144.238.104","172.26.0.20","NNTP","1434","Response: 5204c27$1@news.cnice.mec"
"43","10.946193","172.26.0.20","193.144.238.104","TCP","66","36388  >  119 [ACK] Seq=117 Ack=4561 Win=14048 Len=0 TSval=2066299 TSecr=15134398"
"44","10.947246","193.144.238.104","172.26.0.20","NNTP","1434","Response: 0100\\t<45ded6c3$1@news.cn"
"45","10.970808","193.144.238.104","172.26.0.20","NNTP","1434","Response: 2007 02:47:17 +0200\\t<462"
"46","10.970842","172.26.0.20","193.144.238.104","TCP","66","36388  >  119 [ACK] Seq=117 Ack=7297 Win=19520 Len=0 TSval=2066305 TSecr=15134398"
"47","10.971938","193.144.238.104","172.26.0.20","NNTP","1434","Response: : Problemas de audio y v"
"48","10.972549","193.144.238.104","172.26.0.20","NNTP","1434","Response: \\t14\\tXref: news.pntic.mec"
"49","10.972561","172.26.0.20","193.144.238.104","TCP","66","36388  >  119 [ACK] Seq=117 Ack=10033 Win=24992 Len=0 TSval=2066306 TSecr=15134401"
"50","10.996584","193.144.238.104","172.26.0.20","NNTP","1434","Response: 16:41:12 +0200\\t<466eb088"
"51","10.997388","193.144.238.104","172.26.0.20","NNTP","1434","Response: .mec.es>\\t1442\\t24\\tXref: n"
"52","10.997405","172.26.0.20","193.144.238.104","TCP","66","36388  >  119 [ACK] Seq=117 Ack=12769 Win=30464 Len=0 TSval=2066312 TSecr=15134403"
"53","10.998603","193.144.238.104","172.26.0.20","NNTP","1434","Response:  news.pntic.mec.es pntic"
"54","10.999180","193.144.238.104","172.26.0.20","NNTP","1434","Response: m>\\tTue, 16 Oct 2007 16:4"
"55","10.999196","172.26.0.20","193.144.238.104","TCP","66","36388  >  119 [ACK] Seq=117 Ack=15505 Win=35936 Len=0 TSval=2066312 TSecr=15134403"
"56","11.000295","193.144.238.104","172.26.0.20","NNTP","1434","Response: a6082@news.pntic.mec.es>"
"57","11.000869","193.144.238.104","172.26.0.20","NNTP","1434","Response: Xref: news.pntic.mec.es "
"58","11.000884","172.26.0.20","193.144.238.104","TCP","66","36388  >  119 [ACK] Seq=117 Ack=18241 Win=41408 Len=0 TSval=2066313 TSecr=15134404"
"59","11.022634","193.144.238.104","172.26.0.20","NNTP","1434","Response: tic.curso.malted2:2614"
"60","11.023255","193.144.238.104","172.26.0.20","NNTP","1434","Response: o.malted2:2620"
"61","11.023272","172.26.0.20","193.144.238.104","TCP","66","36388  >  119 [ACK] Seq=117 Ack=20977 Win=46880 Len=0 TSval=2066318 TSecr=15134406"
"62","11.024687","193.144.238.104","172.26.0.20","NNTP","1434","Response: 479f1ede$1@news.pntic.me"
"63","11.025223","193.144.238.104","172.26.0.20","NNTP","1434","Response: oblema con applet y malt"
"64","11.025239","172.26.0.20","193.144.238.104","TCP","66","36388  >  119 [ACK] Seq=117 Ack=23713 Win=52352 Len=0 TSval=2066319 TSecr=15134406"
"65","11.026308","193.144.238.104","172.26.0.20","NNTP","1434","Response: ews.pntic.mec.es>\\t1964\\t3"
"66","11.026895","193.144.238.104","172.26.0.20","NNTP","1434","Response: ted2:2655"
"67","11.026910","172.26.0.20","193.144.238.104","TCP","66","36388  >  119 [ACK] Seq=117 Ack=26449 Win=57824 Len=0 TSval=2066319 TSecr=15134406"
"68","11.028046","193.144.238.104","172.26.0.20","NNTP","1434","Response: 4$1@news.pntic.mec.es>\\t9"
"69","11.028875","193.144.238.104","172.26.0.20","NNTP","1434","Response:  +0200\\t<480e4740$1@news."
"70","11.028892","172.26.0.20","193.144.238.104","TCP","66","36388  >  119 [ACK] Seq=117 Ack=29185 Win=63296 Len=0 TSval=2066320 TSecr=15134407"
"71","11.030164","193.144.238.104","172.26.0.20","NNTP","1434","Response:  17:22:25 +0200\\t<481c833"
"72","11.048548","193.144.238.104","172.26.0.20","NNTP","1434","Response: 7221$1@news.pntic.mec.es"
"73","11.048578","172.26.0.20","193.144.238.104","TCP","66","36388  >  119 [ACK] Seq=117 Ack=31921 Win=64096 Len=0 TSval=2066325 TSecr=15134407"
"74","11.049142","193.144.238.104","172.26.0.20","NNTP","1434","Response: o.pntic.mec.es>\\tSun, 25 "
"75","11.049856","193.144.238.104","172.26.0.20","NNTP","1434","Response: 1$1@news.pntic.mec.es>\\t8"
"76","11.049868","172.26.0.20","193.144.238.104","TCP","66","36388  >  119 [ACK] Seq=117 Ack=34657 Win=64096 Len=0 TSval=2066325 TSecr=15134409"
"77","11.050989","193.144.238.104","172.26.0.20","NNTP","1434","Response: mec.es pntic.curso.malte"
"78","11.051775","193.144.238.104","172.26.0.20","NNTP","1434","Response: 1:54:05 +0200\\t<4876a11d$"
"79","11.051790","172.26.0.20","193.144.238.104","TCP","66","36388  >  119 [ACK] Seq=117 Ack=37393 Win=64096 Len=0 TSval=2066326 TSecr=15134409"
"80","11.052967","193.144.238.104","172.26.0.20","NNTP","1434","Response: e: Malted y Moodle\\t""Ayar"
"81","11.053396","193.144.238.104","172.26.0.20","NNTP","1434","Response: ref: news.pntic.mec.es p"
"82","11.053409","172.26.0.20","193.144.238.104","TCP","66","36388  >  119 [ACK] Seq=117 Ack=40129 Win=64096 Len=0 TSval=2066326 TSecr=15134409"
"83","11.054471","193.144.238.104","172.26.0.20","NNTP","1434","Response: <487161f0$1@news.pntic.m"
"84","11.055114","193.144.238.104","172.26.0.20","NNTP","1434","Response: $1@news.pntic.mec.es>\\t<4"
"85","11.055126","172.26.0.20","193.144.238.104","TCP","66","36388  >  119 [ACK] Seq=117 Ack=42865 Win=64096 Len=0 TSval=2066326 TSecr=15134409"
"86","11.056339","193.144.238.104","172.26.0.20","NNTP","1434","Response: 54\\t54\\tXref: news.pntic.m"
"87","11.057279","193.144.238.104","172.26.0.20","NNTP","1434","Response: s>\\tWed, 10 Sep 2008 12:3"
"88","11.057299","172.26.0.20","193.144.238.104","TCP","66","36388  >  119 [ACK] Seq=117 Ack=45601 Win=64096 Len=0 TSval=2066327 TSecr=15134409"
"89","11.058328","193.144.238.104","172.26.0.20","NNTP","1434","Response: Re: Nueva...y algo perdi"
"90","11.073903","193.144.238.104","172.26.0.20","NNTP","1434","Response: 04"
"91","11.073936","172.26.0.20","193.144.238.104","TCP","66","36388  >  119 [ACK] Seq=117 Ack=48337 Win=64096 Len=0 TSval=2066331 TSecr=15134409"
"92","11.075018","193.144.238.104","172.26.0.20","NNTP","1434","Response:  foro\\t<â\200\232@193.144.238.1"
"93","11.075466","193.144.238.104","172.26.0.20","NNTP","1434","Response: .pntic.mec.es pntic.curs"
"94","11.075482","172.26.0.20","193.144.238.104","TCP","66","36388  >  119 [ACK] Seq=117 Ack=51073 Win=64096 Len=0 TSval=2066331 TSecr=15134411"
"95","11.076814","193.144.238.104","172.26.0.20","NNTP","1434","Response: Nov 2008 21:37:57 +0100\\t"
"96","11.077414","193.144.238.104","172.26.0.20","NNTP","1434","Response: ted2:2841"
"97","11.077446","172.26.0.20","193.144.238.104","TCP","66","36388  >  119 [ACK] Seq=117 Ack=53809 Win=64096 Len=0 TSval=2066332 TSecr=15134411"
"98","11.078278","193.144.238.104","172.26.0.20","NNTP","1434","Response: ta.es>\\t18 Nov 2008 10:31"
"99","11.079151","193.144.238.104","172.26.0.20","NNTP","1434","Response: 2070\\t24\\tXref: news.pntic"
"100","11.079163","172.26.0.20","193.144.238.104","TCP","66","36388  >  119 [ACK] Seq=117 Ack=56545 Win=64096 Len=0 TSval=2066332 TSecr=15134411"
"101","11.081254","193.144.238.104","172.26.0.20","NNTP","1434","Response: ews.pntic.mec.es pntic.c"
"102","11.081271","193.144.238.104","172.26.0.20","NNTP","1434","Response: ic.mec.es>\\t2203\\t29\\tXref:"
"103","11.081378","172.26.0.20","193.144.238.104","TCP","66","36388  >  119 [ACK] Seq=117 Ack=59281 Win=64096 Len=0 TSval=2066333 TSecr=15134412"
"104","11.082327","193.144.238.104","172.26.0.20","NNTP","1434","Response: ews.pntic.mec.es pntic.c"
"105","11.082824","193.144.238.104","172.26.0.20","NNTP","1434","Response: ted2:3177"
"106","11.082839","172.26.0.20","193.144.238.104","TCP","66","36388  >  119 [ACK] Seq=117 Ack=62017 Win=64096 Len=0 TSval=2066333 TSecr=15134412"
"107","11.083509","193.144.238.104","172.26.0.20","NNTP","1434","Response: ed2:3199"
"108","11.084258","193.144.238.104","172.26.0.20","NNTP","1434","Response: 1014\\t7\\tXref: news.pntic."
"109","11.084273","172.26.0.20","193.144.238.104","TCP","66","36388  >  119 [ACK] Seq=117 Ack=64753 Win=64096 Len=0 TSval=2066334 TSecr=15134412"
"110","11.085278","193.144.238.104","172.26.0.20","NNTP","1434","Response: elefonica.net>\\t18 May 20"
"111","11.086234","193.144.238.104","172.26.0.20","NNTP","1434","Response: 104>\\t2 Jun 2009 09:47:49"
"112","11.086249","172.26.0.20","193.144.238.104","TCP","66","36388  >  119 [ACK] Seq=117 Ack=67489 Win=64096 Len=0 TSval=2066334 TSecr=15134412"
"113","11.086825","193.144.238.104","172.26.0.20","NNTP","1434","Response: curso.malted2:3248"
"114","11.087330","193.144.238.104","172.26.0.20","NNTP","590","Response: 09 11:04:24 +0200\\t<4ad59"
"115","11.087342","172.26.0.20","193.144.238.104","TCP","66","36388  >  119 [ACK] Seq=117 Ack=69381 Win=64096 Len=0 TSval=2066334 TSecr=15134412"
"116","11.852401","172.26.0.20","193.144.238.104","NNTP","80","Request: ARTICLE 2482"
"117","11.886086","193.144.238.104","172.26.0.20","NNTP","150","Response: 220 2482 <45b481ca$1@new"
"118","11.924871","172.26.0.20","193.144.238.104","TCP","66","36388  >  119 [ACK] Seq=131 Ack=69465 Win=64096 Len=0 TSval=2066544 TSecr=15134493"
"119","11.949899","193.144.238.104","172.26.0.20","NNTP","1177","Response: From: ""Carlos J. Medina"""
"120","11.949934","172.26.0.20","193.144.238.104","TCP","66","36388  >  119 [ACK] Seq=131 Ack=70576 Win=64096 Len=0 TSval=2066550 TSecr=15134499"
"121","12.819751","172.26.0.20","193.144.238.104","NNTP","80","Request: ARTICLE 2539"
"122","12.846054","193.144.238.104","172.26.0.20","NNTP","149","Response: 220 2539 <462520f3$1@new"
"123","12.846092","172.26.0.20","193.144.238.104","TCP","66","36388  >  119 [ACK] Seq=145 Ack=70659 Win=64096 Len=0 TSval=2066774 TSecr=15134589"
"124","12.847271","193.144.238.104","172.26.0.20","NNTP","1434","Response: Date: Tue, 17 Apr 2007 2"
"125","12.847289","172.26.0.20","193.144.238.104","TCP","66","36388  >  119 [ACK] Seq=145 Ack=72027 Win=64096 Len=0 TSval=2066774 TSecr=15134589"
"126","12.870704","193.144.238.104","172.26.0.20","NNTP","282","Response: ragging text, there is a"
"127","12.870744","172.26.0.20","193.144.238.104","TCP","66","36388  >  119 [ACK] Seq=145 Ack=72243 Win=64096 Len=0 TSval=2066780 TSecr=15134591"
"128","15.844693","172.26.0.20","193.144.238.104","NNTP","80","Request: ARTICLE 2677"
"129","15.885423","193.144.238.104","172.26.0.20","NNTP","149","Response: 220 2677 <480e46df$1@new"
"130","15.885469","172.26.0.20","193.144.238.104","TCP","66","36388  >  119 [ACK] Seq=159 Ack=72326 Win=64096 Len=0 TSval=2067534 TSecr=15134892"
"131","15.886709","193.144.238.104","172.26.0.20","NNTP","1434","Response: From: ""Marina Sanchez"" <"
"132","15.886726","172.26.0.20","193.144.238.104","TCP","66","36388  >  119 [ACK] Seq=159 Ack=73694 Win=64096 Len=0 TSval=2067534 TSecr=15134892"
"133","15.911218","193.144.238.104","172.26.0.20","NNTP","1434","Response: EBAUKBwcGCAwKDAwLCgsLDQ4"
"134","15.911259","172.26.0.20","193.144.238.104","TCP","66","36388  >  119 [ACK] Seq=159 Ack=75062 Win=64096 Len=0 TSval=2067540 TSecr=15134895"
"135","15.914051","193.144.238.104","172.26.0.20","NNTP","1434","Response: yXAPCndjkck57moa0Nb6lSDS"
"136","15.914070","172.26.0.20","193.144.238.104","TCP","66","36388  >  119 [ACK] Seq=159 Ack=76430 Win=64096 Len=0 TSval=2067541 TSecr=15134895"
"137","15.914105","193.144.238.104","172.26.0.20","NNTP","1434","Response: 7BMlWCnqRxz/jUalgoyBt7kV"
"138","15.914115","172.26.0.20","193.144.238.104","TCP","66","36388  >  119 [ACK] Seq=159 Ack=77798 Win=62784 Len=0 TSval=2067541 TSecr=15134895"
"139","15.914139","193.144.238.104","172.26.0.20","NNTP","1434","Response: cU7FGOcVm0Iafpmg0tJjmpaE"
"140","15.914153","172.26.0.20","193.144.238.104","TCP","66","36388  >  119 [ACK] Seq=159 Ack=79166 Win=61440 Len=0 TSval=2067541 TSecr=15134895"
"141","15.937908","193.144.238.104","172.26.0.20","NNTP","1434","Response: Ps000qvGpkaSJY9smPmAAJBA"
"142","15.937964","172.26.0.20","193.144.238.104","TCP","66","36388  >  119 [ACK] Seq=159 Ack=80534 Win=64096 Len=0 TSval=2067547 TSecr=15134897"
"143","15.938486","193.144.238.104","172.26.0.20","NNTP","1434","Response: bw7LfyJbpCYzFF5s8p525"
"144","15.938503","172.26.0.20","193.144.238.104","TCP","66","36388  >  119 [ACK] Seq=159 Ack=81902 Win=64096 Len=0 TSval=2067547 TSecr=15134897"
"145","15.940413","193.144.238.104","172.26.0.20","NNTP","1434","Response: vftNs0QV8p5TkcSLj"
"146","15.940431","172.26.0.20","193.144.238.104","TCP","66","36388  >  119 [ACK] Seq=159 Ack=83270 Win=64096 Len=0 TSval=2067548 TSecr=15134898"
"147","15.941720","193.144.238.104","172.26.0.20","NNTP","1434","Response: D90gHHIq1Bb28"
"148","15.941743","172.26.0.20","193.144.238.104","TCP","66","36388  >  119 [ACK] Seq=159 Ack=84638 Win=64096 Len=0 TSval=2067548 TSecr=15134898"
"149","15.942167","193.144.238.104","172.26.0.20","NNTP","1434","Response: 1nW0UFksz"
"150","15.942185","172.26.0.20","193.144.238.104","TCP","66","36388  >  119 [ACK] Seq=159 Ack=86006 Win=64096 Len=0 TSval=2067548 TSecr=15134898"
"151","15.943578","193.144.238.104","172.26.0.20","NNTP","1434","Response: Q9KRj"
"152","15.943607","172.26.0.20","193.144.238.104","TCP","66","36388  >  119 [ACK] Seq=159 Ack=87374 Win=64096 Len=0 TSval=2067549 TSecr=15134898"
"153","15.944036","193.144.238.104","172.26.0.20","NNTP","1434","Response: B"
"154","15.944053","172.26.0.20","193.144.238.104","TCP","66","36388  >  119 [ACK] Seq=159 Ack=88742 Win=64096 Len=0 TSval=2067549 TSecr=15134898"
"155","15.945405","193.144.238.104","172.26.0.20","NNTP","1434","Response: hlPIJBHt2FNLdVXDdMVdwuI2"
"156","15.945424","172.26.0.20","193.144.238.104","TCP","66","36388  >  119 [ACK] Seq=159 Ack=90110 Win=64096 Len=0 TSval=2067549 TSecr=15134898"
"157","15.964065","193.144.238.104","172.26.0.20","NNTP","1434","Response: gBaQ+tGcnpTzCQhY5z6UPUCP"
"158","15.964099","172.26.0.20","193.144.238.104","TCP","66","36388  >  119 [ACK] Seq=159 Ack=91478 Win=64096 Len=0 TSval=2067554 TSecr=15134900"
"159","15.964627","193.144.238.104","172.26.0.20","NNTP","1434","Response: xz9a3vyoyXmN2rt3Y4Pcmhww"
"160","15.964646","172.26.0.20","193.144.238.104","TCP","66","36388  >  119 [ACK] Seq=159 Ack=92846 Win=64096 Len=0 TSval=2067554 TSecr=15134900"
"161","15.965708","193.144.238.104","172.26.0.20","NNTP","1434","Response: UNjg8VVVMyg88VsmXcr3kfmW"
"162","15.967063","193.144.238.104","172.26.0.20","NNTP","1434","Response: FYqHBwc8ryParoLJISI9kvyg"
"163","15.967092","172.26.0.20","193.144.238.104","TCP","66","36388  >  119 [ACK] Seq=159 Ack=95582 Win=64096 Len=0 TSval=2067554 TSecr=15134900"
"164","15.967134","193.144.238.104","172.26.0.20","NNTP","1434","Response: n068VGrfMQFw+fvDnB9hT4bS"
"165","15.968184","193.144.238.104","172.26.0.20","NNTP","1434","Response: YpSeKtWQDcHNOppODSVN0gB+"
"166","15.968225","172.26.0.20","193.144.238.104","TCP","66","36388  >  119 [ACK] Seq=159 Ack=98318 Win=64096 Len=0 TSval=2067555 TSecr=15134900"
"167","15.968771","193.144.238.104","172.26.0.20","NNTP","1434","Response: Ti5Rrdw8QaUuG83PbB+Xb0/G"
"168","15.970239","193.144.238.104","172.26.0.20","NNTP","1434","Response: 5rmr+MOQMHr2rprt47xVbcDy"
"169","15.970260","172.26.0.20","193.144.238.104","TCP","66","36388  >  119 [ACK] Seq=159 Ack=101054 Win=64096 Len=0 TSval=2067555 TSecr=15134900"
"170","15.970840","193.144.238.104","172.26.0.20","NNTP","1434","[TCP Previous segment not captured] Response: ZGlLcr0UAEfnXl3iTN3"
"171","15.970862","172.26.0.20","193.144.238.104","TCP","78","[TCP Dup ACK 169#1] 36388  >  119 [ACK] Seq=159 Ack=101054 Win=64096 Len=0 TSval=2067555 TSecr=15134900 SLE=102422 SRE=103790"
"172","15.971962","193.144.238.104","172.26.0.20","NNTP","1434","Response: UM0edvI7+lMiXDD"
"173","15.971980","172.26.0.20","193.144.238.104","TCP","78","[TCP Dup ACK 169#2] 36388  >  119 [ACK] Seq=159 Ack=101054 Win=64096 Len=0 TSval=2067556 TSecr=15134900 SLE=102422 SRE=105158"
"174","15.973220","193.144.238.104","172.26.0.20","NNTP","1434","Response: 6UxWERlaJjn"
"175","15.973245","172.26.0.20","193.144.238.104","TCP","78","[TCP Dup ACK 169#3] 36388  >  119 [ACK] Seq=159 Ack=101054 Win=64096 Len=0 TSval=2067556 TSecr=15134900 SLE=102422 SRE=106526"
"176","15.976191","193.144.238.104","172.26.0.20","NNTP","1434","Response: CKnl6iG"
"177","15.976211","172.26.0.20","193.144.238.104","TCP","78","[TCP Dup ACK 169#4] 36388  >  119 [ACK] Seq=159 Ack=101054 Win=64096 Len=0 TSval=2067557 TSecr=15134900 SLE=102422 SRE=107894"
"178","15.976241","193.144.238.104","172.26.0.20","NNTP","1434","Response: Jh5"
"179","15.976252","172.26.0.20","193.144.238.104","TCP","78","[TCP Dup ACK 169#5] 36388  >  119 [ACK] Seq=159 Ack=101054 Win=64096 Len=0 TSval=2067557 TSecr=15134900 SLE=102422 SRE=109262"
"180","15.976281","193.144.238.104","172.26.0.20","NNTP","1434","Response: "
"181","15.976292","172.26.0.20","193.144.238.104","TCP","78","[TCP Dup ACK 169#6] 36388  >  119 [ACK] Seq=159 Ack=101054 Win=64096 Len=0 TSval=2067557 TSecr=15134900 SLE=102422 SRE=110630"
"182","15.976491","193.144.238.104","172.26.0.20","NNTP","1434","Response: nUw2Y+SQbjjLcZJPrUbSfKBj"
"183","15.976503","172.26.0.20","193.144.238.104","TCP","78","[TCP Dup ACK 169#7] 36388  >  119 [ACK] Seq=159 Ack=101054 Win=64096 Len=0 TSval=2067557 TSecr=15134900 SLE=102422 SRE=111998"
"184","15.989755","193.144.238.104","172.26.0.20","NNTP","1434","Response: MHpg1wXwIuppvAdmjZZrWZ4F"
"185","15.989796","172.26.0.20","193.144.238.104","TCP","78","[TCP Dup ACK 169#8] 36388  >  119 [ACK] Seq=159 Ack=101054 Win=64096 Len=0 TSval=2067560 TSecr=15134900 SLE=102422 SRE=113366"
"186","15.990391","193.144.238.104","172.26.0.20","NNTP","1434","Response: 3ae/U+lTW8zwb/K2kOpQ7lBy"
"187","15.990409","172.26.0.20","193.144.238.104","TCP","78","[TCP Dup ACK 169#9] 36388  >  119 [ACK] Seq=159 Ack=101054 Win=64096 Len=0 TSval=2067560 TSecr=15134900 SLE=102422 SRE=114734"
"188","15.991594","193.144.238.104","172.26.0.20","NNTP","1434","Response: wbywZCq7uFztXPJPtQ1ts2Do"
"189","15.991611","172.26.0.20","193.144.238.104","TCP","78","[TCP Dup ACK 169#10] 36388  >  119 [ACK] Seq=159 Ack=101054 Win=64096 Len=0 TSval=2067561 TSecr=15134900 SLE=102422 SRE=116102"
"190","15.991860","193.144.238.104","172.26.0.20","NNTP","1434","Response: Vd44J6bhVYSOZGcsRu7D1q0V"
"191","15.991871","172.26.0.20","193.144.238.104","TCP","78","[TCP Dup ACK 169#11] 36388  >  119 [ACK] Seq=159 Ack=101054 Win=64096 Len=0 TSval=2067561 TSecr=15134900 SLE=102422 SRE=117470"
"192","15.993414","193.144.238.104","172.26.0.20","NNTP","1434","Response: k2MQuODmt0rGZZ80oodSQRzn"
"193","15.993431","172.26.0.20","193.144.238.104","TCP","78","[TCP Dup ACK 169#12] 36388  >  119 [ACK] Seq=159 Ack=101054 Win=64096 Len=0 TSval=2067561 TSecr=15134900 SLE=102422 SRE=118838"
"194","15.993799","193.144.238.104","172.26.0.20","NNTP","1434","Response: 7XS47bVXEU8R8syAkhiPX3rv"
"195","15.993815","172.26.0.20","193.144.238.104","TCP","78","[TCP Dup ACK 169#13] 36388  >  119 [ACK] Seq=159 Ack=101054 Win=64096 Len=0 TSval=2067561 TSecr=15134900 SLE=102422 SRE=120206"
"196","15.994966","193.144.238.104","172.26.0.20","NNTP","1434","Response: rj1565qZhl/vde9Qng/yzXyx"
"197","15.994983","172.26.0.20","193.144.238.104","TCP","78","[TCP Dup ACK 169#14] 36388  >  119 [ACK] Seq=159 Ack=101054 Win=64096 Len=0 TSval=2067561 TSecr=15134900 SLE=102422 SRE=121574"
"198","15.995522","193.144.238.104","172.26.0.20","NNTP","1434","Response: LltJZ8LGjybAX46BQM/41QJG"
"199","15.995539","172.26.0.20","193.144.238.104","TCP","78","[TCP Dup ACK 169#15] 36388  >  119 [ACK] Seq=159 Ack=101054 Win=64096 Len=0 TSval=2067562 TSecr=15134900 SLE=102422 SRE=122942"
"200","15.996787","193.144.238.104","172.26.0.20","NNTP","1434","Response: dt+Rm5P41bgkktYjPMpSY"
"201","15.996804","172.26.0.20","193.144.238.104","TCP","78","[TCP Dup ACK 169#16] 36388  >  119 [ACK] Seq=159 Ack=101054 Win=64096 Len=0 TSval=2067562 TSecr=15134900 SLE=102422 SRE=124310"
"202","15.997356","193.144.238.104","172.26.0.20","NNTP","1434","Response: EIzZ2nHIBxzVCVtrn"
"203","15.997374","172.26.0.20","193.144.238.104","TCP","78","[TCP Dup ACK 169#17] 36388  >  119 [ACK] Seq=159 Ack=101054 Win=64096 Len=0 TSval=2067562 TSecr=15134900 SLE=102422 SRE=125678"
"204","15.998812","193.144.238.104","172.26.0.20","NNTP","1434","Response: c+E7vVdSiVNV1"
"205","15.998830","172.26.0.20","193.144.238.104","TCP","78","[TCP Dup ACK 169#18] 36388  >  119 [ACK] Seq=159 Ack=101054 Win=64096 Len=0 TSval=2067562 TSecr=15134900 SLE=102422 SRE=127046"
"206","15.999177","193.144.238.104","172.26.0.20","NNTP","1434","Response: 5zzViRjnA"
"207","15.999195","172.26.0.20","193.144.238.104","TCP","78","[TCP Dup ACK 169#19] 36388  >  119 [ACK] Seq=159 Ack=101054 Win=64096 Len=0 TSval=2067562 TSecr=15134900 SLE=102422 SRE=128414"
"208","16.000522","193.144.238.104","172.26.0.20","NNTP","1434","Response: DPaoZ"
"209","16.000540","172.26.0.20","193.144.238.104","TCP","78","[TCP Dup ACK 169#20] 36388  >  119 [ACK] Seq=159 Ack=101054 Win=64096 Len=0 TSval=2067563 TSecr=15134900 SLE=102422 SRE=129782"
"210","16.001109","193.144.238.104","172.26.0.20","NNTP","1434","Response: 9"
"211","16.001127","172.26.0.20","193.144.238.104","TCP","78","[TCP Dup ACK 169#21] 36388  >  119 [ACK] Seq=159 Ack=101054 Win=64096 Len=0 TSval=2067563 TSecr=15134900 SLE=102422 SRE=131150"
"212","16.002199","193.144.238.104","172.26.0.20","NNTP","1434","Response: XPXrxjpWTOAVJ4HtWqNEUpTk"
"213","16.002221","172.26.0.20","193.144.238.104","TCP","78","[TCP Dup ACK 169#22] 36388  >  119 [ACK] Seq=159 Ack=101054 Win=64096 Len=0 TSval=2067563 TSecr=15134900 SLE=102422 SRE=132518"
"214","16.002644","193.144.238.104","172.26.0.20","NNTP","1434","[TCP Fast Retransmission] Response: djlk9QX5QOc5pj8vkdPSnlk"
"215","16.002671","172.26.0.20","193.144.238.104","TCP","66","36388  >  119 [ACK] Seq=159 Ack=132518 Win=33664 Len=0 TSval=2067563 TSecr=15134904"
"216","16.003695","193.144.238.104","172.26.0.20","NNTP","1434","Response: M7bx83TPal8rG7awIpRl3ITl"
"217","16.003714","172.26.0.20","193.144.238.104","TCP","66","36388  >  119 [ACK] Seq=159 Ack=133886 Win=64096 Len=0 TSval=2067564 TSecr=15134904"
"218","16.004808","193.144.238.104","172.26.0.20","NNTP","1434","Response: WPKkY+7muDuxNp5DRlRMOUKj"
"219","16.004826","172.26.0.20","193.144.238.104","TCP","66","36388  >  119 [ACK] Seq=159 Ack=135254 Win=64096 Len=0 TSval=2067564 TSecr=15134904"
"220","16.015874","193.144.238.104","172.26.0.20","NNTP","1434","Response: 2QQpHWowAeO1SxRBpApwuTyx"
"221","16.015919","172.26.0.20","193.144.238.104","TCP","66","36388  >  119 [ACK] Seq=159 Ack=136622 Win=64096 Len=0 TSval=2067567 TSecr=15134905"
"222","16.017816","193.144.238.104","172.26.0.20","NNTP","1434","Response: x6ioC2BXQtUUjVh1HgEMUI6V"
"223","16.017847","172.26.0.20","193.144.238.104","TCP","66","36388  >  119 [ACK] Seq=159 Ack=137990 Win=64096 Len=0 TSval=2067567 TSecr=15134906"
"224","16.018959","193.144.238.104","172.26.0.20","NNTP","1434","Response: oSgoAOlRAgk9zVKKfoCcHvir"
"225","16.018982","172.26.0.20","193.144.238.104","TCP","66","36388  >  119 [ACK] Seq=159 Ack=139358 Win=64096 Len=0 TSval=2067567 TSecr=15134906"
"226","16.028211","193.144.238.104","172.26.0.20","NNTP","1434","Response: XFoAucZrXRkOS2OZaPIpFTBG"
"227","16.028253","172.26.0.20","193.144.238.104","TCP","66","36388  >  119 [ACK] Seq=159 Ack=140726 Win=64096 Len=0 TSval=2067570 TSecr=15134907"
"228","16.029129","193.144.238.104","172.26.0.20","NNTP","1434","Response: gOlbGoTWqhwVdcKeoGOPSozb"
"229","16.029148","172.26.0.20","193.144.238.104","TCP","66","36388  >  119 [ACK] Seq=159 Ack=142094 Win=66848 Len=0 TSval=2067570 TSecr=15134907"
"230","16.031018","193.144.238.104","172.26.0.20","NNTP","1434","Response: DbWSuhyMVM6hN2zmxpzLnIxn"
"231","16.031038","172.26.0.20","193.144.238.104","TCP","66","36388  >  119 [ACK] Seq=159 Ack=143462 Win=69568 Len=0 TSval=2067570 TSecr=15134907"
"232","16.031075","193.144.238.104","172.26.0.20","NNTP","1434","Response: Ub+6jYs8TeXu6qaW9cwsVbk"
"233","16.031086","172.26.0.20","193.144.238.104","TCP","66","36388  >  119 [ACK] Seq=159 Ack=144830 Win=72320 Len=0 TSval=2067570 TSecr=15134907"
"234","16.032151","193.144.238.104","172.26.0.20","NNTP","1434","Response: wIJDfjTt2ev4Un3zktz"
"235","16.032168","172.26.0.20","193.144.238.104","TCP","66","36388  >  119 [ACK] Seq=159 Ack=146198 Win=74752 Len=0 TSval=2067571 TSecr=15134907"
"236","16.032843","193.144.238.104","172.26.0.20","NNTP","1434","Response: qH+0V2n9zlz3rXf"
"237","16.032861","172.26.0.20","193.144.238.104","TCP","66","36388  >  119 [ACK] Seq=159 Ack=147566 Win=74752 Len=0 TSval=2067571 TSecr=15134907"
"238","16.040898","193.144.238.104","172.26.0.20","NNTP","1434","Response: rNeUHnH4VLc"
"239","16.040916","172.26.0.20","193.144.238.104","TCP","66","36388  >  119 [ACK] Seq=159 Ack=148934 Win=74752 Len=0 TSval=2067573 TSecr=15134908"
"240","16.042000","193.144.238.104","172.26.0.20","NNTP","1434","Response: o71XRAo"
"241","16.042017","172.26.0.20","193.144.238.104","TCP","66","36388  >  119 [ACK] Seq=159 Ack=150302 Win=74752 Len=0 TSval=2067573 TSecr=15134908"
"242","16.043453","193.144.238.104","172.26.0.20","NNTP","1434","Response: IHn"
"243","16.043478","172.26.0.20","193.144.238.104","TCP","66","36388  >  119 [ACK] Seq=159 Ack=151670 Win=74752 Len=0 TSval=2067574 TSecr=15134908"
"244","16.044702","193.144.238.104","172.26.0.20","NNTP","1434","Response: "
"245","16.044741","172.26.0.20","193.144.238.104","TCP","66","36388  >  119 [ACK] Seq=159 Ack=153038 Win=74752 Len=0 TSval=2067574 TSecr=15134908"
"246","16.045370","193.144.238.104","172.26.0.20","NNTP","1434","Response: nmlWLYuRmtT7C7DAXGKja0Yd"
"247","16.045389","172.26.0.20","193.144.238.104","TCP","66","36388  >  119 [ACK] Seq=159 Ack=154406 Win=74752 Len=0 TSval=2067574 TSecr=15134908"
"248","16.054094","193.144.238.104","172.26.0.20","NNTP","1434","Response: RNjKCOlS0VYfHMARnOM9q0UG"
"249","16.054131","172.26.0.20","193.144.238.104","TCP","66","36388  >  119 [ACK] Seq=159 Ack=155774 Win=74752 Len=0 TSval=2067576 TSecr=15134909"
"250","16.055401","193.144.238.104","172.26.0.20","NNTP","1434","Response: iU5waa5yBjnFBjMhxnHFAh0b"
"251","16.055428","172.26.0.20","193.144.238.104","TCP","66","36388  >  119 [ACK] Seq=159 Ack=157142 Win=74752 Len=0 TSval=2067577 TSecr=15134909"
"252","16.056238","193.144.238.104","172.26.0.20","NNTP","1434","Response: Z1KOhZWJ455rl9XtzbvvQ/Ie"
"253","16.057810","193.144.238.104","172.26.0.20","NNTP","1434","Response: axdRi3SEfnXWSWuyPGCTWZNY"
"254","16.057830","172.26.0.20","193.144.238.104","TCP","66","36388  >  119 [ACK] Seq=159 Ack=159878 Win=74752 Len=0 TSval=2067577 TSecr=15134909"
"255","16.058608","193.144.238.104","172.26.0.20","NNTP","1434","Response: 1MA/NkgYGK5ZJi8caNjahJXC"
"256","16.059900","193.144.238.104","172.26.0.20","NNTP","1434","Response: ubPT0qC80xNpaNggBy2/gDHv"
"257","16.059927","172.26.0.20","193.144.238.104","TCP","66","36388  >  119 [ACK] Seq=159 Ack=162614 Win=74752 Len=0 TSval=2067578 TSecr=15134909"
"258","16.065515","193.144.238.104","172.26.0.20","NNTP","1434","Response: +lV4lYK3zMT9akR3j+YSe+DW"
"259","16.066215","193.144.238.104","172.26.0.20","NNTP","1434","Response: eZzzx2p0Xiq82hTIcY7ms1l0"
"260","16.066234","172.26.0.20","193.144.238.104","TCP","66","36388  >  119 [ACK] Seq=159 Ack=165350 Win=74752 Len=0 TSval=2067579 TSecr=15134910"
"261","16.068372","193.144.238.104","172.26.0.20","NNTP","1434","Response: 15rU87FvMY7ueTXbTwbav"
"262","16.070031","193.144.238.104","172.26.0.20","NNTP","1434","Response: vhVz1B61fLLoxObWx"
"263","16.070050","172.26.0.20","193.144.238.104","TCP","66","36388  >  119 [ACK] Seq=159 Ack=168086 Win=74752 Len=0 TSval=2067580 TSecr=15134911"
"264","16.071217","193.144.238.104","172.26.0.20","NNTP","1434","Response: 0+GRVdS+7aDyV"
"265","16.072148","193.144.238.104","172.26.0.20","NNTP","1434","Response: 5nY5GSoas"
"266","16.072175","172.26.0.20","193.144.238.104","TCP","66","36388  >  119 [ACK] Seq=159 Ack=170822 Win=74752 Len=0 TSval=2067581 TSecr=15134911"
"267","16.080265","193.144.238.104","172.26.0.20","NNTP","1434","Response: 490Y6"
"268","16.080728","193.144.238.104","172.26.0.20","NNTP","1434","Response: R"
"269","16.080748","172.26.0.20","193.144.238.104","TCP","66","36388  >  119 [ACK] Seq=159 Ack=173558 Win=74752 Len=0 TSval=2067583 TSecr=15134912"
"270","16.081882","193.144.238.104","172.26.0.20","NNTP","1434","Response: AT1PpUbRHDDGBnqBXWWvh5rp"
"271","16.082810","193.144.238.104","172.26.0.20","NNTP","1434","Response: rXWDy7kHY2AR0rPurMhstjgc"
"272","16.082834","172.26.0.20","193.144.238.104","TCP","66","36388  >  119 [ACK] Seq=159 Ack=176294 Win=74752 Len=0 TSval=2067583 TSecr=15134912"
"273","16.083937","193.144.238.104","172.26.0.20","NNTP","1434","Response: 9eR1PrWidjqjG25l+UWzzmo2"
"274","16.084418","193.144.238.104","172.26.0.20","NNTP","1434","Response: 3HTpVZfATRscoXAwCMV9Tt8P"
"275","16.084436","172.26.0.20","193.144.238.104","TCP","66","36388  >  119 [ACK] Seq=159 Ack=179030 Win=74752 Len=0 TSval=2067584 TSecr=15134912"
"276","16.091992","193.144.238.104","172.26.0.20","NNTP","1434","Response: QPrX1L48+GMFn4a1SS5gW7s4"
"277","16.092869","193.144.238.104","172.26.0.20","NNTP","1434","Response: miYKUOTUFz4WukUHyce9aqrH"
"278","16.092893","172.26.0.20","193.144.238.104","TCP","66","36388  >  119 [ACK] Seq=159 Ack=181766 Win=74752 Len=0 TSval=2067586 TSecr=15134913"
"279","16.095448","193.144.238.104","172.26.0.20","NNTP","1434","Response: GPCon2gwpPJGAmZXYknueenY"
"280","16.095897","193.144.238.104","172.26.0.20","NNTP","1434","Response: AEY49K6HTdFEIyNjDGM4rmqZ"
"281","16.095918","172.26.0.20","193.144.238.104","TCP","66","36388  >  119 [ACK] Seq=159 Ack=184502 Win=74752 Len=0 TSval=2067587 TSecr=15134913"
"282","16.097276","193.144.238.104","172.26.0.20","NNTP","1434","Response: kaHx717TrvwLLEI3WzsIze/6"
"283","16.098035","193.144.238.104","172.26.0.20","NNTP","1434","Response: fDl/LofiCV9WmtTa+Zfm/Rg"
"284","16.098054","172.26.0.20","193.144.238.104","TCP","66","36388  >  119 [ACK] Seq=159 Ack=187238 Win=74752 Len=0 TSval=2067587 TSecr=15134914"
"285","16.106130","193.144.238.104","172.26.0.20","NNTP","1434","Response: lFHOyW+pICoYEe9ZV9a"
"286","16.107106","193.144.238.104","172.26.0.20","NNTP","1434","Response: 9hcanb6BawW9jZS"
"287","16.107131","172.26.0.20","193.144.238.104","TCP","66","36388  >  119 [ACK] Seq=159 Ack=189974 Win=74752 Len=0 TSval=2067589 TSecr=15134914"
"288","16.108683","193.144.238.104","172.26.0.20","NNTP","1434","Response: H1ow+Id5Jap"
"289","16.109328","193.144.238.104","172.26.0.20","NNTP","1434","Response: 8k95b3F"
"290","16.109347","172.26.0.20","193.144.238.104","TCP","66","36388  >  119 [ACK] Seq=159 Ack=192710 Win=74752 Len=0 TSval=2067590 TSecr=15134915"
"291","16.110404","193.144.238.104","172.26.0.20","NNTP","1434","Response: DDI"
"292","16.111202","193.144.238.104","172.26.0.20","NNTP","1434","Response: "
"293","16.111222","172.26.0.20","193.144.238.104","TCP","66","36388  >  119 [ACK] Seq=159 Ack=195446 Win=74752 Len=0 TSval=2067590 TSecr=15134915"
"294","16.117805","193.144.238.104","172.26.0.20","NNTP","1434","Response: BedtXfqO9kY9/IIiiA5YsKcq"
"295","16.118277","193.144.238.104","172.26.0.20","NNTP","1434","Response: NuGvLd1GFET9QOWBXkHNec+I"
"296","16.118298","172.26.0.20","193.144.238.104","TCP","66","36388  >  119 [ACK] Seq=159 Ack=198182 Win=74752 Len=0 TSval=2067592 TSecr=15134916"
"297","16.121584","193.144.238.104","172.26.0.20","NNTP","1434","Response: KJSrAqTydgwBj617BDoAMRVU"
"298","16.121927","193.144.238.104","172.26.0.20","NNTP","1434","Response: pbW/4DOlkkudd8S3WqWBxYiD"
"299","16.121981","172.26.0.20","193.144.238.104","TCP","66","36388  >  119 [ACK] Seq=159 Ack=200918 Win=74752 Len=0 TSval=2067593 TSecr=15134916"
"300","16.123202","193.144.238.104","172.26.0.20","NNTP","1434","Response: I3OSpzK6h1sdQfCFr8LPBPhS"
"301","16.124136","193.144.238.104","172.26.0.20","NNTP","1434","Response: X91LO6pt/dqMYxVB7IAn5cZG"
"302","16.124156","172.26.0.20","193.144.238.104","TCP","66","36388  >  119 [ACK] Seq=159 Ack=203654 Win=74752 Len=0 TSval=2067594 TSecr=15134916"
"303","16.125268","193.144.238.104","172.26.0.20","NNTP","1434","Response: UP+sj559uh/I19H+GvC002kI"
"304","16.132490","193.144.238.104","172.26.0.20","NNTP","1434","Response: vJXIzzjn+Xevcf23f2Tx+z/q"
"305","16.132510","172.26.0.20","193.144.238.104","TCP","66","36388  >  119 [ACK] Seq=159 Ack=206390 Win=74752 Len=0 TSval=2067596 TSecr=15134916"
"306","16.133421","193.144.238.104","172.26.0.20","NNTP","1434","Response: OKratWPoRZLTcNzD2NWYNUsr"
"307","16.134692","193.144.238.104","172.26.0.20","NNTP","1434","Response: PgPx5p2o/CnVnuYZtH1tt"
"308","16.134710","172.26.0.20","193.144.238.104","TCP","66","36388  >  119 [ACK] Seq=159 Ack=209126 Win=74752 Len=0 TSval=2067596 TSecr=15134917"
"309","16.135807","193.144.238.104","172.26.0.20","NNTP","1434","Response: 4+yzTarZYYyGFgPLO"
"310","16.137356","193.144.238.104","172.26.0.20","NNTP","1434","Response: Fdm9n5jEBSCai"
"311","16.137397","172.26.0.20","193.144.238.104","TCP","66","36388  >  119 [ACK] Seq=159 Ack=211862 Win=74752 Len=0 TSval=2067597 TSecr=15134917"
"312","16.137487","193.144.238.104","172.26.0.20","NNTP","1434","Response: d18Zne5gk"
"313","16.144138","193.144.238.104","172.26.0.20","NNTP","1434","Response: omltZ"
"314","16.144177","172.26.0.20","193.144.238.104","TCP","66","36388  >  119 [ACK] Seq=159 Ack=214598 Win=74752 Len=0 TSval=2067599 TSecr=15134917"
"315","16.147794","193.144.238.104","172.26.0.20","NNTP","1434","Response: N"
"316","16.147834","193.144.238.104","172.26.0.20","NNTP","1434","Response: 5KwpdSxsEUNtAYoDkYyAMng9"
"317","16.147844","193.144.238.104","172.26.0.20","NNTP","1434","Response: HXw8/Z88NeJ/Dq+KdUneTVpr"
"318","16.148035","172.26.0.20","193.144.238.104","TCP","66","36388  >  119 [ACK] Seq=159 Ack=218702 Win=75040 Len=0 TSval=2067600 TSecr=15134918"
"319","16.149155","193.144.238.104","172.26.0.20","NNTP","1434","Response: l8OyEkNgAngClPheSRMBcf1r"
"320","16.149792","193.144.238.104","172.26.0.20","NNTP","1434","Response: w3UAADj8Mivn5JHQMFYgHg47"
"321","16.149902","172.26.0.20","193.144.238.104","TCP","66","36388  >  119 [ACK] Seq=159 Ack=221438 Win=75040 Len=0 TSval=2067600 TSecr=15134919"
"322","16.159240","193.144.238.104","172.26.0.20","NNTP","1434","Response: IKiFs4JIIHTnjr+FVmHzHjB9"
"323","16.159440","193.144.238.104","172.26.0.20","NNTP","1434","Response: PXsMVvQQxoCCdpz/nFcjq+lG"
"324","16.159532","172.26.0.20","193.144.238.104","TCP","66","36388  >  119 [ACK] Seq=159 Ack=224174 Win=75040 Len=0 TSval=2067603 TSecr=15134920"
"325","16.160723","193.144.238.104","172.26.0.20","NNTP","1434","Response: 0nRNMh0rT7ezd/IRURAxYR46"
"326","16.162413","193.144.238.104","172.26.0.20","NNTP","1434","Response: XSLS5ZQ0N3d3MouLi5V3JLBk"
"327","16.162588","172.26.0.20","193.144.238.104","TCP","66","36388  >  119 [ACK] Seq=159 Ack=226910 Win=75040 Len=0 TSval=2067603 TSecr=15134920"
"328","16.163803","193.144.238.104","172.26.0.20","NNTP","1434","Response: HywAjP41aqt7EOkluZsOkJME"
"329","16.164103","193.144.238.104","172.26.0.20","NNTP","1434","Response: 94Vmia4muREi4hSV9wcdSVI"
"330","16.164200","172.26.0.20","193.144.238.104","TCP","66","36388  >  119 [ACK] Seq=159 Ack=229646 Win=75040 Len=0 TSval=2067604 TSecr=15134920"
"331","16.168924","193.144.238.104","172.26.0.20","NNTP","1434","Response: dE1C4yLu6WCEjlbdFVz"
"332","16.169817","193.144.238.104","172.26.0.20","NNTP","1434","Response: 2M72axyRfLcIUTf"
"333","16.169931","172.26.0.20","193.144.238.104","TCP","66","36388  >  119 [ACK] Seq=159 Ack=232382 Win=75040 Len=0 TSval=2067605 TSecr=15134921"
"334","16.172934","193.144.238.104","172.26.0.20","NNTP","1434","Response: +Fnib4Bft3f"
"335","16.174189","193.144.238.104","172.26.0.20","NNTP","1434","Response: FPBUMuh"
