"No.","Time","Source","Destination","Protocol","Length","Info"
"1","0.000000","ExtremeN_ff:ae:80","Broadcast","ARP","60","Who has 10.65.199.31? Tell 10.65.199.1"
"2","4.024256","10.65.199.21","10.65.200.11","TCP","74","756  >  111 [SYN] Seq=0 Win=5840 Len=0 MSS=1460 SACK_PERM TSval=32875000 TSecr=0 WS=1"
"3","4.024370","10.65.200.11","10.65.199.21","TCP","74","111  >  756 [SYN, ACK] Seq=0 Ack=1 Win=65535 Len=0 MSS=1460 WS=16 TSval=245432548 TSecr=32875000"
"4","4.024393","10.65.199.21","10.65.200.11","TCP","66","756  >  111 [ACK] Seq=1 Ack=1 Win=5840 Len=0 TSval=32875000 TSecr=245432548"
"5","4.024452","10.65.199.21","10.65.200.11","Portmap","110","V2 DUMP Call (Reply In 7)[Packet size limited during capture]"
"6","4.024500","10.65.200.11","10.65.199.21","TCP","66","[TCP Window Update] 111  >  756 [ACK] Seq=1 Ack=1 Win=525616 Len=0 TSval=245432548 TSecr=32875000"
"7","4.024745","10.65.200.11","10.65.199.21","Portmap","338","V2 DUMP Reply (Call In 5)"
"8","4.024757","10.65.199.21","10.65.200.11","TCP","66","756  >  111 [ACK] Seq=45 Ack=273 Win=6432 Len=0 TSval=32875000 TSecr=245432548"
"9","4.024786","10.65.199.21","10.65.200.11","TCP","66","756  >  111 [FIN, ACK] Seq=45 Ack=273 Win=6432 Len=0 TSval=32875000 TSecr=245432548"
"10","4.024817","10.65.199.21","10.65.200.11","TCP","74","757  >  1023 [SYN] Seq=0 Win=5840 Len=0 MSS=1460 SACK_PERM TSval=32875000 TSecr=0 WS=1"
"11","4.024864","10.65.200.11","10.65.199.21","TCP","66","111  >  756 [ACK] Seq=273 Ack=46 Win=525616 Len=0 TSval=245432549 TSecr=32875000"
"12","4.024898","10.65.200.11","10.65.199.21","TCP","74","1023  >  757 [SYN, ACK] Seq=0 Ack=1 Win=65535 Len=0 MSS=1460 WS=16 TSval=245432549 TSecr=32875000"
"13","4.024907","10.65.199.21","10.65.200.11","TCP","66","757  >  1023 [ACK] Seq=1 Ack=1 Win=5840 Len=0 TSval=32875000 TSecr=245432549"
"14","4.024923","10.65.200.11","10.65.199.21","TCP","66","111  >  756 [FIN, ACK] Seq=273 Ack=46 Win=525616 Len=0 TSval=245432549 TSecr=32875000"
"15","4.024938","10.65.199.21","10.65.200.11","TCP","66","756  >  111 [ACK] Seq=46 Ack=274 Win=6432 Len=0 TSval=32875000 TSecr=245432549"
"16","4.024964","10.65.199.21","10.65.200.11","MOUNT","190","V3 MNT Call (Reply In 18)[Packet size limited during capture]"
"17","4.024993","10.65.200.11","10.65.199.21","TCP","66","[TCP Window Update] 1023  >  757 [ACK] Seq=1 Ack=1 Win=525616 Len=0 TSval=245432549 TSecr=32875000"
"18","4.025239","10.65.200.11","10.65.199.21","MOUNT","158","V3 MNT Reply (Call In 16)"
"19","4.025248","10.65.199.21","10.65.200.11","TCP","66","757  >  1023 [ACK] Seq=125 Ack=93 Win=5840 Len=0 TSval=32875000 TSecr=245432549"
"20","4.025313","10.65.199.21","10.65.200.11","Portmap","98","V2 GETPORT Call (Reply In 21) NFS(100003) V:3 TCP[Packet size limited during capture]"
"21","4.025513","10.65.200.11","10.65.199.21","Portmap","70","V2 GETPORT Reply (Call In 20) Port:2049"
"22","4.025549","10.65.199.21","10.65.200.11","TCP","66","757  >  1023 [FIN, ACK] Seq=125 Ack=93 Win=5840 Len=0 TSval=32875000 TSecr=245432549"
"23","4.025627","10.65.200.11","10.65.199.21","TCP","66","1023  >  757 [ACK] Seq=93 Ack=126 Win=525616 Len=0 TSval=245432549 TSecr=32875000"
"24","4.025647","10.65.199.21","10.65.200.11","TCP","74","799  >  2049 [SYN] Seq=0 Win=5840 Len=0 MSS=1460 SACK_PERM TSval=32875000 TSecr=0 WS=1"
"25","4.025733","10.65.200.11","10.65.199.21","TCP","74","2049  >  799 [SYN, ACK] Seq=0 Ack=1 Win=65535 Len=0 MSS=1460 WS=16 TSval=245432549 TSecr=32875000"
"26","4.025745","10.65.199.21","10.65.200.11","TCP","66","799  >  2049 [ACK] Seq=1 Ack=1 Win=5840 Len=0 TSval=32875000 TSecr=245432549"
"27","4.025758","10.65.199.21","10.65.200.11","NFS","218","V3 GETATTR Call (Reply In 29)[Packet size limited during capture]"
"28","4.025832","10.65.200.11","10.65.199.21","TCP","66","[TCP Window Update] 2049  >  799 [ACK] Seq=1 Ack=1 Win=525616 Len=0 TSval=245432550 TSecr=32875000"
"29","4.025908","10.65.200.11","10.65.199.21","NFS","182","V3 GETATTR Reply (Call In 27)"
"30","4.025921","10.65.199.21","10.65.200.11","TCP","66","799  >  2049 [ACK] Seq=153 Ack=117 Win=5840 Len=0 TSval=32875000 TSecr=245432550"
"31","4.025943","10.65.199.21","10.65.200.11","NFS","218","V3 FSSTAT Call (Reply In 32)[Packet size limited during capture]"
"32","4.026061","10.65.200.11","10.65.199.21","NFS","238","V3 FSSTAT Reply (Call In 31)"
"33","4.026082","10.65.199.21","10.65.200.11","NFS","218","V3 FSINFO Call (Reply In 34)[Packet size limited during capture]"
"34","4.026193","10.65.200.11","10.65.199.21","NFS","234","V3 FSINFO Reply (Call In 33)"
"35","4.026869","10.65.199.21","10.65.200.11","NFS","222","V3 ACCESS Call (Reply In 36)[Packet size limited during capture]"
"36","4.026988","10.65.200.11","10.65.199.21","NFS","190","V3 ACCESS Reply (Call In 35)"
"37","4.028439","10.65.200.11","10.65.199.21","TCP","66","1023  >  757 [FIN, ACK] Seq=93 Ack=126 Win=525616 Len=0 TSval=245432552 TSecr=32875000"
"38","4.028483","10.65.199.21","10.65.200.11","TCP","66","757  >  1023 [ACK] Seq=126 Ack=94 Win=5840 Len=0 TSval=32875000 TSecr=245432552"
"39","4.028547","10.65.199.21","10.65.200.11","NFS","222","V3 ACCESS Call (Reply In 40)[Packet size limited during capture]"
"40","4.028665","10.65.200.11","10.65.199.21","NFS","190","V3 ACCESS Reply (Call In 39)"
"41","4.028700","10.65.199.21","10.65.200.11","NFS","222","V3 ACCESS Call (Reply In 42)[Packet size limited during capture]"
"42","4.028807","10.65.200.11","10.65.199.21","NFS","190","V3 ACCESS Reply (Call In 41)"
"43","4.028832","10.65.199.21","10.65.200.11","NFS","234","V3 LOOKUP Call (Reply In 45)[Packet size limited during capture]"
"44","4.038756","10.65.200.11","10.65.199.21","TCP","66","2049  >  799 [ACK] Seq=829 Ack=1093 Win=524528 Len=0 TSval=245432563 TSecr=32875000"
"45","4.050902","10.65.200.11","10.65.199.21","NFS","326","V3 LOOKUP Reply (Call In 43)"
"46","4.050939","10.65.199.21","10.65.200.11","NFS","222","V3 ACCESS Call (Reply In 47)[Packet size limited during capture]"
"47","4.059418","10.65.200.11","10.65.199.21","NFS","190","V3 ACCESS Reply (Call In 46)"
"48","4.059528","10.65.199.21","10.65.200.11","NFS","230","V3 READ Call (Reply In 49)[Packet size limited during capture]"
"49","4.060883","10.65.200.11","10.65.199.21","NFS","1514","V3 READ Reply (Call In 48)"
"50","4.060901","10.65.199.21","10.65.200.11","NFS","230","V3 READ Call (Reply In 85)[Packet size limited during capture]"
"51","4.060896","10.65.200.11","10.65.199.21","RPC","1514","Continuation"
"52","4.060910","10.65.200.11","10.65.199.21","RPC","1514","Continuation"
"53","4.060924","10.65.199.21","10.65.200.11","TCP","66","799  >  2049 [ACK] Seq=1577 Ack=5557 Win=14480 Len=0 TSval=32875004 TSecr=245432585"
"54","4.060921","10.65.200.11","10.65.199.21","RPC","1514","Continuation"
"55","4.061074","10.65.200.11","10.65.199.21","RPC","1514","Continuation"
"56","4.061084","10.65.199.21","10.65.200.11","TCP","66","799  >  2049 [ACK] Seq=1577 Ack=8453 Win=20272 Len=0 TSval=32875004 TSecr=245432585"
"57","4.061087","10.65.200.11","10.65.199.21","RPC","1514","Continuation"
"58","4.061100","10.65.200.11","10.65.199.21","RPC","1514","Continuation"
"59","4.061106","10.65.199.21","10.65.200.11","TCP","66","799  >  2049 [ACK] Seq=1577 Ack=11349 Win=26064 Len=0 TSval=32875004 TSecr=245432585"
"60","4.061114","10.65.200.11","10.65.199.21","RPC","1514","Continuation"
"61","4.061124","10.65.200.11","10.65.199.21","RPC","1514","Continuation"
"62","4.061129","10.65.199.21","10.65.200.11","TCP","66","799  >  2049 [ACK] Seq=1577 Ack=14245 Win=31856 Len=0 TSval=32875004 TSecr=245432585"
"63","4.061138","10.65.200.11","10.65.199.21","RPC","1514","Continuation"
"64","4.061150","10.65.200.11","10.65.199.21","RPC","1514","Continuation"
"65","4.061155","10.65.199.21","10.65.200.11","TCP","66","799  >  2049 [ACK] Seq=1577 Ack=17141 Win=31856 Len=0 TSval=32875004 TSecr=245432585"
"66","4.061164","10.65.200.11","10.65.199.21","RPC","1514","Continuation"
"67","4.061174","10.65.200.11","10.65.199.21","RPC","1514","Continuation"
"68","4.061180","10.65.199.21","10.65.200.11","TCP","66","799  >  2049 [ACK] Seq=1577 Ack=20037 Win=31856 Len=0 TSval=32875004 TSecr=245432585"
"69","4.061251","10.65.200.11","10.65.199.21","RPC","1514","Continuation"
"70","4.061262","10.65.200.11","10.65.199.21","RPC","1514","Continuation"
"71","4.061268","10.65.199.21","10.65.200.11","TCP","66","799  >  2049 [ACK] Seq=1577 Ack=22933 Win=31856 Len=0 TSval=32875004 TSecr=245432585"
"72","4.061276","10.65.200.11","10.65.199.21","RPC","1514","Continuation"
"73","4.061287","10.65.200.11","10.65.199.21","RPC","1514","Continuation"
"74","4.061293","10.65.199.21","10.65.200.11","TCP","66","799  >  2049 [ACK] Seq=1577 Ack=25829 Win=31856 Len=0 TSval=32875004 TSecr=245432585"
"75","4.061302","10.65.200.11","10.65.199.21","RPC","1514","Continuation"
"76","4.061312","10.65.200.11","10.65.199.21","RPC","1514","Continuation"
"77","4.061318","10.65.199.21","10.65.200.11","TCP","66","799  >  2049 [ACK] Seq=1577 Ack=28725 Win=31856 Len=0 TSval=32875004 TSecr=245432585"
"78","4.061325","10.65.200.11","10.65.199.21","RPC","1514","Continuation"
"79","4.061336","10.65.200.11","10.65.199.21","RPC","1514","Continuation"
"80","4.061341","10.65.199.21","10.65.200.11","TCP","66","799  >  2049 [ACK] Seq=1577 Ack=31621 Win=31856 Len=0 TSval=32875004 TSecr=245432585"
"81","4.061350","10.65.200.11","10.65.199.21","RPC","1514","Continuation"
"82","4.061357","10.65.200.11","10.65.199.21","RPC","1110","Continuation"
"83","4.061365","10.65.199.21","10.65.200.11","TCP","66","799  >  2049 [ACK] Seq=1577 Ack=34113 Win=31856 Len=0 TSval=32875004 TSecr=245432585"
"84","4.061442","10.65.199.21","10.65.200.11","NFS","230","V3 READ Call (Reply In 120)[Packet size limited during capture]"
"85","4.062262","10.65.200.11","10.65.199.21","NFS","1514","V3 READ Reply (Call In 50)"
"86","4.062283","10.65.199.21","10.65.200.11","NFS","558","V3 READ Call (Reply In 260)[Packet size limited during capture]"
"87","4.062274","10.65.200.11","10.65.199.21","RPC","1514","Continuation"
"88","4.062287","10.65.200.11","10.65.199.21","RPC","1514","Continuation"
"89","4.062305","10.65.199.21","10.65.200.11","TCP","66","799  >  2049 [ACK] Seq=2233 Ack=38457 Win=31856 Len=0 TSval=32875004 TSecr=245432586"
"90","4.062299","10.65.200.11","10.65.199.21","RPC","1514","Continuation"
"91","4.062313","10.65.200.11","10.65.199.21","RPC","1514","Continuation"
"92","4.062331","10.65.199.21","10.65.200.11","TCP","66","799  >  2049 [ACK] Seq=2233 Ack=41353 Win=31856 Len=0 TSval=32875004 TSecr=245432586"
"93","4.062325","10.65.200.11","10.65.199.21","RPC","1514","Continuation"
"94","4.062338","10.65.200.11","10.65.199.21","RPC","1514","Continuation"
"95","4.062354","10.65.199.21","10.65.200.11","TCP","66","799  >  2049 [ACK] Seq=2233 Ack=44249 Win=31856 Len=0 TSval=32875004 TSecr=245432586"
"96","4.062349","10.65.200.11","10.65.199.21","RPC","1514","Continuation"
"97","4.062367","10.65.200.11","10.65.199.21","RPC","1514","Continuation"
"98","4.062378","10.65.199.21","10.65.200.11","TCP","66","799  >  2049 [ACK] Seq=2233 Ack=47145 Win=31856 Len=0 TSval=32875004 TSecr=245432586"
"99","4.062375","10.65.200.11","10.65.199.21","RPC","1514","Continuation"
"100","4.062388","10.65.200.11","10.65.199.21","RPC","1514","Continuation"
"101","4.062405","10.65.199.21","10.65.200.11","TCP","66","799  >  2049 [ACK] Seq=2233 Ack=50041 Win=31856 Len=0 TSval=32875004 TSecr=245432586"
"102","4.062398","10.65.200.11","10.65.199.21","RPC","1514","Continuation"
"103","4.062413","10.65.200.11","10.65.199.21","RPC","1514","Continuation"
"104","4.062428","10.65.199.21","10.65.200.11","TCP","66","799  >  2049 [ACK] Seq=2233 Ack=52937 Win=31856 Len=0 TSval=32875004 TSecr=245432586"
"105","4.062423","10.65.200.11","10.65.199.21","RPC","1514","Continuation"
"106","4.062437","10.65.200.11","10.65.199.21","RPC","1514","Continuation"
"107","4.062451","10.65.199.21","10.65.200.11","TCP","66","799  >  2049 [ACK] Seq=2233 Ack=55833 Win=31856 Len=0 TSval=32875004 TSecr=245432586"
"108","4.062448","10.65.200.11","10.65.199.21","RPC","1514","Continuation"
"109","4.062461","10.65.200.11","10.65.199.21","RPC","1514","Continuation"
"110","4.062469","10.65.199.21","10.65.200.11","TCP","66","799  >  2049 [ACK] Seq=2233 Ack=58729 Win=31856 Len=0 TSval=32875004 TSecr=245432586"
"111","4.062473","10.65.200.11","10.65.199.21","RPC","1514","Continuation"
"112","4.062486","10.65.200.11","10.65.199.21","RPC","1514","Continuation"
"113","4.062493","10.65.199.21","10.65.200.11","TCP","66","799  >  2049 [ACK] Seq=2233 Ack=61625 Win=31856 Len=0 TSval=32875004 TSecr=245432586"
"114","4.062498","10.65.200.11","10.65.199.21","RPC","1514","Continuation"
"115","4.062510","10.65.200.11","10.65.199.21","RPC","1514","Continuation"
"116","4.062517","10.65.199.21","10.65.200.11","TCP","66","799  >  2049 [ACK] Seq=2233 Ack=64521 Win=31856 Len=0 TSval=32875004 TSecr=245432586"
"117","4.062523","10.65.200.11","10.65.199.21","RPC","1514","Continuation"
"118","4.062531","10.65.200.11","10.65.199.21","RPC","1110","Continuation"
"119","4.062548","10.65.199.21","10.65.200.11","TCP","66","799  >  2049 [ACK] Seq=2233 Ack=67013 Win=31856 Len=0 TSval=32875004 TSecr=245432586"
"120","4.063966","10.65.200.11","10.65.199.21","NFS","1514","V3 READ Reply (Call In 84)"
"121","4.063978","10.65.200.11","10.65.199.21","RPC","1514","Continuation"
"122","4.063985","10.65.199.21","10.65.200.11","TCP","66","799  >  2049 [ACK] Seq=2233 Ack=69909 Win=31856 Len=0 TSval=32875004 TSecr=245432588"
"123","4.063991","10.65.200.11","10.65.199.21","RPC","1514","Continuation"
"124","4.064003","10.65.200.11","10.65.199.21","RPC","1514","Continuation"
"125","4.064009","10.65.199.21","10.65.200.11","TCP","66","799  >  2049 [ACK] Seq=2233 Ack=72805 Win=31856 Len=0 TSval=32875004 TSecr=245432588"
"126","4.064017","10.65.200.11","10.65.199.21","RPC","1514","Continuation"
"127","4.064028","10.65.200.11","10.65.199.21","RPC","1514","Continuation"
"128","4.064034","10.65.199.21","10.65.200.11","TCP","66","799  >  2049 [ACK] Seq=2233 Ack=75701 Win=31856 Len=0 TSval=32875004 TSecr=245432588"
"129","4.064042","10.65.200.11","10.65.199.21","RPC","1514","Continuation"
"130","4.064053","10.65.200.11","10.65.199.21","RPC","1514","Continuation"
"131","4.064059","10.65.199.21","10.65.200.11","TCP","66","799  >  2049 [ACK] Seq=2233 Ack=78597 Win=31856 Len=0 TSval=32875004 TSecr=245432588"
"132","4.064066","10.65.200.11","10.65.199.21","RPC","1514","Continuation"
"133","4.064078","10.65.200.11","10.65.199.21","RPC","1514","Continuation"
"134","4.064082","10.65.199.21","10.65.200.11","TCP","66","799  >  2049 [ACK] Seq=2233 Ack=81493 Win=31856 Len=0 TSval=32875004 TSecr=245432588"
"135","4.064092","10.65.200.11","10.65.199.21","RPC","1514","Continuation"
"136","4.064102","10.65.200.11","10.65.199.21","RPC","1514","Continuation"
"137","4.064107","10.65.199.21","10.65.200.11","TCP","66","799  >  2049 [ACK] Seq=2233 Ack=84389 Win=31856 Len=0 TSval=32875004 TSecr=245432588"
"138","4.064116","10.65.200.11","10.65.199.21","RPC","1514","Continuation"
"139","4.064127","10.65.200.11","10.65.199.21","RPC","1514","Continuation"
"140","4.064132","10.65.199.21","10.65.200.11","TCP","66","799  >  2049 [ACK] Seq=2233 Ack=87285 Win=31856 Len=0 TSval=32875004 TSecr=245432588"
"141","4.064141","10.65.200.11","10.65.199.21","RPC","1514","Continuation"
"142","4.064152","10.65.200.11","10.65.199.21","RPC","1514","Continuation"
"143","4.064158","10.65.199.21","10.65.200.11","TCP","66","799  >  2049 [ACK] Seq=2233 Ack=90181 Win=31856 Len=0 TSval=32875004 TSecr=245432588"
"144","4.064165","10.65.200.11","10.65.199.21","RPC","1514","Continuation"
"145","4.064176","10.65.200.11","10.65.199.21","RPC","1514","Continuation"
"146","4.064181","10.65.199.21","10.65.200.11","TCP","66","799  >  2049 [ACK] Seq=2233 Ack=93077 Win=31856 Len=0 TSval=32875004 TSecr=245432588"
"147","4.064190","10.65.200.11","10.65.199.21","RPC","1514","Continuation"
"148","4.064201","10.65.200.11","10.65.199.21","RPC","1514","Continuation"
"149","4.064206","10.65.199.21","10.65.200.11","TCP","66","799  >  2049 [ACK] Seq=2233 Ack=95973 Win=31856 Len=0 TSval=32875004 TSecr=245432588"
"150","4.064215","10.65.200.11","10.65.199.21","RPC","1514","Continuation"
"151","4.064225","10.65.200.11","10.65.199.21","RPC","1514","Continuation"
"152","4.064231","10.65.199.21","10.65.200.11","TCP","66","799  >  2049 [ACK] Seq=2233 Ack=98869 Win=31856 Len=0 TSval=32875004 TSecr=245432588"
"153","4.064234","10.65.200.11","10.65.199.21","RPC","1110","Continuation"
"154","4.064305","10.65.199.21","10.65.200.11","NFS","230","V3 READ Call (Reply In 190)[Packet size limited during capture]"
"155","4.065457","10.65.200.11","10.65.199.21","RPC","1514","Continuation"
"156","4.065479","10.65.199.21","10.65.200.11","NFS","558","V3 READ Call (Reply In 331)[Packet size limited during capture]"
"157","4.065469","10.65.200.11","10.65.199.21","RPC","1514","Continuation"
"158","4.065482","10.65.200.11","10.65.199.21","RPC","1514","Continuation"
"159","4.065499","10.65.199.21","10.65.200.11","TCP","66","799  >  2049 [ACK] Seq=2889 Ack=104257 Win=31856 Len=0 TSval=32875004 TSecr=245432589"
"160","4.065495","10.65.200.11","10.65.199.21","RPC","1514","Continuation"
"161","4.065508","10.65.200.11","10.65.199.21","RPC","1514","Continuation"
"162","4.065522","10.65.199.21","10.65.200.11","TCP","66","799  >  2049 [ACK] Seq=2889 Ack=107153 Win=31856 Len=0 TSval=32875004 TSecr=245432589"
"163","4.065519","10.65.200.11","10.65.199.21","RPC","1514","Continuation"
"164","4.065533","10.65.200.11","10.65.199.21","RPC","1514","Continuation"
"165","4.065540","10.65.199.21","10.65.200.11","TCP","66","799  >  2049 [ACK] Seq=2889 Ack=110049 Win=31856 Len=0 TSval=32875004 TSecr=245432589"
"166","4.065544","10.65.200.11","10.65.199.21","RPC","1514","Continuation"
"167","4.065557","10.65.200.11","10.65.199.21","RPC","1514","Continuation"
"168","4.065562","10.65.199.21","10.65.200.11","TCP","66","799  >  2049 [ACK] Seq=2889 Ack=112945 Win=31856 Len=0 TSval=32875004 TSecr=245432589"
"169","4.065570","10.65.200.11","10.65.199.21","RPC","1514","Continuation"
"170","4.065581","10.65.200.11","10.65.199.21","RPC","1514","Continuation"
"171","4.065589","10.65.199.21","10.65.200.11","TCP","66","799  >  2049 [ACK] Seq=2889 Ack=115841 Win=31856 Len=0 TSval=32875004 TSecr=245432589"
"172","4.065593","10.65.200.11","10.65.199.21","RPC","1514","Continuation"
"173","4.065606","10.65.200.11","10.65.199.21","RPC","1514","Continuation"
"174","4.065612","10.65.199.21","10.65.200.11","TCP","66","799  >  2049 [ACK] Seq=2889 Ack=118737 Win=31856 Len=0 TSval=32875004 TSecr=245432589"
"175","4.065619","10.65.200.11","10.65.199.21","RPC","1514","Continuation"
"176","4.065630","10.65.200.11","10.65.199.21","RPC","1514","Continuation"
"177","4.065647","10.65.199.21","10.65.200.11","TCP","66","799  >  2049 [ACK] Seq=2889 Ack=121633 Win=31856 Len=0 TSval=32875004 TSecr=245432589"
"178","4.065642","10.65.200.11","10.65.199.21","RPC","1514","Continuation"
"179","4.065656","10.65.200.11","10.65.199.21","RPC","1514","Continuation"
"180","4.065670","10.65.199.21","10.65.200.11","TCP","66","799  >  2049 [ACK] Seq=2889 Ack=124529 Win=31856 Len=0 TSval=32875004 TSecr=245432589"
"181","4.065667","10.65.200.11","10.65.199.21","RPC","1514","Continuation"
"182","4.065681","10.65.200.11","10.65.199.21","RPC","1514","Continuation"
"183","4.065688","10.65.199.21","10.65.200.11","TCP","66","799  >  2049 [ACK] Seq=2889 Ack=127425 Win=31856 Len=0 TSval=32875004 TSecr=245432589"
"184","4.065692","10.65.200.11","10.65.199.21","RPC","1514","Continuation"
"185","4.065704","10.65.200.11","10.65.199.21","RPC","1514","Continuation"
"186","4.065710","10.65.199.21","10.65.200.11","TCP","66","799  >  2049 [ACK] Seq=2889 Ack=130321 Win=31856 Len=0 TSval=32875004 TSecr=245432589"
"187","4.065717","10.65.200.11","10.65.199.21","RPC","1514","Continuation"
"188","4.065725","10.65.200.11","10.65.199.21","RPC","1110","Continuation"
"189","4.065740","10.65.199.21","10.65.200.11","TCP","66","799  >  2049 [ACK] Seq=2889 Ack=132813 Win=31856 Len=0 TSval=32875004 TSecr=245432589"
"190","4.067082","10.65.200.11","10.65.199.21","NFS","1514","V3 READ Reply (Call In 154)"
"191","4.067097","10.65.200.11","10.65.199.21","RPC","1514","Continuation"
"192","4.067102","10.65.199.21","10.65.200.11","TCP","66","799  >  2049 [ACK] Seq=2889 Ack=135709 Win=31856 Len=0 TSval=32875004 TSecr=245432591"
"193","4.067109","10.65.200.11","10.65.199.21","RPC","1514","Continuation"
"194","4.067120","10.65.200.11","10.65.199.21","RPC","1514","Continuation"
"195","4.067126","10.65.199.21","10.65.200.11","TCP","66","799  >  2049 [ACK] Seq=2889 Ack=138605 Win=31856 Len=0 TSval=32875004 TSecr=245432591"
"196","4.067134","10.65.200.11","10.65.199.21","RPC","1514","Continuation"
"197","4.067145","10.65.200.11","10.65.199.21","RPC","1514","Continuation"
"198","4.067151","10.65.199.21","10.65.200.11","TCP","66","799  >  2049 [ACK] Seq=2889 Ack=141501 Win=31856 Len=0 TSval=32875004 TSecr=245432591"
"199","4.067159","10.65.200.11","10.65.199.21","RPC","1514","Continuation"
"200","4.067170","10.65.200.11","10.65.199.21","RPC","1514","Continuation"
"201","4.067175","10.65.199.21","10.65.200.11","TCP","66","799  >  2049 [ACK] Seq=2889 Ack=144397 Win=31856 Len=0 TSval=32875004 TSecr=245432591"
"202","4.067184","10.65.200.11","10.65.199.21","RPC","1514","Continuation"
"203","4.067195","10.65.200.11","10.65.199.21","RPC","1514","Continuation"
"204","4.067200","10.65.199.21","10.65.200.11","TCP","66","799  >  2049 [ACK] Seq=2889 Ack=147293 Win=31856 Len=0 TSval=32875004 TSecr=245432591"
"205","4.067208","10.65.200.11","10.65.199.21","RPC","1514","Continuation"
"206","4.067219","10.65.200.11","10.65.199.21","RPC","1514","Continuation"
"207","4.067224","10.65.199.21","10.65.200.11","TCP","66","799  >  2049 [ACK] Seq=2889 Ack=150189 Win=31856 Len=0 TSval=32875004 TSecr=245432591"
"208","4.067233","10.65.200.11","10.65.199.21","RPC","1514","Continuation"
"209","4.067244","10.65.200.11","10.65.199.21","RPC","1514","Continuation"
"210","4.067249","10.65.199.21","10.65.200.11","TCP","66","799  >  2049 [ACK] Seq=2889 Ack=153085 Win=31856 Len=0 TSval=32875004 TSecr=245432591"
"211","4.067258","10.65.200.11","10.65.199.21","RPC","1514","Continuation"
"212","4.067269","10.65.200.11","10.65.199.21","RPC","1514","Continuation"
"213","4.067273","10.65.199.21","10.65.200.11","TCP","66","799  >  2049 [ACK] Seq=2889 Ack=155981 Win=31856 Len=0 TSval=32875004 TSecr=245432591"
"214","4.067282","10.65.200.11","10.65.199.21","RPC","1514","Continuation"
"215","4.067293","10.65.200.11","10.65.199.21","RPC","1514","Continuation"
"216","4.067298","10.65.199.21","10.65.200.11","TCP","66","799  >  2049 [ACK] Seq=2889 Ack=158877 Win=31856 Len=0 TSval=32875004 TSecr=245432591"
"217","4.067307","10.65.200.11","10.65.199.21","RPC","1514","Continuation"
"218","4.067322","10.65.200.11","10.65.199.21","RPC","1514","Continuation"
"219","4.067327","10.65.199.21","10.65.200.11","TCP","66","799  >  2049 [ACK] Seq=2889 Ack=161773 Win=31856 Len=0 TSval=32875004 TSecr=245432591"
"220","4.067330","10.65.200.11","10.65.199.21","RPC","1514","Continuation"
"221","4.067343","10.65.200.11","10.65.199.21","RPC","1514","Continuation"
"222","4.067354","10.65.199.21","10.65.200.11","TCP","66","799  >  2049 [ACK] Seq=2889 Ack=164669 Win=31856 Len=0 TSval=32875004 TSecr=245432591"
"223","4.067351","10.65.200.11","10.65.199.21","RPC","1110","Continuation"
"224","4.100643","10.65.199.21","10.65.200.11","TCP","66","799  >  2049 [ACK] Seq=2889 Ack=165713 Win=31856 Len=0 TSval=32875008 TSecr=245432591"
"225","4.100827","10.65.200.11","10.65.199.21","RPC","1514","Continuation"
"226","4.100841","10.65.200.11","10.65.199.21","RPC","1514","Continuation"
"227","4.100848","10.65.199.21","10.65.200.11","TCP","66","799  >  2049 [ACK] Seq=2889 Ack=168609 Win=31856 Len=0 TSval=32875008 TSecr=245432625"
"228","4.100854","10.65.200.11","10.65.199.21","RPC","1514","Continuation"
"229","4.100866","10.65.200.11","10.65.199.21","RPC","1514","Continuation"
"230","4.100872","10.65.199.21","10.65.200.11","TCP","66","799  >  2049 [ACK] Seq=2889 Ack=171505 Win=31856 Len=0 TSval=32875008 TSecr=245432625"
"231","4.100879","10.65.200.11","10.65.199.21","RPC","1514","Continuation"
"232","4.100891","10.65.200.11","10.65.199.21","RPC","1514","Continuation"
"233","4.100897","10.65.199.21","10.65.200.11","TCP","66","799  >  2049 [ACK] Seq=2889 Ack=174401 Win=31856 Len=0 TSval=32875008 TSecr=245432625"
"234","4.100904","10.65.200.11","10.65.199.21","RPC","1514","Continuation"
"235","4.100914","10.65.200.11","10.65.199.21","RPC","1514","Continuation"
"236","4.100920","10.65.199.21","10.65.200.11","TCP","66","799  >  2049 [ACK] Seq=2889 Ack=177297 Win=31856 Len=0 TSval=32875008 TSecr=245432625"
"237","4.100929","10.65.200.11","10.65.199.21","RPC","1514","Continuation"
"238","4.100940","10.65.200.11","10.65.199.21","RPC","1514","Continuation"
"239","4.100945","10.65.199.21","10.65.200.11","TCP","66","799  >  2049 [ACK] Seq=2889 Ack=180193 Win=31856 Len=0 TSval=32875008 TSecr=245432625"
"240","4.100953","10.65.200.11","10.65.199.21","RPC","1514","Continuation"
"241","4.100964","10.65.200.11","10.65.199.21","RPC","1514","Continuation"
"242","4.100969","10.65.199.21","10.65.200.11","TCP","66","799  >  2049 [ACK] Seq=2889 Ack=183089 Win=31856 Len=0 TSval=32875008 TSecr=245432625"
"243","4.100978","10.65.200.11","10.65.199.21","RPC","1514","Continuation"
"244","4.100989","10.65.200.11","10.65.199.21","RPC","1514","Continuation"
"245","4.100994","10.65.199.21","10.65.200.11","TCP","66","799  >  2049 [ACK] Seq=2889 Ack=185985 Win=31856 Len=0 TSval=32875008 TSecr=245432625"
"246","4.101002","10.65.200.11","10.65.199.21","RPC","1514","Continuation"
"247","4.101013","10.65.200.11","10.65.199.21","RPC","1514","Continuation"
"248","4.101019","10.65.199.21","10.65.200.11","TCP","66","799  >  2049 [ACK] Seq=2889 Ack=188881 Win=31856 Len=0 TSval=32875008 TSecr=245432625"
"249","4.101027","10.65.200.11","10.65.199.21","RPC","1514","Continuation"
"250","4.101038","10.65.200.11","10.65.199.21","RPC","1514","Continuation"
"251","4.101043","10.65.199.21","10.65.200.11","TCP","66","799  >  2049 [ACK] Seq=2889 Ack=191777 Win=31856 Len=0 TSval=32875008 TSecr=245432625"
"252","4.101052","10.65.200.11","10.65.199.21","RPC","1514","Continuation"
"253","4.101062","10.65.200.11","10.65.199.21","RPC","1514","Continuation"
"254","4.101067","10.65.199.21","10.65.200.11","TCP","66","799  >  2049 [ACK] Seq=2889 Ack=194673 Win=31856 Len=0 TSval=32875008 TSecr=245432625"
"255","4.101076","10.65.200.11","10.65.199.21","RPC","1514","Continuation"
"256","4.101087","10.65.200.11","10.65.199.21","RPC","1514","Continuation"
"257","4.101093","10.65.199.21","10.65.200.11","TCP","66","799  >  2049 [ACK] Seq=2889 Ack=197569 Win=31856 Len=0 TSval=32875008 TSecr=245432625"
"258","4.101095","10.65.200.11","10.65.199.21","RPC","1110","Continuation"
"259","4.101110","10.65.199.21","10.65.200.11","TCP","66","799  >  2049 [ACK] Seq=2889 Ack=198613 Win=31856 Len=0 TSval=32875008 TSecr=245432625"
"260","4.101335","10.65.200.11","10.65.199.21","NFS","1514","V3 READ Reply (Call In 86)"
"261","4.101348","10.65.200.11","10.65.199.21","RPC","1514","Continuation"
"262","4.101353","10.65.199.21","10.65.200.11","TCP","66","799  >  2049 [ACK] Seq=2889 Ack=201509 Win=31856 Len=0 TSval=32875008 TSecr=245432625"
"263","4.101362","10.65.200.11","10.65.199.21","RPC","1514","Continuation"
"264","4.101373","10.65.200.11","10.65.199.21","RPC","1514","Continuation"
"265","4.101378","10.65.199.21","10.65.200.11","TCP","66","799  >  2049 [ACK] Seq=2889 Ack=204405 Win=31856 Len=0 TSval=32875008 TSecr=245432625"
"266","4.101387","10.65.200.11","10.65.199.21","RPC","1514","Continuation"
"267","4.101398","10.65.200.11","10.65.199.21","RPC","1514","Continuation"
"268","4.101403","10.65.199.21","10.65.200.11","TCP","66","799  >  2049 [ACK] Seq=2889 Ack=207301 Win=31856 Len=0 TSval=32875008 TSecr=245432625"
"269","4.101412","10.65.200.11","10.65.199.21","RPC","1514","Continuation"
"270","4.101423","10.65.200.11","10.65.199.21","RPC","1514","Continuation"
"271","4.101428","10.65.199.21","10.65.200.11","TCP","66","799  >  2049 [ACK] Seq=2889 Ack=210197 Win=31856 Len=0 TSval=32875008 TSecr=245432625"
"272","4.101437","10.65.200.11","10.65.199.21","RPC","1514","Continuation"
"273","4.101448","10.65.200.11","10.65.199.21","RPC","1514","Continuation"
"274","4.101453","10.65.199.21","10.65.200.11","TCP","66","799  >  2049 [ACK] Seq=2889 Ack=213093 Win=31856 Len=0 TSval=32875008 TSecr=245432625"
"275","4.101461","10.65.200.11","10.65.199.21","RPC","1514","Continuation"
"276","4.101472","10.65.200.11","10.65.199.21","RPC","1514","Continuation"
"277","4.101477","10.65.199.21","10.65.200.11","TCP","66","799  >  2049 [ACK] Seq=2889 Ack=215989 Win=31856 Len=0 TSval=32875008 TSecr=245432625"
"278","4.101486","10.65.200.11","10.65.199.21","RPC","1514","Continuation"
"279","4.101496","10.65.200.11","10.65.199.21","RPC","1514","Continuation"
"280","4.101502","10.65.199.21","10.65.200.11","TCP","66","799  >  2049 [ACK] Seq=2889 Ack=218885 Win=31856 Len=0 TSval=32875008 TSecr=245432625"
"281","4.101510","10.65.200.11","10.65.199.21","RPC","1514","Continuation"
"282","4.101521","10.65.200.11","10.65.199.21","RPC","1514","Continuation"
"283","4.101526","10.65.199.21","10.65.200.11","TCP","66","799  >  2049 [ACK] Seq=2889 Ack=221781 Win=31856 Len=0 TSval=32875008 TSecr=245432625"
"284","4.101535","10.65.200.11","10.65.199.21","RPC","1514","Continuation"
"285","4.101546","10.65.200.11","10.65.199.21","RPC","1514","Continuation"
"286","4.101550","10.65.199.21","10.65.200.11","TCP","66","799  >  2049 [ACK] Seq=2889 Ack=224677 Win=31856 Len=0 TSval=32875008 TSecr=245432625"
"287","4.101559","10.65.200.11","10.65.199.21","RPC","1514","Continuation"
"288","4.101570","10.65.200.11","10.65.199.21","RPC","1514","Continuation"
"289","4.101575","10.65.199.21","10.65.200.11","TCP","66","799  >  2049 [ACK] Seq=2889 Ack=227573 Win=31856 Len=0 TSval=32875008 TSecr=245432625"
"290","4.101584","10.65.200.11","10.65.199.21","RPC","1514","Continuation"
"291","4.101596","10.65.200.11","10.65.199.21","RPC","1514","Continuation"
"292","4.101601","10.65.199.21","10.65.200.11","TCP","66","799  >  2049 [ACK] Seq=2889 Ack=230469 Win=31856 Len=0 TSval=32875008 TSecr=245432625"
"293","4.101603","10.65.200.11","10.65.199.21","RPC","1110","Continuation"
"294","4.101618","10.65.199.21","10.65.200.11","TCP","66","799  >  2049 [ACK] Seq=2889 Ack=231513 Win=31856 Len=0 TSval=32875008 TSecr=245432625"
"295","4.102079","10.65.200.11","10.65.199.21","RPC","1514","Continuation"
"296","4.102092","10.65.200.11","10.65.199.21","RPC","1514","Continuation"
"297","4.102099","10.65.199.21","10.65.200.11","TCP","66","799  >  2049 [ACK] Seq=2889 Ack=234409 Win=31856 Len=0 TSval=32875008 TSecr=245432626"
"298","4.102106","10.65.200.11","10.65.199.21","RPC","1514","Continuation"
"299","4.102118","10.65.200.11","10.65.199.21","RPC","1514","Continuation"
"300","4.102124","10.65.199.21","10.65.200.11","TCP","66","799  >  2049 [ACK] Seq=2889 Ack=237305 Win=31856 Len=0 TSval=32875008 TSecr=245432626"
"301","4.102132","10.65.200.11","10.65.199.21","RPC","1514","Continuation"
"302","4.102142","10.65.200.11","10.65.199.21","RPC","1514","Continuation"
"303","4.102147","10.65.199.21","10.65.200.11","TCP","66","799  >  2049 [ACK] Seq=2889 Ack=240201 Win=31856 Len=0 TSval=32875008 TSecr=245432626"
"304","4.102156","10.65.200.11","10.65.199.21","RPC","1514","Continuation"
"305","4.102167","10.65.200.11","10.65.199.21","RPC","1514","Continuation"
"306","4.102172","10.65.199.21","10.65.200.11","TCP","66","799  >  2049 [ACK] Seq=2889 Ack=243097 Win=31856 Len=0 TSval=32875008 TSecr=245432626"
"307","4.102180","10.65.200.11","10.65.199.21","RPC","1514","Continuation"
"308","4.102191","10.65.200.11","10.65.199.21","RPC","1514","Continuation"
"309","4.102196","10.65.199.21","10.65.200.11","TCP","66","799  >  2049 [ACK] Seq=2889 Ack=245993 Win=31856 Len=0 TSval=32875008 TSecr=245432626"
"310","4.102205","10.65.200.11","10.65.199.21","RPC","1514","Continuation"
"311","4.102216","10.65.200.11","10.65.199.21","RPC","1514","Continuation"
"312","4.102221","10.65.199.21","10.65.200.11","TCP","66","799  >  2049 [ACK] Seq=2889 Ack=248889 Win=31856 Len=0 TSval=32875008 TSecr=245432626"
"313","4.102231","10.65.200.11","10.65.199.21","RPC","1514","Continuation"
"314","4.102241","10.65.200.11","10.65.199.21","RPC","1514","Continuation"
"315","4.102246","10.65.199.21","10.65.200.11","TCP","66","799  >  2049 [ACK] Seq=2889 Ack=251785 Win=31856 Len=0 TSval=32875008 TSecr=245432626"
"316","4.102254","10.65.200.11","10.65.199.21","RPC","1514","Continuation"
"317","4.102265","10.65.200.11","10.65.199.21","RPC","1514","Continuation"
"318","4.102281","10.65.199.21","10.65.200.11","TCP","66","799  >  2049 [ACK] Seq=2889 Ack=254681 Win=31856 Len=0 TSval=32875008 TSecr=245432626"
"319","4.102277","10.65.200.11","10.65.199.21","RPC","1514","Continuation"
"320","4.102290","10.65.200.11","10.65.199.21","RPC","1514","Continuation"
"321","4.102299","10.65.199.21","10.65.200.11","TCP","66","799  >  2049 [ACK] Seq=2889 Ack=257577 Win=31856 Len=0 TSval=32875008 TSecr=245432626"
"322","4.102302","10.65.200.11","10.65.199.21","RPC","1514","Continuation"
"323","4.102315","10.65.200.11","10.65.199.21","RPC","1514","Continuation"
"324","4.102321","10.65.199.21","10.65.200.11","TCP","66","799  >  2049 [ACK] Seq=2889 Ack=260473 Win=31856 Len=0 TSval=32875008 TSecr=245432626"
"325","4.102328","10.65.200.11","10.65.199.21","RPC","1514","Continuation"
"326","4.102339","10.65.200.11","10.65.199.21","RPC","1514","Continuation"
"327","4.102344","10.65.199.21","10.65.200.11","TCP","66","799  >  2049 [ACK] Seq=2889 Ack=263369 Win=31856 Len=0 TSval=32875008 TSecr=245432626"
"328","4.102347","10.65.200.11","10.65.199.21","RPC","1110","Continuation"
"329","4.102361","10.65.199.21","10.65.200.11","TCP","66","799  >  2049 [ACK] Seq=2889 Ack=264413 Win=31856 Len=0 TSval=32875008 TSecr=245432626"
"330","4.102453","10.65.199.21","10.65.200.11","NFS","230","V3 READ Call (Reply In 401)[Packet size limited during capture]"
"331","4.102671","10.65.200.11","10.65.199.21","NFS","1514","V3 READ Reply (Call In 156)"
"332","4.102700","10.65.199.21","10.65.200.11","NFS","558","V3 READ Call (Reply In 437)[Packet size limited during capture]"
"333","4.102683","10.65.200.11","10.65.199.21","RPC","1514","Continuation"
"334","4.102695","10.65.200.11","10.65.199.21","RPC","1514","Continuation"
"335","4.102718","10.65.199.21","10.65.200.11","TCP","66","799  >  2049 [ACK] Seq=3545 Ack=268757 Win=31856 Len=0 TSval=32875008 TSecr=245432626"
"336","4.102709","10.65.200.11","10.65.199.21","RPC","1514","Continuation"
"337","4.102720","10.65.200.11","10.65.199.21","RPC","1514","Continuation"
"338","4.102740","10.65.199.21","10.65.200.11","TCP","66","799  >  2049 [ACK] Seq=3545 Ack=271653 Win=31856 Len=0 TSval=32875008 TSecr=245432626"
"339","4.102733","10.65.200.11","10.65.199.21","RPC","1514","Continuation"
"340","4.102745","10.65.200.11","10.65.199.21","RPC","1514","Continuation"
"341","4.102763","10.65.199.21","10.65.200.11","TCP","66","799  >  2049 [ACK] Seq=3545 Ack=274549 Win=31856 Len=0 TSval=32875008 TSecr=245432626"
"342","4.102760","10.65.200.11","10.65.199.21","RPC","1514","Continuation"
"343","4.102771","10.65.200.11","10.65.199.21","RPC","1514","Continuation"
"344","4.102786","10.65.199.21","10.65.200.11","TCP","66","799  >  2049 [ACK] Seq=3545 Ack=277445 Win=31856 Len=0 TSval=32875008 TSecr=245432626"
"345","4.102781","10.65.200.11","10.65.199.21","RPC","1514","Continuation"
"346","4.102795","10.65.200.11","10.65.199.21","RPC","1514","Continuation"
"347","4.102810","10.65.199.21","10.65.200.11","TCP","66","799  >  2049 [ACK] Seq=3545 Ack=280341 Win=31856 Len=0 TSval=32875008 TSecr=245432626"
"348","4.102806","10.65.200.11","10.65.199.21","RPC","1514","Continuation"
"349","4.102820","10.65.200.11","10.65.199.21","RPC","1514","Continuation"
"350","4.102833","10.65.199.21","10.65.200.11","TCP","66","799  >  2049 [ACK] Seq=3545 Ack=283237 Win=31856 Len=0 TSval=32875008 TSecr=245432626"
"351","4.102831","10.65.200.11","10.65.199.21","RPC","1514","Continuation"
"352","4.102844","10.65.200.11","10.65.199.21","RPC","1514","Continuation"
"353","4.102851","10.65.199.21","10.65.200.11","TCP","66","799  >  2049 [ACK] Seq=3545 Ack=286133 Win=31856 Len=0 TSval=32875008 TSecr=245432626"
"354","4.102855","10.65.200.11","10.65.199.21","RPC","1514","Continuation"
"355","4.102868","10.65.200.11","10.65.199.21","RPC","1514","Continuation"
"356","4.102876","10.65.199.21","10.65.200.11","TCP","66","799  >  2049 [ACK] Seq=3545 Ack=289029 Win=31856 Len=0 TSval=32875008 TSecr=245432626"
"357","4.102881","10.65.200.11","10.65.199.21","RPC","1514","Continuation"
"358","4.102893","10.65.200.11","10.65.199.21","RPC","1514","Continuation"
"359","4.102899","10.65.199.21","10.65.200.11","TCP","66","799  >  2049 [ACK] Seq=3545 Ack=291925 Win=31856 Len=0 TSval=32875008 TSecr=245432626"
"360","4.102906","10.65.200.11","10.65.199.21","RPC","1514","Continuation"
"361","4.102917","10.65.200.11","10.65.199.21","RPC","1514","Continuation"
"362","4.102923","10.65.199.21","10.65.200.11","TCP","66","799  >  2049 [ACK] Seq=3545 Ack=294821 Win=31856 Len=0 TSval=32875008 TSecr=245432627"
"363","4.102930","10.65.200.11","10.65.199.21","RPC","1514","Continuation"
"364","4.102938","10.65.200.11","10.65.199.21","RPC","1110","Continuation"
"365","4.102958","10.65.199.21","10.65.200.11","TCP","66","799  >  2049 [ACK] Seq=3545 Ack=297313 Win=31856 Len=0 TSval=32875008 TSecr=245432627"
"366","4.103243","10.65.200.11","10.65.199.21","RPC","1514","Continuation"
"367","4.103256","10.65.200.11","10.65.199.21","RPC","1514","Continuation"
"368","4.103264","10.65.199.21","10.65.200.11","TCP","66","799  >  2049 [ACK] Seq=3545 Ack=300209 Win=31856 Len=0 TSval=32875008 TSecr=245432627"
"369","4.103267","10.65.200.11","10.65.199.21","RPC","1514","Continuation"
"370","4.103280","10.65.200.11","10.65.199.21","RPC","1514","Continuation"
"371","4.103287","10.65.199.21","10.65.200.11","TCP","66","799  >  2049 [ACK] Seq=3545 Ack=303105 Win=31856 Len=0 TSval=32875008 TSecr=245432627"
"372","4.103293","10.65.200.11","10.65.199.21","RPC","1514","Continuation"
"373","4.103305","10.65.200.11","10.65.199.21","RPC","1514","Continuation"
"374","4.103311","10.65.199.21","10.65.200.11","TCP","66","799  >  2049 [ACK] Seq=3545 Ack=306001 Win=31856 Len=0 TSval=32875008 TSecr=245432627"
"375","4.103318","10.65.200.11","10.65.199.21","RPC","1514","Continuation"
"376","4.103329","10.65.200.11","10.65.199.21","RPC","1514","Continuation"
"377","4.103335","10.65.199.21","10.65.200.11","TCP","66","799  >  2049 [ACK] Seq=3545 Ack=308897 Win=31856 Len=0 TSval=32875008 TSecr=245432627"
"378","4.103343","10.65.200.11","10.65.199.21","RPC","1514","Continuation"
"379","4.103353","10.65.200.11","10.65.199.21","RPC","1514","Continuation"
"380","4.103358","10.65.199.21","10.65.200.11","TCP","66","799  >  2049 [ACK] Seq=3545 Ack=311793 Win=31856 Len=0 TSval=32875008 TSecr=245432627"
"381","4.103368","10.65.200.11","10.65.199.21","RPC","1514","Continuation"
"382","4.103379","10.65.200.11","10.65.199.21","RPC","1514","Continuation"
"383","4.103383","10.65.199.21","10.65.200.11","TCP","66","799  >  2049 [ACK] Seq=3545 Ack=314689 Win=31856 Len=0 TSval=32875008 TSecr=245432627"
"384","4.103393","10.65.200.11","10.65.199.21","RPC","1514","Continuation"
"385","4.103402","10.65.200.11","10.65.199.21","RPC","1514","Continuation"
"386","4.103407","10.65.199.21","10.65.200.11","TCP","66","799  >  2049 [ACK] Seq=3545 Ack=317585 Win=31856 Len=0 TSval=32875008 TSecr=245432627"
"387","4.103417","10.65.200.11","10.65.199.21","RPC","1514","Continuation"
"388","4.103427","10.65.200.11","10.65.199.21","RPC","1514","Continuation"
"389","4.103432","10.65.199.21","10.65.200.11","TCP","66","799  >  2049 [ACK] Seq=3545 Ack=320481 Win=31856 Len=0 TSval=32875008 TSecr=245432627"
