"No.","Time","Source","Destination","Protocol","Length","Info"
"1","0.000000000","127.0.0.1","127.0.0.1","HTTP","383","GET / HTTP/1.1 "
"2","0.000311154","127.0.0.1","127.0.0.1","TCP","83","80  >  47660 [PSH, ACK] Seq=1 Ack=318 Win=350 Len=17 TSval=3407717901 TSecr=3407717900 [TCP segment of a reassembled PDU]"
"3","0.000338512","127.0.0.1","127.0.0.1","TCP","104","80  >  47660 [PSH, ACK] Seq=18 Ack=318 Win=350 Len=38 TSval=3407717901 TSecr=3407717901 [TCP segment of a reassembled PDU]"
"4","0.000379313","127.0.0.1","127.0.0.1","TCP","103","80  >  47660 [PSH, ACK] Seq=56 Ack=318 Win=350 Len=37 TSval=3407717901 TSecr=3407717901 [TCP segment of a reassembled PDU]"
"5","0.000407565","127.0.0.1","127.0.0.1","TCP","68","HTTP/1.0 200 OK  [TCP segment of a reassembled PDU]"
"6","9.194182783","127.0.0.1","127.0.0.1","HTTP","392","GET /?path=foo HTTP/1.1 "
"7","9.194526597","127.0.0.1","127.0.0.1","TCP","86","80  >  47662 [PSH, ACK] Seq=1 Ack=327 Win=350 Len=20 TSval=3407727095 TSecr=3407727095 [TCP segment of a reassembled PDU]"
"8","9.194591897","127.0.0.1","127.0.0.1","TCP","104","80  >  47662 [PSH, ACK] Seq=21 Ack=327 Win=350 Len=38 TSval=3407727095 TSecr=3407727095 [TCP segment of a reassembled PDU]"
"9","9.194627047","127.0.0.1","127.0.0.1","TCP","103","80  >  47662 [PSH, ACK] Seq=59 Ack=327 Win=350 Len=37 TSval=3407727095 TSecr=3407727095 [TCP segment of a reassembled PDU]"
"10","9.194647752","127.0.0.1","127.0.0.1","TCP","81","80  >  47662 [PSH, ACK] Seq=96 Ack=327 Win=350 Len=15 TSval=3407727095 TSecr=3407727095 [TCP segment of a reassembled PDU]"
"11","9.194673906","127.0.0.1","127.0.0.1","TCP","68","HTTP/1.0 302 Found  [TCP segment of a reassembled PDU]"
"12","9.198745152","127.0.0.1","127.0.0.1","HTTP","386","GET /foo HTTP/1.1 "
"13","9.198965441","127.0.0.1","127.0.0.1","TCP","86","80  >  47664 [PSH, ACK] Seq=1 Ack=321 Win=350 Len=20 TSval=3407727099 TSecr=3407727099 [TCP segment of a reassembled PDU]"
"14","9.199001482","127.0.0.1","127.0.0.1","TCP","104","80  >  47664 [PSH, ACK] Seq=21 Ack=321 Win=350 Len=38 TSval=3407727099 TSecr=3407727099 [TCP segment of a reassembled PDU]"
"15","9.199034689","127.0.0.1","127.0.0.1","TCP","103","80  >  47664 [PSH, ACK] Seq=59 Ack=321 Win=350 Len=37 TSval=3407727099 TSecr=3407727099 [TCP segment of a reassembled PDU]"
"16","9.199055885","127.0.0.1","127.0.0.1","TCP","79","80  >  47664 [PSH, ACK] Seq=96 Ack=321 Win=350 Len=13 TSval=3407727099 TSecr=3407727099 [TCP segment of a reassembled PDU]"
"17","9.199074910","127.0.0.1","127.0.0.1","TCP","68","HTTP/1.0 302 Found  [TCP segment of a reassembled PDU]"
"18","9.208661628","127.0.0.1","127.0.0.1","HTTP","383","GET / HTTP/1.1 "
"19","9.208912876","127.0.0.1","127.0.0.1","TCP","83","80  >  47666 [PSH, ACK] Seq=1 Ack=318 Win=350 Len=17 TSval=3407727109 TSecr=3407727109 [TCP segment of a reassembled PDU]"
"20","9.208949264","127.0.0.1","127.0.0.1","TCP","104","80  >  47666 [PSH, ACK] Seq=18 Ack=318 Win=350 Len=38 TSval=3407727109 TSecr=3407727109 [TCP segment of a reassembled PDU]"
"21","9.208980798","127.0.0.1","127.0.0.1","TCP","103","80  >  47666 [PSH, ACK] Seq=56 Ack=318 Win=350 Len=37 TSval=3407727109 TSecr=3407727109 [TCP segment of a reassembled PDU]"
"22","9.209000788","127.0.0.1","127.0.0.1","TCP","68","HTTP/1.0 200 OK  [TCP segment of a reassembled PDU]"
"23","52529.660045184","127.0.0.1","127.0.0.1","HTTP","402","GET /my/path?path=foobar HTTP/1.1 "
"24","52529.660430759","127.0.0.1","127.0.0.1","TCP","86","80  >  47862 [PSH, ACK] Seq=1 Ack=337 Win=350 Len=20 TSval=3460247561 TSecr=3460247560 [TCP segment of a reassembled PDU]"
"25","52529.660459380","127.0.0.1","127.0.0.1","TCP","104","80  >  47862 [PSH, ACK] Seq=21 Ack=337 Win=350 Len=38 TSval=3460247561 TSecr=3460247561 [TCP segment of a reassembled PDU]"
"26","52529.660491579","127.0.0.1","127.0.0.1","TCP","103","80  >  47862 [PSH, ACK] Seq=59 Ack=337 Win=350 Len=37 TSval=3460247561 TSecr=3460247561 [TCP segment of a reassembled PDU]"
"27","52529.660511994","127.0.0.1","127.0.0.1","TCP","84","80  >  47862 [PSH, ACK] Seq=96 Ack=337 Win=350 Len=18 TSval=3460247561 TSecr=3460247561 [TCP segment of a reassembled PDU]"
"28","52529.660530635","127.0.0.1","127.0.0.1","TCP","68","HTTP/1.0 302 Found  [TCP segment of a reassembled PDU]"
"29","52529.668559538","127.0.0.1","127.0.0.1","HTTP","392","GET /my/foobar HTTP/1.1 "
"30","52529.668944748","127.0.0.1","127.0.0.1","TCP","86","80  >  47864 [PSH, ACK] Seq=1 Ack=327 Win=350 Len=20 TSval=3460247569 TSecr=3460247569 [TCP segment of a reassembled PDU]"
"31","52529.668980514","127.0.0.1","127.0.0.1","TCP","104","80  >  47864 [PSH, ACK] Seq=21 Ack=327 Win=350 Len=38 TSval=3460247569 TSecr=3460247569 [TCP segment of a reassembled PDU]"
"32","52529.669013600","127.0.0.1","127.0.0.1","TCP","103","80  >  47864 [PSH, ACK] Seq=59 Ack=327 Win=350 Len=37 TSval=3460247569 TSecr=3460247569 [TCP segment of a reassembled PDU]"
"33","52529.669034462","127.0.0.1","127.0.0.1","TCP","79","80  >  47864 [PSH, ACK] Seq=96 Ack=327 Win=350 Len=13 TSval=3460247569 TSecr=3460247569 [TCP segment of a reassembled PDU]"
"34","52529.669060936","127.0.0.1","127.0.0.1","TCP","68","HTTP/1.0 302 Found  [TCP segment of a reassembled PDU]"
"35","52529.677161751","127.0.0.1","127.0.0.1","HTTP","383","GET / HTTP/1.1 "
"36","52529.677594207","127.0.0.1","127.0.0.1","TCP","83","80  >  47866 [PSH, ACK] Seq=1 Ack=318 Win=350 Len=17 TSval=3460247578 TSecr=3460247577 [TCP segment of a reassembled PDU]"
"37","52529.677622689","127.0.0.1","127.0.0.1","TCP","104","80  >  47866 [PSH, ACK] Seq=18 Ack=318 Win=350 Len=38 TSval=3460247578 TSecr=3460247578 [TCP segment of a reassembled PDU]"
"38","52529.677693503","127.0.0.1","127.0.0.1","TCP","103","80  >  47866 [PSH, ACK] Seq=56 Ack=318 Win=350 Len=37 TSval=3460247578 TSecr=3460247578 [TCP segment of a reassembled PDU]"
"39","52529.677732978","127.0.0.1","127.0.0.1","TCP","68","HTTP/1.0 200 OK  [TCP segment of a reassembled PDU]"
"40","52555.828797589","127.0.0.1","127.0.0.1","HTTP","402","GET /my/path?path=foobar HTTP/1.1 "
"41","52555.829192073","127.0.0.1","127.0.0.1","TCP","86","80  >  47870 [PSH, ACK] Seq=1 Ack=337 Win=350 Len=20 TSval=3460273730 TSecr=3460273729 [TCP segment of a reassembled PDU]"
"42","52555.829222667","127.0.0.1","127.0.0.1","TCP","104","80  >  47870 [PSH, ACK] Seq=21 Ack=337 Win=350 Len=38 TSval=3460273730 TSecr=3460273730 [TCP segment of a reassembled PDU]"
"43","52555.829263079","127.0.0.1","127.0.0.1","TCP","103","80  >  47870 [PSH, ACK] Seq=59 Ack=337 Win=350 Len=37 TSval=3460273730 TSecr=3460273730 [TCP segment of a reassembled PDU]"
"44","52555.829283904","127.0.0.1","127.0.0.1","TCP","84","80  >  47870 [PSH, ACK] Seq=96 Ack=337 Win=350 Len=18 TSval=3460273730 TSecr=3460273730 [TCP segment of a reassembled PDU]"
"45","52555.829302872","127.0.0.1","127.0.0.1","TCP","68","HTTP/1.0 302 Found  [TCP segment of a reassembled PDU]"
"46","52555.833324146","127.0.0.1","127.0.0.1","HTTP","392","GET /my/foobar HTTP/1.1 "
"47","52555.833625421","127.0.0.1","127.0.0.1","TCP","86","80  >  47872 [PSH, ACK] Seq=1 Ack=327 Win=350 Len=20 TSval=3460273734 TSecr=3460273734 [TCP segment of a reassembled PDU]"
"48","52555.833651587","127.0.0.1","127.0.0.1","TCP","104","80  >  47872 [PSH, ACK] Seq=21 Ack=327 Win=350 Len=38 TSval=3460273734 TSecr=3460273734 [TCP segment of a reassembled PDU]"
"49","52555.833718916","127.0.0.1","127.0.0.1","TCP","103","80  >  47872 [PSH, ACK] Seq=59 Ack=327 Win=350 Len=37 TSval=3460273734 TSecr=3460273734 [TCP segment of a reassembled PDU]"
"50","52555.833740029","127.0.0.1","127.0.0.1","TCP","79","80  >  47872 [PSH, ACK] Seq=96 Ack=327 Win=350 Len=13 TSval=3460273734 TSecr=3460273734 [TCP segment of a reassembled PDU]"
"51","52555.833759052","127.0.0.1","127.0.0.1","TCP","68","HTTP/1.0 302 Found  [TCP segment of a reassembled PDU]"
"52","52555.839636187","127.0.0.1","127.0.0.1","HTTP","383","GET / HTTP/1.1 "
"53","52555.840206468","127.0.0.1","127.0.0.1","TCP","83","80  >  47874 [PSH, ACK] Seq=1 Ack=318 Win=350 Len=17 TSval=3460273741 TSecr=3460273740 [TCP segment of a reassembled PDU]"
"54","52555.840449546","127.0.0.1","127.0.0.1","TCP","104","80  >  47874 [PSH, ACK] Seq=18 Ack=318 Win=350 Len=38 TSval=3460273741 TSecr=3460273741 [TCP segment of a reassembled PDU]"
"55","52555.840489916","127.0.0.1","127.0.0.1","TCP","103","80  >  47874 [PSH, ACK] Seq=56 Ack=318 Win=350 Len=37 TSval=3460273741 TSecr=3460273741 [TCP segment of a reassembled PDU]"
"56","52555.840511354","127.0.0.1","127.0.0.1","TCP","68","HTTP/1.0 200 OK  [TCP segment of a reassembled PDU]"
"57","52843.379837232","127.0.0.1","127.0.0.1","HTTP","392","GET /?path=g:h HTTP/1.1 "
"58","52843.380133088","127.0.0.1","127.0.0.1","TCP","86","80  >  47880 [PSH, ACK] Seq=1 Ack=327 Win=350 Len=20 TSval=3460561280 TSecr=3460561280 [TCP segment of a reassembled PDU]"
"59","52843.380168293","127.0.0.1","127.0.0.1","TCP","104","80  >  47880 [PSH, ACK] Seq=21 Ack=327 Win=350 Len=38 TSval=3460561280 TSecr=3460561280 [TCP segment of a reassembled PDU]"
"60","52843.380217600","127.0.0.1","127.0.0.1","TCP","103","80  >  47880 [PSH, ACK] Seq=59 Ack=327 Win=350 Len=37 TSval=3460561281 TSecr=3460561281 [TCP segment of a reassembled PDU]"
"61","52843.380249883","127.0.0.1","127.0.0.1","TCP","81","80  >  47880 [PSH, ACK] Seq=96 Ack=327 Win=350 Len=15 TSval=3460561281 TSecr=3460561281 [TCP segment of a reassembled PDU]"
"62","52843.380271972","127.0.0.1","127.0.0.1","TCP","68","HTTP/1.0 302 Found  [TCP segment of a reassembled PDU]"
"63","52848.826174812","127.0.0.1","127.0.0.1","HTTP","383","GET / HTTP/1.1 "
"64","52848.826474504","127.0.0.1","127.0.0.1","TCP","83","80  >  47882 [PSH, ACK] Seq=1 Ack=318 Win=350 Len=17 TSval=3460566727 TSecr=3460566727 [TCP segment of a reassembled PDU]"
"65","52848.826512585","127.0.0.1","127.0.0.1","TCP","104","80  >  47882 [PSH, ACK] Seq=18 Ack=318 Win=350 Len=38 TSval=3460566727 TSecr=3460566727 [TCP segment of a reassembled PDU]"
"66","52848.826566392","127.0.0.1","127.0.0.1","TCP","103","80  >  47882 [PSH, ACK] Seq=56 Ack=318 Win=350 Len=37 TSval=3460566727 TSecr=3460566727 [TCP segment of a reassembled PDU]"
"67","52848.826598138","127.0.0.1","127.0.0.1","TCP","68","HTTP/1.0 200 OK  [TCP segment of a reassembled PDU]"
"68","52893.056996358","127.0.0.1","127.0.0.1","HTTP","401","GET /b/c/d;p?q&path=g:h HTTP/1.1 "
"69","52893.057386761","127.0.0.1","127.0.0.1","TCP","86","80  >  47884 [PSH, ACK] Seq=1 Ack=336 Win=350 Len=20 TSval=3460610958 TSecr=3460610957 [TCP segment of a reassembled PDU]"
"70","52893.057415451","127.0.0.1","127.0.0.1","TCP","104","80  >  47884 [PSH, ACK] Seq=21 Ack=336 Win=350 Len=38 TSval=3460610958 TSecr=3460610958 [TCP segment of a reassembled PDU]"
"71","52893.057448701","127.0.0.1","127.0.0.1","TCP","103","80  >  47884 [PSH, ACK] Seq=59 Ack=336 Win=350 Len=37 TSval=3460610958 TSecr=3460610958 [TCP segment of a reassembled PDU]"
"72","52893.057469888","127.0.0.1","127.0.0.1","TCP","81","80  >  47884 [PSH, ACK] Seq=96 Ack=336 Win=350 Len=15 TSval=3460610958 TSecr=3460610958 [TCP segment of a reassembled PDU]"
"73","52893.057488793","127.0.0.1","127.0.0.1","TCP","68","HTTP/1.0 302 Found  [TCP segment of a reassembled PDU]"
"74","52898.284971289","127.0.0.1","127.0.0.1","HTTP","399","GET /b/c/d;p?q&path=g HTTP/1.1 "
"75","52898.285645638","127.0.0.1","127.0.0.1","TCP","86","80  >  47886 [PSH, ACK] Seq=1 Ack=334 Win=350 Len=20 TSval=3460616186 TSecr=3460616185 [TCP segment of a reassembled PDU]"
"76","52898.285679857","127.0.0.1","127.0.0.1","TCP","104","80  >  47886 [PSH, ACK] Seq=21 Ack=334 Win=350 Len=38 TSval=3460616186 TSecr=3460616186 [TCP segment of a reassembled PDU]"
"77","52898.285716552","127.0.0.1","127.0.0.1","TCP","103","80  >  47886 [PSH, ACK] Seq=59 Ack=334 Win=350 Len=37 TSval=3460616186 TSecr=3460616186 [TCP segment of a reassembled PDU]"
"78","52898.285739930","127.0.0.1","127.0.0.1","TCP","79","80  >  47886 [PSH, ACK] Seq=96 Ack=334 Win=350 Len=13 TSval=3460616186 TSecr=3460616186 [TCP segment of a reassembled PDU]"
"79","52898.285761360","127.0.0.1","127.0.0.1","TCP","68","HTTP/1.0 302 Found  [TCP segment of a reassembled PDU]"
"80","52898.299174670","127.0.0.1","127.0.0.1","HTTP","388","GET /b/c/g HTTP/1.1 "
"81","52898.301780894","127.0.0.1","127.0.0.1","TCP","86","80  >  47888 [PSH, ACK] Seq=1 Ack=323 Win=350 Len=20 TSval=3460616202 TSecr=3460616200 [TCP segment of a reassembled PDU]"
"82","52898.302106537","127.0.0.1","127.0.0.1","TCP","104","80  >  47888 [PSH, ACK] Seq=21 Ack=323 Win=350 Len=38 TSval=3460616202 TSecr=3460616202 [TCP segment of a reassembled PDU]"
"83","52898.302147183","127.0.0.1","127.0.0.1","TCP","103","80  >  47888 [PSH, ACK] Seq=59 Ack=323 Win=350 Len=37 TSval=3460616202 TSecr=3460616202 [TCP segment of a reassembled PDU]"
"84","52898.302170757","127.0.0.1","127.0.0.1","TCP","79","80  >  47888 [PSH, ACK] Seq=96 Ack=323 Win=350 Len=13 TSval=3460616202 TSecr=3460616202 [TCP segment of a reassembled PDU]"
"85","52898.302192192","127.0.0.1","127.0.0.1","TCP","68","HTTP/1.0 302 Found  [TCP segment of a reassembled PDU]"
"86","52898.309125842","127.0.0.1","127.0.0.1","HTTP","383","GET / HTTP/1.1 "
"87","52898.309501856","127.0.0.1","127.0.0.1","TCP","83","80  >  47890 [PSH, ACK] Seq=1 Ack=318 Win=350 Len=17 TSval=3460616210 TSecr=3460616209 [TCP segment of a reassembled PDU]"
"88","52898.309537677","127.0.0.1","127.0.0.1","TCP","104","80  >  47890 [PSH, ACK] Seq=18 Ack=318 Win=350 Len=38 TSval=3460616210 TSecr=3460616210 [TCP segment of a reassembled PDU]"
"89","52898.309592914","127.0.0.1","127.0.0.1","TCP","103","80  >  47890 [PSH, ACK] Seq=56 Ack=318 Win=350 Len=37 TSval=3460616210 TSecr=3460616210 [TCP segment of a reassembled PDU]"
"90","52898.309622078","127.0.0.1","127.0.0.1","TCP","68","HTTP/1.0 200 OK  [TCP segment of a reassembled PDU]"
"91","52910.270235385","127.0.0.1","127.0.0.1","HTTP","401","GET /b/c/d;p?q&path=./g HTTP/1.1 "
"92","52910.270520369","127.0.0.1","127.0.0.1","TCP","86","80  >  47892 [PSH, ACK] Seq=1 Ack=336 Win=350 Len=20 TSval=3460628171 TSecr=3460628171 [TCP segment of a reassembled PDU]"
"93","52910.270555463","127.0.0.1","127.0.0.1","TCP","104","80  >  47892 [PSH, ACK] Seq=21 Ack=336 Win=350 Len=38 TSval=3460628171 TSecr=3460628171 [TCP segment of a reassembled PDU]"
"94","52910.270589265","127.0.0.1","127.0.0.1","TCP","103","80  >  47892 [PSH, ACK] Seq=59 Ack=336 Win=350 Len=37 TSval=3460628171 TSecr=3460628171 [TCP segment of a reassembled PDU]"
"95","52910.270617220","127.0.0.1","127.0.0.1","TCP","81","80  >  47892 [PSH, ACK] Seq=96 Ack=336 Win=350 Len=15 TSval=3460628171 TSecr=3460628171 [TCP segment of a reassembled PDU]"
"96","52910.270637007","127.0.0.1","127.0.0.1","TCP","68","HTTP/1.0 302 Found  [TCP segment of a reassembled PDU]"
"97","52910.274919494","127.0.0.1","127.0.0.1","HTTP","388","GET /b/c/g HTTP/1.1 "
"98","52910.275194391","127.0.0.1","127.0.0.1","TCP","86","80  >  47894 [PSH, ACK] Seq=1 Ack=323 Win=350 Len=20 TSval=3460628176 TSecr=3460628175 [TCP segment of a reassembled PDU]"
"99","52910.275224338","127.0.0.1","127.0.0.1","TCP","104","80  >  47894 [PSH, ACK] Seq=21 Ack=323 Win=350 Len=38 TSval=3460628176 TSecr=3460628176 [TCP segment of a reassembled PDU]"
"100","52910.275257394","127.0.0.1","127.0.0.1","TCP","103","80  >  47894 [PSH, ACK] Seq=59 Ack=323 Win=350 Len=37 TSval=3460628176 TSecr=3460628176 [TCP segment of a reassembled PDU]"
"101","52910.275277755","127.0.0.1","127.0.0.1","TCP","79","80  >  47894 [PSH, ACK] Seq=96 Ack=323 Win=350 Len=13 TSval=3460628176 TSecr=3460628176 [TCP segment of a reassembled PDU]"
"102","52910.275296265","127.0.0.1","127.0.0.1","TCP","68","HTTP/1.0 302 Found  [TCP segment of a reassembled PDU]"
"103","52910.277196790","127.0.0.1","127.0.0.1","HTTP","383","GET / HTTP/1.1 "
"104","52910.277415582","127.0.0.1","127.0.0.1","TCP","83","80  >  47896 [PSH, ACK] Seq=1 Ack=318 Win=350 Len=17 TSval=3460628178 TSecr=3460628178 [TCP segment of a reassembled PDU]"
"105","52910.277448523","127.0.0.1","127.0.0.1","TCP","104","80  >  47896 [PSH, ACK] Seq=18 Ack=318 Win=350 Len=38 TSval=3460628178 TSecr=3460628178 [TCP segment of a reassembled PDU]"
"106","52910.277481003","127.0.0.1","127.0.0.1","TCP","103","80  >  47896 [PSH, ACK] Seq=56 Ack=318 Win=350 Len=37 TSval=3460628178 TSecr=3460628178 [TCP segment of a reassembled PDU]"
"107","52910.277501699","127.0.0.1","127.0.0.1","TCP","68","HTTP/1.0 200 OK  [TCP segment of a reassembled PDU]"
"108","52916.833731255","127.0.0.1","127.0.0.1","HTTP","400","GET /b/c/d;p?q&path=g/ HTTP/1.1 "
"109","52916.834069824","127.0.0.1","127.0.0.1","TCP","86","80  >  47898 [PSH, ACK] Seq=1 Ack=335 Win=350 Len=20 TSval=3460634734 TSecr=3460634734 [TCP segment of a reassembled PDU]"
"110","52916.834111660","127.0.0.1","127.0.0.1","TCP","104","80  >  47898 [PSH, ACK] Seq=21 Ack=335 Win=350 Len=38 TSval=3460634734 TSecr=3460634734 [TCP segment of a reassembled PDU]"
"111","52916.834146399","127.0.0.1","127.0.0.1","TCP","103","80  >  47898 [PSH, ACK] Seq=59 Ack=335 Win=350 Len=37 TSval=3460634734 TSecr=3460634734 [TCP segment of a reassembled PDU]"
"112","52916.834167805","127.0.0.1","127.0.0.1","TCP","80","80  >  47898 [PSH, ACK] Seq=96 Ack=335 Win=350 Len=14 TSval=3460634734 TSecr=3460634734 [TCP segment of a reassembled PDU]"
"113","52916.834194605","127.0.0.1","127.0.0.1","TCP","68","HTTP/1.0 302 Found  [TCP segment of a reassembled PDU]"
"114","52916.861925590","127.0.0.1","127.0.0.1","HTTP","389","GET /b/c/g/ HTTP/1.1 "
"115","52916.862359958","127.0.0.1","127.0.0.1","TCP","86","80  >  47900 [PSH, ACK] Seq=1 Ack=324 Win=350 Len=20 TSval=3460634763 TSecr=3460634762 [TCP segment of a reassembled PDU]"
"116","52916.862438886","127.0.0.1","127.0.0.1","TCP","104","80  >  47900 [PSH, ACK] Seq=21 Ack=324 Win=350 Len=38 TSval=3460634763 TSecr=3460634763 [TCP segment of a reassembled PDU]"
"117","52916.862484681","127.0.0.1","127.0.0.1","TCP","103","80  >  47900 [PSH, ACK] Seq=59 Ack=324 Win=350 Len=37 TSval=3460634763 TSecr=3460634763 [TCP segment of a reassembled PDU]"
"118","52916.862509806","127.0.0.1","127.0.0.1","TCP","79","80  >  47900 [PSH, ACK] Seq=96 Ack=324 Win=350 Len=13 TSval=3460634763 TSecr=3460634763 [TCP segment of a reassembled PDU]"
"119","52916.862532014","127.0.0.1","127.0.0.1","TCP","68","HTTP/1.0 302 Found  [TCP segment of a reassembled PDU]"
"120","52916.879033274","127.0.0.1","127.0.0.1","HTTP","383","GET / HTTP/1.1 "
"121","52916.879268590","127.0.0.1","127.0.0.1","TCP","83","80  >  47902 [PSH, ACK] Seq=1 Ack=318 Win=350 Len=17 TSval=3460634780 TSecr=3460634779 [TCP segment of a reassembled PDU]"
"122","52916.879304740","127.0.0.1","127.0.0.1","TCP","104","80  >  47902 [PSH, ACK] Seq=18 Ack=318 Win=350 Len=38 TSval=3460634780 TSecr=3460634780 [TCP segment of a reassembled PDU]"
"123","52916.879341364","127.0.0.1","127.0.0.1","TCP","103","80  >  47902 [PSH, ACK] Seq=56 Ack=318 Win=350 Len=37 TSval=3460634780 TSecr=3460634780 [TCP segment of a reassembled PDU]"
"124","52916.879364397","127.0.0.1","127.0.0.1","TCP","68","HTTP/1.0 200 OK  [TCP segment of a reassembled PDU]"
"125","52922.715357576","127.0.0.1","127.0.0.1","HTTP","400","GET /b/c/d;p?q&path=/g HTTP/1.1 "
"126","52922.715677812","127.0.0.1","127.0.0.1","TCP","86","80  >  47904 [PSH, ACK] Seq=1 Ack=335 Win=350 Len=20 TSval=3460640616 TSecr=3460640616 [TCP segment of a reassembled PDU]"
"127","52922.715713635","127.0.0.1","127.0.0.1","TCP","104","80  >  47904 [PSH, ACK] Seq=21 Ack=335 Win=350 Len=38 TSval=3460640616 TSecr=3460640616 [TCP segment of a reassembled PDU]"
"128","52922.715747444","127.0.0.1","127.0.0.1","TCP","103","80  >  47904 [PSH, ACK] Seq=59 Ack=335 Win=350 Len=37 TSval=3460640616 TSecr=3460640616 [TCP segment of a reassembled PDU]"
"129","52922.715768088","127.0.0.1","127.0.0.1","TCP","80","80  >  47904 [PSH, ACK] Seq=96 Ack=335 Win=350 Len=14 TSval=3460640616 TSecr=3460640616 [TCP segment of a reassembled PDU]"
"130","52922.715794462","127.0.0.1","127.0.0.1","TCP","68","HTTP/1.0 302 Found  [TCP segment of a reassembled PDU]"
"131","52922.723936955","127.0.0.1","127.0.0.1","HTTP","384","GET /g HTTP/1.1 "
"132","52922.724343002","127.0.0.1","127.0.0.1","TCP","86","80  >  47906 [PSH, ACK] Seq=1 Ack=319 Win=350 Len=20 TSval=3460640625 TSecr=3460640624 [TCP segment of a reassembled PDU]"
"133","52922.724380008","127.0.0.1","127.0.0.1","TCP","104","80  >  47906 [PSH, ACK] Seq=21 Ack=319 Win=350 Len=38 TSval=3460640625 TSecr=3460640625 [TCP segment of a reassembled PDU]"
"134","52922.724414156","127.0.0.1","127.0.0.1","TCP","103","80  >  47906 [PSH, ACK] Seq=59 Ack=319 Win=350 Len=37 TSval=3460640625 TSecr=3460640625 [TCP segment of a reassembled PDU]"
"135","52922.724434865","127.0.0.1","127.0.0.1","TCP","79","80  >  47906 [PSH, ACK] Seq=96 Ack=319 Win=350 Len=13 TSval=3460640625 TSecr=3460640625 [TCP segment of a reassembled PDU]"
"136","52922.724453531","127.0.0.1","127.0.0.1","TCP","68","HTTP/1.0 302 Found  [TCP segment of a reassembled PDU]"
"137","52922.750878652","127.0.0.1","127.0.0.1","HTTP","383","GET / HTTP/1.1 "
"138","52922.751114137","127.0.0.1","127.0.0.1","TCP","83","80  >  47908 [PSH, ACK] Seq=1 Ack=318 Win=350 Len=17 TSval=3460640651 TSecr=3460640651 [TCP segment of a reassembled PDU]"
"139","52922.751180293","127.0.0.1","127.0.0.1","TCP","104","80  >  47908 [PSH, ACK] Seq=18 Ack=318 Win=350 Len=38 TSval=3460640652 TSecr=3460640651 [TCP segment of a reassembled PDU]"
"140","52922.751216563","127.0.0.1","127.0.0.1","TCP","103","80  >  47908 [PSH, ACK] Seq=56 Ack=318 Win=350 Len=37 TSval=3460640652 TSecr=3460640652 [TCP segment of a reassembled PDU]"
"141","52922.751247338","127.0.0.1","127.0.0.1","TCP","68","HTTP/1.0 200 OK  [TCP segment of a reassembled PDU]"
"142","52928.760163126","127.0.0.1","127.0.0.1","HTTP","401","GET /b/c/d;p?q&path=//g HTTP/1.1 "
"143","52928.760716315","127.0.0.1","127.0.0.1","TCP","86","80  >  47910 [PSH, ACK] Seq=1 Ack=336 Win=350 Len=20 TSval=3460646661 TSecr=3460646660 [TCP segment of a reassembled PDU]"
"144","52928.760751179","127.0.0.1","127.0.0.1","TCP","104","80  >  47910 [PSH, ACK] Seq=21 Ack=336 Win=350 Len=38 TSval=3460646661 TSecr=3460646661 [TCP segment of a reassembled PDU]"
"145","52928.760800755","127.0.0.1","127.0.0.1","TCP","103","80  >  47910 [PSH, ACK] Seq=59 Ack=336 Win=350 Len=37 TSval=3460646661 TSecr=3460646661 [TCP segment of a reassembled PDU]"
"146","52928.760828795","127.0.0.1","127.0.0.1","TCP","81","80  >  47910 [PSH, ACK] Seq=96 Ack=336 Win=350 Len=15 TSval=3460646661 TSecr=3460646661 [TCP segment of a reassembled PDU]"
"147","52928.760848381","127.0.0.1","127.0.0.1","TCP","68","HTTP/1.0 302 Found  [TCP segment of a reassembled PDU]"
"148","52952.469470531","127.0.0.1","127.0.0.1","HTTP","400","GET /b/c/d;p?q&path=?y HTTP/1.1 "
"149","52952.469706865","127.0.0.1","127.0.0.1","TCP","86","80  >  47914 [PSH, ACK] Seq=1 Ack=335 Win=350 Len=20 TSval=3460670370 TSecr=3460670370 [TCP segment of a reassembled PDU]"
"150","52952.469742056","127.0.0.1","127.0.0.1","TCP","104","80  >  47914 [PSH, ACK] Seq=21 Ack=335 Win=350 Len=38 TSval=3460670370 TSecr=3460670370 [TCP segment of a reassembled PDU]"
"151","52952.469775509","127.0.0.1","127.0.0.1","TCP","103","80  >  47914 [PSH, ACK] Seq=59 Ack=335 Win=350 Len=37 TSval=3460670370 TSecr=3460670370 [TCP segment of a reassembled PDU]"
"152","52952.469796861","127.0.0.1","127.0.0.1","TCP","80","80  >  47914 [PSH, ACK] Seq=96 Ack=335 Win=350 Len=14 TSval=3460670370 TSecr=3460670370 [TCP segment of a reassembled PDU]"
"153","52952.469815851","127.0.0.1","127.0.0.1","TCP","68","HTTP/1.0 302 Found  [TCP segment of a reassembled PDU]"
"154","52952.477728488","127.0.0.1","127.0.0.1","HTTP","392","GET /b/c/d;p?y HTTP/1.1 "
"155","52952.478059985","127.0.0.1","127.0.0.1","TCP","86","80  >  47916 [PSH, ACK] Seq=1 Ack=327 Win=350 Len=20 TSval=3460670378 TSecr=3460670378 [TCP segment of a reassembled PDU]"
"156","52952.478094194","127.0.0.1","127.0.0.1","TCP","104","80  >  47916 [PSH, ACK] Seq=21 Ack=327 Win=350 Len=38 TSval=3460670378 TSecr=3460670378 [TCP segment of a reassembled PDU]"
"157","52952.478128267","127.0.0.1","127.0.0.1","TCP","103","80  >  47916 [PSH, ACK] Seq=59 Ack=327 Win=350 Len=37 TSval=3460670378 TSecr=3460670378 [TCP segment of a reassembled PDU]"
"158","52952.478149369","127.0.0.1","127.0.0.1","TCP","79","80  >  47916 [PSH, ACK] Seq=96 Ack=327 Win=350 Len=13 TSval=3460670378 TSecr=3460670378 [TCP segment of a reassembled PDU]"
"159","52952.478168842","127.0.0.1","127.0.0.1","TCP","68","HTTP/1.0 302 Found  [TCP segment of a reassembled PDU]"
"160","52952.487824120","127.0.0.1","127.0.0.1","HTTP","383","GET / HTTP/1.1 "
"161","52952.488076298","127.0.0.1","127.0.0.1","TCP","83","80  >  47918 [PSH, ACK] Seq=1 Ack=318 Win=350 Len=17 TSval=3460670388 TSecr=3460670388 [TCP segment of a reassembled PDU]"
"162","52952.488109660","127.0.0.1","127.0.0.1","TCP","104","80  >  47918 [PSH, ACK] Seq=18 Ack=318 Win=350 Len=38 TSval=3460670388 TSecr=3460670388 [TCP segment of a reassembled PDU]"
"163","52952.488141943","127.0.0.1","127.0.0.1","TCP","103","80  >  47918 [PSH, ACK] Seq=56 Ack=318 Win=350 Len=37 TSval=3460670388 TSecr=3460670388 [TCP segment of a reassembled PDU]"
"164","52952.488162583","127.0.0.1","127.0.0.1","TCP","68","HTTP/1.0 200 OK  [TCP segment of a reassembled PDU]"
"165","52961.684882752","127.0.0.1","127.0.0.1","HTTP","401","GET /b/c/d;p?q&path=g?y HTTP/1.1 "
"166","52961.685321806","127.0.0.1","127.0.0.1","TCP","86","80  >  47922 [PSH, ACK] Seq=1 Ack=336 Win=350 Len=20 TSval=3460679586 TSecr=3460679585 [TCP segment of a reassembled PDU]"
"167","52961.685357065","127.0.0.1","127.0.0.1","TCP","104","80  >  47922 [PSH, ACK] Seq=21 Ack=336 Win=350 Len=38 TSval=3460679586 TSecr=3460679586 [TCP segment of a reassembled PDU]"
"168","52961.685408430","127.0.0.1","127.0.0.1","TCP","103","80  >  47922 [PSH, ACK] Seq=59 Ack=336 Win=350 Len=37 TSval=3460679586 TSecr=3460679586 [TCP segment of a reassembled PDU]"
"169","52961.685437410","127.0.0.1","127.0.0.1","TCP","81","80  >  47922 [PSH, ACK] Seq=96 Ack=336 Win=350 Len=15 TSval=3460679586 TSecr=3460679586 [TCP segment of a reassembled PDU]"
"170","52961.685456712","127.0.0.1","127.0.0.1","TCP","68","HTTP/1.0 302 Found  [TCP segment of a reassembled PDU]"
"171","52961.688146249","127.0.0.1","127.0.0.1","HTTP","390","GET /b/c/g?y HTTP/1.1 "
"172","52961.690570753","127.0.0.1","127.0.0.1","TCP","86","80  >  47924 [PSH, ACK] Seq=1 Ack=325 Win=350 Len=20 TSval=3460679591 TSecr=3460679588 [TCP segment of a reassembled PDU]"
"173","52961.690621120","127.0.0.1","127.0.0.1","TCP","104","80  >  47924 [PSH, ACK] Seq=21 Ack=325 Win=350 Len=38 TSval=3460679591 TSecr=3460679591 [TCP segment of a reassembled PDU]"
"174","52961.690655305","127.0.0.1","127.0.0.1","TCP","103","80  >  47924 [PSH, ACK] Seq=59 Ack=325 Win=350 Len=37 TSval=3460679591 TSecr=3460679591 [TCP segment of a reassembled PDU]"
"175","52961.690683924","127.0.0.1","127.0.0.1","TCP","79","80  >  47924 [PSH, ACK] Seq=96 Ack=325 Win=350 Len=13 TSval=3460679591 TSecr=3460679591 [TCP segment of a reassembled PDU]"
"176","52961.690700233","127.0.0.1","127.0.0.1","TCP","68","HTTP/1.0 302 Found  [TCP segment of a reassembled PDU]"
"177","52961.699096411","127.0.0.1","127.0.0.1","HTTP","383","GET / HTTP/1.1 "
"178","52961.699471250","127.0.0.1","127.0.0.1","TCP","83","80  >  47926 [PSH, ACK] Seq=1 Ack=318 Win=350 Len=17 TSval=3460679600 TSecr=3460679599 [TCP segment of a reassembled PDU]"
"179","52961.699528818","127.0.0.1","127.0.0.1","TCP","104","80  >  47926 [PSH, ACK] Seq=18 Ack=318 Win=350 Len=38 TSval=3460679600 TSecr=3460679600 [TCP segment of a reassembled PDU]"
"180","52961.699559634","127.0.0.1","127.0.0.1","TCP","103","80  >  47926 [PSH, ACK] Seq=56 Ack=318 Win=350 Len=37 TSval=3460679600 TSecr=3460679600 [TCP segment of a reassembled PDU]"
"181","52961.699590291","127.0.0.1","127.0.0.1","TCP","68","HTTP/1.0 200 OK  [TCP segment of a reassembled PDU]"
"182","52972.731189234","127.0.0.1","127.0.0.1","HTTP","398","GET /b/c/d;p?q&path= HTTP/1.1 "
"183","52972.731434041","127.0.0.1","127.0.0.1","TCP","86","80  >  47930 [PSH, ACK] Seq=1 Ack=333 Win=350 Len=20 TSval=3460690632 TSecr=3460690632 [TCP segment of a reassembled PDU]"
"184","52972.731471994","127.0.0.1","127.0.0.1","TCP","104","80  >  47930 [PSH, ACK] Seq=21 Ack=333 Win=350 Len=38 TSval=3460690632 TSecr=3460690632 [TCP segment of a reassembled PDU]"
"185","52972.731507766","127.0.0.1","127.0.0.1","TCP","103","80  >  47930 [PSH, ACK] Seq=59 Ack=333 Win=350 Len=37 TSval=3460690632 TSecr=3460690632 [TCP segment of a reassembled PDU]"
"186","52972.731538084","127.0.0.1","127.0.0.1","TCP","79","80  >  47930 [PSH, ACK] Seq=96 Ack=333 Win=350 Len=13 TSval=3460690632 TSecr=3460690632 [TCP segment of a reassembled PDU]"
"187","52972.731585564","127.0.0.1","127.0.0.1","TCP","68","HTTP/1.0 302 Found  [TCP segment of a reassembled PDU]"
"188","52972.749952027","127.0.0.1","127.0.0.1","HTTP","383","GET / HTTP/1.1 "
"189","52972.750251230","127.0.0.1","127.0.0.1","TCP","83","80  >  47932 [PSH, ACK] Seq=1 Ack=318 Win=350 Len=17 TSval=3460690651 TSecr=3460690650 [TCP segment of a reassembled PDU]"
"190","52972.750286793","127.0.0.1","127.0.0.1","TCP","104","80  >  47932 [PSH, ACK] Seq=18 Ack=318 Win=350 Len=38 TSval=3460690651 TSecr=3460690651 [TCP segment of a reassembled PDU]"
"191","52972.750323115","127.0.0.1","127.0.0.1","TCP","103","80  >  47932 [PSH, ACK] Seq=56 Ack=318 Win=350 Len=37 TSval=3460690651 TSecr=3460690651 [TCP segment of a reassembled PDU]"
"192","52972.750354528","127.0.0.1","127.0.0.1","TCP","68","HTTP/1.0 200 OK  [TCP segment of a reassembled PDU]"
"193","52979.552060757","127.0.0.1","127.0.0.1","HTTP","399","GET /b/c/d;p?q&path=g HTTP/1.1 "
"194","52979.553362211","127.0.0.1","127.0.0.1","TCP","86","80  >  47934 [PSH, ACK] Seq=1 Ack=334 Win=350 Len=20 TSval=3460697454 TSecr=3460697452 [TCP segment of a reassembled PDU]"
"195","52979.553400489","127.0.0.1","127.0.0.1","TCP","104","80  >  47934 [PSH, ACK] Seq=21 Ack=334 Win=350 Len=38 TSval=3460697454 TSecr=3460697454 [TCP segment of a reassembled PDU]"
"196","52979.553444434","127.0.0.1","127.0.0.1","TCP","103","80  >  47934 [PSH, ACK] Seq=59 Ack=334 Win=350 Len=37 TSval=3460697454 TSecr=3460697454 [TCP segment of a reassembled PDU]"
"197","52979.553475303","127.0.0.1","127.0.0.1","TCP","79","80  >  47934 [PSH, ACK] Seq=96 Ack=334 Win=350 Len=13 TSval=3460697454 TSecr=3460697454 [TCP segment of a reassembled PDU]"
"198","52979.553497289","127.0.0.1","127.0.0.1","TCP","68","HTTP/1.0 302 Found  [TCP segment of a reassembled PDU]"
"199","52979.578947170","127.0.0.1","127.0.0.1","HTTP","388","GET /b/c/g HTTP/1.1 "
"200","52979.581476018","127.0.0.1","127.0.0.1","TCP","86","80  >  47936 [PSH, ACK] Seq=1 Ack=323 Win=350 Len=20 TSval=3460697482 TSecr=3460697479 [TCP segment of a reassembled PDU]"
"201","52979.581514169","127.0.0.1","127.0.0.1","TCP","104","80  >  47936 [PSH, ACK] Seq=21 Ack=323 Win=350 Len=38 TSval=3460697482 TSecr=3460697482 [TCP segment of a reassembled PDU]"
"202","52979.581581740","127.0.0.1","127.0.0.1","TCP","103","80  >  47936 [PSH, ACK] Seq=59 Ack=323 Win=350 Len=37 TSval=3460697482 TSecr=3460697482 [TCP segment of a reassembled PDU]"
"203","52979.581605574","127.0.0.1","127.0.0.1","TCP","79","80  >  47936 [PSH, ACK] Seq=96 Ack=323 Win=350 Len=13 TSval=3460697482 TSecr=3460697482 [TCP segment of a reassembled PDU]"
"204","52979.581624495","127.0.0.1","127.0.0.1","TCP","68","HTTP/1.0 302 Found  [TCP segment of a reassembled PDU]"
"205","52979.586863253","127.0.0.1","127.0.0.1","HTTP","383","GET / HTTP/1.1 "
"206","52979.588265600","127.0.0.1","127.0.0.1","TCP","83","80  >  47938 [PSH, ACK] Seq=1 Ack=318 Win=350 Len=17 TSval=3460697489 TSecr=3460697487 [TCP segment of a reassembled PDU]"
"207","52979.588308100","127.0.0.1","127.0.0.1","TCP","104","80  >  47938 [PSH, ACK] Seq=18 Ack=318 Win=350 Len=38 TSval=3460697489 TSecr=3460697489 [TCP segment of a reassembled PDU]"
"208","52979.588343179","127.0.0.1","127.0.0.1","TCP","103","80  >  47938 [PSH, ACK] Seq=56 Ack=318 Win=350 Len=37 TSval=3460697489 TSecr=3460697489 [TCP segment of a reassembled PDU]"
"209","52979.588372360","127.0.0.1","127.0.0.1","TCP","68","HTTP/1.0 200 OK  [TCP segment of a reassembled PDU]"
"210","52993.537584982","127.0.0.1","127.0.0.1","HTTP","401","GET /b/c/d;p?q&path=g?y HTTP/1.1 "
"211","52993.538136586","127.0.0.1","127.0.0.1","TCP","86","80  >  47944 [PSH, ACK] Seq=1 Ack=336 Win=350 Len=20 TSval=3460711438 TSecr=3460711438 [TCP segment of a reassembled PDU]"
"212","52993.538176617","127.0.0.1","127.0.0.1","TCP","104","80  >  47944 [PSH, ACK] Seq=21 Ack=336 Win=350 Len=38 TSval=3460711439 TSecr=3460711438 [TCP segment of a reassembled PDU]"
"213","52993.538228172","127.0.0.1","127.0.0.1","TCP","103","80  >  47944 [PSH, ACK] Seq=59 Ack=336 Win=350 Len=37 TSval=3460711439 TSecr=3460711439 [TCP segment of a reassembled PDU]"
"214","52993.538250826","127.0.0.1","127.0.0.1","TCP","81","80  >  47944 [PSH, ACK] Seq=96 Ack=336 Win=350 Len=15 TSval=3460711439 TSecr=3460711439 [TCP segment of a reassembled PDU]"
"215","52993.538270916","127.0.0.1","127.0.0.1","TCP","68","HTTP/1.0 302 Found  [TCP segment of a reassembled PDU]"
"216","52993.551613678","127.0.0.1","127.0.0.1","HTTP","390","GET /b/c/g?y HTTP/1.1 "
"217","52993.552688873","127.0.0.1","127.0.0.1","TCP","86","80  >  47946 [PSH, ACK] Seq=1 Ack=325 Win=350 Len=20 TSval=3460711453 TSecr=3460711452 [TCP segment of a reassembled PDU]"
"218","52993.552728326","127.0.0.1","127.0.0.1","TCP","104","80  >  47946 [PSH, ACK] Seq=21 Ack=325 Win=350 Len=38 TSval=3460711453 TSecr=3460711453 [TCP segment of a reassembled PDU]"
"219","52993.552765711","127.0.0.1","127.0.0.1","TCP","103","80  >  47946 [PSH, ACK] Seq=59 Ack=325 Win=350 Len=37 TSval=3460711453 TSecr=3460711453 [TCP segment of a reassembled PDU]"
"220","52993.552796207","127.0.0.1","127.0.0.1","TCP","79","80  >  47946 [PSH, ACK] Seq=96 Ack=325 Win=350 Len=13 TSval=3460711453 TSecr=3460711453 [TCP segment of a reassembled PDU]"
"221","52993.552814221","127.0.0.1","127.0.0.1","TCP","68","HTTP/1.0 302 Found  [TCP segment of a reassembled PDU]"
"222","52993.573327701","127.0.0.1","127.0.0.1","HTTP","383","GET / HTTP/1.1 "
"223","52993.573851317","127.0.0.1","127.0.0.1","TCP","83","80  >  47948 [PSH, ACK] Seq=1 Ack=318 Win=350 Len=17 TSval=3460711474 TSecr=3460711474 [TCP segment of a reassembled PDU]"
"224","52993.573908419","127.0.0.1","127.0.0.1","TCP","104","80  >  47948 [PSH, ACK] Seq=18 Ack=318 Win=350 Len=38 TSval=3460711474 TSecr=3460711474 [TCP segment of a reassembled PDU]"
"225","52993.573949544","127.0.0.1","127.0.0.1","TCP","103","80  >  47948 [PSH, ACK] Seq=56 Ack=318 Win=350 Len=37 TSval=3460711474 TSecr=3460711474 [TCP segment of a reassembled PDU]"
"226","52993.573972915","127.0.0.1","127.0.0.1","TCP","68","HTTP/1.0 200 OK  [TCP segment of a reassembled PDU]"
"227","53002.933611783","127.0.0.1","127.0.0.1","HTTP","400","GET /b/c/d;p?q&path=;x HTTP/1.1 "
"228","53002.933966808","127.0.0.1","127.0.0.1","TCP","86","80  >  47952 [PSH, ACK] Seq=1 Ack=335 Win=350 Len=20 TSval=3460720834 TSecr=3460720834 [TCP segment of a reassembled PDU]"
"229","53002.933999756","127.0.0.1","127.0.0.1","TCP","104","80  >  47952 [PSH, ACK] Seq=21 Ack=335 Win=350 Len=38 TSval=3460720834 TSecr=3460720834 [TCP segment of a reassembled PDU]"
"230","53002.934039955","127.0.0.1","127.0.0.1","TCP","103","80  >  47952 [PSH, ACK] Seq=59 Ack=335 Win=350 Len=37 TSval=3460720834 TSecr=3460720834 [TCP segment of a reassembled PDU]"
"231","53002.934066222","127.0.0.1","127.0.0.1","TCP","79","80  >  47952 [PSH, ACK] Seq=96 Ack=335 Win=350 Len=13 TSval=3460720834 TSecr=3460720834 [TCP segment of a reassembled PDU]"
"232","53002.934081444","127.0.0.1","127.0.0.1","TCP","68","HTTP/1.0 302 Found  [TCP segment of a reassembled PDU]"
"233","53002.966866044","127.0.0.1","127.0.0.1","HTTP","383","GET / HTTP/1.1 "
"234","53002.967198144","127.0.0.1","127.0.0.1","TCP","83","80  >  47954 [PSH, ACK] Seq=1 Ack=318 Win=350 Len=17 TSval=3460720868 TSecr=3460720867 [TCP segment of a reassembled PDU]"
"235","53002.967233883","127.0.0.1","127.0.0.1","TCP","104","80  >  47954 [PSH, ACK] Seq=18 Ack=318 Win=350 Len=38 TSval=3460720868 TSecr=3460720868 [TCP segment of a reassembled PDU]"
"236","53002.967269599","127.0.0.1","127.0.0.1","TCP","103","80  >  47954 [PSH, ACK] Seq=56 Ack=318 Win=350 Len=37 TSval=3460720868 TSecr=3460720868 [TCP segment of a reassembled PDU]"
"237","53002.967292371","127.0.0.1","127.0.0.1","TCP","68","HTTP/1.0 200 OK  [TCP segment of a reassembled PDU]"
"238","53006.941524360","127.0.0.1","127.0.0.1","HTTP","401","GET /b/c/d;p?q&path=g;x HTTP/1.1 "
"239","53006.941956704","127.0.0.1","127.0.0.1","TCP","86","80  >  47956 [PSH, ACK] Seq=1 Ack=336 Win=350 Len=20 TSval=3460724842 TSecr=3460724842 [TCP segment of a reassembled PDU]"
"240","53006.941988281","127.0.0.1","127.0.0.1","TCP","104","80  >  47956 [PSH, ACK] Seq=21 Ack=336 Win=350 Len=38 TSval=3460724842 TSecr=3460724842 [TCP segment of a reassembled PDU]"
"241","53006.942024855","127.0.0.1","127.0.0.1","TCP","103","80  >  47956 [PSH, ACK] Seq=59 Ack=336 Win=350 Len=37 TSval=3460724842 TSecr=3460724842 [TCP segment of a reassembled PDU]"
"242","53006.942048005","127.0.0.1","127.0.0.1","TCP","79","80  >  47956 [PSH, ACK] Seq=96 Ack=336 Win=350 Len=13 TSval=3460724842 TSecr=3460724842 [TCP segment of a reassembled PDU]"
"243","53006.942069421","127.0.0.1","127.0.0.1","TCP","68","HTTP/1.0 302 Found  [TCP segment of a reassembled PDU]"
"244","53006.961935385","127.0.0.1","127.0.0.1","HTTP","388","GET /b/c/g HTTP/1.1 "
"245","53006.962367723","127.0.0.1","127.0.0.1","TCP","86","80  >  47958 [PSH, ACK] Seq=1 Ack=323 Win=350 Len=20 TSval=3460724863 TSecr=3460724862 [TCP segment of a reassembled PDU]"
"246","53006.962398993","127.0.0.1","127.0.0.1","TCP","104","80  >  47958 [PSH, ACK] Seq=21 Ack=323 Win=350 Len=38 TSval=3460724863 TSecr=3460724863 [TCP segment of a reassembled PDU]"
"247","53006.962717164","127.0.0.1","127.0.0.1","TCP","103","80  >  47958 [PSH, ACK] Seq=59 Ack=323 Win=350 Len=37 TSval=3460724863 TSecr=3460724863 [TCP segment of a reassembled PDU]"
"248","53006.962742914","127.0.0.1","127.0.0.1","TCP","79","80  >  47958 [PSH, ACK] Seq=96 Ack=323 Win=350 Len=13 TSval=3460724863 TSecr=3460724863 [TCP segment of a reassembled PDU]"
"249","53006.962764738","127.0.0.1","127.0.0.1","TCP","68","HTTP/1.0 302 Found  [TCP segment of a reassembled PDU]"
"250","53006.971807606","127.0.0.1","127.0.0.1","HTTP","383","GET / HTTP/1.1 "
"251","53006.972127716","127.0.0.1","127.0.0.1","TCP","83","80  >  47960 [PSH, ACK] Seq=1 Ack=318 Win=350 Len=17 TSval=3460724872 TSecr=3460724872 [TCP segment of a reassembled PDU]"
"252","53006.972160005","127.0.0.1","127.0.0.1","TCP","104","80  >  47960 [PSH, ACK] Seq=18 Ack=318 Win=350 Len=38 TSval=3460724872 TSecr=3460724872 [TCP segment of a reassembled PDU]"
"253","53006.972197977","127.0.0.1","127.0.0.1","TCP","103","80  >  47960 [PSH, ACK] Seq=56 Ack=318 Win=350 Len=37 TSval=3460724873 TSecr=3460724872 [TCP segment of a reassembled PDU]"
"254","53006.972258746","127.0.0.1","127.0.0.1","TCP","68","HTTP/1.0 200 OK  [TCP segment of a reassembled PDU]"
"255","53018.507040692","127.0.0.1","127.0.0.1","HTTP","403","GET /b/c/d;p?q&path=g;x?y HTTP/1.1 "
"256","53018.507423720","127.0.0.1","127.0.0.1","TCP","86","80  >  47964 [PSH, ACK] Seq=1 Ack=338 Win=350 Len=20 TSval=3460736408 TSecr=3460736407 [TCP segment of a reassembled PDU]"
"257","53018.507456517","127.0.0.1","127.0.0.1","TCP","104","80  >  47964 [PSH, ACK] Seq=21 Ack=338 Win=350 Len=38 TSval=3460736408 TSecr=3460736408 [TCP segment of a reassembled PDU]"
"258","53018.507489330","127.0.0.1","127.0.0.1","TCP","103","80  >  47964 [PSH, ACK] Seq=59 Ack=338 Win=350 Len=37 TSval=3460736408 TSecr=3460736408 [TCP segment of a reassembled PDU]"
"259","53018.507509009","127.0.0.1","127.0.0.1","TCP","79","80  >  47964 [PSH, ACK] Seq=96 Ack=338 Win=350 Len=13 TSval=3460736408 TSecr=3460736408 [TCP segment of a reassembled PDU]"
"260","53018.507534311","127.0.0.1","127.0.0.1","TCP","68","HTTP/1.0 302 Found  [TCP segment of a reassembled PDU]"
"261","53018.514964197","127.0.0.1","127.0.0.1","HTTP","388","GET /b/c/g HTTP/1.1 "
"262","53018.516238709","127.0.0.1","127.0.0.1","TCP","86","80  >  47966 [PSH, ACK] Seq=1 Ack=323 Win=350 Len=20 TSval=3460736417 TSecr=3460736415 [TCP segment of a reassembled PDU]"
"263","53018.516282356","127.0.0.1","127.0.0.1","TCP","104","80  >  47966 [PSH, ACK] Seq=21 Ack=323 Win=350 Len=38 TSval=3460736417 TSecr=3460736417 [TCP segment of a reassembled PDU]"
"264","53018.516315838","127.0.0.1","127.0.0.1","TCP","103","80  >  47966 [PSH, ACK] Seq=59 Ack=323 Win=350 Len=37 TSval=3460736417 TSecr=3460736417 [TCP segment of a reassembled PDU]"
"265","53018.516343024","127.0.0.1","127.0.0.1","TCP","79","80  >  47966 [PSH, ACK] Seq=96 Ack=323 Win=350 Len=13 TSval=3460736417 TSecr=3460736417 [TCP segment of a reassembled PDU]"
"266","53018.516362539","127.0.0.1","127.0.0.1","TCP","68","HTTP/1.0 302 Found  [TCP segment of a reassembled PDU]"
"267","53018.528998100","127.0.0.1","127.0.0.1","HTTP","383","GET / HTTP/1.1 "
"268","53018.529548230","127.0.0.1","127.0.0.1","TCP","83","80  >  47968 [PSH, ACK] Seq=1 Ack=318 Win=350 Len=17 TSval=3460736430 TSecr=3460736429 [TCP segment of a reassembled PDU]"
"269","53018.529584715","127.0.0.1","127.0.0.1","TCP","104","80  >  47968 [PSH, ACK] Seq=18 Ack=318 Win=350 Len=38 TSval=3460736430 TSecr=3460736430 [TCP segment of a reassembled PDU]"
"270","53018.529620538","127.0.0.1","127.0.0.1","TCP","103","80  >  47968 [PSH, ACK] Seq=56 Ack=318 Win=350 Len=37 TSval=3460736430 TSecr=3460736430 [TCP segment of a reassembled PDU]"
"271","53018.529650166","127.0.0.1","127.0.0.1","TCP","68","HTTP/1.0 200 OK  [TCP segment of a reassembled PDU]"
