Time,Source,Destination,Protocol,Length,Info
2617.567105,2800:480:ff50:503::e,2800:484:b384:c80a:f81c:f268:6f0b:c2f4,TCP,1514,443  >  61093 [ACK] Seq=284308340 Ack=475306 Win=1259264 Len=1440 [TCP segment of a reassembled PDU]
1662.224088,2800:484:b384:c80a:f81c:f268:6f0b:c2f4,2800:3f0:4005:407::200e,TCP,1514,59745  >  443 [ACK] Seq=2311578 Ack=1017989 Win=512 Len=1440 [TCP segment of a reassembled PDU]
2249.990456,2800:480:ff50:503::e,2800:484:b384:c80a:f81c:f268:6f0b:c2f4,TCP,1514,443  >  61093 [ACK] Seq=218340411 Ack=365552 Win=983808 Len=1440 [TCP segment of a reassembled PDU]
2322.138315,2800:480:ff50:503::e,2800:484:b384:c80a:f81c:f268:6f0b:c2f4,TCP,1514,443  >  61093 [ACK] Seq=227657348 Ack=381243 Win=1024256 Len=1440 [TCP segment of a reassembled PDU]
124.083471,20.189.173.13,192.168.20.26,TCP,60,443  >  60703 [ACK] Seq=14438 Ack=160893 Win=525568 Len=0
886.966851,2800:480:ff50:503::e,2800:484:b384:c80a:f81c:f268:6f0b:c2f4,TCP,1514,443  >  61093 [ACK] Seq=11541944 Ack=18514 Win=112896 Len=1440 [TCP segment of a reassembled PDU]
1572.927267,2800:484:b384:c80a:f81c:f268:6f0b:c2f4,2800:480:ff50:503::e,TCP,74,61093  >  443 [ACK] Seq=195380 Ack=118366804 Win=264960 Len=0
1687.906275,2800:480:ff50:503::e,2800:484:b384:c80a:f81c:f268:6f0b:c2f4,TCP,1514,"443  >  61093 [PSH, ACK] Seq=135058132 Ack=224497 Win=631808 Len=1440 [TCP segment of a reassembled PDU]"
2219.080027,2800:480:ff50:503::e,2800:484:b384:c80a:f81c:f268:6f0b:c2f4,TCP,1514,"443  >  61093 [PSH, ACK] Seq=214201604 Ack=358839 Win=967936 Len=1440 [TCP segment of a reassembled PDU]"
25.10123,13.107.21.200,192.168.137.147,TCP,66,"443  >  62469 [SYN, ACK] Seq=0 Ack=1 Win=14600 Len=0 MSS=1460 SACK_PERM WS=128"
200.319019,2800:480:ff50:b1::b536:a098,2800:484:b384:c80a:f81c:f268:6f0b:c2f4,TCP,1514,"443  >  60974 [PSH, ACK] Seq=430136 Ack=4546 Win=64128 Len=1440 [TCP segment of a reassembled PDU]"
1652.984885,2800:3f0:4005:40b::2005,2800:484:b384:c80a:f81c:f268:6f0b:c2f4,TCP,74,443  >  61236 [ACK] Seq=2719785 Ack=314158 Win=856832 Len=0
1148.384131,2800:484:b384:c80a:f81c:f268:6f0b:c2f4,2800:480:ff50:503::e,TCP,74,61093  >  443 [ACK] Seq=90078 Ack=54166964 Win=264960 Len=0
1001.307213,2800:480:ff50:503::e,2800:484:b384:c80a:f81c:f268:6f0b:c2f4,TCP,1514,"443  >  61093 [PSH, ACK] Seq=29519421 Ack=49854 Win=193536 Len=1440 [TCP segment of a reassembled PDU]"
89.750377,192.168.18.1,192.168.18.46,TCP,66,"53  >  59246 [SYN, ACK] Seq=0 Ack=1 Win=14600 Len=0 MSS=1460 SACK_PERM WS=4"
1872.073906,2800:480:ff50:503::e,2800:484:b384:c80a:f81c:f268:6f0b:c2f4,TCP,1514,443  >  61093 [ACK] Seq=161762335 Ack=269305 Win=741632 Len=1440 [TCP segment of a reassembled PDU]
287.428036,2800:484:b384:c80a:f81c:f268:6f0b:c2f4,2800:480:ff50:503::e,TCP,74,61028  >  443 [ACK] Seq=27280 Ack=11670891 Win=529920 Len=0
1730.369539,2800:484:b384:c80a:f81c:f268:6f0b:c2f4,2800:480:ff50:503::e,TCP,74,61093  >  443 [ACK] Seq=235740 Ack=142136028 Win=264960 Len=0
1770.830104,2800:484:b384:c80a:f81c:f268:6f0b:c2f4,2800:480:ff50:503::e,TCP,74,61093  >  443 [ACK] Seq=246901 Ack=148183273 Win=264960 Len=0
1712.205259,2800:480:ff50:503::e,2800:484:b384:c80a:f81c:f268:6f0b:c2f4,TCP,1514,443  >  61093 [ACK] Seq=138452070 Ack=231210 Win=647936 Len=1440 [TCP segment of a reassembled PDU]
2204.835653,2800:480:ff50:503::e,2800:484:b384:c80a:f81c:f268:6f0b:c2f4,TCP,1514,443  >  61093 [ACK] Seq=212083902 Ack=354391 Win=956416 Len=1440 [TCP segment of a reassembled PDU]
2630.871468,2800:3f0:4005:40c::200e,2800:484:b384:c80a:f81c:f268:6f0b:c2f4,TCP,1294,"443  >  61992 [PSH, ACK] Seq=1221 Ack=518 Win=66816 Len=1220 [TCP segment of a reassembled PDU]"
248.562237,2800:480:ff50:503::e,2800:484:b384:c80a:f81c:f268:6f0b:c2f4,TCP,1514,443  >  61028 [ACK] Seq=1010934 Ack=9443 Win=88320 Len=1440 [TCP segment of a reassembled PDU]
1246.013128,2800:484:b384:c80a:f81c:f268:6f0b:c2f4,2800:480:ff50:503::e,TCP,74,61093  >  443 [ACK] Seq=112452 Ack=67850331 Win=264960 Len=0
1933.44049,2600:9000:23e7:aa00:1b:bbc:46c0:93a1,2800:484:b384:c80a:f81c:f268:6f0b:c2f4,TCP,1294,443  >  61757 [ACK] Seq=1598070 Ack=1756 Win=70144 Len=1220 [TCP segment of a reassembled PDU]
1001.633806,2800:480:ff50:503::e,2800:484:b384:c80a:f81c:f268:6f0b:c2f4,TCP,1514,443  >  61093 [ACK] Seq=30646554 Ack=52034 Win=199168 Len=1440 [TCP segment of a reassembled PDU]
1753.706093,2a04:4e42:49::347,2800:484:b384:c80a:f81c:f268:6f0b:c2f4,TCP,1514,443  >  61380 [ACK] Seq=3053518 Ack=8438 Win=20864 Len=1440 [TCP segment of a reassembled PDU]
2236.600427,2800:480:ff50:503::e,2800:484:b384:c80a:f81c:f268:6f0b:c2f4,TCP,1514,"443  >  61093 [PSH, ACK] Seq=217298463 Ack=363287 Win=978176 Len=1440 [TCP segment of a reassembled PDU]"
221.911465,2800:3f0:4005:b::7,2800:484:b384:c80a:f81c:f268:6f0b:c2f4,TCP,1294,443  >  60956 [ACK] Seq=3471772 Ack=8927 Win=86272 Len=1220 [TCP segment of a reassembled PDU]
1513.527642,2800:480:ff50:503::e,2800:484:b384:c80a:f81c:f268:6f0b:c2f4,TCP,1514,443  >  61093 [ACK] Seq=109295811 Ack=179689 Win=521984 Len=1440 [TCP segment of a reassembled PDU]
2596.298081,2800:480:ff50:503::e,2800:484:b384:c80a:f81c:f268:6f0b:c2f4,TCP,1514,"443  >  61093 [PSH, ACK] Seq=278267819 Ack=466328 Win=1236224 Len=1440 [TCP segment of a reassembled PDU]"
1729.24606,2800:484:b384:c80a:f81c:f268:6f0b:c2f4,2800:480:ff50:b1::b536:a092,TCP,74,61561  >  443 [ACK] Seq=4222 Ack=11748741 Win=529920 Len=0
907.565018,2800:480:ff50:503::e,2800:484:b384:c80a:f81c:f268:6f0b:c2f4,TCP,1514,443  >  61093 [ACK] Seq=14195287 Ack=25218 Win=130048 Len=1440 [TCP segment of a reassembled PDU]
257.199936,2800:480:ff50:503::e,2800:484:b384:c80a:f81c:f268:6f0b:c2f4,TCP,1514,443  >  61028 [ACK] Seq=6171866 Ack=20578 Win=116992 Len=1440 [TCP segment of a reassembled PDU]
1848.173839,2800:480:ff50:503::e,2800:484:b384:c80a:f81c:f268:6f0b:c2f4,TCP,1514,443  >  61093 [ACK] Seq=158340967 Ack=262592 Win=724224 Len=1440 [TCP segment of a reassembled PDU]
2654.557067,2800:484:b384:c80a:f81c:f268:6f0b:c2f4,2800:3f0:4005:6::9,TCP,74,62007  >  443 [ACK] Seq=5136 Ack=2041149 Win=131072 Len=0
38.059925,192.168.18.1,192.168.18.46,TCP,54,"53  >  58818 [FIN, ACK] Seq=632 Ack=31 Win=14600 Len=0"
16.206289,2800:480:ff50:b1::b536:a098,2800:484:b384:c80a:f81c:f268:6f0b:c2f4,TCP,1514,443  >  60719 [ACK] Seq=1501836 Ack=2147 Win=64128 Len=1440 [TCP segment of a reassembled PDU]
1177.871816,2800:480:ff50:503::e,2800:484:b384:c80a:f81c:f268:6f0b:c2f4,TCP,1514,"443  >  61093 [PSH, ACK] Seq=57244398 Ack=94602 Win=307200 Len=1440 [TCP segment of a reassembled PDU]"
1787.872813,2800:480:ff50:503::e,2800:484:b384:c80a:f81c:f268:6f0b:c2f4,TCP,1514,"443  >  61093 [PSH, ACK] Seq=149882765 Ack=249166 Win=692736 Len=1440 [TCP segment of a reassembled PDU]"
1549.424576,2800:484:b384:c80a:f81c:f268:6f0b:c2f4,2800:480:ff50:503::e,TCP,74,61093  >  443 [ACK] Seq=188667 Ack=114177871 Win=264960 Len=0
30.696779,20.189.173.13,192.168.20.26,TCP,60,443  >  60703 [ACK] Seq=11741 Ack=115638 Win=525568 Len=0
1012.738031,2800:484:b384:c80a:f81c:f268:6f0b:c2f4,2800:480:ff50:503::e,TCP,74,61093  >  443 [ACK] Seq=54296 Ack=31157925 Win=264960 Len=0
124.088604,192.168.20.26,190.157.8.101,TCP,54,"60831  >  53 [FIN, ACK] Seq=37 Ack=117 Win=131072 Len=0"
2309.598488,2800:484:b384:c80a:f81c:f268:6f0b:c2f4,2800:480:ff50:503::e,TCP,74,61093  >  443 [ACK] Seq=378978 Ack=226793275 Win=529920 Len=0
1616.422923,2800:3f0:4005:40c::2001,2800:484:b384:c80a:f81c:f268:6f0b:c2f4,TCP,86,"443  >  61268 [SYN, ACK] Seq=0 Ack=1 Win=14400 Len=0 MSS=1440 SACK_PERM WS=128"
238.904624,192.168.18.1,192.168.18.46,TCP,66,"53  >  60382 [SYN, ACK] Seq=0 Ack=1 Win=14600 Len=0 MSS=1460 SACK_PERM WS=4"
251.941115,2800:3f0:4005:b::7,2800:484:b384:c80a:f81c:f268:6f0b:c2f4,TCP,1294,443  >  60956 [ACK] Seq=5001381 Ack=11135 Win=90624 Len=1220 [TCP segment of a reassembled PDU]
2627.622222,2800:480:ff50:503::e,2800:484:b384:c80a:f81c:f268:6f0b:c2f4,TCP,1514,"443  >  61093 [PSH, ACK] Seq=287497719 Ack=479754 Win=1270784 Len=1440 [TCP segment of a reassembled PDU]"
307.775031,192.168.137.147,52.159.126.152,TCP,54,49412  >  443 [ACK] Seq=2416 Ack=5018 Win=130304 Len=0
1619.574941,2800:484:b384:c80a:f81c:f268:6f0b:c2f4,2800:3f0:4005:400::200a,TCP,74,61309  >  443 [ACK] Seq=518 Ack=6101 Win=132352 Len=0
1950.227849,2800:484:b384:c80a:f81c:f268:6f0b:c2f4,2600:9000:235b:4400:14:6083:cf00:93a1,TCP,74,61768  >  443 [ACK] Seq=13080 Ack=1879064 Win=263424 Len=0
1573.024748,2800:480:ff50:503::e,2800:484:b384:c80a:f81c:f268:6f0b:c2f4,TCP,1514,443  >  61093 [ACK] Seq=118738324 Ack=195380 Win=559616 Len=1440 [TCP segment of a reassembled PDU]
1023.655724,2800:484:b384:c80a:f81c:f268:6f0b:c2f4,2800:480:ff50:503::e,TCP,74,61093  >  443 [ACK] Seq=56558 Ack=33641487 Win=264960 Len=0
954.434112,2800:480:ff50:503::e,2800:484:b384:c80a:f81c:f268:6f0b:c2f4,TCP,1514,443  >  61093 [ACK] Seq=22536329 Ack=38626 Win=164608 Len=1440 [TCP segment of a reassembled PDU]
1134.323328,66.110.49.114,192.168.20.26,TCP,60,443  >  61077 [ACK] Seq=1239143 Ack=1619569 Win=65535 Len=0
1683.072007,132.255.20.10,192.168.20.26,TCP,1514,443  >  61515 [ACK] Seq=311644 Ack=957 Win=31744 Len=1460 [TCP segment of a reassembled PDU]
69.42019,127.0.0.1,127.0.0.1,TCP,44,63610  >  21 [ACK] Seq=2658 Ack=13524 Win=1188 Len=0
402.268959,192.168.18.46,192.168.18.1,TCP,66,61763  >  53 [SYN] Seq=0 Win=64240 Len=0 MSS=1460 WS=256 SACK_PERM
170.661439,2800:480:ff50:54::c,2800:484:b384:c80a:f81c:f268:6f0b:c2f4,TCP,1514,443  >  60920 [ACK] Seq=1341096 Ack=16025 Win=107008 Len=1440 [TCP segment of a reassembled PDU]
2401.112158,2800:480:ff50:503::e,2800:484:b384:c80a:f81c:f268:6f0b:c2f4,TCP,1514,"443  >  61093 [PSH, ACK] Seq=239791043 Ack=401382 Win=1074432 Len=1440 [TCP segment of a reassembled PDU]"
2158.484058,2800:480:ff50:503::e,2800:484:b384:c80a:f81c:f268:6f0b:c2f4,TCP,1514,"443  >  61093 [PSH, ACK] Seq=206015873 Ack=345413 Win=933376 Len=1440 [TCP segment of a reassembled PDU]"
151.447097,192.168.18.46,192.168.18.1,TCP,54,59690  >  53 [ACK] Seq=31 Ack=633 Win=130560 Len=0
2509.784267,2800:480:ff50:503::e,2800:484:b384:c80a:f81c:f268:6f0b:c2f4,TCP,1514,"443  >  61093 [PSH, ACK] Seq=261234813 Ack=435029 Win=1156864 Len=1440 [TCP segment of a reassembled PDU]"
1663.954159,2800:484:b384:c80a:f81c:f268:6f0b:c2f4,2800:480:ff50:503::e,TCP,74,61093  >  443 [ACK] Seq=217784 Ack=131586577 Win=264960 Len=0
1189.34855,2800:480:ff50:503::e,2800:484:b384:c80a:f81c:f268:6f0b:c2f4,TCP,1514,443  >  61093 [ACK] Seq=58895337 Ack=96864 Win=313088 Len=1440 [TCP segment of a reassembled PDU]
1939.412857,2600:9000:235b:2a00:17:3fb3:2400:93a1,2800:484:b384:c80a:f81c:f268:6f0b:c2f4,TCP,1294,"443  >  61786 [PSH, ACK] Seq=33032 Ack=48858 Win=176128 Len=1220 [TCP segment of a reassembled PDU]"
2122.498745,2800:480:ff50:503::e,2800:484:b384:c80a:f81c:f268:6f0b:c2f4,TCP,1514,443  >  61093 [ACK] Seq=196337872 Ack=327539 Win=888576 Len=1440 [TCP segment of a reassembled PDU]
2448.309712,2800:484:b384:c80a:f81c:f268:6f0b:c2f4,2800:480:ff50:503::e,TCP,74,61093  >  443 [ACK] Seq=419338 Ack=250016966 Win=529920 Len=0
198.438545,2800:480:ff50:b1::b536:a098,2800:484:b384:c80a:f81c:f268:6f0b:c2f4,TCP,1514,443  >  60973 [ACK] Seq=166787 Ack=4495 Win=64128 Len=1440 [TCP segment of a reassembled PDU]
452.858389,192.168.18.46,192.168.18.1,TCP,54,"62219  >  53 [FIN, ACK] Seq=30 Ack=632 Win=130560 Len=0"
1213.710384,2800:480:ff50:503::e,2800:484:b384:c80a:f81c:f268:6f0b:c2f4,TCP,1514,"443  >  61093 [PSH, ACK] Seq=62608458 Ack=103568 Win=330240 Len=1440 [TCP segment of a reassembled PDU]"
1626.195005,2800:484:b384:c80a:f81c:f268:6f0b:c2f4,2800:3f0:4005:40b::2005,TCP,1514,61236  >  443 [ACK] Seq=103009 Ack=803931 Win=132352 Len=1440 [TCP segment of a reassembled PDU]
138.515398,2800:3f0:4005:400::200e,2800:484:b384:c80a:f81c:f268:6f0b:c2f4,TCP,74,443  >  60907 [ACK] Seq=15554 Ack=11402 Win=107520 Len=0
887.180294,2800:480:ff50:503::e,2800:484:b384:c80a:f81c:f268:6f0b:c2f4,TCP,1514,443  >  61093 [ACK] Seq=12057398 Ack=20694 Win=118528 Len=1440 [TCP segment of a reassembled PDU]
2642.95368,2800:484:b384:c80a:f81c:f268:6f0b:c2f4,2800:3f0:4005:6::9,TCP,74,62007  >  443 [ACK] Seq=2859 Ack=631040 Win=131072 Len=0
1894.093353,2800:480:ff50:503::e,2800:484:b384:c80a:f81c:f268:6f0b:c2f4,TCP,1514,"443  >  61093 [PSH, ACK] Seq=164079351 Ack=276018 Win=758784 Len=1440 [TCP segment of a reassembled PDU]"
1806.092222,2800:484:b384:c80a:f81c:f268:6f0b:c2f4,2800:480:ff50:503::e,TCP,74,61093  >  443 [ACK] Seq=253614 Ack=152975351 Win=264960 Len=0
1721.827131,2800:484:b384:c80a:f81c:f268:6f0b:c2f4,2800:480:ff50:503::e,TCP,74,61093  >  443 [ACK] Seq=233475 Ack=140443978 Win=264960 Len=0
1616.913992,2600:1419:8400::684b:ab33,2800:484:b384:c80a:f81c:f268:6f0b:c2f4,TCP,1514,443  >  61187 [ACK] Seq=405824 Ack=4611 Win=64128 Len=1440 [TCP segment of a reassembled PDU]
1305.200129,2800:484:b384:c80a:f81c:f268:6f0b:c2f4,2800:480:ff50:503::e,TCP,74,61093  >  443 [ACK] Seq=125942 Ack=77509174 Win=264960 Len=0
2646.162286,2800:484:b384:c80a:f81c:f268:6f0b:c2f4,2800:3f0:4005:40a::2004,TCP,74,61944  >  443 [ACK] Seq=383306 Ack=1355751 Win=132352 Len=0
2137.212485,2800:480:ff50:503::e,2800:484:b384:c80a:f81c:f268:6f0b:c2f4,TCP,1514,"443  >  61093 [PSH, ACK] Seq=199712497 Ack=334252 Win=905984 Len=1440 [TCP segment of a reassembled PDU]"
365.793724,192.168.18.1,192.168.18.46,TCP,54,53  >  61458 [ACK] Seq=1 Ack=30 Win=14600 Len=0
1787.74463,2800:480:ff50:503::e,2800:484:b384:c80a:f81c:f268:6f0b:c2f4,TCP,1514,443  >  61093 [ACK] Seq=149182925 Ack=249166 Win=692736 Len=1440 [TCP segment of a reassembled PDU]
467.260928,192.168.20.26,190.157.8.101,TCP,54,"61052  >  53 [FIN, ACK] Seq=33 Ack=176 Win=131072 Len=0"
503.328802,192.168.18.1,192.168.18.46,TCP,54,"53  >  62632 [FIN, ACK] Seq=632 Ack=31 Win=14600 Len=0"
2448.444728,2800:480:ff50:503::e,2800:484:b384:c80a:f81c:f268:6f0b:c2f4,TCP,1514,443  >  61093 [ACK] Seq=250441766 Ack=419338 Win=1117952 Len=1440 [TCP segment of a reassembled PDU]
257.070218,2800:484:b384:c80a:f81c:f268:6f0b:c2f4,2800:3f0:4005:407::200e,TCP,1514,59745  >  443 [ACK] Seq=270787 Ack=910285 Win=516 Len=1440 [TCP segment of a reassembled PDU]
1122.477568,66.110.49.114,192.168.20.26,TCP,56,[TCP Dup ACK 111497#2] 443  >  61077 [ACK] Seq=1057233 Ack=1368195 Win=65535 Len=0
277.31425,2800:480:ff50:503::e,2800:484:b384:c80a:f81c:f268:6f0b:c2f4,TCP,1514,443  >  61028 [ACK] Seq=9161371 Ack=25018 Win=127232 Len=1440 [TCP segment of a reassembled PDU]
783.656131,66.110.49.114,192.168.20.26,TCP,56,443  >  61077 [ACK] Seq=822 Ack=1543 Win=63728 Len=0
1003.882174,66.110.49.114,192.168.20.26,TCP,60,443  >  61077 [ACK] Seq=210236 Ack=289045 Win=65535 Len=0
2219.003755,2800:480:ff50:503::e,2800:484:b384:c80a:f81c:f268:6f0b:c2f4,TCP,1514,443  >  61093 [ACK] Seq=213760964 Ack=358839 Win=967936 Len=1440 [TCP segment of a reassembled PDU]
1627.976532,2800:480:ff50:503::e,2800:484:b384:c80a:f81c:f268:6f0b:c2f4,TCP,1514,443  >  61093 [ACK] Seq=126421716 Ack=208806 Win=594176 Len=1440 [TCP segment of a reassembled PDU]
1933.711401,2600:9000:23e7:aa00:1b:bbc:46c0:93a1,2800:484:b384:c80a:f81c:f268:6f0b:c2f4,TCP,1294,"443  >  61757 [PSH, ACK] Seq=2999850 Ack=1756 Win=70144 Len=1220 [TCP segment of a reassembled PDU]"
133.2825,104.122.75.227,192.168.137.147,TCP,394,"[TCP Spurious Retransmission] 443  >  57247 [PSH, ACK] Seq=2963 Ack=582 Win=16768 Len=340"
201.052317,2800:484:b384:c80a:f81c:f268:6f0b:c2f4,2800:480:ff50:b1::b536:a098,TCP,74,60973  >  443 [ACK] Seq=7642 Ack=2832231 Win=1059840 Len=0
2448.727015,2800:480:ff50:503::e,2800:484:b384:c80a:f81c:f268:6f0b:c2f4,TCP,1514,443  >  61093 [ACK] Seq=251379206 Ack=419338 Win=1117952 Len=1440 [TCP segment of a reassembled PDU]
1975.019529,2800:480:ff50:503::e,2800:484:b384:c80a:f81c:f268:6f0b:c2f4,TCP,1514,"443  >  61093 [PSH, ACK] Seq=175614630 Ack=293974 Win=804864 Len=1440 [TCP segment of a reassembled PDU]"
1676.64115,2800:480:ff50:503::e,2800:484:b384:c80a:f81c:f268:6f0b:c2f4,TCP,1514,443  >  61093 [ACK] Seq=134333392 Ack=222232 Win=626176 Len=1440 [TCP segment of a reassembled PDU]
1461.215822,2800:484:b384:c80a:f81c:f268:6f0b:c2f4,2800:480:ff50:503::e,TCP,74,61093  >  443 [ACK] Seq=166263 Ack=100910331 Win=264960 Len=0
1744.215325,2800:480:ff50:503::e,2800:484:b384:c80a:f81c:f268:6f0b:c2f4,TCP,1514,443  >  61093 [ACK] Seq=144137594 Ack=240188 Win=670976 Len=1440 [TCP segment of a reassembled PDU]
1712.623822,2800:480:ff50:503::e,2800:484:b384:c80a:f81c:f268:6f0b:c2f4,TCP,1514,443  >  61093 [ACK] Seq=139586790 Ack=231210 Win=647936 Len=1440 [TCP segment of a reassembled PDU]
689.867826,184.28.11.156,192.168.137.147,TCP,1490,"443  >  57362 [PSH, ACK] Seq=23152 Ack=498 Win=16768 Len=1436 [TCP segment of a reassembled PDU]"
1730.823453,2800:484:b384:c80a:f81c:f268:6f0b:c2f4,2800:480:ff50:503::e,TCP,74,61093  >  443 [ACK] Seq=237923 Ack=143314608 Win=264960 Len=0
1012.659605,2800:480:ff50:503::e,2800:484:b384:c80a:f81c:f268:6f0b:c2f4,TCP,1514,443  >  61093 [ACK] Seq=30736005 Ack=54296 Win=205056 Len=1440 [TCP segment of a reassembled PDU]
858.383829,192.168.137.147,13.107.237.41,TCP,54,57446  >  443 [ACK] Seq=1044 Ack=774 Win=261120 Len=0
1177.951299,2800:480:ff50:503::e,2800:484:b384:c80a:f81c:f268:6f0b:c2f4,TCP,1514,443  >  61093 [ACK] Seq=57630318 Ack=94602 Win=307200 Len=1440 [TCP segment of a reassembled PDU]
2382.03175,31.3.152.121,192.168.137.147,TCP,54,443  >  57569 [ACK] Seq=6546 Ack=2133 Win=16768 Len=0
954.401414,2800:484:b384:c80a:f81c:f268:6f0b:c2f4,2800:480:ff50:503::e,TCP,74,61093  >  443 [ACK] Seq=38626 Ack=22373609 Win=264960 Len=0
1504.828139,2800:480:ff50:503::e,2800:484:b384:c80a:f81c:f268:6f0b:c2f4,TCP,1514,443  >  61093 [ACK] Seq=107433991 Ack=177424 Win=516096 Len=1440 [TCP segment of a reassembled PDU]
287.337037,2800:480:ff50:503::e,2800:484:b384:c80a:f81c:f268:6f0b:c2f4,TCP,1514,443  >  61028 [ACK] Seq=11106411 Ack=27280 Win=133120 Len=1440 [TCP segment of a reassembled PDU]
196.328787,2600:1419:8400::684b:ab48,2800:484:b384:c80a:f81c:f268:6f0b:c2f4,TCP,1514,"443  >  60968 [PSH, ACK] Seq=1441 Ack=518 Win=64384 Len=1440 [TCP segment of a reassembled PDU]"
71.445738,127.0.0.1,127.0.0.1,TCP,44,21  >  63610 [ACK] Seq=14472 Ack=2850 Win=8424 Len=0
153.152703,192.168.18.46,34.199.93.197,TCP,66,59704  >  443 [SYN] Seq=0 Win=64240 Len=0 MSS=1460 WS=256 SACK_PERM
2149.978607,2800:484:b384:c80a:f81c:f268:6f0b:c2f4,2800:480:ff50:503::e,TCP,74,61093  >  443 [ACK] Seq=340965 Ack=203618988 Win=529920 Len=0
15.742062,2800:484:b384:c80a:f81c:f268:6f0b:c2f4,2800:480:ff50:b1::b536:a098,TCP,74,60718  >  443 [ACK] Seq=4530 Ack=88291 Win=132352 Len=0
1770.982705,2800:484:b384:c80a:f81c:f268:6f0b:c2f4,2800:480:ff50:503::e,TCP,74,61093  >  443 [ACK] Seq=246901 Ack=149015593 Win=264960 Len=0
1664.171186,2800:480:ff50:503::e,2800:484:b384:c80a:f81c:f268:6f0b:c2f4,TCP,1514,"443  >  61093 [PSH, ACK] Seq=131881777 Ack=217784 Win=615936 Len=1440 [TCP segment of a reassembled PDU]"
2429.609486,2800:480:ff50:503::e,2800:484:b384:c80a:f81c:f268:6f0b:c2f4,TCP,1514,443  >  61093 [ACK] Seq=246322754 Ack=412625 Win=1102080 Len=1440 [TCP segment of a reassembled PDU]
1047.758718,2800:480:ff50:503::e,2800:484:b384:c80a:f81c:f268:6f0b:c2f4,TCP,1514,"443  >  61093 [PSH, ACK] Seq=37531562 Ack=63262 Win=228096 Len=1440 [TCP segment of a reassembled PDU]"
384.64275,2800:484:b384:c80a:f81c:f268:6f0b:c2f4,2800:480:ff50:503::e,TCP,74,61028  >  443 [ACK] Seq=33984 Ack=15154560 Win=529920 Len=0
13.169328,192.168.20.26,20.189.173.13,TCP,54,60682  >  443 [ACK] Seq=1 Ack=1 Win=132352 Len=0
1871.998443,2800:484:b384:c80a:f81c:f268:6f0b:c2f4,2800:480:ff50:503::e,TCP,74,61093  >  443 [ACK] Seq=269305 Ack=161399455 Win=264960 Len=0
1177.520451,2800:484:b384:c80a:f81c:f268:6f0b:c2f4,2800:480:ff50:503::e,TCP,74,61093  >  443 [ACK] Seq=94602 Ack=55962798 Win=264960 Len=0
1631.715564,2800:484:b384:c80a:f81c:f268:6f0b:c2f4,2a04:4e42:49::347,TCP,74,61284  >  443 [ACK] Seq=8861 Ack=1806528 Win=132352 Len=0
2570.238562,2800:480:ff50:503::e,2800:484:b384:c80a:f81c:f268:6f0b:c2f4,TCP,1514,443  >  61093 [ACK] Seq=271423756 Ack=455167 Win=1207296 Len=1440 [TCP segment of a reassembled PDU]
2384.658981,192.168.137.147,20.60.224.129,TCP,1514,57588  >  443 [ACK] Seq=171145 Ack=7554 Win=131072 Len=1460 [TCP segment of a reassembled PDU]
1393.725329,2800:480:ff50:503::e,2800:484:b384:c80a:f81c:f268:6f0b:c2f4,TCP,1514,"443  >  61093 [PSH, ACK] Seq=91572439 Ack=150499 Win=446976 Len=1440 [TCP segment of a reassembled PDU]"
1904.241027,2800:480:ff50:503::e,2800:484:b384:c80a:f81c:f268:6f0b:c2f4,TCP,1514,443  >  61093 [ACK] Seq=167727368 Ack=280466 Win=770304 Len=1440 [TCP segment of a reassembled PDU]
17.359375,81.131.67.131,211.28.6.30,TCP,54,2769  >  6348 [ACK] Seq=1 Ack=14337 Win=7736 Len=0
1847.976677,2800:480:ff50:503::e,2800:484:b384:c80a:f81c:f268:6f0b:c2f4,TCP,1514,443  >  61093 [ACK] Seq=157376167 Ack=262592 Win=724224 Len=1440 [TCP segment of a reassembled PDU]
310.201211,52.109.108.96,192.168.18.46,TCP,1466,443  >  60680 [ACK] Seq=386327 Ack=34885 Win=525056 Len=1412 [TCP segment of a reassembled PDU]
1904.254496,2800:480:ff50:503::e,2800:484:b384:c80a:f81c:f268:6f0b:c2f4,TCP,1514,443  >  61093 [ACK] Seq=167790728 Ack=280466 Win=770304 Len=1440 [TCP segment of a reassembled PDU]
990.43522,2800:480:ff50:503::e,2800:484:b384:c80a:f81c:f268:6f0b:c2f4,TCP,1514,"443  >  61093 [PSH, ACK] Seq=27004963 Ack=47592 Win=187648 Len=1440 [TCP segment of a reassembled PDU]"
447.820113,192.168.18.1,192.168.18.46,TCP,54,"53  >  62171 [FIN, ACK] Seq=877 Ack=32 Win=14600 Len=0"
1032.051621,66.110.49.114,192.168.20.26,TCP,60,443  >  61077 [ACK] Seq=454818 Ack=591629 Win=65535 Len=0
2627.173488,2800:484:b384:c80a:f81c:f268:6f0b:c2f4,2800:480:ff50:503::e,TCP,74,61093  >  443 [ACK] Seq=479754 Ack=287237079 Win=529920 Len=0
2309.505209,2800:480:ff50:503::e,2800:484:b384:c80a:f81c:f268:6f0b:c2f4,TCP,1514,443  >  61093 [ACK] Seq=226351195 Ack=378978 Win=1018368 Len=1440 [TCP segment of a reassembled PDU]
287.27314,2800:484:b384:c80a:f81c:f268:6f0b:c2f4,2800:480:ff50:503::e,TCP,74,61028  >  443 [ACK] Seq=27280 Ack=10788171 Win=529920 Len=0
1622.495469,2a04:4e42:49::347,2800:484:b384:c80a:f81c:f268:6f0b:c2f4,TCP,1514,443  >  61284 [ACK] Seq=313296 Ack=2874 Win=25216 Len=1440 [TCP segment of a reassembled PDU]
167.372933,2800:480:ff50:54::c,2800:484:b384:c80a:f81c:f268:6f0b:c2f4,TCP,1514,443  >  60920 [ACK] Seq=436100 Ack=9356 Win=89856 Len=1440 [TCP segment of a reassembled PDU]
2127.709448,2800:480:ff50:503::e,2800:484:b384:c80a:f81c:f268:6f0b:c2f4,TCP,1514,"443  >  61093 [PSH, ACK] Seq=198429243 Ack=331987 Win=900096 Len=1440 [TCP segment of a reassembled PDU]"
414.270292,192.168.18.46,34.199.93.197,TCP,54,61860  >  80 [ACK] Seq=255 Ack=760 Win=130304 Len=0
1213.708882,2800:480:ff50:503::e,2800:484:b384:c80a:f81c:f268:6f0b:c2f4,TCP,1514,443  >  61093 [ACK] Seq=62598378 Ack=103568 Win=330240 Len=1440 [TCP segment of a reassembled PDU]
1245.376222,2800:480:ff50:503::e,2800:484:b384:c80a:f81c:f268:6f0b:c2f4,TCP,1514,"443  >  61093 [PSH, ACK] Seq=65836059 Ack=110272 Win=346368 Len=1440 [TCP segment of a reassembled PDU]"
1376.209987,2800:480:ff50:503::e,2800:484:b384:c80a:f81c:f268:6f0b:c2f4,TCP,1514,443  >  61093 [ACK] Seq=87747917 Ack=146055 Win=435456 Len=1440 [TCP segment of a reassembled PDU]
1329.63895,2800:480:ff50:503::e,2800:484:b384:c80a:f81c:f268:6f0b:c2f4,TCP,1514,"443  >  61093 [PSH, ACK] Seq=81179656 Ack=132646 Win=402432 Len=1440 [TCP segment of a reassembled PDU]"
2172.255912,2800:484:b384:c80a:f81c:f268:6f0b:c2f4,2800:480:ff50:503::e,TCP,74,61093  >  443 [ACK] Seq=349861 Ack=209278807 Win=529920 Len=0
211.830233,2800:480:ff50:54::d,2800:484:b384:c80a:f81c:f268:6f0b:c2f4,TCP,1514,443  >  60932 [ACK] Seq=1081651 Ack=21541 Win=122880 Len=1440 [TCP segment of a reassembled PDU]
919.540383,2800:480:ff50:503::e,2800:484:b384:c80a:f81c:f268:6f0b:c2f4,TCP,1514,"443  >  61093 [PSH, ACK] Seq=17284181 Ack=29660 Win=141568 Len=1440 [TCP segment of a reassembled PDU]"
1727.592877,2800:480:ff50:b1::b536:a092,2800:484:b384:c80a:f81c:f268:6f0b:c2f4,TCP,1514,443  >  61561 [ACK] Seq=8715912 Ack=3982 Win=64128 Len=1440 [TCP segment of a reassembled PDU]
2236.03202,2800:480:ff50:503::e,2800:484:b384:c80a:f81c:f268:6f0b:c2f4,TCP,1514,443  >  61093 [ACK] Seq=215763075 Ack=361104 Win=973824 Len=1440 [TCP segment of a reassembled PDU]
2509.774227,2800:480:ff50:503::e,2800:484:b384:c80a:f81c:f268:6f0b:c2f4,TCP,1514,443  >  61093 [ACK] Seq=261184413 Ack=435029 Win=1156864 Len=1440 [TCP segment of a reassembled PDU]
2493.742299,2800:480:ff50:503::e,2800:484:b384:c80a:f81c:f268:6f0b:c2f4,TCP,1514,"443  >  61093 [PSH, ACK] Seq=257286430 Ack=428316 Win=1139712 Len=1440 [TCP segment of a reassembled PDU]"
193.164531,2800:3f0:4005:b::7,2800:484:b384:c80a:f81c:f268:6f0b:c2f4,TCP,1294,443  >  60956 [ACK] Seq=467560 Ack=2621 Win=70656 Len=1220 [TCP segment of a reassembled PDU]
1652.850056,2800:480:ff50:503::e,2800:484:b384:c80a:f81c:f268:6f0b:c2f4,TCP,1514,"443  >  61093 [PSH, ACK] Seq=130864651 Ack=215519 Win=610048 Len=1440 [TCP segment of a reassembled PDU]"
2482.166752,2800:480:ff50:503::e,2800:484:b384:c80a:f81c:f268:6f0b:c2f4,TCP,1514,443  >  61093 [ACK] Seq=255654821 Ack=426051 Win=1133824 Len=1440 [TCP segment of a reassembled PDU]
1487.831152,2800:480:ff50:503::e,2800:484:b384:c80a:f81c:f268:6f0b:c2f4,TCP,1514,"443  >  61093 [PSH, ACK] Seq=105555595 Ack=172976 Win=504576 Len=1440 [TCP segment of a reassembled PDU]"
966.117002,2800:480:ff50:503::e,2800:484:b384:c80a:f81c:f268:6f0b:c2f4,TCP,1514,443  >  61093 [ACK] Seq=24504869 Ack=40888 Win=170496 Len=1440 [TCP segment of a reassembled PDU]
2185.135204,2800:480:ff50:503::e,2800:484:b384:c80a:f81c:f268:6f0b:c2f4,TCP,1514,"443  >  61093 [PSH, ACK] Seq=210447979 Ack=352126 Win=950784 Len=1440 [TCP segment of a reassembled PDU]"
1631.616611,2a04:4e42:49::347,2800:484:b384:c80a:f81c:f268:6f0b:c2f4,TCP,1514,443  >  61284 [ACK] Seq=1688856 Ack=7956 Win=59776 Len=1440 [TCP segment of a reassembled PDU]
2127.490315,2800:484:b384:c80a:f81c:f268:6f0b:c2f4,2800:480:ff50:503::e,TCP,74,61093  >  443 [ACK] Seq=331987 Ack=197316123 Win=529920 Len=0
1609.38077,192.168.20.26,20.189.173.13,TCP,1494,61172  >  443 [ACK] Seq=16944 Ack=7247 Win=131072 Len=1440 [TCP segment of a reassembled PDU]
1190.362629,66.110.49.114,192.168.20.26,TCP,60,443  >  61077 [ACK] Seq=1845522 Ack=2396769 Win=65535 Len=0
2570.501566,2800:480:ff50:503::e,2800:484:b384:c80a:f81c:f268:6f0b:c2f4,TCP,1514,443  >  61093 [ACK] Seq=272653516 Ack=455167 Win=1207296 Len=1440 [TCP segment of a reassembled PDU]
2144.552433,2800:480:ff50:503::e,2800:484:b384:c80a:f81c:f268:6f0b:c2f4,TCP,1514,443  >  61093 [ACK] Seq=201502940 Ack=338700 Win=917504 Len=1440 [TCP segment of a reassembled PDU]
513.019278,192.168.18.1,192.168.18.46,TCP,54,"53  >  62705 [FIN, ACK] Seq=632 Ack=31 Win=14600 Len=0"
58.138281,34.203.15.122,192.168.18.46,TCP,1466,443  >  58979 [ACK] Seq=1528 Ack=518 Win=28160 Len=1412 [TCP segment of a reassembled PDU]
2204.331877,2800:480:ff50:503::e,2800:484:b384:c80a:f81c:f268:6f0b:c2f4,TCP,1514,443  >  61093 [ACK] Seq=211500702 Ack=354391 Win=956416 Len=1440 [TCP segment of a reassembled PDU]
1859.027037,2800:480:ff50:503::e,2800:484:b384:c80a:f81c:f268:6f0b:c2f4,TCP,1514,"443  >  61093 [PSH, ACK] Seq=159588432 Ack=267040 Win=735744 Len=1440 [TCP segment of a reassembled PDU]"
2439.397088,2800:480:ff50:503::e,2800:484:b384:c80a:f81c:f268:6f0b:c2f4,TCP,1514,443  >  61093 [ACK] Seq=248282100 Ack=414890 Win=1106432 Len=1440 [TCP segment of a reassembled PDU]
1122.263058,2800:480:ff50:503::e,2800:484:b384:c80a:f81c:f268:6f0b:c2f4,TCP,1514,443  >  61093 [ACK] Seq=48706994 Ack=81194 Win=274176 Len=1440 [TCP segment of a reassembled PDU]
277.243183,2800:480:ff50:503::e,2800:484:b384:c80a:f81c:f268:6f0b:c2f4,TCP,1514,443  >  61028 [ACK] Seq=8709211 Ack=25018 Win=127232 Len=1440 [TCP segment of a reassembled PDU]
943.631096,2800:480:ff50:503::e,2800:484:b384:c80a:f81c:f268:6f0b:c2f4,TCP,1514,443  >  61093 [ACK] Seq=19456530 Ack=34184 Win=153088 Len=1440 [TCP segment of a reassembled PDU]
1471.822686,2800:480:ff50:503::e,2800:484:b384:c80a:f81c:f268:6f0b:c2f4,TCP,1514,443  >  61093 [ACK] Seq=102898300 Ack=170711 Win=498944 Len=1440 [TCP segment of a reassembled PDU]
1933.363039,2600:9000:23e7:aa00:1b:bbc:46c0:93a1,2800:484:b384:c80a:f81c:f268:6f0b:c2f4,TCP,1294,443  >  61757 [ACK] Seq=1317470 Ack=1643 Win=70144 Len=1220 [TCP segment of a reassembled PDU]
2393.747826,2800:484:b384:c80a:f81c:f268:6f0b:c2f4,2800:480:ff50:503::e,TCP,74,61093  >  443 [ACK] Seq=396934 Ack=237395083 Win=529920 Len=0
32.015325,2800:480:ff50:b1::b536:a098,2800:484:b384:c80a:f81c:f268:6f0b:c2f4,TCP,1514,443  >  60791 [ACK] Seq=352357 Ack=1427 Win=64128 Len=1440 [TCP segment of a reassembled PDU]
1933.592426,2600:9000:23e7:aa00:1b:bbc:46c0:93a1,2800:484:b384:c80a:f81c:f268:6f0b:c2f4,TCP,1294,443  >  61757 [ACK] Seq=2347150 Ack=1756 Win=70144 Len=1220 [TCP segment of a reassembled PDU]
1993.376746,172.16.0.73,192.168.137.147,TCP,66,"8080  >  57566 [SYN, ACK] Seq=0 Ack=1 Win=29200 Len=0 MSS=1460 SACK_PERM WS=128"
1859.202883,2800:480:ff50:503::e,2800:484:b384:c80a:f81c:f268:6f0b:c2f4,TCP,1514,443  >  61093 [ACK] Seq=160593552 Ack=267040 Win=735744 Len=1440 [TCP segment of a reassembled PDU]
1770.669308,2800:480:ff50:503::e,2800:484:b384:c80a:f81c:f268:6f0b:c2f4,TCP,1514,443  >  61093 [ACK] Seq=147359593 Ack=246901 Win=686848 Len=1440 [TCP segment of a reassembled PDU]
7.000548,192.168.137.147,10.4.73.130,TCP,66,62452  >  49669 [SYN] Seq=0 Win=64240 Len=0 MSS=1460 WS=256 SACK_PERM
297.445391,2800:480:ff50:503::e,2800:484:b384:c80a:f81c:f268:6f0b:c2f4,TCP,1514,443  >  61028 [ACK] Seq=12705960 Ack=31722 Win=143104 Len=1440 [TCP segment of a reassembled PDU]
248.620396,2800:484:b384:c80a:f81c:f268:6f0b:c2f4,2800:480:ff50:503::e,TCP,74,61028  >  443 [ACK] Seq=9443 Ack=1320534 Win=264960 Len=0
1245.770464,2800:480:ff50:503::e,2800:484:b384:c80a:f81c:f268:6f0b:c2f4,TCP,1514,"443  >  61093 [PSH, ACK] Seq=67461819 Ack=110272 Win=346368 Len=1440 [TCP segment of a reassembled PDU]"
297.293213,2800:484:b384:c80a:f81c:f268:6f0b:c2f4,2800:480:ff50:503::e,TCP,74,61028  >  443 [ACK] Seq=29460 Ack=12218715 Win=529920 Len=0
161.408399,192.168.18.1,192.168.18.46,TCP,54,53  >  59776 [ACK] Seq=1 Ack=30 Win=14600 Len=0
1724.493665,2800:484:b384:c80a:f81c:f268:6f0b:c2f4,2800:480:ff50:b1::b536:a092,TCP,74,61561  >  443 [ACK] Seq=2728 Ack=3456686 Win=529920 Len=0
943.771566,2800:484:b384:c80a:f81c:f268:6f0b:c2f4,2800:480:ff50:503::e,TCP,74,61093  >  443 [ACK] Seq=34184 Ack=20169330 Win=264960 Len=0
954.618388,2800:480:ff50:503::e,2800:484:b384:c80a:f81c:f268:6f0b:c2f4,TCP,1514,"443  >  61093 [PSH, ACK] Seq=23434889 Ack=38626 Win=164608 Len=1440 [TCP segment of a reassembled PDU]"
263.83448,2800:484:b384:c80a:f81c:f268:6f0b:c2f4,2800:3f0:4005:b::7,TCP,74,60956  >  443 [ACK] Seq=13343 Ack=8023152 Win=1048832 Len=0
196.854581,2800:480:ff50:54::d,2800:484:b384:c80a:f81c:f268:6f0b:c2f4,TCP,1514,443  >  60932 [ACK] Seq=825108 Ack=19434 Win=117248 Len=1440 [TCP segment of a reassembled PDU]
1061.942345,2800:480:ff50:503::e,2800:484:b384:c80a:f81c:f268:6f0b:c2f4,TCP,1514,443  >  61093 [ACK] Seq=38962675 Ack=65524 Win=233728 Len=1440 [TCP segment of a reassembled PDU]
2580.483219,2800:484:b384:c80a:f81c:f268:6f0b:c2f4,2800:480:ff50:503::e,TCP,74,61093  >  443 [ACK] Seq=459615 Ack=274758296 Win=529920 Len=0
944.104987,2800:484:b384:c80a:f81c:f268:6f0b:c2f4,2800:480:ff50:503::e,TCP,74,61093  >  443 [ACK] Seq=34184 Ack=20964210 Win=264960 Len=0
2684.721049,2800:484:b384:c80a:f81c:f268:6f0b:c2f4,2800:3f0:4005:6::9,TCP,74,62006  >  443 [ACK] Seq=9604 Ack=1604341 Win=264960 Len=0
1923.544172,190.157.8.101,192.168.20.26,TCP,56,"53  >  61668 [FIN, ACK] Seq=208 Ack=32 Win=14630 Len=0"
2137.324851,2800:480:ff50:503::e,2800:484:b384:c80a:f81c:f268:6f0b:c2f4,TCP,1514,443  >  61093 [ACK] Seq=200331697 Ack=334252 Win=905984 Len=1440 [TCP segment of a reassembled PDU]
1181.549326,66.110.49.114,192.168.20.26,TCP,56,443  >  61077 [ACK] Seq=1793255 Ack=2318449 Win=65535 Len=0
348.37459,192.168.18.46,34.193.132.77,TCP,54,61300  >  443 [ACK] Seq=958 Ack=6291 Win=130304 Len=0
263.664335,2800:484:b384:c80a:f81c:f268:6f0b:c2f4,2800:3f0:4005:b::7,TCP,74,60956  >  443 [ACK] Seq=13343 Ack=7186232 Win=1048832 Len=0
1419.692732,2800:480:ff50:503::e,2800:484:b384:c80a:f81c:f268:6f0b:c2f4,TCP,1514,443  >  61093 [ACK] Seq=93226990 Ack=155024 Win=458496 Len=1440 [TCP segment of a reassembled PDU]
1227.399239,2800:480:ff50:503::e,2800:484:b384:c80a:f81c:f268:6f0b:c2f4,TCP,1514,443  >  61093 [ACK] Seq=64443109 Ack=108010 Win=340480 Len=1440 [TCP segment of a reassembled PDU]
244.031305,2800:484:b384:c80a:f81c:f268:6f0b:c2f4,2800:480:ff50:503::e,TCP,74,61023  >  443 [ACK] Seq=9253 Ack=878082 Win=264960 Len=0
201.031824,2800:480:ff50:b1::b536:a098,2800:484:b384:c80a:f81c:f268:6f0b:c2f4,TCP,1514,"443  >  60973 [PSH, ACK] Seq=2725671 Ack=7642 Win=64128 Len=1440 [TCP segment of a reassembled PDU]"
2536.452022,2800:480:ff50:503::e,2800:484:b384:c80a:f81c:f268:6f0b:c2f4,TCP,1514,"443  >  61093 [PSH, ACK] Seq=264464350 Ack=439559 Win=1168384 Len=1440 [TCP segment of a reassembled PDU]"
1354.944845,2800:480:ff50:503::e,2800:484:b384:c80a:f81c:f268:6f0b:c2f4,TCP,1514,443  >  61093 [ACK] Seq=83868390 Ack=139350 Win=419584 Len=1440 [TCP segment of a reassembled PDU]
2127.68876,2800:484:b384:c80a:f81c:f268:6f0b:c2f4,2800:480:ff50:503::e,TCP,74,61093  >  443 [ACK] Seq=331987 Ack=198303963 Win=529920 Len=0
1846.111266,192.168.20.26,20.114.189.135,TCP,54,61642  >  443 [ACK] Seq=1 Ack=1 Win=132352 Len=0
2144.628408,2800:480:ff50:503::e,2800:484:b384:c80a:f81c:f268:6f0b:c2f4,TCP,1514,443  >  61093 [ACK] Seq=201921980 Ack=338700 Win=917504 Len=1440 [TCP segment of a reassembled PDU]
2122.260999,2800:480:ff50:503::e,2800:484:b384:c80a:f81c:f268:6f0b:c2f4,TCP,1514,443  >  61093 [ACK] Seq=195208912 Ack=327539 Win=888576 Len=1440 [TCP segment of a reassembled PDU]
173.878513,192.168.18.1,192.168.18.46,TCP,54,53  >  59888 [ACK] Seq=1 Ack=31 Win=14600 Len=0
1625.953024,2a04:4e42:45::444,2800:484:b384:c80a:f81c:f268:6f0b:c2f4,TCP,1514,"443  >  61387 [PSH, ACK] Seq=681314 Ack=1343 Win=146944 Len=1440 [TCP segment of a reassembled PDU]"
306.113461,192.168.18.46,192.168.18.1,TCP,54,"60948  >  53 [FIN, ACK] Seq=30 Ack=632 Win=130560 Len=0"
1177.596939,2800:480:ff50:503::e,2800:484:b384:c80a:f81c:f268:6f0b:c2f4,TCP,1514,"443  >  61093 [PSH, ACK] Seq=56351598 Ack=94602 Win=307200 Len=1440 [TCP segment of a reassembled PDU]"
2309.393307,2800:480:ff50:503::e,2800:484:b384:c80a:f81c:f268:6f0b:c2f4,TCP,1514,443  >  61093 [ACK] Seq=225707515 Ack=378978 Win=1018368 Len=1440 [TCP segment of a reassembled PDU]
2071.954696,2800:480:ff50:503::e,2800:484:b384:c80a:f81c:f268:6f0b:c2f4,TCP,1514,443  >  61093 [ACK] Seq=190530728 Ack=318561 Win=865536 Len=1440 [TCP segment of a reassembled PDU]
1712.328717,2800:480:ff50:503::e,2800:484:b384:c80a:f81c:f268:6f0b:c2f4,TCP,1514,443  >  61093 [ACK] Seq=138776070 Ack=231210 Win=647936 Len=1440 [TCP segment of a reassembled PDU]
205.545893,192.168.20.26,20.201.67.219,TCP,54,[TCP Keep-Alive ACK] 60943  >  443 [ACK] Seq=598 Ack=6636 Win=132096 Len=0
2122.373872,2800:480:ff50:503::e,2800:484:b384:c80a:f81c:f268:6f0b:c2f4,TCP,1514,443  >  61093 [ACK] Seq=195718672 Ack=327539 Win=888576 Len=1440 [TCP segment of a reassembled PDU]
1487.654393,2800:480:ff50:503::e,2800:484:b384:c80a:f81c:f268:6f0b:c2f4,TCP,1514,443  >  61093 [ACK] Seq=104603755 Ack=172976 Win=504576 Len=1440 [TCP segment of a reassembled PDU]
2142.251121,2620:1ec:c11::239,2800:484:b384:c80a:f81c:f268:6f0b:c2f4,TCP,74,"443  >  61821 [RST, ACK] Seq=7634 Ack=5885 Win=0 Len=0"
198.594392,2800:480:ff50:b1::b536:a098,2800:484:b384:c80a:f81c:f268:6f0b:c2f4,TCP,1514,443  >  60973 [ACK] Seq=679427 Ack=4495 Win=64128 Len=1440 [TCP segment of a reassembled PDU]
1632.167776,54.207.241.31,192.168.20.26,TCP,66,"443  >  61461 [SYN, ACK] Seq=0 Ack=1 Win=26883 Len=0 MSS=1460 SACK_PERM WS=256"
1894.254658,2800:480:ff50:503::e,2800:484:b384:c80a:f81c:f268:6f0b:c2f4,TCP,1514,"443  >  61093 [PSH, ACK] Seq=164800791 Ack=276018 Win=758784 Len=1440 [TCP segment of a reassembled PDU]"
53.644232,172.16.0.73,192.168.137.147,TCP,1514,8080  >  57398 [ACK] Seq=48133 Ack=2217 Win=34048 Len=1460 [TCP segment of a reassembled PDU]
2309.468283,2800:480:ff50:503::e,2800:484:b384:c80a:f81c:f268:6f0b:c2f4,TCP,1514,443  >  61093 [ACK] Seq=226136635 Ack=378978 Win=1018368 Len=1440 [TCP segment of a reassembled PDU]
402.365822,34.199.93.197,192.168.18.46,TCP,1466,443  >  61761 [ACK] Seq=1528 Ack=518 Win=28160 Len=1412 [TCP segment of a reassembled PDU]
297.518116,2800:480:ff50:503::e,2800:484:b384:c80a:f81c:f268:6f0b:c2f4,TCP,1514,443  >  61028 [ACK] Seq=13018440 Ack=31722 Win=143104 Len=1440 [TCP segment of a reassembled PDU]
2292.51982,2800:480:ff50:503::e,2800:484:b384:c80a:f81c:f268:6f0b:c2f4,TCP,1514,"443  >  61093 [PSH, ACK] Seq=222309907 Ack=372265 Win=1001216 Len=1440 [TCP segment of a reassembled PDU]"
1036.676332,66.110.49.114,192.168.20.26,TCP,1514,443  >  61077 [ACK] Seq=573381 Ack=770107 Win=65535 Len=1460 [TCP segment of a reassembled PDU]
178.897666,192.168.18.46,192.168.18.1,TCP,54,"59922  >  53 [FIN, ACK] Seq=30 Ack=632 Win=130560 Len=0"
2045.489883,2800:484:b384:c80a:f81c:f268:6f0b:c2f4,2800:480:ff50:503::e,TCP,74,61093  >  443 [ACK] Seq=311848 Ack=187497453 Win=529920 Len=0
1720.540395,2800:484:b384:c80a:f81c:f268:6f0b:c2f4,2a04:4e42:49::347,TCP,74,61284  >  443 [ACK] Seq=11580 Ack=3667780 Win=264960 Len=0
287.451333,2800:480:ff50:503::e,2800:484:b384:c80a:f81c:f268:6f0b:c2f4,TCP,1514,"443  >  61028 [PSH, ACK] Seq=11787531 Ack=27280 Win=133120 Len=1440 [TCP segment of a reassembled PDU]"
2548.426927,2800:480:ff50:503::e,2800:484:b384:c80a:f81c:f268:6f0b:c2f4,TCP,1514,443  >  61093 [ACK] Seq=266385213 Ack=444007 Win=1178624 Len=1440 [TCP segment of a reassembled PDU]
640.650846,192.229.211.108,192.168.137.147,TCP,1514,80  >  57407 [ACK] Seq=1 Ack=207 Win=15744 Len=1460 [TCP segment of a reassembled PDU]
1770.848287,2800:480:ff50:503::e,2800:484:b384:c80a:f81c:f268:6f0b:c2f4,TCP,1514,443  >  61093 [ACK] Seq=148312873 Ack=246901 Win=686848 Len=1440 [TCP segment of a reassembled PDU]
303.563084,34.193.132.77,192.168.18.46,TCP,56,443  >  60927 [ACK] Seq=5472 Ack=955 Win=29184 Len=0
1683.224952,132.255.20.10,192.168.20.26,TCP,1514,443  >  61515 [ACK] Seq=422604 Ack=957 Win=31744 Len=1460 [TCP segment of a reassembled PDU]
340.972746,192.168.18.46,192.168.18.1,TCP,54,61238  >  53 [ACK] Seq=1 Ack=1 Win=131328 Len=0
1613.582476,2800:480:ff50:503::e,2800:484:b384:c80a:f81c:f268:6f0b:c2f4,TCP,1514,443  >  61093 [ACK] Seq=125291918 Ack=206541 Win=588288 Len=1440 [TCP segment of a reassembled PDU]
20.962232,34.203.15.122,192.168.18.46,TCP,54,"443  >  58700 [FIN, ACK] Seq=6290 Ack=958 Win=29184 Len=0"
1084.01929,2800:480:ff50:503::e,2800:484:b384:c80a:f81c:f268:6f0b:c2f4,TCP,1514,443  >  61093 [ACK] Seq=42997658 Ack=72228 Win=251136 Len=1440 [TCP segment of a reassembled PDU]
931.070747,2800:484:b384:c80a:f81c:f268:6f0b:c2f4,2800:480:ff50:503::e,TCP,74,61093  >  443 [ACK] Seq=31922 Ack=18546572 Win=264960 Len=0
1859.068234,2800:484:b384:c80a:f81c:f268:6f0b:c2f4,2800:480:ff50:503::e,TCP,74,61093  >  443 [ACK] Seq=267040 Ack=159862032 Win=264960 Len=0
1744.201145,2800:484:b384:c80a:f81c:f268:6f0b:c2f4,2800:480:ff50:503::e,TCP,74,61093  >  443 [ACK] Seq=240188 Ack=144092954 Win=264960 Len=0
1727.432988,2800:484:b384:c80a:f81c:f268:6f0b:c2f4,2800:480:ff50:b1::b536:a092,TCP,74,61561  >  443 [ACK] Seq=3742 Ack=8145266 Win=529920 Len=0
2644.725955,2800:3f0:4005:6::9,2800:484:b384:c80a:f81c:f268:6f0b:c2f4,TCP,1294,443  >  62007 [ACK] Seq=1369140 Ack=2859 Win=71168 Len=1220 [TCP segment of a reassembled PDU]
1727.406764,2800:484:b384:c80a:f81c:f268:6f0b:c2f4,2800:480:ff50:b1::b536:a092,TCP,74,61561  >  443 [ACK] Seq=3742 Ack=8014212 Win=529920 Len=0
7.28125,81.131.67.131,210.146.64.4,TCP,54,2727  >  80 [ACK] Seq=1 Ack=27741 Win=8760 Len=0
1245.376222,2800:480:ff50:503::e,2800:484:b384:c80a:f81c:f268:6f0b:c2f4,TCP,1514,443  >  61093 [ACK] Seq=65837499 Ack=110272 Win=346368 Len=1440 [TCP segment of a reassembled PDU]
